"catalog","order","family","genus","species","date","dates_corr","year","orders"
"CASENT9101445","Trichoptera","Philopotamidae","Dolophilodes","novusamericanus","11/5/14",2014-11-05,"2014","Trichoptera"
"CASENT9101446","Trichoptera","Philopotamidae","Wormaldia","anilla","11/5/14",2014-11-05,"2014","Trichoptera"
"CASLOT059836","Plecoptera","Leuctridae","Despaxia","augusta","11/5/14",2014-11-05,"2014","Plecoptera"
"CASLOT059837","Plecoptera","Capniidae","Mesocapnia","projecta","11/5/14",2014-11-05,"2014","Plecoptera"
"CASLOT059818","Plecoptera","Nemouridae","Malenka","depressa","11/5/14",2014-11-05,"2014","Plecoptera"
"CASLOT059826","Diptera","Dixidae","Meringodixa","chaloensis","11/5/14",2014-11-05,"2014","Diptera"
"CASENT9101450","Diptera","Dixidae","Dixa","sp.","11/5/14",2014-11-05,"2014","Diptera"
"CASENT9101454","Ephemeroptera","Leptophlebiidae","Paraleptophlebia","sp.","11/5/14",2014-11-05,"2014","Ephemeroptera"
"CASLOT059827","Ephemeroptera","Leptophlebiidae","Paraleptophlebia","helena","11/7/14",2014-11-07,"2014","Ephemeroptera"
"CASLOT059828","Ephemeroptera","Leptophlebiidae","Paraleptophlebia","sp.","11/7/14",2014-11-07,"2014","Ephemeroptera"
"CASLOT059814","Littorinimorpha","Hydrobiidae","Pyrgulopsis","sp.","11/18/14",2014-11-18,"2014","Littorinimorpha"
"CASENT9101448","Trichoptera","Rhyacophilidae","Rhyacophila","oreta","11/18/14",2014-11-18,"2014","Trichoptera"
"CASENT9101459","Coleoptera","Scirtidae","Elodes","sp.","11/18/14",2014-11-18,"2014","Coleoptera"
"CASENT9101451","Diptera","Dixidae","Dixa","sp.","11/18/14",2014-11-18,"2014","Diptera"
"CASLOT059812","Odonata","Coenagrionidae","Argia","vivida","11/18/14",2014-11-18,"2014","Odonata"
"CASLOT059829","Ephemeroptera","Leptophlebiidae","Paraleptophebia","helena","11/14/14",2014-11-14,"2014","Ephemeroptera"
"CASLOT059830","Ephemeroptera","Leptophlebiidae","Paraleptophlebia","debilis","11/14/14",2014-11-14,"2014","Ephemeroptera"
"CASENT9133012","Ephemeroptera","Leptophlebiidae","Paraleptophlebia","debilis","11/14/14",2014-11-14,"2014","Ephemeroptera"
"CASENT9101455","Ephemeroptera","Leptophlebiidae","Paraleptophlebia","debilis","11/7/14",2014-11-07,"2014","Ephemeroptera"
"CASENT9101460","Ephemeroptera","Isonychiidae","Isonychia","velma","11/7/14",2014-11-07,"2014","Ephemeroptera"
"CASENT9101443","Plecoptera","Perlidae","Hesperoperla","hoguei","10/11/14",2014-10-11,"2014","Plecoptera"
"CASLOT059860","Plecoptera","Leuctridae","Despaxia","augusta","11/17/14",2014-11-17,"2014","Plecoptera"
"CASLOT059853","Plecoptera","Capniidae","Mesocapnia","projecta","11/17/14",2014-11-17,"2014","Plecoptera"
"CASENT9101478","Trichoptera","Philopotamidae","Dolophilodes","novusamericanus","11/17/14",2014-11-17,"2014","Trichoptera"
"CASENT9101471","Plecoptera","Capniidae","Isocapnia","mogila","1/30/15",2015-01-30,"2015","Plecoptera"
"CASLOT059849","Plecoptera","Perlidae","Calineuria","californica","1/30/15",2015-01-30,"2015","Plecoptera"
"CASLOT059854","Ephemeroptera","Heptageniidae","Rhithrogena","sp.","1/30/15",2015-01-30,"2015","Ephemeroptera"
"CASLOT059855","Ephemeroptera","Heptageniidae","Epeorus","longimanus","1/30/15",2015-01-30,"2015","Ephemeroptera"
"CASLOT059846","Ephemeroptera","Baetidae","Baetis","tricaudatus","1/30/15",2015-01-30,"2015","Ephemeroptera"
"CASENT9101479","Ephemeroptera","Ameletidae","Ameletus","sp.","1/30/15",2015-01-30,"2015","Ephemeroptera"
"CASENT9101474","Plecoptera","Leuctridae","Despaxia","augusta","1/30/15",2015-01-30,"2015","Plecoptera"
"CASLOT059856","Ephemeroptera","Heptageniidae","Epeorus","longimanus","1/30/15",2015-01-30,"2015","Ephemeroptera"
"CASLOT059847","Ephemeroptera","Baetidae","Baetis","tricaudatus","1/30/15",2015-01-30,"2015","Ephemeroptera"
"CASLOT059851","Diptera","Simuliidae","Prosimulium","sp.","1/30/15",2015-01-30,"2015","Diptera"
"CASENT9101467","Ephemeroptera","Ephemerellidae","Drunella","flavilinea","1/30/15",2015-01-30,"2015","Ephemeroptera"
"CASENT9101477","Diptera","Blephariceridae","Blepharicera","jordani","1/30/15",2015-01-30,"2015","Diptera"
"CASLOT059861","Trichoptera","Glossosomatidae","Glossosoma","sp.",NA,NA,NA,"Trichoptera"
"CASENT9101472","Plecoptera","Capniidae","Mesocapnia","projecta","1/30/15",2015-01-30,"2015","Plecoptera"
"CASENT9101475","Plecoptera","Leuctridae","Despaxia","augusta","1/30/15",2015-01-30,"2015","Plecoptera"
"CASENT9101476","Plecoptera","Leuctridae","Calileuctra","ephemera","1/30/15",2015-01-30,"2015","Plecoptera"
"CASENT9101473","Plecoptera","Capniidae","Capnia","ventura complex","1/30/15",2015-01-30,"2015","Plecoptera"
"CASLOT059848","Ixodida","Ixodidae","Ixodes","pacificus","1/30/15",2015-01-30,"2015","Ixodida"
"CASENT9101466","Ixodida","Ixodidae","Dermacentor","occidentalis","1/30/15",2015-01-30,"2015","Ixodida"
"CASENT9101469","Plecoptera","Perlodidae","Osobenus","yakimae","1/30/15",2015-01-30,"2015","Plecoptera"
"CASLOT059850","Plecoptera","Perlidae","Calineuria","californica","1/30/15",2015-01-30,"2015","Plecoptera"
"CASLOT059857","Ephemeroptera","Heptageniidae","Ironodes","sp.","1/30/15",2015-01-30,"2015","Ephemeroptera"
"CASLOT059858","Ephemeroptera","Heptageniidae","Rhithrogena","sp.","1/30/15",2015-01-30,"2015","Ephemeroptera"
"CASLOT059859","Ephemeroptera","Heptageniidae","Epeorus","longimanus","1/30/15",2015-01-30,"2015","Ephemeroptera"
"CASENT9101468","Ephemeroptera","Ephemerellidae","Drunella","flavilinea","1/30/15",2015-01-30,"2015","Ephemeroptera"
"CASLOT059852","Diptera","Simuliidae","Simulium","sp.","1/30/15",2015-01-30,"2015","Diptera"
"CASENT9101481","Plecoptera","Pteronarcyidae","Pteronarcys","californica","1/30/15",2015-01-30,"2015","Plecoptera"
"CASENT9101480","Trichoptera","Limnephilidae","Onocosmoecus","unicolor",NA,NA,NA,"Trichoptera"
"CASENT9101470","Plecoptera","Perlodidae","Isoperla","pinta",NA,NA,NA,"Plecoptera"
"CASENT9131598","Ephemeroptera","Ameletidae","Ameletus","sp.",NA,NA,NA,"Ephemeroptera"
"CASENT9132411","Ephemeroptera","Leptophlebiidae","Paraleptophlebia","sp.",NA,NA,NA,"Ephemeroptera"
"CASENT9132632","Hemiptera","Corixidae","Sigara","mckinstryi",NA,NA,NA,"Hemiptera"
"CASENT9131672","Ephemeroptera","Ephemerellidae","Ephemerella","excrucians",NA,NA,NA,"Ephemeroptera"
"CASENT9131085","Ephemeroptera","Baetidae","Baetis","alius",NA,NA,NA,"Ephemeroptera"
"CASENT9131304","Plecoptera","Capniidae","Mesocapnia","projecta",NA,NA,NA,"Plecoptera"
"CASENT9130312","Plecoptera","Capniidae","Capnia","sp.",NA,NA,NA,"Plecoptera"
"CASENT9132402",NA,NA,"Ischnura","sp.",NA,NA,NA,NA
"CASENT9130358","Plecoptera","Capniidae","Capnia","sp.","1/30/15",2015-01-30,"2015","Plecoptera"
"CASENT9131254","Ephemeroptera","Baetidae","Baetis","tricaudatus","1/30/15",2015-01-30,"2015","Ephemeroptera"
"CASENT9130353","Ephemeroptera","Baetidae","Baetis","alius","1/30/15",2015-01-30,"2015","Ephemeroptera"
"CASENT9131768","Plecoptera","Capniidae","Capnia","sp.","1/30/15",2015-01-30,"2015","Plecoptera"
"CASENT9131891","Plecoptera","Chloroperlidae","Sweltsa","sp.","1/30/15",2015-01-30,"2015","Plecoptera"
"CASENT9131793","Ephemeroptera","Ameletidae","Ameletus","sp.","1/30/15",2015-01-30,"2015","Ephemeroptera"
"CASENT9132248","Plecoptera","Capniidae","Mesocapnia","projecta","1/30/15",2015-01-30,"2015","Plecoptera"
"CASENT9131675","Plecoptera","Leuctridae","Calileuctra","ephemera","1/3/15",2015-01-03,"2015","Plecoptera"
"CASENT9131773","Plecoptera","Capniidae","Mesocapnia","projecta","1/3/15",2015-01-03,"2015","Plecoptera"
"CASENT9132752","Ephemeroptera","Leptophlebiidae","Paraleptophlebia","helena","11/24/14",2014-11-24,"2014","Ephemeroptera"
"CASENT9131967","Ephemeroptera","Leptophlebiidae","Paraleptophlebia","helena","11/7/14",2014-11-07,"2014","Ephemeroptera"
"CASENT9132499","Trichoptera","Limnephilidae","Lenarchus","sp.",NA,NA,NA,"Trichoptera"
"CASENT9131890","Plecoptera","Nemouridae","Malenka","sp.",NA,NA,NA,"Plecoptera"
"CASENT9132787","Plecoptera","Leuctridae","Paraleuctra","divisa",NA,NA,NA,"Plecoptera"
"CASENT9131285","Plecoptera","Chloroperlidae","Suwallia","sp.","4/8/15",2015-04-08,"2015","Plecoptera"
"CASENT9130075","Ephemeroptera","Leptohyphidae","Tricorythodes","explicatus","4/8/15",2015-04-08,"2015","Ephemeroptera"
"CASENT9131601","Plecoptera","Perlodidae","Isoperla","sp.","4/8/15",2015-04-08,"2015","Plecoptera"
"CASENT9132416","Plecoptera","Perlodidae","Isoperla","pinta","4/8/15",2015-04-08,"2015","Plecoptera"
"CASENT9130439","Plecoptera","Perlidae","Calineuria","californica","4/8/15",2015-04-08,"2015","Plecoptera"
"CASENT9131914","Ephemeroptera","Ephemerellidae","Drunella","flavilinea","4/8/15",2015-04-08,"2015","Ephemeroptera"
"CASENT9131543","Ephemeroptera","Ephemerellidae","Ephemerella","maculata","4/8/15",2015-04-08,"2015","Ephemeroptera"
"CASENT9130467","Ephemeroptera","Ephemerellidae","Ephemerella","tibialis","4/8/15",2015-04-08,"2015","Ephemeroptera"
"CASENT9132563","Ephemeroptera","Ephemerellidae","Matriella","teresa","4/8/15",2015-04-08,"2015","Ephemeroptera"
"CASENT9132160","Ephemeroptera","Leptophlebiidae","Paraleptophlebia","sp.","4/8/15",2015-04-08,"2015","Ephemeroptera"
"CASENT9131894","Trichoptera","Polycentropodidae","Polycentropus","sp.","4/8/15",2015-04-08,"2015","Trichoptera"
"CASENT9132519","Trichoptera","Philopotamidae","Wormaldia","sp.","4/8/15",2015-04-08,"2015","Trichoptera"
"CASENT9131535","Trichoptera","Hydropsychidae","Hydropsyche","sp.","4/8/15",2015-04-08,"2015","Trichoptera"
"CASENT9132951","Trichoptera","Rhyacophilidae","Rhyacophila","sp.","4/8/15",2015-04-08,"2015","Trichoptera"
"CASENT9132704","Trichoptera","Rhyacophilidae","Rhyacophila","vedra","4/8/15",2015-04-08,"2015","Trichoptera"
"CASENT9131090","Ephemeroptera","Baetidae","Baetis","tricaudatus","4/8/15",2015-04-08,"2015","Ephemeroptera"
"CASENT9132305","Megaloptera","Corydalidae","Neohermes","sp.","4/8/15",2015-04-08,"2015","Megaloptera"
"CASENT9131828","Diptera","Empididae","Wiedemannia","sp.","4/8/15",2015-04-08,"2015","Diptera"
"CASENT9131772","Diptera","Simuliidae","Simulium","sp.","4/8/15",2015-04-08,"2015","Diptera"
"CASENT9130354","Diptera","Simuliidae","Simulium","canadense","4/8/15",2015-04-08,"2015","Diptera"
"CASLOT060508","Diptera","Simuliidae","Simulium","hippovorum","4/8/15",2015-04-08,"2015","Diptera"
"CASLOT060509","Plecoptera","Perlodidae","Kogotus","nonus","3/26/15",2015-03-26,"2015","Plecoptera"
"CASLOT060510","Ephemeroptera","Ephemerellidae","Drunella","coloradensis","3/26/15",2015-03-26,"2015","Ephemeroptera"
"CASLOT060511","Ephemeroptera","Heptageniidae","Epeorus","sp.","3/26/15",2015-03-26,"2015","Ephemeroptera"
"CASENT9095428","Plecoptera","Nemouridae","Malenka","sp.","3/26/15",2015-03-26,"2015","Plecoptera"
"CASLOT060512","Trichoptera","Philopotamidae","Dolophilodes","sp.","3/26/15",2015-03-26,"2015","Trichoptera"
"CASLOT060513","Trichoptera","Rhyacophilidae","Rhyacophila","angelita","3/26/15",2015-03-26,"2015","Trichoptera"
"CASLOT060514","Plecoptera","Chloroperlidae","Sweltsa","sp.","3/26/15",2015-03-26,"2015","Plecoptera"
"CASENT9095429","Megaloptera","Corydalidae","Neohermes","sp.","3/26/15",2015-03-26,"2015","Megaloptera"
"CASENT9095430","Coleoptera","Elmidae","Narpus","angustus","3/26/15",2015-03-26,"2015","Coleoptera"
"CASLOT060515","Ephemeroptera","Baetidae","Baetis","tricaudatus","3/26/15",2015-03-26,"2015","Ephemeroptera"
"CASENT9101465","Trichoptera","Hydropsychidae","Hydropsyche","sp.","1/30/15",2015-01-30,"2015","Trichoptera"
"CASLOT060516","Ephemeroptera","Baetidae","Baetis","alius","3/26/15",2015-03-26,"2015","Ephemeroptera"
"CASENT9095431","Plecoptera","Perlidae","Calineuria","californica","3/26/15",2015-03-26,"2015","Plecoptera"
"CASLOT059863","Plecoptera","Perlidae","Hesperoperla","pacifica","3/26/15",2015-03-26,"2015","Plecoptera"
"CASLOT059864","Plecoptera","Pteronarcyidae","Pteronarcys","californica","3/26/15",2015-03-26,"2015","Plecoptera"
"CASENT9095432","Plecoptera","Perlodidae","Isoperla","sp.","3/26/15",2015-03-26,"2015","Plecoptera"
"CASLOT060517","Trichoptera","Rhyacophilidae","Rhyacophila","sp.","3/26/15",2015-03-26,"2015","Trichoptera"
"CASENT9095433","Trichoptera","Rhyacophilidae","Rhyacophila","angelita","3/26/15",2015-03-26,"2015","Trichoptera"
"CASLOT060518","Trichoptera","Rhyacophilidae","Rhyacophila","sp.","3/26/15",2015-03-26,"2015","Trichoptera"
"CASLOT060519","Ephemeroptera","Ephemerellidae","Drunella","coloradensis","3/26/15",2015-03-26,"2015","Ephemeroptera"
"CASLOT060520","Trichoptera","Hydropsychidae","Hydropsyche","sp.","3/26/15",2015-03-26,"2015","Trichoptera"
"CASLOT060521","Trichoptera","Hydropsychidae","Hydropsyche","sp.","3/26/15",2015-03-26,"2015","Trichoptera"
"CASLOT060522","Coleoptera","Psephenidae","Psephenus","falli","3/26/15",2015-03-26,"2015","Coleoptera"
"CASLOT060523","Coleoptera","Elmidae","Optioservus","quadrimaculatus","3/26/15",2015-03-26,"2015","Coleoptera"
"CASENT9095434","Megaloptera","Corydalidae","Neohermes","filicornis","3/26/15",2015-03-26,"2015","Megaloptera"
"CASLOT060524","Ephemeroptera","Heptageniidae","Epeorus","longimanus","3/26/15",2015-03-26,"2015","Ephemeroptera"
"CASLOT060525","Ephemeroptera","Heptageniidae","Rhithrogena","morrisoni","3/26/15",2015-03-26,"2015","Ephemeroptera"
"CASENT9095435","Ephemeroptera","Heptageniidae","Ironodes","sp.","3/26/15",2015-03-26,"2015","Ephemeroptera"
"CASLOT060526","Ephemeroptera","Baetidae","Baetis","alius","3/26/15",2015-03-26,"2015","Ephemeroptera"
"CASENT9095436","Ephemeroptera","Heptageniidae","Cinygmula","sp.","3/26/15",2015-03-26,"2015","Ephemeroptera"
"CASENT9095437","Ephemeroptera","Ameletidae","Ameletus","sp.","3/26/15",2015-03-26,"2015","Ephemeroptera"
"CASENT9095438","Plecoptera","Nemouridae","Malenka","sp.","3/26/15",2015-03-26,"2015","Plecoptera"
"CASLOT059865","Trichoptera","Limnephilidae","Lenarchus","sp.","4/13/15",2015-04-13,"2015","Trichoptera"
"CASLOT060527","Trichoptera","Brachycentridae","Micrasema","dimicki","4/16/15",2015-04-16,"2015","Trichoptera"
"CASENT9095439","Trichoptera","Philopotamidae","Wormaldia","sp.","4/16/15",2015-04-16,"2015","Trichoptera"
"CASENT9095440","Trichoptera","Rhyacophilidae","Rhyacophila","narvae","4/16/15",2015-04-16,"2015","Trichoptera"
"CASLOT060528","Plecoptera","Chloroperlidae","Sweltsa","pisteri","4/16/15",2015-04-16,"2015","Plecoptera"
"CASLOT060529","Ephemeroptera","Baetidae","Fallceon","thermophilos","5/11/15",2015-05-11,"2015","Ephemeroptera"
"CASLOT060530","Ephemeroptera","Baetidae","Fallceon","thermophilos",NA,NA,NA,"Ephemeroptera"
"CASENT9095441","Trichoptera","Hydroptilidae","Leucotrichia","pictipes",NA,NA,NA,"Trichoptera"
"CASLOT060531","Ephemeroptera","Baetidae","Fallceon","thermophilos","5/11/15",2015-05-11,"2015","Ephemeroptera"
"CASLOT060532","Ephemeroptera","Baetidae","Fallceon","thermophilos","5/11/15",2015-05-11,"2015","Ephemeroptera"
"CASENT9095442","Ephemeroptera","Baetidae","Acentrella","turbida","5/11/15",2015-05-11,"2015","Ephemeroptera"
"CASLOT060533","Ephemeroptera","Baetidae","Centroptilum","sp.","5/11/15",2015-05-11,"2015","Ephemeroptera"
"CASLOT060534","Ephemeroptera","Heptageniidae","Nixe","sp.","5/11/15",2015-05-11,"2015","Ephemeroptera"
"CASLOT060535","Ephemeroptera","Baetidae","Baetis","alius","5/11/15",2015-05-11,"2015","Ephemeroptera"
"CASENT9095443","Plecoptera","Pteronarcyidae","Pteronarcys","sp.","5/11/15",2015-05-11,"2015","Plecoptera"
"CASENT9101408","Ephemeroptera","Leptohyphidae","Tricorythodes","explicatus","5/11/15",2015-05-11,"2015","Ephemeroptera"
"CASLOT059806",NA,"Pleuroceridae","Juga","sp.","5/11/15",2015-05-11,"2015",NA
"CASENT9101434","Trichoptera","Brachycentridae","Amiocentrus","aspilus","5/11/15",2015-05-11,"2015","Trichoptera"
"CASENT9101435","Amphipoda","Anisogammaridae","Ramellogammarus","sp.","5/11/15",2015-05-11,"2015","Amphipoda"
"CASLOT059776","Trichoptera","Hydropsychidae","Hydropsyche","sp.","5/11/15",2015-05-11,"2015","Trichoptera"
"CASENT9101404","Coleoptera","Psephenidae","Psephenus","falli","5/11/15",2015-05-11,"2015","Coleoptera"
"CASENT9101399","Coleoptera","Elmidae","Optioservus","quadrimaculatus","5/11/15",2015-05-11,"2015","Coleoptera"
"CASENT9101394","Ephemeroptera","Baetidae","Fallceon","thermophilos","5/13/15",2015-05-13,"2015","Ephemeroptera"
"CASLOT059769","Ephemeroptera","Baetidae","Baetis","alius","5/13/15",2015-05-13,"2015","Ephemeroptera"
"CASLOT059770","Ephemeroptera","Baetidae","Fallceon","thermophilos","5/11/15",2015-05-11,"2015","Ephemeroptera"
"CASENT9101436","Ephemeroptera","Ephemerellidae","Serratella","levis","5/11/15",2015-05-11,"2015","Ephemeroptera"
"CASLOT059800","Ephemeroptera","Baetidae","Centroptilum","bifurcatum","4/16/15",2015-04-16,"2015","Ephemeroptera"
"CASENT9101395","Ephemeroptera","Baetidae","Baetis","alius","5/8/15",2015-05-08,"2015","Ephemeroptera"
"CASENT9101437","Ephemeroptera","Ephemerellidae","Serratella","levis","5/19/15",2015-05-19,"2015","Ephemeroptera"
"CASENT9101396","Ephemeroptera","Baetidae","Acentrella","turbida","5/19/15",2015-05-19,"2015","Ephemeroptera"
"CASLOT059801","Ephemeroptera","Baetidae","Baetis","alius","5/19/15",2015-05-19,"2015","Ephemeroptera"
"CASLOT059802","Ephemeroptera","Baetidae","Fallceon","thermophilos","5/19/15",2015-05-19,"2015","Ephemeroptera"
"CASENT9101397","Ephemeroptera","Baetidae","Fallceon","thermophilos",NA,NA,NA,"Ephemeroptera"
"CASENT9101432","Ephemeroptera","Baetidae","Fallceon","thermophilos",NA,NA,NA,"Ephemeroptera"
"CASENT9101433","Ephemeroptera","Baetidae","Fallceon","thermophilos",NA,NA,NA,"Ephemeroptera"
"CASLOT059803","Ephemeroptera","Baetidae","Diphetor","hageni","3/26/15",2015-03-26,"2015","Ephemeroptera"
"CASLOT059804","Ephemeroptera","Baetidae","Baetis","alius","3/26/15",2015-03-26,"2015","Ephemeroptera"
"CASLOT059807","Ephemeroptera","Heptageniidae","Rhithrogena","sp.","3/26/15",2015-03-26,"2015","Ephemeroptera"
"CASENT9101405","Coleoptera","Psephenidae","Eubrianax","edwardsi","3/26/15",2015-03-26,"2015","Coleoptera"
"CASENT9101406","Coleoptera","Psephenidae","Psephenus","falli","3/26/15",2015-03-26,"2015","Coleoptera"
"CASLOT059773","Plecoptera","Perlidae","Hesperoperla","pacifica","3/26/15",2015-03-26,"2015","Plecoptera"
"CASLOT059866","Plecoptera","Perlidae","Calineuria","californica","3/26/15",2015-03-26,"2015","Plecoptera"
"CASLOT059771","Coleoptera","Elmidae","Optioservus","quadrimaculatus","3/26/15",2015-03-26,"2015","Coleoptera"
"CASENT9101400","Coleoptera","Elmidae","Ordobrevia","nubifera","3/26/15",2015-03-26,"2015","Coleoptera"
"CASENT9101438","Decapoda","Astacidae","Pacifasticus","leniusculus","3/26/15",2015-03-26,"2015","Decapoda"
"CASENT910439","Odonata","Gomphidae","Ophiogomphus","bison","3/26/15",2015-03-26,"2015","Odonata"
"CASLOT059805","Ephemeroptera","Baetidae","Centroptilum","bifurcatum","5/28/15",2015-05-28,"2015","Ephemeroptera"
"CASLOT059775","Ephemeroptera","Leptohyphidae","Tricorythodes","explicatus","5/28/15",2015-05-28,"2015","Ephemeroptera"
"CASLOT059867","Plecoptera","Pteronarcyidae","Pteronarcys","princeps","6/26/15",2015-06-26,"2015","Plecoptera"
"CASENT9101440","Trichoptera","Rhyacophilidae","Himalopsyche","phryganea","6/26/15",2015-06-26,"2015","Trichoptera"
"CASLOT059868","Plecoptera","Perlidae","Doroneuria","baumanni","6/26/15",2015-06-26,"2015","Plecoptera"
"CASLOT059774","Plecoptera","Perlidae","Calineuria","californica","6/26/15",2015-06-26,"2015","Plecoptera"
"CASENT9101407","Plecoptera","Perlidae","Hesperoperla","pacifica","6/26/15",2015-06-26,"2015","Plecoptera"
"CASLOT059767","Ephemeroptera","Ephemerellidae","Drunella","spinifera","6/26/15",2015-06-26,"2015","Ephemeroptera"
"CASLOT059768","Ephemeroptera","Ephemerellidae","Drunella","coloradensis","6/26/15",2015-06-26,"2015","Ephemeroptera"
"CASENT9101402","Ephemeroptera","Ephemerellidae","Drunella","pelosa","6/26/15",2015-06-26,"2015","Ephemeroptera"
"CASENT9101398","Ephemeroptera","Ephemerellidae","Caudatella","heterocaudata","6/26/15",2015-06-26,"2015","Ephemeroptera"
"CASLOT059808","Trichoptera","Glossosomatidae","Glossosoma","sp.","6/26/15",2015-06-26,"2015","Trichoptera"
"CASLOT059772","Trichoptera","Rhyacophilidae","Rhyacophila","sp.","6/26/15",2015-06-26,"2015","Trichoptera"
"CASENT9101403","Trichoptera","Rhyacophilidae","Rhyacophila","sp.","6/26/15",2015-06-26,"2015","Trichoptera"
"CASENT9101409","Trichoptera","Lepidostomatidae","Lepidostoma","cinereum","6/26/15",2015-06-26,"2015","Trichoptera"
"CASENT9101410","Trichoptera","Lepidostomatidae","Lepidostoma","sp.","6/26/15",2015-06-26,"2015","Trichoptera"
"CASLOT059777","Trichoptera","Hydropsychidae","Hydropsyche","sp.","6/26/15",2015-06-26,"2015","Trichoptera"
"CASENT9101441","Trichoptera","Limnephilidae","Dicosmoecus","gilvipes","6/26/15",2015-06-26,"2015","Trichoptera"
"CASENT9101401","Coleoptera","Elmidae","Zaitzevia","parvula","6/26/15",2015-06-26,"2015","Coleoptera"
"CASLOT060536","Ephemeroptera","Heptageniidae","Epeorus","longimanus","6/26/15",2015-06-26,"2015","Ephemeroptera"
"CASENT9095444","Ephemeroptera","Heptageniidae","Rhithrogena","sp.","6/26/15",2015-06-26,"2015","Ephemeroptera"
"CASENT9095445","Ephemeroptera","Heptageniidae","Ironodes","sp.","6/26/15",2015-06-26,"2015","Ephemeroptera"
"CASENT9095446","Ephemeroptera","Heptageniidae","Cinygmula","sp.","6/26/15",2015-06-26,"2015","Ephemeroptera"
"CASENT9095447","Ephemeroptera","Heptageniidae","Nixe","sp.","6/26/15",2015-06-26,"2015","Ephemeroptera"
"CASENT9095448","Ephemeroptera","Ameletidae","Ameletus","sp.","6/26/15",2015-06-26,"2015","Ephemeroptera"
"CASLOT060537","Ephemeroptera","Baetidae","Baetis","tricaudatus","6/26/15",2015-06-26,"2015","Ephemeroptera"
"CASLOT060538","Ephemeroptera","Baetidae","Baetis","sp.","6/26/15",2015-06-26,"2015","Ephemeroptera"
"CASLOT060539","Ephemeroptera","Ephemerellidae","Serratella","micheneri","6/26/15",2015-06-26,"2015","Ephemeroptera"
"CASLOT060540","Coleoptera","Elmidae","Cleptelmis","ornata","6/26/15",2015-06-26,"2015","Coleoptera"
"CASLOT059869","Trichoptera","Limnephilidae","Hydatophylax","hesperus","11/5/15",2015-11-05,"2015","Trichoptera"
"CASENT9095449","Trichoptera","Calamoceratidae","Heteroplectron","californicum","11/5/15",2015-11-05,"2015","Trichoptera"
"CASENT9095450","Trichoptera","Sericostomatidae","Gumaga","sp.","11/5/15",2015-11-05,"2015","Trichoptera"
"CASLOT060541","Ephemeroptera","Leptophlebiidae","Paraleptophlebia","helena","11/5/15",2015-11-05,"2015","Ephemeroptera"
"CASLOT060542","Ephemeroptera","Leptophlebiidae","Paraleptophlebia","debilis","11/5/15",2015-11-05,"2015","Ephemeroptera"
"CASENT9095451","Odonata","Gomphidae","Ophiogomphus","bison","11/5/15",2015-11-05,"2015","Odonata"
"CASLOT060543","Trichoptera","Lepidostomatidae","Lepidostoma","podagrum","11/5/15",2015-11-05,"2015","Trichoptera"
"CASLOT060544","Ephemeroptera","Leptohyphidae","Tricorythodes","explicatus","11/5/15",2015-11-05,"2015","Ephemeroptera"
"CASENT9095452","Plecoptera","Perlodidae","Isoperla","pinta","11/5/15",2015-11-05,"2015","Plecoptera"
"CASLOT060545",NA,"Pleuroceridae","Juga","sp.","11/5/15",2015-11-05,"2015",NA
"CASLOT060546","Coleoptera","Hydrophilidae","Enochrus","californicus","2/9/04",2004-02-09,"2004","Coleoptera"
"CASLOT060547","Trichoptera","Limnephilidae","Grammotaulius","sp.","1/27/16",2016-01-27,"2016","Trichoptera"
"CASLOT060548","Coleoptera","Hydrophilidae","Helophorus","sp.","1/27/16",2016-01-27,"2016","Coleoptera"
"CASLOT060550","Coleoptera","Dytiscidae","Agabus","sp.","1/27/16",2016-01-27,"2016","Coleoptera"
"CASLOT060551","Coleoptera","Dytiscidae","Agabus","lineellus","1/27/16",2016-01-27,"2016","Coleoptera"
"CASENT9095453","Coleoptera","Dytiscidae","Agabus","lutosus","1/27/16",2016-01-27,"2016","Coleoptera"
"CASENT9095454","Coleoptera","Dytiscidae","Uvarus","subtilus","1/27/16",2016-01-27,"2016","Coleoptera"
"CASLOT060552","Coleoptera","Dytiscidae","Hydroporus","sp.","1/27/16",2016-01-27,"2016","Coleoptera"
"CASENT9131465","Diptera","Empididae","Wiedemannia","sp.","7/30/14",2014-07-30,"2014","Diptera"
"CASLOT060549","Plecoptera","Leuctridae","Calileuctra","ephemera","2/11/16",2016-02-11,"2016","Plecoptera"
"CASLOT060553","Trichoptera","Odontoceridae","Nerophilus","californicus","2/9/16",2016-02-09,"2016","Trichoptera"
"CASLOT060554","Plecoptera","Nemouridae","Malenka","depressa","2/9/16",2016-02-09,"2016","Plecoptera"
"CASLOT060555","Trichoptera","Hydropsychidae","Homoplectra","norada","2/9/16",2016-02-09,"2016","Trichoptera"
"CASLOT060556","Diptera","Sciomyzidae","Dictya","sp.","2/9/16",2016-02-09,"2016","Diptera"
"CASLOT060557","Trichoptera","Hydropsychidae","Homoplectra","norada","2/9/16",2016-02-09,"2016","Trichoptera"
"CASLOT060558","Trichoptera","Odontoceridae","Nerophilus","californicus","2/9/16",2016-02-09,"2016","Trichoptera"
"CASLOT060559","Plecoptera","Nemouridae","Malenka","depressa","2/9/16",2016-02-09,"2016","Plecoptera"
"CASENT9095455","Plecoptera","Leuctridae","Paraleuctra","occidentalis","2/9/16",2016-02-09,"2016","Plecoptera"
"CASENT9095456","Diptera","Sciomyzidae","Dictya","sp.","2/9/16",2016-02-09,"2016","Diptera"
"CASENT9095457","Diptera","Psychodidae","Maruina","lanceolata","2/9/16",2016-02-09,"2016","Diptera"
"CASENT9095458","Odonata","Coenagrionidae","Ischnura","cervula","2/9/16",2016-02-09,"2016","Odonata"
"CASLOT060560","Plecoptera","Nemouridae","Malenka","depressa","2/9/16",2016-02-09,"2016","Plecoptera"
"CASLOT060561","Plecoptera","Leuctridae","Paraleuctra","occidentalis","2/9/16",2016-02-09,"2016","Plecoptera"
"CASENT9095460","Plecoptera","Nemouridae","Zapada","frigida","2/9/16",2016-02-09,"2016","Plecoptera"
"CASLOT060562","Plecoptera","Leuctridae","Despaxia","augusta","2/9/16",2016-02-09,"2016","Plecoptera"
"CASLOT060563","Plecoptera","Leuctridae","Perlomyia","collaris","2/9/16",2016-02-09,"2016","Plecoptera"
"CASLOT060564","Diptera","Psychodidae","Maruina","lanceolata","2/9/16",2016-02-09,"2016","Diptera"
"CASENT9095461","Ixodida","Ixodidae","Ixodes","pacificus","2/9/16",2016-02-09,"2016","Ixodida"
"CASLOT060565","Plecoptera","Nemouridae","Malenka","depressa","2/9/16",2016-02-09,"2016","Plecoptera"
"CASLOT059798","Plecoptera","Leuctridae","Paraleuctra","occidentalis","2/9/16",2016-02-09,"2016","Plecoptera"
"CASLOT059799","Plecoptera","Leuctridae","Paraleuctra","occidentalis","2/9/16",2016-02-09,"2016","Plecoptera"
"CASENT9101425","Plecoptera","Nemouridae","Malenka","depressa","2/9/16",2016-02-09,"2016","Plecoptera"
"CASENT9101431","Plecoptera","Leuctridae","Paraleuctra","occidentalis","2/9/16",2016-02-09,"2016","Plecoptera"
"CASENT9101426","Plecoptera","Nemouridae","Malenka","depressa","2/9/16",2016-02-09,"2016","Plecoptera"
"CASENT9101430","Plecoptera","Leuctridae","Despaxia","augusta","2/9/16",2016-02-09,"2016","Plecoptera"
"CASLOT059797","Plecoptera","Leuctridae","Despaxia","augusta","2/9/16",2016-02-09,"2016","Plecoptera"
"CASENT9101424","Trichoptera","Philopotamidae","Dolophilodes","novusamericanus","2/9/16",2016-02-09,"2016","Trichoptera"
"CASLOT059795","Trichoptera","Glossosomatidae","Anagapetus","bernea","2/9/16",2016-02-09,"2016","Trichoptera"
"CASENT9101429","Plecoptera","Leuctridae","Perlomyia","collaris","2/9/16",2016-02-09,"2016","Plecoptera"
"CASENT9101421","Ixodida","Ixodidae","Ixodes","pacificus","2/10/16",2016-02-10,"2016","Ixodida"
"CASLOT059792","Plecoptera","Capniidae","Mesocapnia","projecta","2/11/16",2016-02-11,"2016","Plecoptera"
"CASLOT059793","Plecoptera","Capniidae","Capnia","ventura complex","2/11/16",2016-02-11,"2016","Plecoptera"
"CASENT9101422","Ixodida","Ixodidae","Ixodes","pacificus","2/11/16",2016-02-11,"2016","Ixodida"
"CASLOT059794","Ephemeroptera","Baetidae","Fallceon","thermophilos","6/25/15",2015-06-25,"2015","Ephemeroptera"
"CASENT9101423","Ephemeroptera","Leptohyphidae","Asioplax","edmundsi","6/25/15",2015-06-25,"2015","Ephemeroptera"
"CASENT9101427","Trichoptera","Rhyacophilidae","Rhyacophila","verrula","6/27/15",2015-06-27,"2015","Trichoptera"
"CASLOT059796","Trichoptera","Rhyacophilidae","Rhyacophila","sp.","6/27/15",2015-06-27,"2015","Trichoptera"
"CASENT9101428","Trichoptera","Rhyacophilidae","Rhyacophila","sp.","6/27/15",2015-06-27,"2015","Trichoptera"
"CASLOT059791","Plecoptera","Perlidae","Hesperoperla","pacifica","6/27/15",2015-06-27,"2015","Plecoptera"
"CASLOT059790","Plecoptera","Perlodidae","Isoperla","sp.","6/27/15",2015-06-27,"2015","Plecoptera"
"CASENT9101420","Ephemeroptera","Baetidae","Baetis","tricaudatus","6/27/15",2015-06-27,"2015","Ephemeroptera"
"CASENT9101416","Ephemeroptera","Ameletidae","Ameletus","sp.","6/27/15",2015-06-27,"2015","Ephemeroptera"
"CASENT9101415","Ephemeroptera","Heptageniidae","Cinygmula","sp.","6/27/15",2015-06-27,"2015","Ephemeroptera"
"CASLOT059789","Plecoptera","Perlodidae","Isoperla","sp.","6/27/15",2015-06-27,"2015","Plecoptera"
"CASLOT059783","Plecoptera","Peltoperlidae","Yoraperla","nigrisoma","6/27/15",2015-06-27,"2015","Plecoptera"
"CASENT9101412","Ephemeroptera","Baetidae","Fallceon","thermophilos",NA,NA,NA,"Ephemeroptera"
"CASLOT059786","Trichoptera","Rhyacophilidae","Rhyacophila","malkini","5/19/15",2015-05-19,"2015","Trichoptera"
"CASLOT059787","Trichoptera","Rhyacophilidae","Rhyacophila","sp.","5/19/15",2015-05-19,"2015","Trichoptera"
"CASENT9101419","Trichoptera","Rhyacophilidae","Rhyacophila","vocala","5/19/15",2015-05-19,"2015","Trichoptera"
"CASENT9101418","Ephemeroptera","Ephemerellidae","Timpanoga","hecuba","5/19/15",2015-05-19,"2015","Ephemeroptera"
"CASENT9101417","Plecoptera","Perlidae","Calineuria","californica","5/19/15",2015-05-19,"2015","Plecoptera"
"CASLOT059784","Plecoptera","Perlidae","Hesperoperla","pacifica","5/19/15",2015-05-19,"2015","Plecoptera"
"CASLOT059782","Plecoptera","Pteronarcyidae","Pteronarcys","sp.","5/19/15",2015-05-19,"2015","Plecoptera"
"CASLOT059781","Trichoptera","Philopotamidae","Wormaldia","sp.","5/19/15",2015-05-19,"2015","Trichoptera"
"CASLOT059785","Ephemeroptera","Ephemerellidae","Drunella","flavilinea","5/19/15",2015-05-19,"2015","Ephemeroptera"
"CASENT9101414","Odonata","Coenagrionidae","Argia","sp.","5/19/15",2015-05-19,"2015","Odonata"
"CASLOT059779","Diptera","Simuliidae","Prosimulium","sp.","5/19/15",2015-05-19,"2015","Diptera"
"CASLOT059780","Diptera","Simuliidae","Simulium","sp.","5/19/15",2015-05-19,"2015","Diptera"
"CASENT9101413","Diptera","Limoniidae","Antocha","sp.","5/19/15",2015-05-19,"2015","Diptera"
"CASLOT059778","Diptera","Chironomidae",NA,NA,"5/19/15",2015-05-19,"2015","Diptera"
"CASLOT75464","Ephemeroptera","Baetidae","Centroptilum","asperatum","3/17/16",2016-03-17,"2016","Ephemeroptera"
"CASENT9132142","Coleoptera","Hydrophilidae","Cymbiodyta","pacifica","3/17/16",2016-03-17,"2016","Coleoptera"
"CASENT9132483","Plecoptera","Taeniopterygidae","Oemopteryx","vanduzeei","3/17/16",2016-03-17,"2016","Plecoptera"
"CASENT9101212","Ixodida","Ixodidae","Ixodes","pacifica","3/17/16",2016-03-17,"2016","Ixodida"
"CASENT9132423","Plecoptera","Taeniopterygidae","Oemopteryx","vanduzeei","3/17/16",2016-03-17,"2016","Plecoptera"
"CASENT9132542","Plecoptera","Taeniopterygidae","Oemopteryx","vanduzeei","3/17/16",2016-03-17,"2016","Plecoptera"
"CASLOT75463","Ephemeroptera","Baetidae","Centroptilum","asperatum","3/17/16",2016-03-17,"2016","Ephemeroptera"
"CASENT9128152","Ephemeroptera","Baetidae","Baetis","alius","3/17/16",2016-03-17,"2016","Ephemeroptera"
"CASENT9132590","Plecoptera","Taeniopterygidae","Oemopteryx","vanduzeei","3/17/16",2016-03-17,"2016","Plecoptera"
"CASENT9131899","Odonata","Libellulidae",NA,NA,"3/17/16",2016-03-17,"2016","Odonata"
"CASENT9115582","Coleoptera","Dytiscidae","Uvarus","subtilus","3/17/16",2016-03-17,"2016","Coleoptera"
"CASENT9101213","Ixodida","Ixodidae","Ixodes","pacificus","3/17/16",2016-03-17,"2016","Ixodida"
"CASENT9131807","Diptera","Psychodidae","Maruina","lanceolata","3/17/16",2016-03-17,"2016","Diptera"
"CASENT9131845","Diptera","Sciomyzidae","Dictya","sp.","3/17/16",2016-03-17,"2016","Diptera"
"CASENT9132841","Diptera","Sciomyzidae",NA,NA,"3/17/16",2016-03-17,"2016","Diptera"
"CASLOT059651","Ephemeroptera","Heptageniidae","Ironodes","californicus","3/17/16",2016-03-17,"2016","Ephemeroptera"
"CASLOT75331","Ephemeroptera","Baetidae","Baetis","piscatoris","3/17/16",2016-03-17,"2016","Ephemeroptera"
"CASENT9130459","Coleoptera","Hydrophilidae","Anacaena","signaticollis","3/17/16",2016-03-17,"2016","Coleoptera"
"CASENT9131713",NA,"Libellulide",NA,NA,"3/17/16",2016-03-17,"2016",NA
"CASLOT064562","Coleoptera","Dytiscidae","Uvarus","subtilus","3/17/16",2016-03-17,"2016","Coleoptera"
"CASENT9130961","Ephemeroptera","Baetidae","Baetis","sp.","8/27/15",2015-08-27,"2015","Ephemeroptera"
"CASLOT059652","Ephemeroptera","Heptageniidae","Ironodes","californicus","3/16/16",2016-03-16,"2016","Ephemeroptera"
"CASLOT76025","Ephemeroptera","Baetidae","Baetis","tricaudatus","3/16/16",2016-03-16,"2016","Ephemeroptera"
"CASENT9132907","Plecoptera","Perlidae","Hesperoperla","pacifica","3/16/16",2016-03-16,"2016","Plecoptera"
"CASLOT059653","Ephemeroptera","Heptageniidae","Ironodes","californicus","3/16/16",2016-03-16,"2016","Ephemeroptera"
"CASENT9130103","Trichoptera","Rhyacophilidae","Rhyacophila","sp.","3/16/16",2016-03-16,"2016","Trichoptera"
"CASENT9130040","Trichoptera","Uenoidae","Farula","sp.","3/16/16",2016-03-16,"2016","Trichoptera"
"CASENT9128142","Ephemeroptera","Baetidae","Baetis","tricaudatus","3/16/16",2016-03-16,"2016","Ephemeroptera"
"CASENT9131420","Ephemeroptera","Baetidae","Baetis","sp.","3/16/16",2016-03-16,"2016","Ephemeroptera"
"CASENT9127893","Ephemeroptera","Baetidae","Diphetor","hageni","3/16/16",2016-03-16,"2016","Ephemeroptera"
"CASENT9130971","Diptera","Limoniidae","Hexatoma","sp.","3/16/16",2016-03-16,"2016","Diptera"
"CASLOT059870","Trichoptera","Hydropsychidae","Parapsyche","sp.","3/16/16",2016-03-16,"2016","Trichoptera"
"CASENT9101483","Trichoptera","Hydropsychidae","Hydropsyche","sp.","3/16/16",2016-03-16,"2016","Trichoptera"
"CASENT9101484","Plecoptera","Perlidae","Hesperoperla","pacifica","3/16/16",2016-03-16,"2016","Plecoptera"
"CASLOT059871","Plecoptera","Perlidae","Calineuria","californica","3/16/16",2016-03-16,"2016","Plecoptera"
"CASLOT059872","Ephemeroptera","Heptageniidae","Ironodes","californicus","3/16/16",2016-03-16,"2016","Ephemeroptera"
"CASENT9101485","Ephemeroptera","Heptageniidae","Cinygma","sp.","3/16/16",2016-03-16,"2016","Ephemeroptera"
"CASLOT059873",NA,"Thremmatidae","Neophylax","splendens","3/16/16",2016-03-16,"2016",NA
"CASENT9101486","Trichoptera","Rhyacophilidae","Rhyacophila","sp.","3/16/16",2016-03-16,"2016","Trichoptera"
"CASLOT059874","Plecoptera","Nemouridae","Malenka","sp.","3/16/16",2016-03-16,"2016","Plecoptera"
"CASLOT060506","Ephemeroptera","Leptophlebiidae","Paraleptophlebia","sp.","3/16/16",2016-03-16,"2016","Ephemeroptera"
"CASLOT059875","Ephemeroptera","Baetidae","Diphetor","hageni","3/16/16",2016-03-16,"2016","Ephemeroptera"
"CASENT9101364","Trichoptera","Lepidostomatidae","Lepidostoma","sp.","3/16/16",2016-03-16,"2016","Trichoptera"
"CASENT9101365","Diptera","Dixidae","Dixa","sp.","3/16/16",2016-03-16,"2016","Diptera"
"CASLOT059714","Coleoptera","Scirtidae","Elodes","sp.","3/16/16",2016-03-16,"2016","Coleoptera"
"CASLOT059715","Isopoda","Ligiidae","Ligidium","sp.","3/16/16",2016-03-16,"2016","Isopoda"
"CASLOT059716","Diptera","Simuliidae","Prosimulium","sp.","3/16/16",2016-03-16,"2016","Diptera"
"CASENT9101366","Plecoptera","Perlodidae","Cultus","sp.","3/29/16",2016-03-29,"2016","Plecoptera"
"CASLOT059717","Plecoptera","Taeniopterygidae","Oemopteryx","vanduzeei","3/25/16",2016-03-25,"2016","Plecoptera"
"CASENT9128167",NA,NA,"Cetroptilum","asperatum","3/25/16",2016-03-25,"2016",NA
"CASENT9132550","Plecoptera","Taeniopterygidae","Oemopteryx","vanduzeei","3/25/16",2016-03-25,"2016","Plecoptera"
"CASENT9130723","Ephemeroptera","Baetidae","Centroptilum","asperatum","3/17/16",2016-03-17,"2016","Ephemeroptera"
"CASENT9132832","Plecoptera","Perlodidae","Isoperla","miwok","3/17/16",2016-03-17,"2016","Plecoptera"
"CASENT9132539","Plecoptera","Capniidae","Eucapnosis","brevicauda","3/31/16",2016-03-31,"2016","Plecoptera"
"CASENT9132410","Plecoptera","Leuctridae","Paraleuctra","divisa","3/31/16",2016-03-31,"2016","Plecoptera"
"CASENT9131690","Plecoptera","Capniidae","Capnia","excavata","3/31/16",2016-03-31,"2016","Plecoptera"
"CASENT9131689","Plecoptera","Capniidae","Eucapnosis","brevicauda","3/31/16",2016-03-31,"2016","Plecoptera"
"CASENT9131930",NA,"Kathroperlidae","Kathroperla","takhoma","3/31/16",2016-03-31,"2016",NA
"CASENT9132485",NA,"Kathroperlidae","Kathroperla","takhoma","3/31/16",2016-03-31,"2016",NA
"CASENT9132457",NA,"Kathroperlidae","Kathroperla","takhoma","3/31/16",2016-03-31,"2016",NA
"CASLOT059654","Ephemeroptera","Heptageniidae","Ironodes","californicus","3/31/16",2016-03-31,"2016","Ephemeroptera"
"CASLOT062157","Ephemeroptera","Heptageniidae","Epeorus","longimanus","3/31/16",2016-03-31,"2016","Ephemeroptera"
"CASLOT059172","Ephemeroptera","Heptageniidae","Cinygmula","mimus","3/31/16",2016-03-31,"2016","Ephemeroptera"
"CASLOT059005","Ephemeroptera","Ephemerellidae","Drunella","flavilinea","3/31/16",2016-03-31,"2016","Ephemeroptera"
"CASENT9127884","Ephemeroptera","Baetidae","Diphetor","hageni","3/31/16",2016-03-31,"2016","Ephemeroptera"
"CASENT9131139","Trichoptera","Hydropsychidae","Hydropsyche","oslari","3/31/16",2016-03-31,"2016","Trichoptera"
"CASENT9130015","Trichoptera","Rhyacophilidae","Rhyacophila","angelita","3/31/16",2016-03-31,"2016","Trichoptera"
"CASLOT76018","Ephemeroptera","Baetidae","Baetis","tricaudatus","3/31/16",2016-03-31,"2016","Ephemeroptera"
"CASLOT75333","Ephemeroptera","Baetidae","Baetis","piscatoris","3/31/16",2016-03-31,"2016","Ephemeroptera"
"CASLOT060974","Ephemeroptera","Leptophlebiidae","Paraleptophlebia","temporalis","3/31/16",2016-03-31,"2016","Ephemeroptera"
"CASENT9130812","Ephemeroptera","Ameletidae","Ameletus","dissitus","3/31/16",2016-03-31,"2016","Ephemeroptera"
"CASLOT76010","Ephemeroptera","Baetidae","Baetis","tricaudatus","3/31/16",2016-03-31,"2016","Ephemeroptera"
"CASENT9101329","Ephemeroptera","Heptageniidae","Ironodes","californicus","3/31/16",2016-03-31,"2016","Ephemeroptera"
"CASLOT062158","Ephemeroptera","Heptageniidae","Epeorus","longimanus","3/31/16",2016-03-31,"2016","Ephemeroptera"
"CASLOT059173","Ephemeroptera","Heptageniidae","Cinygmula","mimus","3/31/16",2016-03-31,"2016","Ephemeroptera"
"CASENT9101244","Ephemeroptera","Heptageniidae","Ecdyonurus","criddlei","3/31/16",2016-03-31,"2016","Ephemeroptera"
"CASLOT059000","Ephemeroptera","Ephemerellidae","Drunella","flavilinea","3/31/16",2016-03-31,"2016","Ephemeroptera"
"CASLOT060975","Ephemeroptera","Leptophlebiidae","Paraleptophlebia","temporalis","3/31/16",2016-03-31,"2016","Ephemeroptera"
"CASENT9130105","Trichoptera","Polycentropodidae","Polycentropus","variegatus","3/31/16",2016-03-31,"2016","Trichoptera"
"CASLOT75533","Ephemeroptera","Ameletidae","Ameletus","vancouverensis","3/31/16",2016-03-31,"2016","Ephemeroptera"
"CASLOT75332","Ephemeroptera","Baetidae","Baetis","piscatoris","3/31/16",2016-03-31,"2016","Ephemeroptera"
"CASLOT76020","Ephemeroptera","Baetidae","Baetis","tricaudatus","3/31/16",2016-03-31,"2016","Ephemeroptera"
"CASLOT059655","Ephemeroptera","Heptageniidae","Ironodes","californicus","3/31/16",2016-03-31,"2016","Ephemeroptera"
"CASLOT062159","Ephemeroptera","Heptageniidae","Epeorus","longimanus","3/31/16",2016-03-31,"2016","Ephemeroptera"
"CASLOT059002","Ephemeroptera","Ephemerellidae","Drunella","flavilinea","3/31/16",2016-03-31,"2016","Ephemeroptera"
"CASLOT76019","Ephemeroptera","Baetidae","Baetis","tricaudatus","3/31/16",2016-03-31,"2016","Ephemeroptera"
"CASLOT75334","Ephemeroptera","Baetidae","Baetis","piscatoris","3/31/16",2016-03-31,"2016","Ephemeroptera"
"CASENT9128214","Ephemeroptera","Ameletidae","Ameletus","vancouverensis","3/31/16",2016-03-31,"2016","Ephemeroptera"
"CASLOT75414","Ephemeroptera","Baetidae","Baetis","alius","3/31/16",2016-03-31,"2016","Ephemeroptera"
"CASENT9128166","Ephemeroptera","Baetidae","Centroptilum","asperatum","3/17/16",2016-03-17,"2016","Ephemeroptera"
"CASENT9132043","Plecoptera","Perlodidae","Isoperla","miwok","3/25/16",2016-03-25,"2016","Plecoptera"
"CASENT9131649","Plecoptera","Leuctridae","Pomoleuctra","andersoni","4/7/16",2016-04-07,"2016","Plecoptera"
"CASENT9132533","Plecoptera","Taeniopterygidae","Taenionema","sp.","4/7/16",2016-04-07,"2016","Plecoptera"
"CASENT9131549","Plecoptera","Nemouridae","Soyedina","nevadensis","4/7/16",2016-04-07,"2016","Plecoptera"
"CASENT9130347","Trichoptera","Philopotamidae","Wormaldia","anilla","4/7/16",2016-04-07,"2016","Trichoptera"
"CASENT9128179","Ephemeroptera","Baetidae","Centroptilum","asperatum","3/17/16",2016-03-17,"2016","Ephemeroptera"
"CASENT9132434","Plecoptera","Perlidae","Doroneuria","baumanni","4/7/16",2016-04-07,"2016","Plecoptera"
"CASENT9132167","Plecoptera","Perlodidae","Diura","knowltoni","4/7/16",2016-04-07,"2016","Plecoptera"
"CASENT9131033","Coleoptera","Ptilodactylidae","Anchycteis","velutina","4/7/16",2016-04-07,"2016","Coleoptera"
"CASENT9130313","Trichoptera","Rhyacophilidae","Rhyacophila","verrula","4/7/16",2016-04-07,"2016","Trichoptera"
"CASENT9130783",NA,"Thremmatidae","Neophylax","splendens","4/7/16",2016-04-07,"2016",NA
"CASENT9130952","Trichoptera","Lepidostomatidae","Lepidostoma","sp.","4/7/16",2016-04-07,"2016","Trichoptera"
"CASENT9130935","Megaloptera","Corydalidae","Orohermes","crepusculus","4/7/16",2016-04-07,"2016","Megaloptera"
"CASLOT75555","Ephemeroptera","Ameletidae","Ameletus","sp.","4/7/16",2016-04-07,"2016","Ephemeroptera"
"CASLOT060976","Ephemeroptera","Leptophlebiidae","Paraleptophlebia","sp.","4/7/16",2016-04-07,"2016","Ephemeroptera"
"CASLOT75343","Ephemeroptera","Baetidae","Baetis","bicaudatus","4/7/16",2016-04-07,"2016","Ephemeroptera"
"CASENT9128124","Ephemeroptera","Baetidae","Baetis","tricaudatus","4/7/16",2016-04-07,"2016","Ephemeroptera"
"CASLOT059644","Ephemeroptera","Heptageniidae","Ironodes","sp.","4/7/16",2016-04-07,"2016","Ephemeroptera"
"CASENT9131155","Plecoptera","Peltoperlidae","Sieraperla","cora","4/7/16",2016-04-07,"2016","Plecoptera"
"CASENT9130314","Plecoptera","Peltoperlidae","Yoraperla","sp.","4/7/16",2016-04-07,"2016","Plecoptera"
"CASENT9132415","Plecoptera","Leuctridae","Moselia","infuscata","4/7/16",2016-04-07,"2016","Plecoptera"
"CASENT9132681","Plecoptera","Leuctridae","Moselia","infuscata","4/7/16",2016-04-07,"2016","Plecoptera"
"CASLOT062160","Ephemeroptera","Heptageniidae","Epeorus","longimanus","4/7/16",2016-04-07,"2016","Ephemeroptera"
"CASLOT059645","Ephemeroptera","Heptageniidae","Ironodes","sp.","4/7/16",2016-04-07,"2016","Ephemeroptera"
"CASLOT059257","Ephemeroptera","Heptageniidae","Cinygmula","sp.","4/7/16",2016-04-07,"2016","Ephemeroptera"
"CASENT9132501","Plecoptera","Perlodidae","Kogotus","nonus","4/7/16",2016-04-07,"2016","Plecoptera"
"CASLOT059056","Ephemeroptera","Ephemerellidae","Drunella","flavilinea","4/7/16",2016-04-07,"2016","Ephemeroptera"
"CASLOT75327","Ephemeroptera","Baetidae","Baetis","bicaudatus","4/7/16",2016-04-07,"2016","Ephemeroptera"
"CASENT9130877","Ephemeroptera","Baetidae","Baetis","sp.","4/7/16",2016-04-07,"2016","Ephemeroptera"
"CASENT9130916","Ephemeroptera","Ameletidae","Ameletus","sp.","4/7/16",2016-04-07,"2016","Ephemeroptera"
"CASENT9130597",NA,"Thremmatidae","Neophylax","rickeri","4/7/16",2016-04-07,"2016",NA
"CASENT9132661","Plecoptera","Taeniopterygidae","Taenionema","sp.","4/7/16",2016-04-07,"2016","Plecoptera"
"CASENT9130920","Coleoptera","Amphizoidae","Amphizoa","insolens","8/15/08",2008-08-15,"2008","Coleoptera"
"CASENT9132624","Plecoptera","Perlodidae","Kogotus","sp.","8/15/08",2008-08-15,"2008","Plecoptera"
"CASENT9130093","Trichoptera","Limnephilidae","Cryptochia","sp.","8/15/08",2008-08-15,"2008","Trichoptera"
"CASENT9130323","Plecoptera","Peltoperlidae","Yoraperla","sp.","8/15/08",2008-08-15,"2008","Plecoptera"
"CASENT9131123",NA,"Thremmatidae","Neophylax","sp.","8/15/08",2008-08-15,"2008",NA
"CASLOT062324","Diptera","Chironomidae",NA,NA,"8/15/08",2008-08-15,"2008","Diptera"
"CASENT9130539","Diptera","Limoniidae","Hesperoconopa","sp.","8/15/08",2008-08-15,"2008","Diptera"
"CASENT9130125","Trichoptera","Rhyacophilidae","Rhyacophila","vaccua","8/15/08",2008-08-15,"2008","Trichoptera"
"CASLOT059718","Anostraca","Branchinectidae","Branchinecta","sp.",NA,NA,NA,"Anostraca"
"CASENT9132559","Plecoptera","Taeniopterygidae","Taenionema","sp.","4/8/16",2016-04-08,"2016","Plecoptera"
"CASENT9130052","Ephemeroptera","Baetidae","Baetis","alius","5/19/15",2015-05-19,"2015","Ephemeroptera"
"CASENT9130588","Ephemeroptera","Baetidae","Baetis","alius","5/8/15",2015-05-08,"2015","Ephemeroptera"
"CASENT9130860","Trichoptera","Rhyacophilidae","Rhyacophila","kernada","5/8/15",2015-05-08,"2015","Trichoptera"
"CASENT9130704","Trichoptera","Hydropsychidae","Hydropsyche","sp.","5/8/15",2015-05-08,"2015","Trichoptera"
"CASENT9132710","Plecoptera","Perlodidae","Isoperla","sp.","5/8/15",2015-05-08,"2015","Plecoptera"
"CASENT9130932","Trichoptera","Hydropsychidae","Hydropsyche","sp.","5/8/15",2015-05-08,"2015","Trichoptera"
"CASENT9130770","Trichoptera","Hydroptilidae","Leucotrichia","pictipes","5/8/15",2015-05-08,"2015","Trichoptera"
"CASENT9131849","Diptera","Dolichopodidae","Dolichopus","sp.","5/8/15",2015-05-08,"2015","Diptera"
"CASENT9130427","Trichoptera","Philopotamidae","Chimarra","utahensis","5/8/15",2015-05-08,"2015","Trichoptera"
"CASENT9131012","Trichoptera","Limnephilidae","Lenarchus","sp.","4/10/15",2015-04-10,"2015","Trichoptera"
"CASENT9132449","Diptera","Chaoboridae","Chaoborus","sp.","4/10/15",2015-04-10,"2015","Diptera"
"CASENT9130543","Diptera","Culicidae","Culiseta","particeps","4/10/15",2015-04-10,"2015","Diptera"
"CASENT9115584","Coleoptera","Dytiscidae","Uvarus","subtilus","4/10/15",2015-04-10,"2015","Coleoptera"
"CASENT9131609","Odonata","Libellulidae","Sympetrum","sp.","4/10/15",2015-04-10,"2015","Odonata"
"CASENT9131094","Trichoptera","Limnephilidae","Lenarchus","sp.","4/10/15",2015-04-10,"2015","Trichoptera"
"CASENT9131596","Diptera","Chaoboridae","Chaoborus","sp.","4/10/15",2015-04-10,"2015","Diptera"
"CASENT9130830","Diptera","Culicidae","Culiseta","particeps","4/10/15",2015-04-10,"2015","Diptera"
"CASLOT060607","Ephemeroptera","Isonychiidae","Isonychia","velma","10/1/15",2015-10-01,"2015","Ephemeroptera"
"CASENT9131903","Plecoptera","Capniidae","Mesocapnia","projecta","11/3/15",2015-11-03,"2015","Plecoptera"
"CASLOT060977","Ephemeroptera","Leptophlebiidae","Paraleptophlebia","helena","10/27/15",2015-10-27,"2015","Ephemeroptera"
"CASENT9128093","Ephemeroptera","Baetidae","Callibaetis","pictus","10/1/15",2015-10-01,"2015","Ephemeroptera"
"CASENT9101214","Araneae","Lycosidae","Arctosa","littoralis","10/1/15",2015-10-01,"2015","Araneae"
"CASENT9131427","Megaloptera","Corydalidae","Orohermes","crepusculus","5/3/16",2016-05-03,"2016","Megaloptera"
"CASENT9132611","Plecoptera","Perlidae","Hesperoperla","hoguei","5/3/16",2016-05-03,"2016","Plecoptera"
"CASENT9130160","Plecoptera","Pteronarcyidae","Pteronarcys","princeps","5/3/16",2016-05-03,"2016","Plecoptera"
"CASENT9132462",NA,"Kathroperlidae","Kathroperla","takhoma","5/3/16",2016-05-03,"2016",NA
"CASLOT059656","Ephemeroptera","Heptageniidae","Ironodes","californicus","5/3/16",2016-05-03,"2016","Ephemeroptera"
"CASENT9130688","Trichoptera","Rhyacophilidae","Rhyacophila","grandis","5/3/16",2016-05-03,"2016","Trichoptera"
"CASLOT062875","Megaloptera","Corydalidae","Neohermes","filicornis","5/13/16",2016-05-13,"2016","Megaloptera"
"CASENT9131232","Megaloptera","Corydalidae","Neohermes","filicornis","5/13/16",2016-05-13,"2016","Megaloptera"
"CASENT9131142","Megaloptera","Corydalidae","Neohermes","filicornis","5/13/16",2016-05-13,"2016","Megaloptera"
"CASENT9131319","Megaloptera","Corydalidae","Protochauliodes","spenceri","5/13/16",2016-05-13,"2016","Megaloptera"
"CASLOT75543","Ephemeroptera","Ameletidae","Ameletus","sp.","5/13/16",2016-05-13,"2016","Ephemeroptera"
"CASLOT062089","Ephemeroptera","Heptageniidae","Epeorus","sp.","5/13/16",2016-05-13,"2016","Ephemeroptera"
"CASLOT064556","Coleoptera","Dytiscidae","Sanfilippodytes","villis","5/13/16",2016-05-13,"2016","Coleoptera"
"CASENT9130706","Megaloptera","Corydalidae","Neohermes","filicornis","5/13/16",2016-05-13,"2016","Megaloptera"
"CASLOT75558","Ephemeroptera","Ameletidae","Ameletus","sp.","5/13/16",2016-05-13,"2016","Ephemeroptera"
"CASLOT062090","Ephemeroptera","Heptageniidae","Epeorus","sp.","5/13/16",2016-05-13,"2016","Ephemeroptera"
"CASENT9130335","Coleoptera","Hydrophilidae","Anacaena","sp.","5/13/16",2016-05-13,"2016","Coleoptera"
"CASENT9132007","Coleoptera","Hydrophilidae","Hydrobius","fuscipes","5/13/16",2016-05-13,"2016","Coleoptera"
"CASENT9131923","Coleoptera","Elmidae","Narpus","angustus","5/13/16",2016-05-13,"2016","Coleoptera"
"CASENT9101003","Ephemeroptera","Ephemerellidae","Drunella","coloradensis","5/13/16",2016-05-13,"2016","Ephemeroptera"
"CASLOT062460","Ephemeroptera","Ephemerellidae","Serratella","micheneri","5/13/16",2016-05-13,"2016","Ephemeroptera"
"CASLOT75541","Ephemeroptera","Ameletidae","Ameletus","sp.","5/13/16",2016-05-13,"2016","Ephemeroptera"
"CASENT9132682","Coleoptera","Elmidae","Narpus","angustus","5/13/16",2016-05-13,"2016","Coleoptera"
"CASENT9132076","Plecoptera","Perlodidae","Kogotus","nonus","5/13/16",2016-05-13,"2016","Plecoptera"
"CASENT9132464","Plecoptera","Perlodidae","Isoperla","pinta","5/13/16",2016-05-13,"2016","Plecoptera"
"CASLOT75314","Ephemeroptera","Baetidae","Baetis","tricaudatus","5/13/16",2016-05-13,"2016","Ephemeroptera"
"CASLOT060978","Ephemeroptera","Leptophlebiidae","Paraleptophlebia","sp.","5/13/16",2016-05-13,"2016","Ephemeroptera"
"CASENT9130741","Trichoptera","Rhyacophilidae","Rhyacophila","angelita","5/3/16",2016-05-03,"2016","Trichoptera"
"CASLOT75318","Ephemeroptera","Baetidae","Baetis","tricaudatus","5/3/16",2016-05-03,"2016","Ephemeroptera"
"CASENT9131036",NA,"Thremmatidae","Neophylax","splendens","5/3/16",2016-05-03,"2016",NA
"CASENT9130208","Trichoptera","Rhyacophilidae","Himalopsyche","phryganea","5/3/16",2016-05-03,"2016","Trichoptera"
"CASENT9130776",NA,"Thremmatidae","Neophylax","splendens","5/3/16",2016-05-03,"2016",NA
"CASENT9130595","Diptera","Blephariceridae","Agathon","doanei","5/3/16",2016-05-03,"2016","Diptera"
"CASENT9130104","Diptera","Blephariceridae","Philorus","californicus","5/3/16",2016-05-03,"2016","Diptera"
"CASLOT059657","Ephemeroptera","Heptageniidae","Ironodes","californicus","5/3/16",2016-05-03,"2016","Ephemeroptera"
"CASENT9132685","Plecoptera","Perlidae","Hesperoperla","hoguei","5/3/16",2016-05-03,"2016","Plecoptera"
"CASENT9116242","Ephemeroptera","Heptageniidae","Epeorus","grandis","5/3/16",2016-05-03,"2016","Ephemeroptera"
"CASLOT062161","Ephemeroptera","Heptageniidae","Epeorus","longimanus","5/3/16",2016-05-03,"2016","Ephemeroptera"
"CASLOT75293","Ephemeroptera","Baetidae","Baetis","tricaudatus","5/3/16",2016-05-03,"2016","Ephemeroptera"
"CASENT9130841","Trichoptera","Hydropsychidae","Parapsyche","sp.","5/3/16",2016-05-03,"2016","Trichoptera"
"CASENT9130642","Diptera","Limoniidae","Hexatoma","sp.","5/3/16",2016-05-03,"2016","Diptera"
"CASENT9130493","Trichoptera","Hydropsychidae","Hydropsyche","sp.","5/3/16",2016-05-03,"2016","Trichoptera"
"CASLOT060979","Ephemeroptera","Leptophlebiidae","Paraleptophlebia","sp.","5/3/16",2016-05-03,"2016","Ephemeroptera"
"CASLOT064543","Coleoptera","Dytiscidae","Oreodytes","picturatus","5/3/16",2016-05-03,"2016","Coleoptera"
"CASLOT059658","Ephemeroptera","Heptageniidae","Ironodes","californicus","5/3/16",2016-05-03,"2016","Ephemeroptera"
"CASENT9131284",NA,"Thremmatidae","Neophylax","splendens","5/3/16",2016-05-03,"2016",NA
"CASENT9132296","Plecoptera","Nemouridae","Zapada","cordillera","5/3/16",2016-05-03,"2016","Plecoptera"
"CASLOT059160","Ephemeroptera","Heptageniidae","Cinygma","sp.","5/3/16",2016-05-03,"2016","Ephemeroptera"
"CASENT9131448",NA,"Oreogetonidae","Oreogeton","sp.","5/3/16",2016-05-03,"2016",NA
"CASLOT060980","Ephemeroptera","Leptophlebiidae","Paraleptophlebia","sp.","5/3/16",2016-05-03,"2016","Ephemeroptera"
"CASENT9130238","Trichoptera","Philopotamidae","Wormaldia","occidea","5/3/16",2016-05-03,"2016","Trichoptera"
"CASENT9131015","Coleoptera","Psephenidae","Acneus","quadrimaculatus","5/3/16",2016-05-03,"2016","Coleoptera"
"CASENT9131469","Plecoptera","Chloroperlidae","Sweltsa","pisteri","5/3/16",2016-05-03,"2016","Plecoptera"
"CASENT9132603","Plecoptera","Perlidae","Hesperoperla","hoguei","5/3/16",2016-05-03,"2016","Plecoptera"
"CASLOT060981","Ephemeroptera","Leptophlebiidae","Paraleptophlebia","sp.","5/3/16",2016-05-03,"2016","Ephemeroptera"
"CASENT9130263","Diptera","Dixidae","Meringodixa","sp.","5/3/16",2016-05-03,"2016","Diptera"
"CASENT9115682","Coleoptera","Dytiscidae","Sanfilippodytes","villis","5/3/16",2016-05-03,"2016","Coleoptera"
"CASLOT059659","Ephemeroptera","Heptageniidae","Ironodes","californicus","5/11/16",2016-05-11,"2016","Ephemeroptera"
"CASENT9132228","Coleoptera","Scirtidae","Elodes","sp.","5/11/16",2016-05-11,"2016","Coleoptera"
"CASENT9130767","Coleoptera","Psephenidae","Acneus","quadrimaculatus","5/11/16",2016-05-11,"2016","Coleoptera"
"CASENT9132213","Coleoptera","Hydrophilidae","Ametor","latus","5/11/16",2016-05-11,"2016","Coleoptera"
"CASENT9130352","Coleoptera","Hydrophilidae","Anacaena","sp.","5/11/16",2016-05-11,"2016","Coleoptera"
"CASENT9132391","Diptera","Psychodidae","Maruina","lanceolata","5/11/16",2016-05-11,"2016","Diptera"
"CASLOT75295","Ephemeroptera","Baetidae","Baetis","tricaudatus","5/11/16",2016-05-11,"2016","Ephemeroptera"
"CASENT9130005","Trichoptera","Lepidostomatidae","Lepidostoma","jewetti","5/11/16",2016-05-11,"2016","Trichoptera"
"CASENT9116188","Ephemeroptera","Leptophlebiidae","Paraleptophlebia","temporalis","5/11/16",2016-05-11,"2016","Ephemeroptera"
"CASENT9132689","Diptera","Stratiomyidae","Euparyphus","sp.","5/11/16",2016-05-11,"2016","Diptera"
"CASENT9130228","Trichoptera","Lepidostomatidae","Lepidostoma","cantha","5/10/16",2016-05-10,"2016","Trichoptera"
"CASENT9130888","Ephemeroptera","Baetidae","Anafroptilum","sp.","5/10/16",2016-05-10,"2016","Ephemeroptera"
"CASENT9131949","Diptera","Ceratopogonidae","Monohelea","sp.","5/10/16",2016-05-10,"2016","Diptera"
"CASENT9131275","Trichoptera","Limnephilidae","Clostoeca","disjuncta","5/10/16",2016-05-10,"2016","Trichoptera"
"CASENT9130336","Trichoptera","Lepidostomatidae","Lepidostoma","cantha","5/10/16",2016-05-10,"2016","Trichoptera"
"CASENT9130021","Trichoptera","Lepidostomatidae","Lepidostoma","cantha","5/10/16",2016-05-10,"2016","Trichoptera"
"CASENT9130309","Trichoptera","Limnephilidae","Clostoeca","disjuncta","5/10/16",2016-05-10,"2016","Trichoptera"
"CASENT9115681","Coleoptera","Dytiscidae","Sanfilippodytes","villis","5/10/16",2016-05-10,"2016","Coleoptera"
"CASENT9130369","Trichoptera","Lepidostomatidae","Lepidostoma","cantha","5/10/16",2016-05-10,"2016","Trichoptera"
"CASLOT75556","Ephemeroptera","Ameletidae","Ameletus","vancouverensis","5/10/16",2016-05-10,"2016","Ephemeroptera"
"CASENT9128127","Ephemeroptera","Baetidae","Baetis","tricaudatus","5/5/16",2016-05-05,"2016","Ephemeroptera"
"CASENT9101215","Trichoptera","Rhyacophilidae","Rhyacophila","vedra","5/5/16",2016-05-05,"2016","Trichoptera"
"CASENT9132101","Diptera","Psychodidae","Maruina","lanceolata","5/5/16",2016-05-05,"2016","Diptera"
"CASENT9130851","Trichoptera","Philopotamidae","Dolophilodes(Sisko)","sisko","5/5/16",2016-05-05,"2016","Trichoptera"
"CASENT9116189","Ephemeroptera","Leptophlebiidae","Paraleptophlebia","temporalis","5/5/16",2016-05-05,"2016","Ephemeroptera"
"CASENT9131249","Trichoptera","Rhyacophilidae","Rhyacophila","vocala","5/5/16",2016-05-05,"2016","Trichoptera"
"CASENT9131049","Trichoptera","Philopotamidae","Dolophilodes(Sisko)","sisko","5/5/16",2016-05-05,"2016","Trichoptera"
"CASENT9131910","Diptera","Psychodidae","Maruina","lanceolata","5/5/16",2016-05-05,"2016","Diptera"
"CASENT9101229","Orthoptera","Tetrigidae","Paratettix","azteca","5/29/16",2016-05-29,"2016","Orthoptera"
"CASENT9131157","Trichoptera","Philopotamidae","Dolophilodes(Sisko)","sisko","5/5/16",2016-05-05,"2016","Trichoptera"
"CASENT9128210","Ephemeroptera","Ameletidae","Ameletus","vancouverensis","5/5/16",2016-05-05,"2016","Ephemeroptera"
"CASENT9130254","Trichoptera","Lepidostomatidae","Lepidostoma","jewetti","5/27/16",2016-05-27,"2016","Trichoptera"
"CASENT9131961","Coleoptera","Scirtidae","Elodes","sp.","5/27/16",2016-05-27,"2016","Coleoptera"
"CASENT9131941","Coleoptera","Elmidae","Lara","avara","5/27/16",2016-05-27,"2016","Coleoptera"
"CASENT9101330","Ephemeroptera","Heptageniidae","Ironodes","californicus","5/27/16",2016-05-27,"2016","Ephemeroptera"
"CASENT9132210","Coleoptera","Hydrophilidae","Ametor","latus","5/27/16",2016-05-27,"2016","Coleoptera"
"CASENT9131771","Diptera","Psychodidae","Pericoma","sp.","5/11/16",2016-05-11,"2016","Diptera"
"CASENT9131430","Ephemeroptera","Ameletidae","Ameletus","vancouverensis","5/5/16",2016-05-05,"2016","Ephemeroptera"
"CASLOT060982","Ephemeroptera","Leptophlebiidae","Paraleptophlebia","temporalis","5/5/16",2016-05-05,"2016","Ephemeroptera"
"CASLOT060983","Ephemeroptera","Leptophlebiidae","Paraleptophlebia","associata","5/5/16",2016-05-05,"2016","Ephemeroptera"
"CASLOT064584","Coleoptera","Dytiscidae","Agabus","sp.","5/5/16",2016-05-05,"2016","Coleoptera"
"CASLOT059158","Ephemeroptera","Heptageniidae","Cinygma","integrum","5/5/16",2016-05-05,"2016","Ephemeroptera"
"CASLOT059487","Ephemeroptera","Heptageniidae","Ecdyonurus","criddlei","5/5/16",2016-05-05,"2016","Ephemeroptera"
"CASENT9131056","Ephemeroptera","Baetidae","Anafroptilum","conturbatum","5/5/16",2016-05-05,"2016","Ephemeroptera"
"CASLOT75308","Ephemeroptera","Baetidae","Baetis","piscatoris","5/5/16",2016-05-05,"2016","Ephemeroptera"
"CASENT9130084","Diptera","Dixidae","Meringodixa","sp.","5/27/16",2016-05-27,"2016","Diptera"
"CASENT9130553","Coleoptera","Hydraenidae","Hydraena","vandykei","5/27/16",2016-05-27,"2016","Coleoptera"
"CASENT9116190","Ephemeroptera","Leptophlebiidae","Paraleptophlebia","associata","5/27/16",2016-05-27,"2016","Ephemeroptera"
"CASENT9130676","Ephemeroptera","Baetidae","Anafroptilum","asperatum","5/27/16",2016-05-27,"2016","Ephemeroptera"
"CASENT9131979","Coleoptera","Hydrophilidae","Hydrobius","fuscipes","5/27/16",2016-05-27,"2016","Coleoptera"
"CASENT9115603","Coleoptera","Dytiscidae","Agabus","walsinghami","5/27/16",2016-05-27,"2016","Coleoptera"
"CASLOT062495","Coleoptera","Dytiscidae","Sanfilippodytes","villis","5/27/16",2016-05-27,"2016","Coleoptera"
"CASENT9132728","Coleoptera","Haliplidae","Haliplus","subguttatus","5/27/16",2016-05-27,"2016","Coleoptera"
"CASENT91115593","Coleoptera","Dytiscidae","Hydroporus","sp.","5/27/16",2016-05-27,"2016","Coleoptera"
"CASLOT064560","Coleoptera","Dytiscidae","Uvarus","subtilus","5/27/16",2016-05-27,"2016","Coleoptera"
"CASENT9131116","Diptera","Culicidae","Culiseta","inornata","5/27/16",2016-05-27,"2016","Diptera"
"CASENT9130997","Odonata","Lestidae","Lestes","sp.","5/27/16",2016-05-27,"2016","Odonata"
"CASLOT060984","Ephemeroptera","Leptophlebiidae","Paraleptophlebia","associata","5/27/16",2016-05-27,"2016","Ephemeroptera"
"CASENT9128176","Ephemeroptera","Baetidae","Anafroptilum","asperatum","5/27/16",2016-05-27,"2016","Ephemeroptera"
"CASENT9132073","Coleoptera","Hydrophilidae","Hydrobius","fuscipes","5/27/16",2016-05-27,"2016","Coleoptera"
"CASENT9132887","Odonata","Libellulidae","Sympetrum","sp.","5/27/16",2016-05-27,"2016","Odonata"
"CASENT9115687","Coleoptera","Dytiscidae","Sanfilippodytes","sp.","5/27/16",2016-05-27,"2016","Coleoptera"
"CASLOT064581","Coleoptera","Dytiscidae","Agabus","sp.","5/27/16",2016-05-27,"2016","Coleoptera"
"CASENT9130179","Trichoptera","Philopotamidae","Dolophilodes(Sisko)","sisko","5/27/16",2016-05-27,"2016","Trichoptera"
"CASENT9131107","Trichoptera","Polycentropodidae","Polycentropus","variegatus","5/27/16",2016-05-27,"2016","Trichoptera"
"CASLOT059035","Ephemeroptera","Ephemerellidae","Drunella","coloradensis","5/27/16",2016-05-27,"2016","Ephemeroptera"
"CASENT9101060","Ephemeroptera","Heptageniidae","Cinygma","integrum","5/27/16",2016-05-27,"2016","Ephemeroptera"
"CASENT9132198","Coleoptera","Hydrophilidae","Ametor","scabrosus","5/27/16",2016-05-27,"2016","Coleoptera"
"CASENT9130846","Ephemeroptera","Baetidae","Baetis","piscatoris","5/27/16",2016-05-27,"2016","Ephemeroptera"
"CASENT9115609","Coleoptera","Dytiscidae","Agabus","lutosus","5/27/16",2016-05-27,"2016","Coleoptera"
"CASENT9130942",NA,"Thremmatidae","Neophylax","splendens","5/5/16",2016-05-05,"2016",NA
"CASLOT059054","Ephemeroptera","Ephemerellidae","Drunella","flavilinea","5/5/16",2016-05-05,"2016","Ephemeroptera"
"CASLOT059038","Ephemeroptera","Ephemerellidae","Drunella","coloradensis","5/5/16",2016-05-05,"2016","Ephemeroptera"
"CASENT9131730","Odonata","Cordulegastridae","Cordulegaster","dorsalis","5/5/16",2016-05-05,"2016","Odonata"
"CASLOT062775","Odonata","Gomphidae","Octogomphus","specularis","5/5/16",2016-05-05,"2016","Odonata"
"CASLOT059660","Ephemeroptera","Heptageniidae","Ironodes","californicus","5/5/16",2016-05-05,"2016","Ephemeroptera"
"CASENT9116255","Ephemeroptera","Heptageniidae","Epeorus","longimanus","5/5/16",2016-05-05,"2016","Ephemeroptera"
"CASLOT059159","Ephemeroptera","Heptageniidae","Cinygma","integrum","5/5/16",2016-05-05,"2016","Ephemeroptera"
"CASENT9131002","Trichoptera","Hydropsychidae","Parapsyche","almota","5/5/16",2016-05-05,"2016","Trichoptera"
"CASLOT75288","Ephemeroptera","Baetidae","Baetis","tricaudatus","5/5/16",2016-05-05,"2016","Ephemeroptera"
"CASLOT75304","Ephemeroptera","Baetidae","Baetis","piscatoris","5/5/16",2016-05-05,"2016","Ephemeroptera"
"CASENT9116191","Ephemeroptera","Leptophlebiidae","Paraleptophlebia","temporalis","5/11/16",2016-05-11,"2016","Ephemeroptera"
"CASENT9116192","Ephemeroptera","Leptophlebiidae","Paraleptophelbia","sp.","5/5/16",2016-05-05,"2016","Ephemeroptera"
"CASENT9101061","Ephemeroptera","Heptageniidae","Cinygma","integrum","5/5/16",2016-05-05,"2016","Ephemeroptera"
"CASENT9116193","Ephemeroptera","Leptophlebiidae","Paraleptophlebia","sp.","5/10/16",2016-05-10,"2016","Ephemeroptera"
"CASENT9130394","Trichoptera","Philopotamidae","Dolophilodes","sisko","6/8/16",2016-06-08,"2016","Trichoptera"
"CASENT9132823","Plecoptera","Chloroperlidae","Sweltsa","pisteri","6/8/16",2016-06-08,"2016","Plecoptera"
"CASENT9130170","Trichoptera","Brachycentridae","Amiocentrus","aspilus","6/8/16",2016-06-08,"2016","Trichoptera"
"CASLOT060862","Lepidoptera","Crambidae","Petrophila","confusalis","6/8/16",2016-06-08,"2016","Lepidoptera"
"CASLOT060869","Lepidoptera","Crambidae","Petrophila","confusalis","6/8/16",2016-06-08,"2016","Lepidoptera"
"CASENT9130328","Trichoptera","Odontoceridae","Marilia","flexuosa","6/30/16",2016-06-30,"2016","Trichoptera"
"CASENT9130317","Trichoptera","Philopotamidae","Chimarra","utahensis","6/30/16",2016-06-30,"2016","Trichoptera"
"CASENT9131401","Trichoptera","Hydroptilidae","Hydroptila","modica","6/30/16",2016-06-30,"2016","Trichoptera"
"CASENT9130946","Trichoptera","Glossosomatidae","Glossosoma","califica","6/30/16",2016-06-30,"2016","Trichoptera"
"CASENT9130692","Trichoptera","Odontoceridae","Marilia","flexuosa","6/30/16",2016-06-30,"2016","Trichoptera"
"CASENT9131168","Trichoptera","Odontoceridae","Marilia","flexuosa","6/30/16",2016-06-30,"2016","Trichoptera"
"CASENT9131301","Trichoptera","Hydropsychidae","Hydropsyche","oslari","6/30/16",2016-06-30,"2016","Trichoptera"
"CASENT9130631","Trichoptera","Helicopsychidae","Helicopsyche","borealis","6/30/16",2016-06-30,"2016","Trichoptera"
"CASENT9131389","Trichoptera","Glossosomatidae","Agapetus","taho","6/30/16",2016-06-30,"2016","Trichoptera"
"CASENT9130241","Trichoptera","Philopotamidae","Dolophilodes","sisko","6/30/16",2016-06-30,"2016","Trichoptera"
"CASENT9131103","Trichoptera","Philopotamidae","Chimarra","utahensis","6/30/16",2016-06-30,"2016","Trichoptera"
"CASENT9132085","Plecoptera","Perlodidae","Isoperla","roguensis","6/30/16",2016-06-30,"2016","Plecoptera"
"CASLOT060856","Lepidoptera","Crambidae","Petrophila","confusalis","6/30/16",2016-06-30,"2016","Lepidoptera"
"CASENT9130418","Trichoptera","Odontoceridae","Marilia","flexuosa","6/30/16",2016-06-30,"2016","Trichoptera"
"CASENT9132155","Plecoptera","Perlodidae","Isoperla","roguensis","6/30/16",2016-06-30,"2016","Plecoptera"
"CASENT9132812","Plecoptera","Chloroperlidae","Sweltsa","pisteri","6/30/16",2016-06-30,"2016","Plecoptera"
"CASENT9132848","Plecoptera","Chloroperlidae","Suwallia","dubia","6/30/16",2016-06-30,"2016","Plecoptera"
"CASENT9130399","Trichoptera","Philopotamidae","Dolophilodes","sisko","6/30/16",2016-06-30,"2016","Trichoptera"
"CASLOT060985","Ephemeroptera","Leptophlebiidae","Paraleptophlebia","sp.","6/30/16",2016-06-30,"2016","Ephemeroptera"
"CASENT9130868","Ephemeroptera","Baetidae","Centroptilum","bifurcatum","6/30/16",2016-06-30,"2016","Ephemeroptera"
"CASENT9131147","Trichoptera","Odontoceridae","Marilia","flexuosa","6/30/16",2016-06-30,"2016","Trichoptera"
"CASENT9130883","Trichoptera","Helicopsychidae","Helicopsyche","borealis","6/30/16",2016-06-30,"2016","Trichoptera"
"CASENT9130758","Trichoptera","Glossosomatidae","Glossosoma","pternum","6/30/16",2016-06-30,"2016","Trichoptera"
"CASLOT060867","Lepidoptera","Crambidae","Petrophila","confusalis","6/30/16",2016-06-30,"2016","Lepidoptera"
"CASENT9130095","Coleoptera","Hydrophilidae","Crenitis","dissimilis","6/8/16",2016-06-08,"2016","Coleoptera"
"CASLOT059476",NA,"23554",NA,NA,"7/28/16",2016-07-28,"2016",NA
"CASLOT060866","Lepidoptera","Crambidae","Petrophila","confusalis","7/28/16",2016-07-28,"2016","Lepidoptera"
"CASLOT060852","Lepidoptera","Crambidae","Petrophila","confusalis","7/28/16",2016-07-28,"2016","Lepidoptera"
"CASENT9131346","Trichoptera","Hydroptilidae","Hydroptila","modica","7/28/16",2016-07-28,"2016","Trichoptera"
"CASENT9132430",NA,NA,"Laccobius","sp.","7/28/16",2016-07-28,"2016",NA
"CASENT9130771","Trichoptera","Hydroptilidae","Hydroptila","arctia","7/28/16",2016-07-28,"2016","Trichoptera"
"CASLOT060863","Lepidoptera","Crambidae","Petrophila","confusalis","7/28/16",2016-07-28,"2016","Lepidoptera"
"CASENT9130701","Trichoptera","Hydroptilidae","Hydroptila","modica","7/28/16",2016-07-28,"2016","Trichoptera"
"CASLOT060986","Ephemeroptera","Leptophlebiidae","Paraleptophlebia","sp.","8/4/16",2016-08-04,"2016","Ephemeroptera"
"CASENT9130974","Coleoptera","Hydrophilidae","Helophorus","sp.","8/4/16",2016-08-04,"2016","Coleoptera"
"CASENT9131084","Coleoptera","Hydrophilidae","Anacaena","sp.","8/4/16",2016-08-04,"2016","Coleoptera"
"CASENT9115569","Coleoptera","Dytiscidae","Liodessus","obscurellus","8/4/16",2016-08-04,"2016","Coleoptera"
"CASENT9115587","Coleoptera","Dytiscidae","Colymbetes","densus","8/4/16",2016-08-04,"2016","Coleoptera"
"CASENT9132021","Plecoptera","Perlidae","Hesperoperla","hoguei","8/4/16",2016-08-04,"2016","Plecoptera"
"CASENT9130825","Trichoptera","Hydropsychidae","Parapsyche","sp.","8/4/16",2016-08-04,"2016","Trichoptera"
"CASENT9131292","Diptera","Dixidae","Meringodixa","sp.","8/4/16",2016-08-04,"2016","Diptera"
"CASENT9132280","Plecoptera","Nemouridae","Zapada","columbiana","8/4/16",2016-08-04,"2016","Plecoptera"
"CASENT9130469","Trichoptera","Philopotamidae","Dolophilodes","sp.","8/4/16",2016-08-04,"2016","Trichoptera"
"CASENT9130787","Diptera","Tipulidae","Dicranota","sp.","8/4/16",2016-08-04,"2016","Diptera"
"CASENT9131501","Plecoptera","Nemouridae","Soyedina","sp.","8/4/16",2016-08-04,"2016","Plecoptera"
"CASENT9131193","Trichoptera","Rhyacophilidae","Rhyacophila","grandis","8/4/16",2016-08-04,"2016","Trichoptera"
"CASLOT75297","Ephemeroptera","Baetidae","Baetis","tricaudatus","8/4/16",2016-08-04,"2016","Ephemeroptera"
"CASENT9130490","Trichoptera","Hydropsychidae","Parapsyche","sp.","8/4/16",2016-08-04,"2016","Trichoptera"
"CASENT9132087","Coleoptera","Elmidae","Lara","sp.","8/4/16",2016-08-04,"2016","Coleoptera"
"CASENT9132163","Coleoptera","Scirtidae","Elodes","sp.","8/4/16",2016-08-04,"2016","Coleoptera"
"CASENT9130792","Trichoptera","Limnephilidae","Psychoglypha","sp.","8/4/16",2016-08-04,"2016","Trichoptera"
"CASENT9131556","Plecoptera","Nemouridae","Zapada","columbiana","8/4/16",2016-08-04,"2016","Plecoptera"
"CASENT9101326","Ephemeroptera","Heptageniidae","Ironodes","sp.","8/4/16",2016-08-04,"2016","Ephemeroptera"
"CASENT9130281","Trichoptera","Rhyacophilidae","Rhyacophila","angelita","8/3/16",2016-08-03,"2016","Trichoptera"
"CASLOT76371","Ephemeroptera","Baetidae","Diphetor","hageni","8/4/16",2016-08-04,"2016","Ephemeroptera"
"CASENT9131042","Plecoptera","Peltoperlidae","Yoraperla","sp.","8/4/16",2016-08-04,"2016","Plecoptera"
"CASENT9115662","Coleoptera","Dytiscidae","Agabus","sp.","8/4/16",2016-08-04,"2016","Coleoptera"
"CASENT9130185","Trichoptera","Lepidostomatidae","Lepidostoma","sp.","8/4/16",2016-08-04,"2016","Trichoptera"
"CASENT9131442","Diptera","Tabanidae","Tabanus","sp.","8/4/16",2016-08-04,"2016","Diptera"
"CASENT9130878","Odonata","Coenagrionidae","Argia","sp.","8/4/16",2016-08-04,"2016","Odonata"
"CASENT9130875","Trichoptera","Sericostomatidae","Gumaga","sp.","8/4/16",2016-08-04,"2016","Trichoptera"
"CASENT9130435","Coleoptera","Hydrophilidae","Anacaena","sp.","8/4/16",2016-08-04,"2016","Coleoptera"
"CASENT9115674","Coleoptera","Dytiscidae","Rhantus","gutticollis","8/4/16",2016-08-04,"2016","Coleoptera"
"CASENT9131057","Odonata","Coenagrionidae","Argia","sp.","8/4/16",2016-08-04,"2016","Odonata"
"CASLOT060987","Ephemeroptera","Leptophlebiidae","Paraleptophelbia","sp.","8/4/16",2016-08-04,"2016","Ephemeroptera"
"CASENT9130969","Megaloptera","Sialidae","Sialis","nevadensis","8/4/16",2016-08-04,"2016","Megaloptera"
"CASENT9130357","Trichoptera","Limnephilidae","Limnephilus","peltus","8/4/16",2016-08-04,"2016","Trichoptera"
"CASENT9130234","Trichoptera","Limnephilidae","Limnephilus","peltus","8/3/16",2016-08-03,"2016","Trichoptera"
"CASENT9131040","Trichoptera","Limnephilidae","Limnephilus","morrisoni","8/3/16",2016-08-03,"2016","Trichoptera"
"CASENT9131294","Trichoptera","Limnephilidae","Limnephilus","rillus","8/3/16",2016-08-03,"2016","Trichoptera"
"CASENT9130156","Trichoptera","Limnephilidae","Hydatophylax","hesperus","8/3/16",2016-08-03,"2016","Trichoptera"
"CASLOT062768","Trichoptera","Ceratopsyche","Hydropsyche","amblis","8/3/16",2016-08-03,"2016","Trichoptera"
"CASENT9130519","Trichoptera","Ceratopsyche","Hydropsyche","amblis","8/3/16",2016-08-03,"2016","Trichoptera"
"CASLOT062461","Ephemeroptera","Ephemerellidae","Timpanoga","hecuba","8/3/16",2016-08-03,"2016","Ephemeroptera"
"CASENT9130624","Plecoptera","Pteronarcyidae","Pteronarcella","regularis","8/3/16",2016-08-03,"2016","Plecoptera"
"CASENT9131866","Trichoptera","Limnephilidae","Psychoglypha","sp.","8/3/16",2016-08-03,"2016","Trichoptera"
"CASENT9130780","Diptera","Limoniidae","Hexatoma","sp.","8/3/16",2016-08-03,"2016","Diptera"
"CASENT9130918","Trichoptera","Glossosomatidae","Agapetus","sp.","8/3/16",2016-08-03,"2016","Trichoptera"
"CASENT9130344","Trichoptera","Philopotamidae","Dolophilodes","sp.","8/3/16",2016-08-03,"2016","Trichoptera"
"CASENT9130524","Trichoptera","Rhyacophilidae","Rhyacophila","sp.","8/3/16",2016-08-03,"2016","Trichoptera"
"CASENT9130959","Trichoptera","Rhyacophilidae","Rhyacophila","angelita","8/3/16",2016-08-03,"2016","Trichoptera"
"CASENT9130671","Megaloptera","Sialidae","Sialis","occidens","8/3/16",2016-08-03,"2016","Megaloptera"
"CASENT9130938","Ephemeroptera","Ameletidae","Ameletus","sp.","8/3/16",2016-08-03,"2016","Ephemeroptera"
"CASLOT75292","Ephemeroptera","Baetidae","Baetis","tricaudatus","8/3/16",2016-08-03,"2016","Ephemeroptera"
"CASENT9131218","Ephemeroptera","Baetidae","Baetis","sp.","8/3/16",2016-08-03,"2016","Ephemeroptera"
"CASENT9131566","Diptera","Muscidae","Limnophora","sp.","8/3/16",2016-08-03,"2016","Diptera"
"CASLOT062497","Coleoptera","Dytiscidae","Oreodytes","picturatus","8/3/16",2016-08-03,"2016","Coleoptera"
"CASENT9115727","Coleoptera","Dytiscidae","Stictotarsus","griseostriatus","8/3/16",2016-08-03,"2016","Coleoptera"
"CASENT9130905","Hemiptera","Corixidae","Sigara","sp.","8/3/16",2016-08-03,"2016","Hemiptera"
"CASENT9130712","Diptera","Limoniidae","Hexatoma","sp.","8/3/16",2016-08-03,"2016","Diptera"
"CASENT9131356","Megaloptera","Sialidae","Sialis","occidens","8/3/16",2016-08-03,"2016","Megaloptera"
"CASENT9116194","Ephemeroptera","Leptophlebiidae","Paraleptophlebia","sp.","8/3/16",2016-08-03,"2016","Ephemeroptera"
"CASENT9116195","Ephemeroptera","Leptophlebiidae","Paraleptophlebia","sp.","8/3/16",2016-08-03,"2016","Ephemeroptera"
"CASENT9130829","Hemiptera","Gerridae","Aquarius","remigis","8/3/16",2016-08-03,"2016","Hemiptera"
"CASENT9116196","Ephemeroptera","Siphlonuridae","Siphlonurus","sp.","8/3/16",2016-08-03,"2016","Ephemeroptera"
"CASLOT062462","Ephemeroptera","Ephemerellidae","Timpanoga","hecuba","8/3/16",2016-08-03,"2016","Ephemeroptera"
"CASLOT062463","Ephemeroptera","Ephemerellidae","Ephemerella","velmae","8/3/16",2016-08-03,"2016","Ephemeroptera"
"CASENT9116396","Ephemeroptera","Ephemerellidae","Ephemerella","mucronata","8/3/16",2016-08-03,"2016","Ephemeroptera"
"CASENT9116397","Ephemeroptera","Ephemerellidae","Ephemerella","aurivillii","8/3/16",2016-08-03,"2016","Ephemeroptera"
"CASLOT064535","Coleoptera","Dytiscidae","Oreodytes","picturatus","8/3/16",2016-08-03,"2016","Coleoptera"
"CASENT9116215","Ephemeroptera","Heptageniidae","Nixe","sp.","8/3/16",2016-08-03,"2016","Ephemeroptera"
"CASENT9130559","Ephemeroptera","Baetidae","Anafroptilum","conturbatum","8/3/16",2016-08-03,"2016","Ephemeroptera"
"CASENT9130962","Hemiptera","Corixidae",NA,NA,"8/3/16",2016-08-03,"2016","Hemiptera"
"CASENT9131199","Coleoptera","Hydrophilidae","Ametor","sp.","8/3/16",2016-08-03,"2016","Coleoptera"
"CASENT9101367","Plecoptera","Perlodidae","Cultus","sp.","6/30/16",2016-06-30,"2016","Plecoptera"
"CASLOT059719","Plecoptera","Nemouridae","Malenka","sp.","6/24/16",2016-06-24,"2016","Plecoptera"
"CASENT9101368","Megaloptera","Corydalidae","Orohermes","crepusculus","6/24/16",2016-06-24,"2016","Megaloptera"
"CASLOT059720","Trichoptera","Hydropsychidae","Hydropsyche","oslari","8/25/16",2016-08-25,"2016","Trichoptera"
"CASENT9101369","Trichoptera","Hydropsychidae","Hydropsyche","oslari","8/25/16",2016-08-25,"2016","Trichoptera"
"CASENT9101370","Trichoptera","Hydropsychidae","Hydropsyche","sp.","8/25/16",2016-08-25,"2016","Trichoptera"
"CASENT9101371","Trichoptera","Rhyacophilidae","Rhyacophila","sp.","8/25/16",2016-08-25,"2016","Trichoptera"
"CASLOT059721","Trichoptera","Hydropsychidae","Hydropsyche","oslari","8/25/16",2016-08-25,"2016","Trichoptera"
"CASLOT059722","Trichoptera","Hydropsychidae","Hydropsyche","oslari","8/25/16",2016-08-25,"2016","Trichoptera"
"CASENT9101372","Trichoptera","Glossosomatidae","Agapetus","taho","8/25/16",2016-08-25,"2016","Trichoptera"
"CASENT9101373","Trichoptera","Hydroptilidae","Hydroptila","sp.","8/25/16",2016-08-25,"2016","Trichoptera"
"CASLOT059723","Coleoptera","Elmidae","Ordobrevia","nubifera","8/26/16",2016-08-26,"2016","Coleoptera"
"CASLOT059724","Trichoptera","Glossosomatidae","Agapetus","taho","8/26/16",2016-08-26,"2016","Trichoptera"
"CASLOT059725","Plecoptera","Peltoperlidae","Soliperla","thyra","8/26/16",2016-08-26,"2016","Plecoptera"
"CASENT9101374","Trichoptera","Rhyacophilidae","Rhyacophila","vedra","8/26/16",2016-08-26,"2016","Trichoptera"
"CASENT9101375","Isopoda","Ligiidae","Ligidium","sp.","8/26/16",2016-08-26,"2016","Isopoda"
"CASLOT059726","Coleoptera","Psephenidae","Eubrianax","edwardsi","8/26/16",2016-08-26,"2016","Coleoptera"
"CASLOT059727","Diptera","Psychodidae","Maruina","lanceolata","8/26/16",2016-08-26,"2016","Diptera"
"CASENT9101376","Coleoptera","Hydrophilidae","Ametor","scabrosus","8/26/16",2016-08-26,"2016","Coleoptera"
"CASENT9101377","Coleoptera","Dytiscidae","Sanfilippodytes","vilis","8/26/16",2016-08-26,"2016","Coleoptera"
"CASLOT059728","Trichoptera","Limnephilidae","Psychoglypha","sp.","8/26/16",2016-08-26,"2016","Trichoptera"
"CASENT9101378","Odonata","Gomphidae","Octogomphus","specularis","8/26/16",2016-08-26,"2016","Odonata"
"CASLOT059729","Plecoptera","Perlidae","Calineuria","californica","8/26/16",2016-08-26,"2016","Plecoptera"
"CASLOT059730","Trichoptera","Lepidostomatidae","Lepidostoma","cinereum","8/26/16",2016-08-26,"2016","Trichoptera"
"CASLOT059731","Trichoptera","Lepidostomatidae","Lepidostoma","unicolor","8/26/16",2016-08-26,"2016","Trichoptera"
"CASLOT059732","Trichoptera","Polycentropodidae","Polycentropus","sp.","8/26/16",2016-08-26,"2016","Trichoptera"
"CASLOT059733","Coleoptera","Psephenidae","Eubrianax","edwardsi","8/26/16",2016-08-26,"2016","Coleoptera"
"CASLOT059734","Hemiptera","Notonectidae","Notonecta","kirbyi","8/26/16",2016-08-26,"2016","Hemiptera"
"CASLOT059735","Hemiptera","Corixidae","Graptocorixa","californica","8/26/16",2016-08-26,"2016","Hemiptera"
"CASENT9101379","Coleoptera","Dytiscidae","Stictotarsus","striatellus","8/26/16",2016-08-26,"2016","Coleoptera"
"CASENT9101380","Coleoptera","Dytiscidae","Stictotarsus","griseostriatus","8/26/16",2016-08-26,"2016","Coleoptera"
"CASLOT059736","Ephemeroptera","Baetidae","Anafroptilum","conturbatum","8/26/16",2016-08-26,"2016","Ephemeroptera"
"CASLOT059737","Ephemeroptera","Leptophlebiidae","Paraleptophlebia","debilis","8/26/16",2016-08-26,"2016","Ephemeroptera"
"CASLOT059753","Ephemeroptera","Heptageniidae","Nixe","kennedyi","8/26/16",2016-08-26,"2016","Ephemeroptera"
"CASENT9101388","Coleoptera","Dytiscidae","Agabus","lutosus","8/26/16",2016-08-26,"2016","Coleoptera"
"CASLOT059754","Coleoptera","Dytiscidae","Agabus","walsinghami","8/26/16",2016-08-26,"2016","Coleoptera"
"CASLOT059755","Trichoptera","Hydropsychidae","Hydropsyche","oslari","7/14/94",1994-07-14,"1994","Trichoptera"
"CASLOT059756","Coleoptera","Hydrophilidae","Hydrobius","fuscipes","7/14/94",1994-07-14,"1994","Coleoptera"
"CASLOT059757","Plecoptera","Perlidae","Calineuria","californica","8/4/16",2016-08-04,"2016","Plecoptera"
"CASENT9101389","Ephemeroptera","Ephemerellidae","Timpanoga","hecuba","8/4/16",2016-08-04,"2016","Ephemeroptera"
"CASLOT059758","Diptera","Limoniidae","Hexatoma","sp.","8/4/16",2016-08-04,"2016","Diptera"
"CASLOT059759","Plecoptera","Pteronarcyidae","Pteronarcella","regularis","8/4/16",2016-08-04,"2016","Plecoptera"
"CASLOT059760","Trichoptera","Philopotamidae","Wormaldia","sp.","8/4/16",2016-08-04,"2016","Trichoptera"
"CASLOT059761","Trichoptera","Rhyacophilidae","Rhyacophila","sp.","8/4/16",2016-08-04,"2016","Trichoptera"
"CASLOT059762","Trichoptera","Rhyacophilidae","Rhyacophila","sp.","8/4/16",2016-08-04,"2016","Trichoptera"
"CASLOT059763","Diptera","Simuliidae","Simulium","sp.","8/4/16",2016-08-04,"2016","Diptera"
"CASLOT059764","Diptera","Simuliidae","Simulium","sp.","8/4/16",2016-08-04,"2016","Diptera"
"CASENT9101390","Ephemeroptera","Ameletidae","Ameletus","sp.","8/4/16",2016-08-04,"2016","Ephemeroptera"
"CASENT9101391","Ephemeroptera","Baetidae","Baetis","tricaudatus","8/4/16",2016-08-04,"2016","Ephemeroptera"
"CASENT9101392","Ephemeroptera","Ephemerellidae",NA,NA,"8/4/16",2016-08-04,"2016","Ephemeroptera"
"CASLOT059765","Plecoptera","Perlodidae",NA,NA,"8/4/16",2016-08-04,"2016","Plecoptera"
"CASENT9101393","Plecoptera","Chloroperlidae","Sweltsa","sp.","8/4/16",2016-08-04,"2016","Plecoptera"
"CASLOT059766","Coleoptera","Elmidae","Zaitzevia","parvula","8/4/16",2016-08-04,"2016","Coleoptera"
"CASLOT059884","Trichoptera","Lepidostomatidae","Lepidostoma","jewetti","5/27/16",2016-05-27,"2016","Trichoptera"
"CASENT9101492","Trichoptera","Hydropsychidae","Cheumatopsyche","mickeli","9/8/16",2016-09-08,"2016","Trichoptera"
"CASENT9101493","Trichoptera","Sericostomatidae","Gumaga","griseola","9/8/16",2016-09-08,"2016","Trichoptera"
"CASLOT059885","Lepidoptera","Crambidae","Petrophila","confusalis","9/8/16",2016-09-08,"2016","Lepidoptera"
"CASENT9101494","Trichoptera","Hydroptilidae","Hydroptila","sp.","9/8/16",2016-09-08,"2016","Trichoptera"
"CASENT9101495","Coleoptera","Hydraenidae","Hydraena","vandykei","9/8/16",2016-09-08,"2016","Coleoptera"
"CASENT9095304","Trichoptera","Philopotamidae","Wormaldia","gabriella","9/8/16",2016-09-08,"2016","Trichoptera"
"CASLOT059886","Lepidoptera","Crambidae","Petrophila","confusalis","9/8/16",2016-09-08,"2016","Lepidoptera"
"CASLOT059887","Trichoptera","Hydropsychidae","Hydropsyche","oslari","9/8/16",2016-09-08,"2016","Trichoptera"
"CASENT9101496","Trichoptera","Hydropsychidae","Hydropsyche","occidentalis","9/8/16",2016-09-08,"2016","Trichoptera"
"CASENT9101497","Trichoptera","Hydropsychidae","Cheumatopsyche","mickeli","9/8/16",2016-09-08,"2016","Trichoptera"
"CASENT9101498","Trichoptera","Lepidostomatidae","Lepidostoma","sp.","9/8/16",2016-09-08,"2016","Trichoptera"
"CASLOT059888","Trichoptera","Hydroptilidae","Hydroptila","sp.","9/8/16",2016-09-08,"2016","Trichoptera"
"CASENT9101499","Trichoptera","Psychomyiidae","Tinodes","sp.","9/8/16",2016-09-08,"2016","Trichoptera"
"CASLOT059889","Lepidoptera","Crambidae","Petrophila","confusalis","9/8/16",2016-09-08,"2016","Lepidoptera"
"CASENT9095298","Trichoptera","Hydropsychidae","Hydropsyche","oslari","9/8/16",2016-09-08,"2016","Trichoptera"
"CASENT9095299","Trichoptera","Hydropsychidae","Hydropsyche","occidentalis","9/8/16",2016-09-08,"2016","Trichoptera"
"CASENT9095300","Trichoptera","Psychomyiidae","Tinodes","sp.","9/8/16",2016-09-08,"2016","Trichoptera"
"CASENT9095301","Trichoptera","Sericostomatidae","Gumaga","griseola","9/8/16",2016-09-08,"2016","Trichoptera"
"CASENT9095302","Trichoptera","Polycentropodidae","Polycentropus","sp.","9/8/16",2016-09-08,"2016","Trichoptera"
"CASENT9095303","Trichoptera","Hydroptilidae","Hydroptila","sp.","9/8/16",2016-09-08,"2016","Trichoptera"
"CASLOT059890","Trichoptera","Hydroptilidae","Hydroptila","sp.","9/8/16",2016-09-08,"2016","Trichoptera"
"CASLOT059891","Lepidoptera","Crambidae","Petrophila","confusalis","9/8/16",2016-09-08,"2016","Lepidoptera"
"CASLOT059892","Diptera","Simuliidae","Simulium","infernale","9/22/16",2016-09-22,"2016","Diptera"
"CASLOT059893","Diptera","Simuliidae","Simulium","infernale","9/22/16",2016-09-22,"2016","Diptera"
"CASLOT059894","Diptera","Simuliidae","Simulium","infernale","9/22/16",2016-09-22,"2016","Diptera"
"CASENT9095305","Hemiptera","Macroveliidae","Macrovelia","hornii","9/22/16",2016-09-22,"2016","Hemiptera"
"CASENT9095306","Isopoda","Asellidae","Calasellus","sp.","9/22/16",2016-09-22,"2016","Isopoda"
"CASLOT059895","Hemiptera","Gerridae","Aquarius","remigis","9/22/16",2016-09-22,"2016","Hemiptera"
"CASLOT059896","Hemiptera","Corixidae","Graptocorixa","californica","9/22/16",2016-09-22,"2016","Hemiptera"
"CASENT9095307","Trichoptera","Limnephilidae","Psychoglypha","sp","9/22/16",2016-09-22,"2016","Trichoptera"
"CASENT9095308","Coleoptera","Dytiscidae","Stictotarsus","striatellus","9/22/16",2016-09-22,"2016","Coleoptera"
"CASENT9095309","Coleoptera","Dytiscidae","Stictotarsus","griseostriatus","9/22/16",2016-09-22,"2016","Coleoptera"
"CASLOT059897","Trichoptera","Limnephilidae","Psychoglypha","sp.","9/22/16",2016-09-22,"2016","Trichoptera"
"CASENT9095310","Trichoptera","Limnephilidae","Onocosmoecus","unicolor","9/29/16",2016-09-29,"2016","Trichoptera"
"CASLOT059898","Trichoptera","Limnephilidae","Allocosmoecus","partitus","9/29/16",2016-09-29,"2016","Trichoptera"
"CASLOT059899","Trichoptera","Limnephilidae","Desmona","bethula","9/30/16",2016-09-30,"2016","Trichoptera"
"CASLOT059900","Plecoptera","Nemouridae","Zapada","columbiana","9/30/16",2016-09-30,"2016","Plecoptera"
"CASLOT059901","Plecoptera","Nemouridae","Soyedina","sp.","9/30/16",2016-09-30,"2016","Plecoptera"
"CASENT9095311","Trichoptera","Hydropsychidae","Parapsyche","sp.","9/30/16",2016-09-30,"2016","Trichoptera"
"CASENT9132617","Ephemeroptera","Baetidae","Baetis","tricaudatus","9/30/16",2016-09-30,"2016","Ephemeroptera"
"CASENT9131824","Plecoptera","Peltoperlidae","Yoraperla","nigrisoma","9/30/16",2016-09-30,"2016","Plecoptera"
"CASENT9131774","Plecoptera","Chloroperlidae","Sweltsa","sp.","9/30/16",2016-09-30,"2016","Plecoptera"
"CASENT9131733","Coleoptera","Elmidae","Lara","sp.","9/30/16",2016-09-30,"2016","Coleoptera"
"CASENT9131686","Trichoptera","Hydropsychidae","Parapsyche","sp.","9/30/16",2016-09-30,"2016","Trichoptera"
"CASENT9132392","Ephemeroptera","Heptageniidae","Ironodes","sp.","9/30/16",2016-09-30,"2016","Ephemeroptera"
"CASENT9132297","Trichoptera","Odontoceridae","Nerophilus","californicus","9/30/16",2016-09-30,"2016","Trichoptera"
"CASENT9132314","Ephemeroptera","Baetidae","Baetis","tricaudatus","9/30/16",2016-09-30,"2016","Ephemeroptera"
"CASENT9131806","Plecoptera","Nemouridae","Malenka","sp.","9/30/16",2016-09-30,"2016","Plecoptera"
"CASENT9131921","Plecoptera","Nemouridae","Zapada","columbiana","9/30/16",2016-09-30,"2016","Plecoptera"
"CASENT9131853","Plecoptera","Peltoperlidae","Yoraperla","nigrisoma","9/30/16",2016-09-30,"2016","Plecoptera"
"CASENT9132574","Plecoptera","Perlodidae","Isoperla","sp.","9/30/16",2016-09-30,"2016","Plecoptera"
"CASENT9132324","Diptera","Simuliidae","Simulium","sp.","9/30/16",2016-09-30,"2016","Diptera"
"CASENT9131583","Plecoptera","Perlidae","Calineuria","californica","9/30/16",2016-09-30,"2016","Plecoptera"
"CASENT9132856","Diptera","Limoniidae","Hexatoma","sp.","9/30/16",2016-09-30,"2016","Diptera"
"CASENT9132335","Plecoptera","Perlodidae","Skwala","sp.","9/30/16",2016-09-30,"2016","Plecoptera"
"CASENT9130194","Plecoptera","Perlodidae","Perlinodes","aurea","9/30/16",2016-09-30,"2016","Plecoptera"
"CASENT9131674","Plecoptera","Perlodidae","Cultus","sp.","9/30/16",2016-09-30,"2016","Plecoptera"
"CASENT9132547","Ephemeroptera","Ephemerellidae","Drunella","spinifera","9/30/16",2016-09-30,"2016","Ephemeroptera"
"CASENT9131668","Trichoptera","Hydropsychidae","Hydropsyche","sp.","9/30/16",2016-09-30,"2016","Trichoptera"
"CASENT9132987","Plecoptera","Pteronarcyidae","Pteronarcella","regularis","9/30/16",2016-09-30,"2016","Plecoptera"
"CASENT9131460","Trichoptera","Rhyacophilidae","Rhyacophila","sp.","9/30/16",2016-09-30,"2016","Trichoptera"
"CASENT9131776","Coleoptera","Elmidae","Optioservus","sp.","9/30/16",2016-09-30,"2016","Coleoptera"
"CASENT9132308","Trichoptera","Apataniidae","Apatania","sorex","9/30/16",2016-09-30,"2016","Trichoptera"
"CASENT9131893",NA,"Thremmatidae","Neophylax","occidentis","9/30/16",2016-09-30,"2016",NA
"CASENT9132747","Trichoptera","Sericostomatidae","Gumaga","griseola","9/30/16",2016-09-30,"2016","Trichoptera"
"CASENT9131666","Trichoptera","Lepidostomatidae","Lepidostoma","sp.","9/30/16",2016-09-30,"2016","Trichoptera"
"CASENT9132285","Coleoptera","Elmidae","Narpus","concolor","9/30/16",2016-09-30,"2016","Coleoptera"
"CASENT9132106","Coleoptera","Elmidae","Optioservus","quadrimaculatus","9/30/16",2016-09-30,"2016","Coleoptera"
"CASENT9131013","Ephemeroptera","Ameletidae","Ameletus","sp.","9/30/16",2016-09-30,"2016","Ephemeroptera"
"CASENT9131669","Ephemeroptera","Heptageniidae","Nixe","kennedyi","9/30/16",2016-09-30,"2016","Ephemeroptera"
"CASENT9132349","Diptera","Limoniidae","Hexatoma","sp.","9/30/16",2016-09-30,"2016","Diptera"
"CASENT9131884","Odonata","Aeshnidae","Aeshna","sp.","9/30/16",2016-09-30,"2016","Odonata"
"CASENT9131769","Trichoptera","Apataniidae","Apatania","sorex","9/30/16",2016-09-30,"2016","Trichoptera"
"CASENT9131271","Trichoptera","Lepidostomatidae","Lepidostoma","sp.","9/30/16",2016-09-30,"2016","Trichoptera"
"CASENT9131573","Plecoptera","Perlodidae","Skwala","sp.","9/30/16",2016-09-30,"2016","Plecoptera"
"CASENT9132293","Ephemeroptera","Leptophlebiidae","Paraleptophlebia","sp.","9/30/16",2016-09-30,"2016","Ephemeroptera"
"CASENT9131060","Megaloptera","Sialidae","Sialis","sp.","9/30/16",2016-09-30,"2016","Megaloptera"
"CASENT9131822","Trichoptera","Hydropsychidae","Hydropsyche","sp.","9/30/16",2016-09-30,"2016","Trichoptera"
"CASENT9131144","Plecoptera","Chloroperlidae","Sweltsa","sp.","9/30/16",2016-09-30,"2016","Plecoptera"
"CASENT9131587","Diptera","Tabanidae","Tabanus","sp.","9/30/16",2016-09-30,"2016","Diptera"
"CASENT9131673","Coleoptera","Dytiscidae",NA,NA,"9/30/16",2016-09-30,"2016","Coleoptera"
"CASENT9131851","Diptera","Limoniidae","Hexatoma","sp.","9/30/16",2016-09-30,"2016","Diptera"
"CASENT9131338","Trichoptera","Limnephilidae","Hydatophylax","hesperus","9/30/16",2016-09-30,"2016","Trichoptera"
"CASENT9132342","Trichoptera","Calamoceratidae","Heteroplectron","californicum","9/30/16",2016-09-30,"2016","Trichoptera"
"CASENT9131724","Trichoptera","Rhyacophilidae","Rhyacophila","sp.","9/30/16",2016-09-30,"2016","Trichoptera"
"CASENT9131767","Plecoptera","Perlodidae","Skwala","sp.","9/30/16",2016-09-30,"2016","Plecoptera"
"CASLOT060566","Plecoptera","Perlodidae","Perlinodes","aurea","9/30/16",2016-09-30,"2016","Plecoptera"
"CASLOT060567","Plecoptera","Pteronarcyidae","Pteronarcella","regularis","9/30/16",2016-09-30,"2016","Plecoptera"
"CASENT9095462","Ephemeroptera","Ephemerellidae","Drunella","spinifera","9/30/16",2016-09-30,"2016","Ephemeroptera"
"CASLOT060568","Trichoptera","Hydropsychidae","Hydropsyche",NA,"9/30/16",2016-09-30,"2016","Trichoptera"
"CASENT9095463","Plecoptera","Perlodidae","Frisonia","picticeps","9/30/16",2016-09-30,"2016","Plecoptera"
"CASLOT060569","Plecoptera","Nemouridae","Zapada","cinctipes","9/30/16",2016-09-30,"2016","Plecoptera"
"CASENT9095464","Plecoptera","Nemouridae","Malenka","sp.","9/30/16",2016-09-30,"2016","Plecoptera"
"CASENT9095465","Plecoptera","Chloroperlidae","Sweltsa","sp.","9/30/16",2016-09-30,"2016","Plecoptera"
"CASLOT060570","Ephemeroptera","Baetidae","Baetis","tricaudatus","9/30/16",2016-09-30,"2016","Ephemeroptera"
"CASLOT060571","Trichoptera","Lepidostomatidae","Lepidostoma","sp.","9/30/16",2016-09-30,"2016","Trichoptera"
"CASLOT060572","Coleoptera","Elmidae","Optioservus","sp.","9/30/16",2016-09-30,"2016","Coleoptera"
"CASENT9095466",NA,"Thremmatidae","Neophylax","occidentis","9/30/16",2016-09-30,"2016",NA
"CASENT9095467","Ephemeroptera","Leptophlebiidae","Paraleptophlebia","sp.","9/30/16",2016-09-30,"2016","Ephemeroptera"
"CASENT9095478","Ephemeroptera","Baetidae","Anafroptilum","conturbatum","9/30/16",2016-09-30,"2016","Ephemeroptera"
"CASENT9095479","Ephemeroptera","Baetidae","Anafroptilum","album","9/30/16",2016-09-30,"2016","Ephemeroptera"
"CASLOT060573","Ephemeroptera","Leptohyphidae","Tricorythodes","explicatus","9/30/16",2016-09-30,"2016","Ephemeroptera"
"CASLOT060574","Ephemeroptera","Leptohyphidae","Tricorythodes","explicatus","9/30/16",2016-09-30,"2016","Ephemeroptera"
"CASLOT060575","Plecoptera","Perlidae","Calineuria","californica","9/30/16",2016-09-30,"2016","Plecoptera"
"CASENT9095312","Trichoptera","Limnephilidae","Dicosmoecus","atripes","9/30/16",2016-09-30,"2016","Trichoptera"
"CASLOT060576","Diptera","Limoniidae","Hexatoma","sp.","9/30/16",2016-09-30,"2016","Diptera"
"CASLOT060577","Plecoptera","Pteronarcyidae","Pteronarcella","regularis","9/30/16",2016-09-30,"2016","Plecoptera"
"CASLOT060578","Ephemeroptera","Ephemerellidae","Drunella","spinifera","9/30/16",2016-09-30,"2016","Ephemeroptera"
"CASLOT060579","Plecoptera","Perlodidae","Perlinodes","aurea","9/30/16",2016-09-30,"2016","Plecoptera"
"CASLOT060580","Plecoptera","Perlodidae","Skwala","sp.","9/30/16",2016-09-30,"2016","Plecoptera"
"CASENT9095470","Plecoptera","Nemouridae","Zapada","cinctipes","9/30/16",2016-09-30,"2016","Plecoptera"
"CASENT9095471","Hemiptera","Notonectidae","Notonecta","kirbyi","9/30/16",2016-09-30,"2016","Hemiptera"
"CASLOT060581","Trichoptera","Hydropsychidae","Hydropsyche","sp.","9/30/16",2016-09-30,"2016","Trichoptera"
"CASENT9095468","Plecoptera","Chloroperlidae","Sweltsa","sp.","9/30/16",2016-09-30,"2016","Plecoptera"
"CASLOT060582","Trichoptera","Apataniidae","Apatania","sorex","9/30/16",2016-09-30,"2016","Trichoptera"
"CASLOT060583","Ephemeroptera","Baetidae","Diphetor","hageni","9/30/16",2016-09-30,"2016","Ephemeroptera"
"CASLOT060584","Trichoptera","Lepidostomatidae","Lepidostoma","sp.","9/30/16",2016-09-30,"2016","Trichoptera"
"CASENT9095469","Trichoptera","Philopotamidae","Wormaldia","sp.","9/30/16",2016-09-30,"2016","Trichoptera"
"CASLOT060585","Coleoptera","Elmidae","Optioservus","quadrimaculatus","9/30/16",2016-09-30,"2016","Coleoptera"
"CASENT9095472","Coleoptera","Elmidae","Optioservus","sp.","9/30/16",2016-09-30,"2016","Coleoptera"
"CASLOT060586","Trichoptera","Calamoceratidae","Heteroplectron","californicum","9/30/16",2016-09-30,"2016","Trichoptera"
"CASLOT060587","Hemiptera","Gerridae","Aquarius","remigis","9/30/16",2016-09-30,"2016","Hemiptera"
"CASENT9095473","Odonata","Aeshnidae","Aeshna","sp.","9/30/16",2016-09-30,"2016","Odonata"
"CASENT9095474","Plecoptera","Pteronarcyidae","Pteronarcella","regularis","9/30/16",2016-09-30,"2016","Plecoptera"
"CASENT9095475","Trichoptera","Lepidostomatidae","Lepidostoma","cinereum","9/30/16",2016-09-30,"2016","Trichoptera"
"CASLOT060588","Trichoptera","Lepidostomatidae","Lepidostoma","sp.","9/30/16",2016-09-30,"2016","Trichoptera"
"CASLOT060589","Hemiptera","Corixidae","Sigara","mckinstryi","9/30/16",2016-09-30,"2016","Hemiptera"
"CASLOT060590","Ephemeroptera","Leptophlebiidae","Paraleptophlebia","sp.","9/30/16",2016-09-30,"2016","Ephemeroptera"
"CASENT9095476","Ephemeroptera","Leptophlebiidae","Paraleptophlebia","sp.","9/30/16",2016-09-30,"2016","Ephemeroptera"
"CASLOT060591","Ephemeroptera","Baetidae","Anafroptilum","conturbatum","9/30/16",2016-09-30,"2016","Ephemeroptera"
"CASENT9095477","Ephemeroptera","Baetidae","Callibaetis","pictus","9/30/16",2016-09-30,"2016","Ephemeroptera"
"CASLOT060592","Coleoptera","Dryopidae","Helichus","columbianus","9/30/16",2016-09-30,"2016","Coleoptera"
"CASLOT060593","Ephemeroptera","Baetidae","Anafroptilum","conturbatum","9/30/16",2016-09-30,"2016","Ephemeroptera"
"CASLOT060594","Ephemeroptera","Leptophlebiidae","Paraleptophelbia","sp.","9/30/16",2016-09-30,"2016","Ephemeroptera"
"CASENT9130267","Megaloptera","Sialidae","Sialis","sp.","9/30/16",2016-09-30,"2016","Megaloptera"
"CASENT9131972","Coleoptera","Elmidae","Optioservus","sp.","9/30/16",2016-09-30,"2016","Coleoptera"
"CASENT9132502","Plecoptera","Chloroperlidae","Sweltsa","sp.","9/30/16",2016-09-30,"2016","Plecoptera"
"CASENT9130333","Coleoptera","Ptilodactylidae","Anchycteis","velutina","5/3/16",2016-05-03,"2016","Coleoptera"
"CASENT9131025","Trichoptera","Rhyacophilidae","Rhyacophila","neograndis","5/27/16",2016-05-27,"2016","Trichoptera"
"CASLOT059902","Hemiptera","Veliidae","Microvelia","californiensis","9/22/16",2016-09-22,"2016","Hemiptera"
"CASENT9131887","Plecoptera","Taeniopterygidae","Oemopteryx","vanduzeea","1/31/17",2017-01-31,"2017","Plecoptera"
"CASENT9132662","Plecoptera","Taeniopterygidae","Oemopteryx","vanduzeea","1/31/17",2017-01-31,"2017","Plecoptera"
"CASENT9130732","Trichoptera","Rhyacophilidae","Rhyacophila","neograndis","1/31/17",2017-01-31,"2017","Trichoptera"
"CASENT9132290","Plecoptera","Taeniopterygidae","Oemopteryx","vanduzeea","1/31/17",2017-01-31,"2017","Plecoptera"
"CASENT9131895","Ephemeroptera","Ameletidae","Ameletus","sp.","1/31/17",2017-01-31,"2017","Ephemeroptera"
"CASENT9131770","Diptera","Simuliidae","Simulium","sp.","1/31/17",2017-01-31,"2017","Diptera"
"CASENT9131131","Trichoptera","Philopotamidae","Dolophilodes","sp.","1/31/17",2017-01-31,"2017","Trichoptera"
"CASENT9132806","Coleoptera","Hydrophilidae","Berosus","punctatissimus","2/23/17",2017-02-23,"2017","Coleoptera"
"CASENT9131663","Coleoptera","Dytiscidae","Agabus","sp.","2/23/17",2017-02-23,"2017","Coleoptera"
"CASENT9131541","Coleoptera","Dytiscidae","Dytiscus","marginicollis","2/23/17",2017-02-23,"2017","Coleoptera"
"CASENT9132238","Hemiptera","Gerridae","Gerris","incognitus","2/23/17",2017-02-23,"2017","Hemiptera"
"CASENT9131855","Plecoptera","Nemouridae","Nemoura","spiniloba","3/3/17",2017-03-03,"2017","Plecoptera"
"CASENT9131310","Plecoptera","Taeniopterygidae","Oemopteryx","vanduzeea","3/3/17",2017-03-03,"2017","Plecoptera"
"CASENT9131471","Plecoptera","Capniidae","Capnia","excavata","3/3/17",2017-03-03,"2017","Plecoptera"
"CASENT9131189","Plecoptera","Taeniopterygidae","Oemopteryx","vanduzeea","3/3/17",2017-03-03,"2017","Plecoptera"
"CASENT9132516","Plecoptera","Nemouridae","Nemoura","spiniloba","3/3/17",2017-03-03,"2017","Plecoptera"
"CASENT9130134","Plecoptera","Nemouridae","Malenka","depressa","3/3/17",2017-03-03,"2017","Plecoptera"
"CASENT9131183","Trichoptera","Odontoceridae","Nerophilus","californicus","3/3/17",2017-03-03,"2017","Trichoptera"
"CASENT9130436","Trichoptera","Hydropsychidae","Homoplectra","norada","3/3/17",2017-03-03,"2017","Trichoptera"
"CASENT9131868","Plecoptera","Nemouridae","Malenka","depressa","3/3/17",2017-03-03,"2017","Plecoptera"
"CASENT9131529","Trichoptera","Hydropsychidae","Homoplectra","norada","3/3/17",2017-03-03,"2017","Trichoptera"
"CASENT9131537","Trichoptera","Philopotamidae","Dolophilodes","novusamericanus","3/3/17",2017-03-03,"2017","Trichoptera"
"CASENT9132316","Plecoptera","Nemouridae","Malenka","depressa","3/3/17",2017-03-03,"2017","Plecoptera"
"CASENT9131854","Plecoptera","Nemouridae","Soyedina","producta","3/10/17",2017-03-10,"2017","Plecoptera"
"CASENT9131603","Plecoptera","Leuctridae","Perlomyia","collaris","3/10/17",2017-03-10,"2017","Plecoptera"
"CASENT9131083","Plecoptera","Leuctridae","Paraleuctra","vershina","3/10/17",2017-03-10,"2017","Plecoptera"
"CASENT9131919","Trichoptera","Hydropsychidae","Homoplectra","oaklandensis","3/10/17",2017-03-10,"2017","Trichoptera"
"CASENT9132814","Plecoptera","Nemouridae","Malenka","depresa","3/10/17",2017-03-10,"2017","Plecoptera"
"CASENT9131459","Plecoptera","Nemouridae","Soyedina","producta","3/10/17",2017-03-10,"2017","Plecoptera"
"CASENT9132282","Plecoptera","Nemouridae","Zapada","frigida","3/10/17",2017-03-10,"2017","Plecoptera"
"CASENT9130098","Plecoptera","Nemouridae","Malenka","depressa","3/10/17",2017-03-10,"2017","Plecoptera"
"CASENT9131719","Plecoptera","Leuctridae","Perlomyia","collaris","3/10/17",2017-03-10,"2017","Plecoptera"
"CASENT9131521","Plecoptera","Nemouridae","Soyedina","producta","3/10/17",2017-03-10,"2017","Plecoptera"
"CASENT9131547","Plecoptera","Capniidae","Mesocapnia","projecta","3/10/17",2017-03-10,"2017","Plecoptera"
"CASENT9131700","Plecoptera","Leuctridae","Paraleuctra","vershina","3/10/17",2017-03-10,"2017","Plecoptera"
"CASENT9131622","Plecoptera","Capniidae","Mesocapnia","projecta","3/10/17",2017-03-10,"2017","Plecoptera"
"CASENT9131664","Plecoptera","Nemouridae","Soyedina","producta","3/10/17",2017-03-10,"2017","Plecoptera"
"CASLOT059903","Plecoptera","Nemouridae","Zapada","frigida","3/10/17",2017-03-10,"2017","Plecoptera"
"CASENT9095313","Plecoptera","Leuctridae","Despaxia","augusta","3/10/17",2017-03-10,"2017","Plecoptera"
"CASLOT059904","Plecoptera","Leuctridae","Paraleuctra","divisa","3/10/17",2017-03-10,"2017","Plecoptera"
"CASLOT059905","Plecoptera","Leuctridae","Paraleuctra","vershina","3/10/17",2017-03-10,"2017","Plecoptera"
"CASENT9095314","Trichoptera","Hydropsychidae","Homoplectra","oaklandensis","3/10/17",2017-03-10,"2017","Trichoptera"
"CASENT9130672","Trichoptera","Hydropsychidae","Homoplectra","oaklandensis","3/10/17",2017-03-10,"2017","Trichoptera"
"CASENT9132555","Plecoptera","Nemouridae","Zapada","frigida","3/10/17",2017-03-10,"2017","Plecoptera"
"CASENT9131974","Plecoptera","Leuctridae","Perlomyia","collaris","3/10/17",2017-03-10,"2017","Plecoptera"
"CASENT9130907","Trichoptera","Philopotamidae","Wormaldia","occidea","3/17/17",2017-03-17,"2017","Trichoptera"
"CASENT9131491","Trichoptera","Limnephilidae","Halesochila","taylori","3/27/17",2017-03-27,"2017","Trichoptera"
"CASENT9130058","Trichoptera","Limnephilidae","Halesochila","taylori","4/5/17",2017-04-05,"2017","Trichoptera"
"CASENT9131030","Coleoptera","Haliplidae","Haliplus","gracilis","4/5/17",2017-04-05,"2017","Coleoptera"
"CASENT9132156","Coleoptera","Gyrinidae","Gyrinus","pleuralis","4/5/17",2017-04-05,"2017","Coleoptera"
"CASLOT062773","Ephemeroptera","Baetidae","Callibaetis","ferrugineus","4/5/17",2017-04-05,"2017","Ephemeroptera"
"CASENT9131270","Ephemeroptera","Baetidae","Callibaetis","ferrugineus","4/5/17",2017-04-05,"2017","Ephemeroptera"
"CASENT9131331","Odonata","Coenagrionidae","Enallagma","sp.","4/5/17",2017-04-05,"2017","Odonata"
"CASENT9130833","Trichoptera","Limnephilidae","Halesochila","taylori","4/5/17",2017-04-05,"2017","Trichoptera"
"CASENT9131370","Trichoptera","Limnephilidae","Clostoeca","disjuncta","4/5/17",2017-04-05,"2017","Trichoptera"
