catalog,well,plate,order,family,genus,species,date,dates_corr,year,orders
CASENT9131710,H1,CAS_P29,Trichoptera,Philopotamidae,Wormaldia,gabriella,9/30/1982,2019-09-30,2019,Trichoptera
CASENT9131711,D2,CAS_P29,Trichoptera,Lepidostomatidae,Lepidostoma,errigena,5/4/1983,2019-05-04,2019,Trichoptera
CASENT9131920,E2,CAS_P29,Trichoptera,Lepidostomatidae,Lepidostoma,errigena,5/4/1983,2019-05-04,2019,Trichoptera
CASENT9131707,F2,CAS_P29,Trichoptera,Rhyacophilidae,Rhyacophila,norcuta,9/30/1983,2019-09-30,2019,Trichoptera
CASENT9131702,A3,CAS_P29,Ephemeroptera,Heptageniidae,Rhithrogena,morrisoni,1/11/1983,2019-01-11,2019,Ephemeroptera
CASENT9131706,B3,CAS_P29,Plecoptera,Capniidae,Capnia,californica,1/15/1983,2019-01-15,2019,Plecoptera
CASENT9131466,C3,CAS_P29,Plecoptera,Capniidae,Capnia,californica,1/15/1983,2019-01-15,2019,Plecoptera
CASENT9131796,D3,CAS_P29,Plecoptera,Capniidae,Capnia,elongata,4/1/1983,2019-04-01,2019,Plecoptera
CASENT9132347,E3,CAS_P29,Trichoptera,Philopotamidae,Chimarra,sp.,3/20/1982,2019-03-20,2019,Trichoptera
CASENT9131607,F3,CAS_P29,Ephemeroptera,Baetidae,Callibaetis,californicus,9/26/1983,2019-09-26,2019,Ephemeroptera
CASENT9132522,G3,CAS_P29,Diptera,Simuliidae,Cnephia,sp.,9/24/1983,2019-09-24,2019,Diptera
CASENT9131821,H3,CAS_P29,Megaloptera,Sialidae,Sialis,sp.,9/17/1982,2019-09-17,2019,Megaloptera
CASENT9131859,A4,CAS_P29,Plecoptera,Chloroperlidae,Kathoperla,perdita,3/27/1982,2019-03-27,2019,Plecoptera
CASENT9131721,B4,CAS_P29,Ephemeroptera,Baetidae,Baetis,intermedius,1/15/1983,2019-01-15,2019,Ephemeroptera
CASENT9132858,C4,CAS_P29,Trichoptera,Odontoceridae,Parthina,linea,1/23/1984,2019-01-23,2019,Trichoptera
CASENT9131453,D4,CAS_P29,Trichoptera,Glossosomatidae,Agapetus,sp.,3/27/1983,2019-03-27,2019,Trichoptera
CASENT9131704,F4,CAS_P29,Trichoptera,Hydropsychidae,Homoplectra,oaklandensis,"1/5/1983, 1/8/1983, 1/10/1983",2019-01-05,2019,Trichoptera
CASENT9131569,G4,CAS_P29,Ephemeroptera,Heptageniidae,Heptagenia,rubroventris,9/17/1982,2019-09-17,2019,Ephemeroptera
CASENT9132509,H4,CAS_P29,Plecoptera,Nemouridae,Malenka,californica,7/15/1982,2019-07-15,2019,Plecoptera
CASENT9131606,A5,CAS_P29,Plecoptera,Nemouridae,Malenka,californica,7/15/1982,2019-07-15,2019,Plecoptera
CASENT9131618,B5,CAS_P29,Plecoptera,Nemouridae,Malenka,sp.,7/15/1982,2019-07-15,2019,Plecoptera
CASENT9131577,D5,CAS_P29,Trichoptera,Lepidostomatidae,Lepidostoma,sp.,4/1/1983,2019-04-01,2019,Trichoptera
CASENT9131712,E5,CAS_P29,Ephemeroptera,Baetidae,Baetis,intermedius,5/4/1983,2019-05-04,2019,Ephemeroptera
CASENT9132271,F5,CAS_P29,Ephemeroptera,Baetidae,Baetis,intermedius,5/4/1983,2019-05-04,2019,Ephemeroptera
CASENT9131802,G5,CAS_P29,Ephemeroptera,Baetidae,Baetis,intermedius,5/4/1983,2019-05-04,2019,Ephemeroptera
CASENT9132821,H5,CAS_P29,Ephemeroptera,Leptophlebiidae,Paraleptophlebia,debilis,9/17/1982,2019-09-17,2019,Ephemeroptera
CASENT9131523,A6,CAS_P29,Ephemeroptera,Leptophlebiidae,Paraleptophlebia,debilis,9/17/1982,2019-09-17,2019,Ephemeroptera
CASENT9132696,B6,CAS_P29,Ephemeroptera,Leptophlebiidae,Paraleptophlebia,debilis,9/17/1982,2019-09-17,2019,Ephemeroptera
CASENT9132741,C6,CAS_P29,Ephemeroptera,Leptophlebiidae,Paraleptophlebia,debilis,10/6/1980,2019-10-06,2019,Ephemeroptera
CASENT9132607,G6,CAS_P29,Trichoptera,Glossosomatidae,Anagapetus,sp.,3/2/1983,2019-03-02,2019,Trichoptera
CASENT9132804,H6,CAS_P29,Trichoptera,Glossosomatidae,Anagapetus,sp.,3/2/1983,2019-03-02,2019,Trichoptera
CASENT9132175,A7,CAS_P29,Trichoptera,Glossosomatidae,Anagapetus,sp.,2/17/1983,2019-02-17,2019,Trichoptera
CASENT9131524,B7,CAS_P29,Trichoptera,Limnephilidae,Clostoeca,disjunctus,2/8/1984,2019-02-08,2019,Trichoptera
CASENT9132665,F7,CAS_P29,Plecoptera,Chloroperlidae,Sweltsa,fidelis,4/17/1983,2019-04-17,2019,Plecoptera
CASENT9132634,G7,CAS_P29,Plecoptera,Chloroperlidae,Sweltsa,fidelis,4/17/1983,2019-04-17,2019,Plecoptera
CASENT9131658,H7,CAS_P29,Diptera,Simuliidae,Cnephia,minus,7/3/1983,2019-07-03,2019,Diptera
CASENT9131596,F8,CAS_P29,Diptera,Chaoboridae,Chaoborus,sp.,4/10/15,2015-04-10,2015,Diptera
CASENT9131881,G8,CAS_P29,Diptera,Chaoboridae,Chaoborus,sp.,1/29/13,2013-01-29,2013,Diptera
CASENT9132949,H8,CAS_P29,Diptera,Chaoboridae,Chaoborus,sp.,10/1/10,2010-10-01,2010,Diptera
CASENT9131708,A9,CAS_P29,Trichoptera,Philopotamidae,Dolophilodes,novusamericanus,5/9/1983,2019-05-09,2019,Trichoptera
CASENT9131874,B9,CAS_P29,Ephemeroptera,Ephemerellidae,Matriella,teresa,5/29/1983,2019-05-29,2019,Ephemeroptera
CASENT9131877,C9,CAS_P29,Ephemeroptera,Heptageniidae,Heptagenia,sp.,7/15/1982,2019-07-15,2019,Ephemeroptera
CASENT9131899,H9,CAS_P29,Odonata,Libellulidae,NA,NA,3/17/16,2016-03-17,2016,Odonata
CASENT9131713,A10,CAS_P29,NA,Libellulide,NA,NA,3/17/16,2016-03-17,2016,NA
CASENT9131564,C10,CAS_P29,Odonata,Gomphidae,Ophiogomphus,bison,7/13/12,2012-07-13,2012,Odonata
CASENT9131447,D10,CAS_P29,Ephemeroptera,Baetidae,Callibaetis,pictus,10/12/80,1980-10-12,1980,Ephemeroptera
CASENT9131705,E10,CAS_P29,Ephemeroptera,Baetidae,Callibaetis,pictus,6/11/80,1980-06-11,1980,Ephemeroptera
CASENT9131610,F10,CAS_P29,Ephemeroptera,Baetidae,Callibaetis,pictus,6/30/80,1980-06-30,1980,Ephemeroptera
CASENT9131451,G10,CAS_P29,Ephemeroptera,Baetidae,Callibaetis,pictus,5/2/1980,2019-05-02,2019,Ephemeroptera
CASENT9131882,D11,CAS_P29,Odonata,Gomphidae,NA,NA,8/13/06,2006-08-13,2006,Odonata
CASENT9131876,E11,CAS_P29,Ephemeroptera,Baetidae,Callibaetis,ferrugineus,4/9/81,1981-04-09,1981,Ephemeroptera
CASENT9131801,F11,CAS_P29,Plecoptera,Capniidae,Capnura,wanica,1/13/06,2006-01-13,2006,Plecoptera
CASENT9131456,A1,CAS_P33,Trichoptera,Philopotamidae,Wormaldia,gabriella,7/15/1982,2019-07-15,2019,Trichoptera
CASENT9132807,B1,CAS_P33,Trichoptera,Philopotamidae,Wormaldia,gabriella,9/30/1982,2019-09-30,2019,Trichoptera
CASENT9131570,C1,CAS_P33,Trichoptera,Philopotamidae,Wormaldia,gabriella,9/30/1982,2019-09-30,2019,Trichoptera
CASENT9131487,D1,CAS_P33,Trichoptera,Brachycentridae,Amiocentrus,aspilus,3/27/1982,2019-03-27,2019,Trichoptera
CASENT9131790,E1,CAS_P33,Trichoptera,Brachycentridae,Amiocentrus,aspilus,3/27/1982,2019-03-27,2019,Trichoptera
CASENT9131792,G1,CAS_P33,Trichoptera,Brachycentridae,Amiocentrus,aspilus,3/27/1982,2019-03-27,2019,Trichoptera
CASENT9131608,H1,CAS_P33,Ephemeroptera,Heptageniidae,Rhithrogena,morrisoni,1/11/1983,2019-01-11,2019,Ephemeroptera
CASENT9132794,A5,CAS_P33,Trichoptera,Hydropsychidae,Hydropsyche,philo,5/4/1983,2019-05-04,2019,Trichoptera
CASENT9132468,B5,CAS_P33,Trichoptera,Hydropsychidae,Hydropsyche,philo,5/4/1983,2019-05-04,2019,Trichoptera
CASENT9132702,C5,CAS_P33,Trichoptera,Hydropsychidae,Hydropsyche,philo,5/4/1983,2019-05-04,2019,Trichoptera
CASENT9131640,D5,CAS_P33,Trichoptera,Limnephilidae,Clostoeca,disjunctus,2/8/1984,2019-02-08,2019,Trichoptera
CASENT9132319,E5,CAS_P33,Trichoptera,Limnephilidae,Clostoeca,disjunctus,2/8/1984,2019-02-08,2019,Trichoptera
CASENT9132492,F5,CAS_P33,Plecoptera,Chloroperlidae,Sweltsa,fidelis,4/17/1983,2019-04-17,2019,Plecoptera
CASENT9131452,G5,CAS_P33,Odonata,Gomphidae,Octogomphus,specularis,6/5/19,2019-06-05,2019,Odonata
CASENT9131605,H5,CAS_P33,Odonata,Gomphidae,Ophiogomphus,sp.,8/3/05,2005-08-03,2005,Odonata
CASENT9132320,A6,CAS_P33,Odonata,Gomphidae,Ophiogomphus,sp.,2/4/09,2009-02-04,2009,Odonata
CASENT9131880,B6,CAS_P33,Odonata,Libellulidae,NA,NA,4/5/01,2001-04-05,2001,Odonata
CASENT9131609,C6,CAS_P33,Odonata,Libellulidae,Sympetrum,sp.,4/10/15,2015-04-10,2015,Odonata
CASENT9131648,D6,CAS_P33,Odonata,Cordulegastridae,Cordulegaster,dorsalis,9/13/18,2018-09-13,2018,Odonata
CASENT9131872,E6,CAS_P33,Odonata,Gomphidae,Gomphus,kurilis,10/3/08,2008-10-03,2008,Odonata
CASENT9131444,F6,CAS_P33,Odonata,Gomphidae,Gomphus,kurilis,2/4/09,2009-02-04,2009,Odonata
CASENT9131450,G6,CAS_P33,Odonata,Gomphidae,Octogomphus,specularis,10/25/81,1981-10-25,1981,Odonata
CASENT9131794,H6,CAS_P33,Diptera,Muscidae,Caricea,sp.,5/1/19,2019-05-01,2019,Diptera
CASENT9131508,A7,CAS_P33,Diptera,Muscidae,Limnophora,sp.,8/25/10,2010-08-25,2010,Diptera
CASENT9132622,B7,CAS_P33,Diptera,Tabanidae,Apatolestes,comastes,10/14/10,2010-10-14,2010,Diptera
CASENT9131997,C7,CAS_P33,Diptera,Chaoboridae,Eucorethra,underwoodi,9/16/10,2010-09-16,2010,Diptera
CASENT9131462,D7,CAS_P33,Diptera,Stratiomyidae,Odontomyia,sp.,7/26/06,2006-07-26,2006,Diptera
CASENT9131750,E7,CAS_P33,Diptera,Stratiomyidae,Caloparyphus,sp.,4/8/19,2019-04-08,2019,Diptera
CASENT9131442,F7,CAS_P33,Diptera,Tabanidae,Tabanus,sp.,8/4/16,2016-08-04,2016,Diptera
CASENT9132649,G7,CAS_P33,Trichoptera,Limnephilidae,Psychoglypha,sp.,5/9/18,2018-05-09,2018,Trichoptera
CASENT9131866,H7,CAS_P33,Trichoptera,Limnephilidae,Psychoglypha,sp.,8/3/16,2016-08-03,2016,Trichoptera
CASENT9131183,A8,CAS_P33,Trichoptera,Odontoceridae,Nerophilus,californicus,3/3/17,2017-03-03,2017,Trichoptera
CASENT9131601,B8,CAS_P33,Plecoptera,Perlodidae,Isoperla,sp.,4/8/15,2015-04-08,2015,Plecoptera
CASENT9132416,C8,CAS_P33,Plecoptera,Perlodidae,Isoperla,pinta,4/8/15,2015-04-08,2015,Plecoptera
CASENT9131914,D8,CAS_P33,Ephemeroptera,Ephemerellidae,Drunella,flavilinea,4/8/15,2015-04-08,2015,Ephemeroptera
CASENT9132441,E8,CAS_P33,Hemiptera,Nepidae,Ranatra,brevicollis,7/20/82,1982-07-20,1982,Hemiptera
CASENT9132951,F8,CAS_P33,Trichoptera,Rhyacophilidae,Rhyacophila,sp.,4/8/15,2015-04-08,2015,Trichoptera
CASENT9131587,G8,CAS_P33,Diptera,Tabanidae,Tabanus,sp.,9/30/16,2016-09-30,2016,Diptera
CASENT9131884,H8,CAS_P33,Odonata,Aeshnidae,Aeshna,sp.,9/30/16,2016-09-30,2016,Odonata
CASENT9131620,A9,CAS_P33,Trichoptera,Glossosomatidae,Glossosoma,pterna,1/2/1983,2019-01-02,2019,Trichoptera
CASENT9131522,B9,CAS_P33,Trichoptera,Hydropsychidae,Symphitopsyche,sp.,8/23/1982,2019-08-23,2019,Trichoptera
CASENT9132495,C9,CAS_P33,Trichoptera,Hydropsychidae,Symphitopsyche,sp.,8/23/1982,2019-08-23,2019,Trichoptera
CASENT9131544,D9,CAS_P33,Trichoptera,Hydropsychidae,Symphitopsyche,sp.,8/23/1982,2019-08-23,2019,Trichoptera
CASENT9131617,E9,CAS_P33,Trichoptera,Hydropsychidae,Symphitopsyche,sp.,8/23/1982,2019-08-23,2019,Trichoptera
CASENT9131568,F9,CAS_P33,Ephemeroptera,Heptageniidae,Ironodes,nitidus,5/22/1980,2019-05-22,2019,Ephemeroptera
CASENT9131709,G9,CAS_P33,Ephemeroptera,Heptageniidae,Ironodes,nitidus,5/4/1983,2019-05-04,2019,Ephemeroptera
CASENT9131559,H9,CAS_P33,Ephemeroptera,Heptageniidae,Ironodes,nitidus,5/4/1983,2019-05-04,2019,Ephemeroptera
CASENT9131800,A10,CAS_P33,Trichoptera,Rhyacophilidae,Rhyacophila,norcuta,9/30/1983,2019-09-30,2019,Trichoptera
CASENT9131567,B10,CAS_P33,Trichoptera,Philopotamidae,Dolophilodes,novusamericanus,5/9/1983,2019-05-09,2019,Trichoptera
CASENT9131455,C10,CAS_P33,Diptera,Tabanidae,Tabanus,sp.,9/9/08,2008-09-09,2008,Diptera
CASENT9131922,D10,CAS_P33,Diptera,Tabanidae,Tabanus,sp.,7/2/05,2005-07-02,2005,Diptera
CASENT9132857,E10,CAS_P33,Diptera,Muscidae,Limnophora,aequifrons,6/27/80,1980-06-27,1980,Diptera
CASENT9132449,F10,CAS_P33,Diptera,Chaoboridae,Chaoborus,sp.,4/10/15,2015-04-10,2015,Diptera
CASENT9131718,A1,CAS_P31,Diptera,Ceratopogonidae,Probezzia,sp.,3/9/17,2017-03-09,2017,Diptera
CASENT9132913,B1,CAS_P31,Diptera,Ceratopogonidae,Probezzia,sp.,10/1/10,2010-10-01,2010,Diptera
CASENT9131657,C1,CAS_P31,Diptera,Ceratopogonidae,Probezzia,sp.,1/10/83,1983-01-10,1983,Diptera
CASENT9132414,D1,CAS_P31,Diptera,Ceratopogonidae,Dasyhelea,sp.,9/26/82,1982-09-26,1982,Diptera
CASENT9131857,E1,CAS_P31,Diptera,Ceratopogonidae,NA,NA,1/7/09,2009-01-07,2009,Diptera
CASENT9131463,F1,CAS_P31,Diptera,Ceratopogonidae,NA,NA,5/7/08,2008-05-07,2008,Diptera
CASENT9131917,G1,CAS_P31,Diptera,Ceratopogonidae,Forcipomyia,sp.,4/24/99,1999-04-24,1999,Diptera
CASENT9131869,H1,CAS_P31,Diptera,Ceratopogonidae,Forcipomyia,sp.,11/6/04,2004-11-06,2004,Diptera
CASENT9132527,A2,CAS_P31,Diptera,Ceratopogonidae,Monohelea,sp.,7/5/80,1980-07-05,1980,Diptera
CASENT9131737,B2,CAS_P31,Diptera,Ceratopogonidae,Monohelea,sp.,10/1/10,2010-10-01,2010,Diptera
CASENT9131771,C2,CAS_P31,Diptera,Psychodidae,Pericoma,sp.,5/11/16,2016-05-11,2016,Diptera
CASENT9131571,D2,CAS_P31,Diptera,Psychodidae,Pericoma,sp.,4/5/18,2018-04-05,2018,Diptera
CASENT9131847,E2,CAS_P31,Diptera,Psychodidae,Psychoda,sp.,5/25/09,2009-05-25,2009,Diptera
CASENT9131604,F2,CAS_P31,Diptera,Psychodidae,Psychoda,sp.,4/5/18,2018-04-05,2018,Diptera
CASENT9130638,G2,CAS_P31,Diptera,Psychodidae,Psychoda,sp.,5/1/18,2018-05-01,2018,Diptera
CASENT9131888,H2,CAS_P31,Diptera,Muscidae,Limnophora,sp.,2/11/08,2008-02-11,2008,Diptera
CASENT9131445,A3,CAS_P31,Diptera,Ephydridae,Paralimna,sp.,10/7/10,2010-10-07,2010,Diptera
CASENT9131457,B3,CAS_P31,Diptera,Empididae,Wiedemannia,sp.,8/3/11,2011-08-03,2011,Diptera
CASENT9131536,C3,CAS_P31,Diptera,Empididae,Wiedemannia,sp.,8/8/11,2011-08-08,2011,Diptera
CASENT9131443,D3,CAS_P31,Diptera,Empididae,Wiedemannia,sp.,7/22/14,2014-07-22,2014,Diptera
CASENT9131465,E3,CAS_P31,Diptera,Empididae,Wiedemannia,sp.,7/30/14,2014-07-30,2014,Diptera
CASENT9131846,F3,CAS_P31,Diptera,Psychodidae,Telmatoscopus,sp.,6/9/09,2009-06-09,2009,Diptera
CASENT9131864,G3,CAS_P31,Diptera,Psychodidae,Telmatoscopus,sp.,1/28/19,2019-01-28,2019,Diptera
CASENT9131863,H3,CAS_P31,Diptera,Ephydridae,NA,NA,10/1/10,2010-10-01,2010,Diptera
CASENT9131720,A4,CAS_P31,Diptera,Ephydridae,NA,NA,10/15/10,2010-10-15,2010,Diptera
CASENT9132733,B4,CAS_P31,Diptera,Ephydridae,NA,NA,7/23/12,2012-07-23,2012,Diptera
CASENT9132258,C4,CAS_P31,Diptera,Brachystomatidae,Boreodromia,monogramma,6/30/11,2011-06-30,2011,Diptera
CASENT9131949,D4,CAS_P31,Diptera,Ceratopogonidae,Monohelea,sp.,5/10/16,2016-05-10,2016,Diptera
CASENT9131511,E4,CAS_P31,Diptera,Ephydridae,Setacera,sp.,7/4/05,2005-07-04,2005,Diptera
CASENT9131848,F4,CAS_P31,Diptera,Ephydridae,Ephydra,sp.,5/30/83,1983-05-30,1983,Diptera
CASENT9131464,G4,CAS_P31,Diptera,Ephydridae,Ephydra,sp.,10/29/81,1981-10-29,1981,Diptera
CASENT9131812,H4,CAS_P31,Diptera,Mycetophilidae,NA,NA,7/5/1980,2019-07-05,2019,Diptera
CASENT9132810,A5,CAS_P31,Diptera,Mycetophilidae,NA,NA,7/5/1980,2019-07-05,2019,Diptera
CASENT9131729,B5,CAS_P31,Diptera,Mycetophilidae,NA,NA,7/5/1980,2019-07-05,2019,Diptera
CASENT9131734,C5,CAS_P31,Diptera,Dolichopodidae,NA,NA,7/23/12,2012-07-23,2012,Diptera
CASENT9131612,D5,CAS_P31,Diptera,Dolichopodidae,NA,NA,4/6/06,2006-04-06,2006,Diptera
CASENT9131849,E5,CAS_P31,Diptera,Dolichopodidae,Dolichopus,sp.,5/8/15,2015-05-08,2015,Diptera
CASENT9131875,F5,CAS_P31,Diptera,Tabanidae,Tabanus,sp.,2/17/06,2006-02-17,2006,Diptera
CASENT9131565,G5,CAS_P31,Diptera,Psychodidae,Maruina,lanceolata,7/4/05,2005-07-04,2005,Diptera
CASENT9132187,H5,CAS_P31,Diptera,Psychodidae,Maruina,lanceolata,9/16/06,2006-09-16,2006,Diptera
CASENT9131807,A6,CAS_P31,Diptera,Psychodidae,Maruina,lanceolata,3/17/16,2016-03-17,2016,Diptera
CASENT9132101,B6,CAS_P31,Diptera,Psychodidae,Maruina,lanceolata,5/5/16,2016-05-05,2016,Diptera
CASENT9131795,C6,CAS_P31,Diptera,Empididae,Hemerodromia,empiformis,10/7/10,2010-10-07,2010,Diptera
CASENT9132562,D6,CAS_P31,Diptera,Empididae,Hemerodromia,empiformis,10/15/10,2010-10-15,2010,Diptera
CASENT9131970,E6,CAS_P31,Diptera,Ephydridae,Ephydra,sp.,6/3/05,2005-06-03,2005,Diptera
CASENT9131448,F6,CAS_P31,NA,Oreogetonidae,Oreogeton,sp.,5/3/16,2016-05-03,2016,NA
CASENT9132201,G6,CAS_P31,Diptera,Brachystomatidae,Boreodromia,sp.,6/16/17,2017-06-16,2017,Diptera
CASENT9131296,H6,CAS_P31,Diptera,Stratiomyidae,Caloparyphus,sp.,7/23/12,2012-07-23,2012,Diptera
CASENT9132267,A7,CAS_P31,Diptera,Stratiomyidae,Caloparyphus,sp.,7/24/12,2012-07-24,2012,Diptera
CASENT9131063,B7,CAS_P31,Diptera,Stratiomyidae,Caloparyphus,sp.,11/1/18,2018-11-01,2018,Diptera
CASENT9130272,C7,CAS_P31,Diptera,Dixidae,Dixa,chilensis,7/29/80,1980-07-29,1980,Diptera
CASENT9130800,D7,CAS_P31,Diptera,Dixidae,Dixella,sp.,3/30/83,1983-03-30,1983,Diptera
CASENT9131286,E7,CAS_P31,Diptera,Dixidae,Dixa,sp.,6/5/19,2019-06-05,2019,Diptera
CASENT9132114,F7,CAS_P31,Diptera,Dixidae,Dixa,sp.,5/7/19,2019-05-07,2019,Diptera
CASENT9130012,G7,CAS_P31,Diptera,Dixidae,Dixa,sp.,4/19/19,2019-04-19,2019,Diptera
CASENT9132705,H7,CAS_P31,Diptera,Dixidae,Dixa,sp.,4/18/19,2019-04-18,2019,Diptera
CASENT9131558,A8,CAS_P31,Diptera,Psychodidae,Maruina,lanceolata,4/8/19,2019-04-08,2019,Diptera
CASENT9132391,B8,CAS_P31,Diptera,Psychodidae,Maruina,lanceolata,5/11/16,2016-05-11,2016,Diptera
CASENT9131910,C8,CAS_P31,Diptera,Psychodidae,Maruina,lanceolata,5/5/16,2016-05-05,2016,Diptera
CASENT9131778,D8,CAS_P31,Diptera,Psychodidae,Maruina,lanceolata,5/25/09,2009-05-25,2009,Diptera
CASENT9131292,E8,CAS_P31,Diptera,Dixidae,Meringodixa,sp.,8/4/16,2016-08-04,2016,Diptera
CASENT9130084,F8,CAS_P31,Diptera,Dixidae,Meringodixa,sp.,5/27/16,2016-05-27,2016,Diptera
CASENT9130263,G8,CAS_P31,Diptera,Dixidae,Meringodixa,sp.,5/3/16,2016-05-03,2016,Diptera
CASENT9130096,H8,CAS_P31,Diptera,Dixidae,Meringodixa,sp.,6/3/97,1997-06-03,1997,Diptera
CASENT9131477,A9,CAS_P31,Diptera,Dixidae,Dixella,sp.,5/8/19,2019-05-08,2019,Diptera
CASENT9130506,B9,CAS_P31,Diptera,Dixidae,Dixella,sp.,4/18/19,2019-04-18,2019,Diptera
CASENT9130836,C9,CAS_P31,Diptera,Dixidae,Dixella,sp.,4/18/19,2019-04-18,2019,Diptera
CASENT9131480,D9,CAS_P31,Diptera,Dixidae,Dixella,sp.,4/5/17,2017-04-05,2017,Diptera
CASENT9131475,E9,CAS_P31,Trichoptera,Lepidostomatidae,Lepidostoma,cinereum,7/20/82,1982-07-20,1982,Trichoptera
CASENT9131622,F9,CAS_P31,Plecoptera,Capniidae,Mesocapnia,projecta,3/10/17,2017-03-10,2017,Plecoptera
CASENT9131700,G9,CAS_P31,Plecoptera,Leuctridae,Paraleuctra,vershina,3/10/17,2017-03-10,2017,Plecoptera
CASENT9131547,H9,CAS_P31,Plecoptera,Capniidae,Mesocapnia,projecta,3/10/17,2017-03-10,2017,Plecoptera
CASENT9130098,A10,CAS_P31,Plecoptera,Nemouridae,Malenka,depressa,3/10/17,2017-03-10,2017,Plecoptera
CASENT9132282,B10,CAS_P31,Plecoptera,Nemouridae,Zapada,frigida,3/10/17,2017-03-10,2017,Plecoptera
CASENT9131083,C10,CAS_P31,Plecoptera,Leuctridae,Paraleuctra,vershina,3/10/17,2017-03-10,2017,Plecoptera
CASENT9132316,D10,CAS_P31,Plecoptera,Nemouridae,Malenka,depressa,3/3/17,2017-03-03,2017,Plecoptera
CASENT9131529,E10,CAS_P31,Trichoptera,Hydropsychidae,Homoplectra,norada,3/3/17,2017-03-03,2017,Trichoptera
CASENT9130436,F10,CAS_P31,Trichoptera,Hydropsychidae,Homoplectra,norada,3/3/17,2017-03-03,2017,Trichoptera
CASENT9132516,G10,CAS_P31,Plecoptera,Nemouridae,Nemoura,spiniloba,3/3/17,2017-03-03,2017,Plecoptera
CASENT9131471,H10,CAS_P31,Plecoptera,Capniidae,Capnia,excavata,3/3/17,2017-03-03,2017,Plecoptera
CASENT9131131,A11,CAS_P31,Trichoptera,Philopotamidae,Dolophilodes,sp.,1/31/17,2017-01-31,2017,Trichoptera
CASENT9131770,B11,CAS_P31,Diptera,Simuliidae,Simulium,sp.,1/31/17,2017-01-31,2017,Diptera
CASENT9131895,C11,CAS_P31,Ephemeroptera,Ameletidae,Ameletus,sp.,1/31/17,2017-01-31,2017,Ephemeroptera
CASENT9132290,D11,CAS_P31,Plecoptera,Taeniopterygidae,Oemopteryx,vanduzeea,1/31/17,2017-01-31,2017,Plecoptera
CASENT9131887,E11,CAS_P31,Plecoptera,Taeniopterygidae,Oemopteryx,vanduzeea,1/31/17,2017-01-31,2017,Plecoptera
CASENT9132502,F11,CAS_P31,Plecoptera,Chloroperlidae,Sweltsa,sp.,9/30/16,2016-09-30,2016,Plecoptera
CASENT9131972,G11,CAS_P31,Coleoptera,Elmidae,Optioservus,sp.,9/30/16,2016-09-30,2016,Coleoptera
CASENT9130267,H11,CAS_P31,Megaloptera,Sialidae,Sialis,sp.,9/30/16,2016-09-30,2016,Megaloptera
CASENT9131085,A12,CAS_P31,Ephemeroptera,Baetidae,Baetis,alius,NA,NA,NA,Ephemeroptera
CASENT9131304,B12,CAS_P31,Plecoptera,Capniidae,Mesocapnia,projecta,NA,NA,NA,Plecoptera
CASENT9130312,C12,CAS_P31,Plecoptera,Capniidae,Capnia,sp.,NA,NA,NA,Plecoptera
CASENT9130358,D12,CAS_P31,Plecoptera,Capniidae,Capnia,sp.,1/30/15,2015-01-30,2015,Plecoptera
CASENT9131254,E12,CAS_P31,Ephemeroptera,Baetidae,Baetis,tricaudatus,1/30/15,2015-01-30,2015,Ephemeroptera
CASENT9130353,F12,CAS_P31,Ephemeroptera,Baetidae,Baetis,alius,1/30/15,2015-01-30,2015,Ephemeroptera
23S734,A1,CDFA_P1,Diptera (Brachycera),Tephritidae,Trupanea,signata,45100,2023-06-23,2023,Diptera
23S735,A2,CDFA_P1,Diptera (Brachycera),Tephritidae,Terellia,occidentalis,45154,2023-08-16,2023,Diptera
23S737,A3,CDFA_P1,Diptera (Brachycera),Pallopteridae,Toxonevra,jucunda,45154,2023-08-16,2023,Diptera
23S738,A4,CDFA_P1,Diptera (Brachycera),Tephritidae,Rhagoletis,juniperina,45154,2023-08-16,2023,Diptera
23S739,A5,CDFA_P1,Diptera (Brachycera),Tephritidae,Campiglossa,jamesi,45154,2023-08-16,2023,Diptera
23S740,A6,CDFA_P1,Diptera (Brachycera),Tephritidae,Campiglossa,jamesi,45154,2023-08-16,2023,Diptera
23S741,A7,CDFA_P1,Diptera (Brachycera),Tephritidae,Campiglossa,farinata,45154,2023-08-16,2023,Diptera
23S742,A8,CDFA_P1,Diptera (Brachycera),Tephritidae,Campiglossa,farinata,45154,2023-08-16,2023,Diptera
23S652,A9,CDFA_P1,Diptera (Brachycera),Tephritidae,Aciurina,thoracica,45105,2023-06-28,2023,Diptera
23S812,A10,CDFA_P1,Diptera (Brachycera),Tephritidae,Euaresta,stigmatica,42891,2017-06-05,2017,Diptera
23S811,A11,CDFA_P1,Diptera (Brachycera),Tephritidae,Euaresta,stigmatica,42891,2017-06-05,2017,Diptera
23S813,A12,CDFA_P1,Diptera (Brachycera),Tephritidae,Trupanea,radifera,NA,NA,NA,Diptera
23S648,B1,CDFA_P1,Diptera (Brachycera),Tephritidae,Trupanea,femoralis,45044,2023-04-28,2023,Diptera
23S594,B2,CDFA_P1,Diptera (Brachycera),Tephritidae,Paracantha,cultaris,45116,2023-07-09,2023,Diptera
23S458,B3,CDFA_P1,Diptera (Brachycera),Conopidae,Dalmannia,vitiosa,45100,2023-06-23,2023,Diptera
23S476,B4,CDFA_P1,Diptera (Brachycera),Tephritidae,Chaetorellia,succinea,45102,2023-06-25,2023,Diptera
23S477,B5,CDFA_P1,Diptera (Brachycera),Tephritidae,Tephritis,araneosa (pacifica),45086,2023-06-09,2023,Diptera
23S463,B6,CDFA_P1,Diptera (Brachycera),Tephritidae,Tephritis,signatipennis,45100,2023-06-23,2023,Diptera
23S466,B7,CDFA_P1,Diptera (Brachycera),Tephritidae,Campiglossa,clathrata,45100,2023-06-23,2023,Diptera
23S755,B8,CDFA_P1,Diptera (Brachycera),Tephritidae,Campiglossa,farinata,45154,2023-08-16,2023,Diptera
23S470,B9,CDFA_P1,Diptera (Brachycera),Tephritidae,Procecidochares,anthracina,45100,2023-06-23,2023,Diptera
23S815,B10,CDFA_P1,Diptera (Brachycera),Tephritidae,Campiglossa,genalis,44346,2021-05-30,2021,Diptera
23S814,B11,CDFA_P1,Diptera (Brachycera),Tephritidae,Campiglossa,genalis,44346,2021-05-30,2021,Diptera
23S816,B12,CDFA_P1,Diptera (Brachycera),Tephritidae,Paraterellia,ypsilon,44360,2021-06-13,2021,Diptera
23S684,C1,CDFA_P1,Diptera (Brachycera),Tephritidae,Procecidochares,minuta,45100,2023-06-23,2023,Diptera
23S683,C2,CDFA_P1,Diptera (Brachycera),Tephritidae,Procecidochares,anthracina,45100,2023-06-23,2023,Diptera
23S471,C3,CDFA_P1,Diptera (Brachycera),Tephritidae,Trupanea,jonesi,NA,NA,NA,Diptera
23S472,C4,CDFA_P1,Diptera (Brachycera),Tephritidae,Trupanea,jonesi,45079,2023-06-02,2023,Diptera
23S484,C5,CDFA_P1,Diptera (Brachycera),Tephritidae,Trupanea,signata,NA,NA,NA,Diptera
23S529,C6,CDFA_P1,Diptera (Brachycera),Tephritidae,Oxyna,palpalis,45072,2023-05-26,2023,Diptera
23S681,C7,CDFA_P1,Diptera (Brachycera),Tephritidae,Eutreta,hespera,45100,2023-06-23,2023,Diptera
23S682,C8,CDFA_P1,Diptera (Brachycera),Tephritidae,Eutreta,hespera,45100,2023-06-23,2023,Diptera
23S686,C9,CDFA_P1,Diptera (Brachycera),Tephritidae,Campiglossa,murina,45100,2023-06-23,2023,Diptera
23S817,C10,CDFA_P1,Diptera (Brachycera),Tephritidae,Paraterellia,ypsilon,44360,2021-06-13,2021,Diptera
23S818,C11,CDFA_P1,Diptera (Brachycera),Tephritidae,Aciurina,ferruginea,38862,2006-05-25,2006,Diptera
23S819,C12,CDFA_P1,Diptera (Brachycera),Tephritidae,Procecidochares,anthracina,38862,2006-05-25,2006,Diptera
23S687,D1,CDFA_P1,Diptera (Brachycera),Tephritidae,Trupanea,signata,45100,2023-06-23,2023,Diptera
23S688,D2,CDFA_P1,Diptera (Brachycera),Ulidiidae,Diacrita,costalis,45088,2023-06-11,2023,Diptera
23S758,D3,CDFA_P1,Coleoptera,Cerambycidae,Tragosoma,harrisii,45154,2023-08-16,2023,Coleoptera
23S759,D4,CDFA_P1,Diptera (Brachycera),Tephritidae,Tephritis,nr webbii,NA,NA,NA,Diptera
23S474,D5,CDFA_P1,Diptera (Brachycera),Ulidiidae,Curranops,scutellaris,45086,2023-06-09,2023,Diptera
23S760,D6,CDFA_P1,Diptera (Brachycera),Tephritidae,Oxyna,palpalis,45072,2023-05-26,2023,Diptera
23S761,D7,CDFA_P1,Diptera (Brachycera),Ulidiidae,Curranops,scutellaris,45086,2023-06-09,2023,Diptera
23S468,D8,CDFA_P1,Diptera (Brachycera),Tephritidae,Neotephritis,finalis,45100,2023-06-23,2023,Diptera
23S764,D9,CDFA_P1,Diptera (Brachycera),Ulidiidae,Curranops,scutellaris,45086,2023-06-09,2023,Diptera
23S820,D10,CDFA_P1,Diptera (Brachycera),Tephritidae,Eutreta,pollinosa,43231,2018-05-11,2018,Diptera
23S821,D11,CDFA_P1,Diptera (Brachycera),Tephritidae,Tephritis,nr webbii,NA,NA,NA,Diptera
23S822,D12,CDFA_P1,Diptera (Brachycera),Tephritidae,Euarestoides,acutangulus,NA,NA,NA,Diptera
23S765,E1,CDFA_P1,Diptera (Brachycera),Tephritidae,Neotephritis,finalis,45100,2023-06-23,2023,Diptera
23S767,E2,CDFA_P1,Diptera (Brachycera),Tephritidae,Tephritis,nr webbii,45086,2023-06-09,2023,Diptera
23S766,E3,CDFA_P1,Diptera (Brachycera),Tephritidae,Euarestoides,acutangulus,45072,2023-05-26,2023,Diptera
23S768,E4,CDFA_P1,Diptera (Brachycera),Tephritidae,Tephritis,nr webbii,45086,2023-06-09,2023,Diptera
23S769,E5,CDFA_P1,Diptera (Brachycera),Tephritidae,Neaspilota,viridescens,45104,2023-06-27,2023,Diptera
23S770,E6,CDFA_P1,Diptera (Brachycera),Tephritidae,Neaspilota,viridescens,45104,2023-06-27,2023,Diptera
23S771,E7,CDFA_P1,Diptera (Brachycera),Tephritidae,Campiglossa,genalis,45105,2023-06-28,2023,Diptera
23S777,E8,CDFA_P1,Diptera (Brachycera),Tephritidae,Campiglossa,genalis,45105,2023-06-28,2023,Diptera
23S778,E9,CDFA_P1,Diptera (Brachycera),Tephritidae,Urophora,sirunaseva,45102,2023-06-25,2023,Diptera
23S828,E10,CDFA_P1,Diptera (Brachycera),Tephritidae,Campiglossa,snowi,45149,2023-08-11,2023,Diptera
23S825,E11,CDFA_P1,Diptera (Brachycera),Tephritidae,Campiglossa,snowi,45149,2023-08-11,2023,Diptera
23S829,E12,CDFA_P1,Diptera (Brachycera),Tephritidae,Neaspilota,achilleae,44795,2022-08-22,2022,Diptera
23S779,F1,CDFA_P1,Diptera (Brachycera),Tephritidae,Urophora,sirunaseva,45102,2023-06-25,2023,Diptera
23S780,F2,CDFA_P1,Diptera (Brachycera),Tephritidae,Oxyna,aterrima,45100,2023-06-23,2023,Diptera
23S781,F3,CDFA_P1,Diptera (Brachycera),Tephritidae,Oxyna,aterrima,45100,2023-06-23,2023,Diptera
23S783,F4,CDFA_P1,Diptera (Brachycera),Tephritidae,Tephritis,ovatipennis,45105,2023-06-28,2023,Diptera
23S782,F5,CDFA_P1,Diptera (Brachycera),Tephritidae,Tephritis,ovatipennis,45105,2023-06-28,2023,Diptera
23S531,F6,CDFA_P1,Diptera (Brachycera),Tephritidae,Trupanea,signata,45100,2023-06-23,2023,Diptera
23S785,F7,CDFA_P1,Diptera (Brachycera),Tephritidae,Trupanea,bisetosa,44903,2022-12-08,2022,Diptera
23S784,F8,CDFA_P1,Diptera (Brachycera),Tephritidae,Tephritis,ovatipennis,45105,2023-06-28,2023,Diptera
23S469,F9,CDFA_P1,Diptera (Brachycera),Tephritidae,Tephritis,araneosa (pacifica),45100,2023-06-23,2023,Diptera
23S834,F10,CDFA_P1,Diptera (Brachycera),Tephritidae,Neaspilota,signifera,45044,2023-04-28,2023,Diptera
23S835,F11,CDFA_P1,Diptera (Brachycera),Tephritidae,Neaspilota,signifera,45044,2023-04-28,2023,Diptera
23S836,F12,CDFA_P1,Diptera (Brachycera),Tephritidae,Neaspilota,signifera,45044,2023-04-28,2023,Diptera
23S786,G1,CDFA_P1,Diptera (Brachycera),Tephritidae,Trupanea,signata,45100,2023-06-23,2023,Diptera
23S787,G2,CDFA_P1,Diptera (Brachycera),Tephritidae,Tephritis,araneosa (pacifica),45100,2023-06-23,2023,Diptera
23S788,G3,CDFA_P1,Diptera (Brachycera),Stratiomyidae,Pachygaster,montana,45088,2023-06-11,2023,Diptera
23S789,G4,CDFA_P1,Diptera (Brachycera),Stratiomyidae,Pachygaster,montana,45088,2023-06-11,2023,Diptera
23S790,G5,CDFA_P1,Diptera (Brachycera),Stratiomyidae,Pachygaster,montana,45088,2023-06-11,2023,Diptera
23S791,G6,CDFA_P1,Diptera (Brachycera),Stratiomyidae,Dieuryneura,stigma,45088,2023-06-11,2023,Diptera
23S792,G7,CDFA_P1,Diptera (Brachycera),Stratiomyidae,Dieuryneura,stigma,45088,2023-06-11,2023,Diptera
23S793,G8,CDFA_P1,Diptera (Brachycera),Stratiomyidae,Dieuryneura,stigma,45088,2023-06-11,2023,Diptera
23S794,G9,CDFA_P1,Diptera (Brachycera),Conopidae,Zodion,obliquefasciatum,45088,2023-06-11,2023,Diptera
23S824,G10,CDFA_P1,Diptera (Brachycera),Tephritidae,Campiglossa,snowi,45149,2023-08-11,2023,Diptera
23S826,G11,CDFA_P1,Diptera (Brachycera),Tephritidae,Eutreta,diana,45149,2023-08-11,2023,Diptera
23S827,G12,CDFA_P1,Diptera (Brachycera),Tephritidae,Eutreta,diana,45149,2023-08-11,2023,Diptera
23S795,H1,CDFA_P1,Diptera (Brachycera),Conopidae,Zodion,obliquefasciatum,45088,2023-06-11,2023,Diptera
23S796,H2,CDFA_P1,Diptera (Brachycera),Tephritidae,Campiglossa,variabilis,40018,2009-07-24,2009,Diptera
23S797,H3,CDFA_P1,Diptera (Brachycera),Tephritidae,Campiglossa,variabilis,40018,2009-07-24,2009,Diptera
23S798,H4,CDFA_P1,Diptera (Brachycera),Tephritidae,Tephritis,araneosa complex,40018,2009-07-24,2009,Diptera
23S805,H5,CDFA_P1,Diptera (Brachycera),Ulidiidae,Oedopa,capito,40390,2010-07-31,2010,Diptera
23S806,H6,CDFA_P1,Diptera (Brachycera),Ulidiidae,Oedopa,capito,40390,2010-07-31,2010,Diptera
23S807,H7,CDFA_P1,Diptera (Brachycera),Tephritidae,Trupanea,radifera,42881,2017-05-26,2017,Diptera
23S808,H8,CDFA_P1,Diptera (Brachycera),Tephritidae,Trupanea,imperfecta,NA,NA,NA,Diptera
23S809,H9,CDFA_P1,Diptera (Brachycera),Tephritidae,Trupanea,imperfecta,NA,NA,NA,Diptera
23S837,H10,CDFA_P1,Diptera (Brachycera),Tephritidae,Trupanea,femoralis,45044,2023-04-28,2023,Diptera
23S845,H11,CDFA_P1,Diptera (Brachycera),Ulidiidae,Tritoxa,pollinosa,NA,NA,NA,Diptera
23S846,H12,CDFA_P1,Diptera (Brachycera),Tephritidae,Chetostoma,californicum,39198,2007-04-26,2007,Diptera
CASENT9131768,A1,CAS_P32,Plecoptera,Capniidae,Capnia,sp.,1/30/15,2015-01-30,2015,Plecoptera
CASENT9131891,B1,CAS_P32,Plecoptera,Chloroperlidae,Sweltsa,sp.,1/30/15,2015-01-30,2015,Plecoptera
CASENT9131793,C1,CAS_P32,Ephemeroptera,Ameletidae,Ameletus,sp.,1/30/15,2015-01-30,2015,Ephemeroptera
CASENT9132248,D1,CAS_P32,Plecoptera,Capniidae,Mesocapnia,projecta,1/30/15,2015-01-30,2015,Plecoptera
CASENT9131675,E1,CAS_P32,Plecoptera,Leuctridae,Calileuctra,ephemera,1/3/15,2015-01-03,2015,Plecoptera
CASENT9132752,F1,CAS_P32,Ephemeroptera,Leptophlebiidae,Paraleptophlebia,helena,11/24/14,2014-11-24,2014,Ephemeroptera
CASENT9131890,G1,CAS_P32,Plecoptera,Nemouridae,Malenka,sp.,NA,NA,NA,Plecoptera
CASENT9132787,H1,CAS_P32,Plecoptera,Leuctridae,Paraleuctra,divisa,NA,NA,NA,Plecoptera
CASENT9130075,A2,CAS_P32,Ephemeroptera,Leptohyphidae,Tricorythodes,explicatus,4/8/15,2015-04-08,2015,Ephemeroptera
CASENT9130439,B2,CAS_P32,Plecoptera,Perlidae,Calineuria,californica,4/8/15,2015-04-08,2015,Plecoptera
CASENT9130467,C2,CAS_P32,Ephemeroptera,Ephemerellidae,Ephemerella,tibialis,4/8/15,2015-04-08,2015,Ephemeroptera
CASENT9131090,D2,CAS_P32,Ephemeroptera,Baetidae,Baetis,tricaudatus,4/8/15,2015-04-08,2015,Ephemeroptera
CASENT9131828,E2,CAS_P32,Diptera,Empididae,Wiedemannia,sp.,4/8/15,2015-04-08,2015,Diptera
CASENT9131772,F2,CAS_P32,Diptera,Simuliidae,Simulium,sp.,4/8/15,2015-04-08,2015,Diptera
CASENT9130354,G2,CAS_P32,Diptera,Simuliidae,Simulium,canadense,4/8/15,2015-04-08,2015,Diptera
CASENT9131144,H2,CAS_P32,Plecoptera,Chloroperlidae,Sweltsa,sp.,9/30/16,2016-09-30,2016,Plecoptera
CASENT9131060,A3,CAS_P32,Megaloptera,Sialidae,Sialis,sp.,9/30/16,2016-09-30,2016,Megaloptera
CASENT9132293,B3,CAS_P32,Ephemeroptera,Leptophlebiidae,Paraleptophlebia,sp.,9/30/16,2016-09-30,2016,Ephemeroptera
CASENT9131271,C3,CAS_P32,Trichoptera,Lepidostomatidae,Lepidostoma,sp.,9/30/16,2016-09-30,2016,Trichoptera
CASENT9131769,D3,CAS_P32,Trichoptera,Apataniidae,Apatania,sorex,9/30/16,2016-09-30,2016,Trichoptera
CASENT9131669,E3,CAS_P32,Ephemeroptera,Heptageniidae,Nixe,kennedyi,9/30/16,2016-09-30,2016,Ephemeroptera
CASENT9131666,F3,CAS_P32,Trichoptera,Lepidostomatidae,Lepidostoma,sp.,9/30/16,2016-09-30,2016,Trichoptera
CASENT9131893,G3,CAS_P32,NA,Thremmatidae,Neophylax,occidentis,9/30/16,2016-09-30,2016,NA
CASENT9132308,H3,CAS_P32,Trichoptera,Apataniidae,Apatania,sorex,9/30/16,2016-09-30,2016,Trichoptera
CASENT9131668,A4,CAS_P32,Trichoptera,Hydropsychidae,Hydropsyche,sp.,9/30/16,2016-09-30,2016,Trichoptera
CASENT9131776,B4,CAS_P32,Coleoptera,Elmidae,Optioservus,sp.,9/30/16,2016-09-30,2016,Coleoptera
CASENT9131674,C4,CAS_P32,Plecoptera,Perlodidae,Cultus,sp.,9/30/16,2016-09-30,2016,Plecoptera
CASENT9130194,D4,CAS_P32,Plecoptera,Perlodidae,Perlinodes,aurea,9/30/16,2016-09-30,2016,Plecoptera
CASENT9132335,E4,CAS_P32,Plecoptera,Perlodidae,Skwala,sp.,9/30/16,2016-09-30,2016,Plecoptera
CASENT9132324,F4,CAS_P32,Diptera,Simuliidae,Simulium,sp.,9/30/16,2016-09-30,2016,Diptera
CASENT9132574,G4,CAS_P32,Plecoptera,Perlodidae,Isoperla,sp.,9/30/16,2016-09-30,2016,Plecoptera
CASENT9131853,H4,CAS_P32,Plecoptera,Peltoperlidae,Yoraperla,nigrisoma,9/30/16,2016-09-30,2016,Plecoptera
CASENT9131921,A5,CAS_P32,Plecoptera,Nemouridae,Zapada,columbiana,9/30/16,2016-09-30,2016,Plecoptera
CASENT9131806,B5,CAS_P32,Plecoptera,Nemouridae,Malenka,sp.,9/30/16,2016-09-30,2016,Plecoptera
CASENT9132314,C5,CAS_P32,Ephemeroptera,Baetidae,Baetis,tricaudatus,9/30/16,2016-09-30,2016,Ephemeroptera
CASENT9132297,D5,CAS_P32,Trichoptera,Odontoceridae,Nerophilus,californicus,9/30/16,2016-09-30,2016,Trichoptera
CASENT9132392,E5,CAS_P32,Ephemeroptera,Heptageniidae,Ironodes,sp.,9/30/16,2016-09-30,2016,Ephemeroptera
CASENT9131774,F5,CAS_P32,Plecoptera,Chloroperlidae,Sweltsa,sp.,9/30/16,2016-09-30,2016,Plecoptera
CASENT9132617,G5,CAS_P32,Ephemeroptera,Baetidae,Baetis,tricaudatus,9/30/16,2016-09-30,2016,Ephemeroptera
CASENT9131867,H5,CAS_P32,Trichoptera,Hydroptilidae,Leucotrichia,pictipes,7/10/13,2013-07-10,2013,Trichoptera
CASENT9131803,A6,CAS_P32,Trichoptera,Hydroptilidae,Ochrotrichia,sp.,7/10/13,2013-07-10,2013,Trichoptera
CASENT9131850,B6,CAS_P32,Trichoptera,Sericostomatidae,Gumaga,griseola,7/10/13,2013-07-10,2013,Trichoptera
CASENT9131879,C6,CAS_P32,Trichoptera,Glossosomatidae,Glossosoma,sp.,7/10/13,2013-07-10,2013,Trichoptera
CASENT9130933,D6,CAS_P32,Trichoptera,Philopotamidae,Wormaldia,gabriella,7/10/13,2013-07-10,2013,Trichoptera
CASENT9132630,E6,CAS_P32,Ephemeroptera,Baetidae,Baetis,alius,7/10/13,2013-07-10,2013,Ephemeroptera
CASENT9131913,F6,CAS_P32,Ephemeroptera,Heptageniidae,Ecdyonurus,criddlei,7/10/13,2013-07-10,2013,Ephemeroptera
CASENT9132332,G6,CAS_P32,Trichoptera,Hydroptilidae,Ochrotrichia,sp.,7/10/13,2013-07-10,2013,Trichoptera
CASENT9131878,H6,CAS_P32,Trichoptera,Hydroptilidae,Hydroptila,sp.,7/10/13,2013-07-10,2013,Trichoptera
CASENT9131861,A7,CAS_P32,Plecoptera,Nemouridae,Zapada,sp.,8/7/13,2013-08-07,2013,Plecoptera
CASENT9131944,B7,CAS_P32,Diptera,Simuliidae,Simulium,sp.,7/14/13,2013-07-14,2013,Diptera
CASENT9131827,C7,CAS_P32,Ephemeroptera,Baetidae,Baetis,tricaudatus,7/14/13,2013-07-14,2013,Ephemeroptera
CASENT9131671,D7,CAS_P32,Plecoptera,Perlidae,Calineuria,californica,7/13/13,2013-07-13,2013,Plecoptera
CASENT9131886,E7,CAS_P32,Trichoptera,Hydropsychidae,Parapsyche,sp.,7/14/13,2013-07-14,2013,Trichoptera
CASENT9131661,F7,CAS_P32,Diptera,Empididae,Wiedemannia,sp.,7/14/13,2013-07-14,2013,Diptera
CASENT9131560,G7,CAS_P32,Ephemeroptera,Ameletidae,Ameletus,sp.,7/14/13,2013-07-14,2013,Ephemeroptera
CASENT9132643,H7,CAS_P32,Trichoptera,Rhyacophilidae,Rhyacophila,arnaudi,7/14/13,2013-07-14,2013,Trichoptera
CASENT9132346,A8,CAS_P32,Plecoptera,Chloroperlidae,Suwallia,sp.,7/14/13,2013-07-14,2013,Plecoptera
CASENT9131623,B8,CAS_P32,Ephemeroptera,Ephemerellidae,Seratella,micheneri,7/14/13,2013-07-14,2013,Ephemeroptera
CASENT9130691,C8,CAS_P32,Ephemeroptera,Ephemerellidae,Ephemerella,excrucians,7/14/13,2013-07-14,2013,Ephemeroptera
CASENT9131998,D8,CAS_P32,Ephemeroptera,Baetidae,Centroptilum,sp.,7/14/13,2013-07-14,2013,Ephemeroptera
CASENT9132295,E8,CAS_P32,Trichoptera,Hydroptilidae,Leucotrichia,pictipes,8/23/13,2013-08-23,2013,Trichoptera
CASENT9130097,F8,CAS_P32,Trichoptera,Psychomyiidae,Tinodes,sp.,7/8/13,2013-07-08,2013,Trichoptera
CASENT9130910,G8,CAS_P32,Trichoptera,Hydroptilidae,Leucotrichia,pictipes,3/13/14,2014-03-13,2014,Trichoptera
CASENT9130294,H8,CAS_P32,Ephemeroptera,Ephemerellidae,Matriella,teresa,7/13/13,2013-07-13,2013,Ephemeroptera
CASENT9131534,A9,CAS_P32,Trichoptera,Lepidostomatidae,Lepidostoma,sp.,3/11/14,2014-03-11,2014,Trichoptera
CASENT9131805,B9,CAS_P32,Ephemeroptera,Ephemerellidae,Serratella,micheneri,7/13/13,2013-07-13,2013,Ephemeroptera
CASENT9131715,C9,CAS_P32,Plecoptera,Taeniopterygidae,Taenionema,sp.,3/13/14,2014-03-13,2014,Plecoptera
CASENT9132289,D9,CAS_P32,Ephemeroptera,Baetidae,Baetis,tricaudatus,7/13/13,2013-07-13,2013,Ephemeroptera
CASENT9131722,E9,CAS_P32,Ephemeroptera,Leptophlebiidae,Paraleptophlebia,sp.,3/13/14,2014-03-13,2014,Ephemeroptera
CASENT9130460,F9,CAS_P32,Diptera,Simuliidae,Prosimulium,sp.,3/12/14,2014-03-12,2014,Diptera
CASENT9131644,G9,CAS_P32,Diptera,Chironomidae,NA,NA,3/12/14,2014-03-12,2014,Diptera
CASENT9130117,H9,CAS_P32,Ephemeroptera,Baetidae,Procloeon,venosum,7/30/06,2006-07-30,2006,Ephemeroptera
CASENT9130117,H9,CAS_P32,Trichoptera,Helicopsychidae,Helicopsyche,borealis,5/14/06,2006-05-14,2006,Trichoptera
CASENT9131009,A10,CAS_P32,Ephemeroptera,Ephemerellidae,Ephemerella,excrucians,5/14/06,2006-05-14,2006,Ephemeroptera
CASENT9131915,B10,CAS_P32,Trichoptera,Rhyacophilidae,Rhyacophila,oreta,5/20/05,2005-05-20,2005,Trichoptera
contaminated,C10,CAS_P32,NA,NA,NA,NA,NA,NA,NA,NA
CASENT9131614,D10,CAS_P32,NA,NA,NA,NA,NA,NA,NA,NA
CASENT9131288,E10,CAS_P32,Plecoptera,Chloroperlidae,Alloperla,fratena,5/12/05,2005-05-12,2005,Plecoptera
CASENT9131889,F10,CAS_P32,Ephemeroptera,Leptohyphidae,Tricorythodes,explicatus,7/30/06,2006-07-30,2006,Ephemeroptera
CASENT9131775,G10,CAS_P32,Diptera,Dixidae,Dixa,sp.,4/18/05,2005-04-18,2005,Diptera
CASENT9131533,H10,CAS_P32,Trichoptera,Rhyacophilidae,Rhyacophila,sp.,5/12/05,2005-05-12,2005,Trichoptera
CASENT9131667,A11,CAS_P32,Trichoptera,Lepidostomatidae,Lepidostoma,sp.,4/18/05,2005-04-18,2005,Trichoptera
CASENT9131833,B11,CAS_P32,Plecoptera,Nemouridae,Malenka,sp.,4/18/05,2005-04-18,2005,Plecoptera
CASENT9131896,C11,CAS_P32,Ephemeroptera,Baetidae,Baetis,sp.,4/18/05,2005-04-18,2005,Ephemeroptera
CASENT9131912,D11,CAS_P32,Diptera,Chironomidae,NA,NA,4/17/05,2005-04-17,2005,Diptera
CASENT9131613,E11,CAS_P32,Coleoptera,Elmidae,Optioservus,sp.,4/17/05,2005-04-17,2005,Coleoptera
CASENT9130102,F11,CAS_P32,Ephemeroptera,Baetidae,Baetis,sp.,4/17/05,2005-04-17,2005,Ephemeroptera
CASENT9131916,G11,CAS_P32,Ephemeroptera,Baetidae,Baetis,tricaudatus,4/28/06,2006-04-28,2006,Ephemeroptera
CASENT9131779,H11,CAS_P32,Ephemeroptera,Ephemerellidae,Drunella,flavilinea,4/28/06,2006-04-28,2006,Ephemeroptera
CASENT9130996,A12,CAS_P32,Ephemeroptera,Baetidae,Baetis,tricaudatus,4/28/06,2006-04-28,2006,Ephemeroptera
CASENT9131816,B12,CAS_P32,Ephemeroptera,Baetidae,Baetis,sp.,4/28/06,2006-04-28,2006,Ephemeroptera
CASENT9131676,C12,CAS_P32,Ephemeroptera,Baetidae,Diphetor,hageni,4/28/06,2006-04-28,2006,Ephemeroptera
CASENT9131911,D12,CAS_P32,Plecoptera,Chloroperlidae,Sweltsa,sp.,4/28/06,2006-04-28,2006,Plecoptera
CASENT9130647,E12,CAS_P32,Ephemeroptera,Heptageniidae,Ironodes,sp.,4/28/06,2006-04-28,2006,Ephemeroptera
CASENT9130230,F12,CAS_P32,Trichoptera,Rhyacophilidae,Rhyacophila,narvae,4/28/06,2006-04-28,2006,Trichoptera
23T391,A1,CDFA_P4,Hymenoptera,Mutillidae,Sphaeropthalma,edwardsii,23.VII.2017,2017-07-23,2017,Hymenoptera
23T470,B1,CDFA_P4,Hymenoptera,Mutillidae,Sphaeropthalma,megagnathos,24.VI.2017,2017-06-24,2017,Hymenoptera
23T485,C1,CDFA_P4,Hymenoptera,Mutillidae,Sphaeropthalma,pallida,3.VII.2016,2016-07-03,2016,Hymenoptera
23T506,D1,CDFA_P4,Hymenoptera,Mutillidae,Sphaeropthalma,yavapai,31.VII.2016,2016-07-31,2016,Hymenoptera
23T518,E1,CDFA_P4,Hymenoptera,Mutillidae,Acanthophotopsis,falciformis,27.V.2017,2017-05-27,2017,Hymenoptera
23T530,F1,CDFA_P4,Hymenoptera,Mutillidae,Odontophotopsis,bellona,30.VI.2018,2018-06-30,2018,Hymenoptera
23T542,G1,CDFA_P4,Hymenoptera,Mutillidae,Odontophotopsis,delodonta,12.VIII.2018,2018-08-12,2018,Hymenoptera
23T563,H1,CDFA_P4,Hymenoptera,Mutillidae,Odontophotopsis,hypermnestra,7.VII.2015,2015-07-07,2015,Hymenoptera
23T459,A2,CDFA_P4,Hymenoptera,Mutillidae,Sphaeropthalma,edwardsii,2.VIII.2022,2022-08-02,2022,Hymenoptera
23T471,B2,CDFA_P4,Hymenoptera,Mutillidae,Sphaeropthalma,mendica,1.VII.2019,2019-07-01,2019,Hymenoptera
23T486,C2,CDFA_P4,Hymenoptera,Mutillidae,Sphaeropthalma,pallida,23.VII.2017,2017-07-23,2017,Hymenoptera
23T507,D2,CDFA_P4,Hymenoptera,Mutillidae,Sphaeropthalma,yavapai,23.VII.2017,2017-07-23,2017,Hymenoptera
23T519,E2,CDFA_P4,Hymenoptera,Mutillidae,Acrophotopsis,campylognatha,10.VI.2022,2022-06-10,2022,Hymenoptera
23T531,F2,CDFA_P4,Hymenoptera,Mutillidae,Odontophotopsis,bellona,25.VI.2017,2017-06-25,2017,Hymenoptera
23T543,G2,CDFA_P4,Hymenoptera,Mutillidae,Odontophotopsis,exogyra,18.VII.2017,2017-07-18,2017,Hymenoptera
23T573,H2,CDFA_P4,Hymenoptera,Mutillidae,Odontophotopsis,inconspicua,30.VI.2018,2018-06-30,2018,Hymenoptera
23T460,A3,CDFA_P4,Hymenoptera,Mutillidae,Sphaeropthalma,fergusoni,29.V.2005,2005-05-29,2005,Hymenoptera
23T472,B3,CDFA_P4,Hymenoptera,Mutillidae,Sphaeropthalma,mendica,23.VII.2017,2017-07-23,2017,Hymenoptera
23T487,C3,CDFA_P4,Hymenoptera,Mutillidae,Sphaeropthalma,pallidipes,27.V.2017,2017-05-27,2017,Hymenoptera
23T508,D3,CDFA_P4,Hymenoptera,Mutillidae,Sphaeropthalma,yumaella,10.VI.2022,2022-06-10,2022,Hymenoptera
23T520,E3,CDFA_P4,Hymenoptera,Mutillidae,Acrophotopsis,dirce,23.VII.2017,2017-07-23,2017,Hymenoptera
23T532,F3,CDFA_P4,Hymenoptera,Mutillidae,Odontophotopsis,cf. odontoloxia,1.IV.1994,1994-04-01,1994,Hymenoptera
23T544,G3,CDFA_P4,Hymenoptera,Mutillidae,Odontophotopsis,grata,15.VI.2018,2018-06-15,2018,Hymenoptera
23T574,H3,CDFA_P4,Hymenoptera,Mutillidae,Odontophotopsis,inconspicua,15.VI.2018,2018-06-15,2018,Hymenoptera
23T461,A4,CDFA_P4,Hymenoptera,Mutillidae,Sphaeropthalma,ferruginea,24.VI.2017,2017-06-24,2017,Hymenoptera
23T473,B4,CDFA_P4,Hymenoptera,Mutillidae,Sphaeropthalma,mesillensis,29.V.2006,2006-05-29,2006,Hymenoptera
23T490,C4,CDFA_P4,Hymenoptera,Mutillidae,Sphaeropthalma,parapenalis,22.VII.2018,2018-07-22,2018,Hymenoptera
23T509,D4,CDFA_P4,Hymenoptera,Mutillidae,Sphaeropthalma,yumaella,25.VI.2017,2017-06-25,2017,Hymenoptera
23T521,E4,CDFA_P4,Hymenoptera,Mutillidae,Dilophotopsis,concolor,9.VIII.1987,1987-08-09,1987,Hymenoptera
23T533,F4,CDFA_P4,Hymenoptera,Mutillidae,Odontophotopsis,odontoloxia,27.V.2017,2017-05-27,2017,Hymenoptera
23T545,G4,CDFA_P4,Hymenoptera,Mutillidae,Odontophotopsis,grata?,23.VII.2017,2017-07-23,2017,Hymenoptera
23T575,H4,CDFA_P4,Hymenoptera,Mutillidae,Odontophotopsis,inconspicua,1.VII.2019,2019-07-01,2019,Hymenoptera
23T462,A5,CDFA_P4,Hymenoptera,Mutillidae,Sphaeropthalma,ferruginopsis,16.VII.2020,2020-07-16,2020,Hymenoptera
23T474,B5,CDFA_P4,Hymenoptera,Mutillidae,Sphaeropthalma,militaris,30.VI.2018,2018-06-30,2018,Hymenoptera
23T492,C5,CDFA_P4,Hymenoptera,Mutillidae,Sphaeropthalma,parkeri,25.VI.2017,2017-06-25,2017,Hymenoptera
23T510,D5,CDFA_P4,Hymenoptera,Mutillidae,Sphaeropthalma,aff. luiseno,15.VI.2018,2018-06-15,2018,Hymenoptera
23T522,E5,CDFA_P4,Hymenoptera,Mutillidae,Dilophotopsis,paron,30.VI.2018,2018-06-30,2018,Hymenoptera
23T534,F5,CDFA_P4,Hymenoptera,Mutillidae,Odontophotopsis,biramosa,25.VI.2017,2017-06-25,2017,Hymenoptera
23T546,G5,CDFA_P4,Hymenoptera,Mutillidae,Odontophotopsis,hammetti,10.VI.2022,2022-06-10,2022,Hymenoptera
23T576,H5,CDFA_P4,Hymenoptera,Mutillidae,Odontophotopsis,mamata,1.VII.2019,2019-07-01,2019,Hymenoptera
23T463,A6,CDFA_P4,Hymenoptera,Mutillidae,Sphaeropthalma,ferruginea,23.VII.2017,2017-07-23,2017,Hymenoptera
23T475,B6,CDFA_P4,Hymenoptera,Mutillidae,Photomorphus,fallax,17.VIII.2010,2010-08-17,2010,Hymenoptera
23T493,C6,CDFA_P4,Hymenoptera,Mutillidae,Sphaeropthalma,parkeri,27.V.2017,2017-05-27,2017,Hymenoptera
23T511,D6,CDFA_P4,Hymenoptera,Mutillidae,Sphaeropthalma,aff. triangularis,2.IX.2022,2022-09-02,2022,Hymenoptera
23T523,E6,CDFA_P4,Hymenoptera,Mutillidae,Dilophotopsis,paron,30.VI.2018,2018-06-30,2018,Hymenoptera
23T535,F6,CDFA_P4,Hymenoptera,Mutillidae,Odontophotopsis,biramosa,30.VI.2018,2018-06-30,2018,Hymenoptera
23T547,G6,CDFA_P4,Hymenoptera,Mutillidae,Odontophotopsis,hexadonta,2.VIII.2022,2022-08-02,2022,Hymenoptera
23T577,H6,CDFA_P4,Hymenoptera,Mutillidae,Odontophotopsis,mamata,30.VI.2018,2018-06-30,2018,Hymenoptera
23T464,A7,CDFA_P4,Hymenoptera,Mutillidae,Sphaeropthalma,ferruginea,24.V.2000,2000-05-24,2000,Hymenoptera
23T479,B7,CDFA_P4,Hymenoptera,Mutillidae,Sphaeropthalma,brachyptera,31.VII.2016,2016-07-31,2016,Hymenoptera
23T496,C7,CDFA_P4,Hymenoptera,Mutillidae,Sphaeropthalma,similis,23.VII.2020,2020-07-23,2020,Hymenoptera
23T512,D7,CDFA_P4,Hymenoptera,Mutillidae,Sphaeropthalma,aff. sublobata,3.VII.2016,2016-07-03,2016,Hymenoptera
23T524,E7,CDFA_P4,Hymenoptera,Mutillidae,Odontophotopsis,melicausa.F13,9.VIII.1987,1987-08-09,1987,Hymenoptera
23T536,F7,CDFA_P4,Hymenoptera,Mutillidae,Odontophotopsis,cassia,2.VIII.2022,2022-08-02,2022,Hymenoptera
23T548,G7,CDFA_P4,Hymenoptera,Mutillidae,Odontophotopsis,hexadonta,15.IX.2022,2022-09-15,2022,Hymenoptera
23T578,H7,CDFA_P4,Hymenoptera,Mutillidae,Odontophotopsis,melicausa,2.VIII.2022,2022-08-02,2022,Hymenoptera
23T465,A8,CDFA_P4,Hymenoptera,Mutillidae,Sphaeropthalma,ignacio,17.V.2016,2016-05-17,2016,Hymenoptera
23T480,B8,CDFA_P4,Hymenoptera,Mutillidae,Sphaeropthalma,nana,1.VIII.2021,2021-08-01,2021,Hymenoptera
23T499,C8,CDFA_P4,Hymenoptera,Mutillidae,Sphaeropthalma,sublobata,27.V.2017,2017-05-27,2017,Hymenoptera
23T513,D8,CDFA_P4,Hymenoptera,Mutillidae,Sphaeropthalma,aff. sublobata,19.VI.2022,2022-06-19,2022,Hymenoptera
23T525,E8,CDFA_P4,Hymenoptera,Mutillidae,Odontophotopsis,melicausa.F15,4.III.2012,2012-03-04,2012,Hymenoptera
23T537,F8,CDFA_P4,Hymenoptera,Mutillidae,Odontophotopsis,cassia,23.VII.2017,2017-07-23,2017,Hymenoptera
23T549,G8,CDFA_P4,Hymenoptera,Mutillidae,Odontophotopsis,hexadonta,15.IX.2022,2022-09-15,2022,Hymenoptera
23T579,H8,CDFA_P4,Hymenoptera,Mutillidae,Odontophotopsis,melicausa,19.VI.2022,2022-06-19,2022,Hymenoptera
23T466,A9,CDFA_P4,Hymenoptera,Mutillidae,Sphaeropthalma,insignis,2.IX.2022,2022-09-02,2022,Hymenoptera
23T481,B9,CDFA_P4,Hymenoptera,Mutillidae,Sphaeropthalma,orestes,2.VII.2019,2019-07-02,2019,Hymenoptera
23T500,C9,CDFA_P4,Hymenoptera,Mutillidae,Sphaeropthalma,sublobata,23.VII.2017,2017-07-23,2017,Hymenoptera
23T514,D9,CDFA_P4,Hymenoptera,Mutillidae,Sphaeropthalma,aff. sublobata,23.VII.2017,2017-07-23,2017,Hymenoptera
23T526,E9,CDFA_P4,Hymenoptera,Mutillidae,Odontophotopsis,arcuata,29.VI.2009,2009-06-29,2009,Hymenoptera
23T538,F9,CDFA_P4,Hymenoptera,Mutillidae,Odontophotopsis,clypeata,1.VII.2019,2019-07-01,2019,Hymenoptera
23T550,G9,CDFA_P4,Hymenoptera,Mutillidae,Odontophotopsis,hexadonta,1.IX.2022,2022-09-01,2022,Hymenoptera
23T580,H9,CDFA_P4,Hymenoptera,Mutillidae,Odontophotopsis,melicausa,15.IX.2022,2022-09-15,2022,Hymenoptera
23T467,A10,CDFA_P4,Hymenoptera,Mutillidae,Sphaeropthalma,insignis,22.VII.2022,2022-07-22,2022,Hymenoptera
23T482,B10,CDFA_P4,Hymenoptera,Mutillidae,Sphaeropthalma,orestes,18.VII.2020,2020-07-18,2020,Hymenoptera
23T503,C10,CDFA_P4,Hymenoptera,Mutillidae,Sphaeropthalma,triangularis,23.VII.2017,2017-07-23,2017,Hymenoptera
23T515,D10,CDFA_P4,Hymenoptera,Mutillidae,Photomorphus,pudicus,2.IX.2022,2022-09-02,2022,Hymenoptera
23T527,E10,CDFA_P4,Hymenoptera,Mutillidae,Odontophotopsis,armata,23.VII.2017,2017-07-23,2017,Hymenoptera
23T539,F10,CDFA_P4,Hymenoptera,Mutillidae,Odontophotopsis,clypeata,30.VI.2018,2018-06-30,2018,Hymenoptera
23T551,G10,CDFA_P4,Hymenoptera,Mutillidae,Odontophotopsis,cookii,29.VII.2016,2016-07-29,2016,Hymenoptera
23T582,H10,CDFA_P4,Hymenoptera,Mutillidae,Odontophotopsis,microdonta,25.VI.2017,2017-06-25,2017,Hymenoptera
23T468,A11,CDFA_P4,Hymenoptera,Mutillidae,Sphaeropthalma,luiseno,31.V.2000,2000-05-31,2000,Hymenoptera
23T483,B11,CDFA_P4,Hymenoptera,Mutillidae,Sphaeropthalma,orestes,20.VII.2008,2008-07-20,2008,Hymenoptera
23T504,C11,CDFA_P4,Hymenoptera,Mutillidae,Sphaeropthalma,unicolor,5.VIII.2022,2022-08-05,2022,Hymenoptera
23T516,D11,CDFA_P4,Hymenoptera,Mutillidae,Photomorphus,coloradellus,12.VII.2017,2017-07-12,2017,Hymenoptera
23T528,E11,CDFA_P4,Hymenoptera,Mutillidae,Odontophotopsis,armata,1.VII.2019,2019-07-01,2019,Hymenoptera
23T540,F11,CDFA_P4,Hymenoptera,Mutillidae,Odontophotopsis,copioclypeata,1.VIII.2021,2021-08-01,2021,Hymenoptera
23T553,G11,CDFA_P4,Hymenoptera,Mutillidae,Odontophotopsis,aufidia,26.VII.2018,2018-07-26,2018,Hymenoptera
23T584,H11,CDFA_P4,Hymenoptera,Mutillidae,Odontophotopsis,microdonta,27.V.2017,2017-05-27,2017,Hymenoptera
23T667,A1,CDFA_P5,Diptera (Brachycera),Tephritidae,Aciurina,maculata,22.V.2008,2008-05-22,2008,Diptera
23T679,B1,CDFA_P5,Diptera (Brachycera),Tephritidae,Campiglossa,fuscata,05.VI.2016,2016-06-05,2016,Diptera
23T691,C1,CDFA_P5,Diptera (Brachycera),Tephritidae,Campiglossa,steyskali,02.VII.2016,2016-07-02,2016,Diptera
23T703,D1,CDFA_P5,Diptera (Brachycera),Tephritidae,Campiglossa,sp.,02.VII.2002,2002-07-02,2002,Diptera
23T715,E1,CDFA_P5,Diptera (Brachycera),Tephritidae,Euaresta,bellula,2.XI.2005,2005-11-02,2005,Diptera
23T727,F1,CDFA_P5,Diptera (Brachycera),Tephritidae,Eutreta,diana,29.VI.2016,2016-06-29,2016,Diptera
23T739,G1,CDFA_P5,Diptera (Brachycera),Tephritidae,Neaspilota,sp.,20.VII.1998,1998-07-20,1998,Diptera
23T751,H1,CDFA_P5,Diptera (Brachycera),Tephritidae,Procecidochares,anthracina,10.IV.2019,2019-04-10,2019,Diptera
23T668,A2,CDFA_P5,Diptera (Brachycera),Tephritidae,Aciurina,thoracica,12.VI.2006,2006-06-12,2006,Diptera
23T680,B2,CDFA_P5,Diptera (Brachycera),Tephritidae,Campiglossa,jamesi,02.VII.2002,2002-07-02,2002,Diptera
23T692,C2,CDFA_P5,Diptera (Brachycera),Tephritidae,Campiglossa,sp.,02.VII.2016,2016-07-02,2016,Diptera
23T704,D2,CDFA_P5,Diptera (Brachycera),Tephritidae,Campiglossa,sp.,02.VII.2002,2002-07-02,2002,Diptera
23T716,E2,CDFA_P5,Diptera (Brachycera),Tephritidae,Euaresta,bellula,2.XI.2005,2005-11-02,2005,Diptera
23T728,F2,CDFA_P5,Diptera (Brachycera),Tephritidae,Eutreta,angusta,03.XI.2009,2009-11-03,2009,Diptera
23T740,G2,CDFA_P5,Diptera (Brachycera),Tephritidae,Neaspilota,sp.,20.VII.1998,1998-07-20,1998,Diptera
23T752,H2,CDFA_P5,Diptera (Brachycera),Tephritidae,Procecidochares,flavipes,01.V.2008,2008-05-01,2008,Diptera
23T669,A3,CDFA_P5,Diptera (Brachycera),Tephritidae,Aciurina,thoracica,25.IX.2007,2007-09-25,2007,Diptera
23T681,B3,CDFA_P5,Diptera (Brachycera),Tephritidae,Campiglossa,murina,16.X.2009,2009-10-16,2009,Diptera
23T693,C3,CDFA_P5,Diptera (Brachycera),Tephritidae,Campiglossa,sp.,02.VII.2016,2016-07-02,2016,Diptera
23T705,D3,CDFA_P5,Diptera (Brachycera),Tephritidae,Campiglossa,sp.,13.X.1997,1997-10-13,1997,Diptera
23T717,E3,CDFA_P5,Diptera (Brachycera),Tephritidae,Euaresta,bellula,21.IV.2009,2009-04-21,2009,Diptera
23T729,F3,CDFA_P5,Diptera (Brachycera),Tephritidae,Eutreta,pollinosa,29.VI.2016,2016-06-29,2016,Diptera
23T741,G3,CDFA_P5,Diptera (Brachycera),Tephritidae,Paracantha,cultaris,31.VIII.1983,1983-08-31,1983,Diptera
23T753,H3,CDFA_P5,Diptera (Brachycera),Tephritidae,Procecidochares,grindeliae,02.VI.2003,2003-06-02,2003,Diptera
23T670,A4,CDFA_P5,Diptera (Brachycera),Tephritidae,Aciurina,cf. trixa,13.VI.1990,1990-06-13,1990,Diptera
23T682,B4,CDFA_P5,Diptera (Brachycera),Tephritidae,Campiglossa,occidentalis,29.VI.2016,2016-06-29,2016,Diptera
23T694,C4,CDFA_P5,Diptera (Brachycera),Tephritidae,Campiglossa,variabilis,24.V.2018,2018-05-24,2018,Diptera
23T706,D4,CDFA_P5,Diptera (Brachycera),Tephritidae,Campiglossa,sp.,30.VI.2016,2016-06-30,2016,Diptera
23T718,E4,CDFA_P5,Diptera (Brachycera),Tephritidae,Euaresta,stigmatica,29.VI.2016,2016-06-29,2016,Diptera
23T730,F4,CDFA_P5,Diptera (Brachycera),Tephritidae,Eutreta,pollinosa,29.VI.2016,2016-06-29,2016,Diptera
23T742,G4,CDFA_P5,Diptera (Brachycera),Tephritidae,Paracantha,cultaris,31.VIII.1983,1983-08-31,1983,Diptera
23T754,H4,CDFA_P5,Diptera (Brachycera),Tephritidae,Procecidochares,minuta,29.VI.2016,2016-06-29,2016,Diptera
23T671,A5,CDFA_P5,Diptera (Brachycera),Tephritidae,Aciurina,cf. trixa,21.IV.1981,1981-04-21,1981,Diptera
23T683,B5,CDFA_P5,Diptera (Brachycera),Tephritidae,Campiglossa,occidentalis,29.VI.2016,2016-06-29,2016,Diptera
23T695,C5,CDFA_P5,Diptera (Brachycera),Tephritidae,Campiglossa,variabilis,24.V.2018,2018-05-24,2018,Diptera
23T707,D5,CDFA_P5,Diptera (Brachycera),Tephritidae,Campiglossa,sp.,02.VII.2016,2016-07-02,2016,Diptera
23T719,E5,CDFA_P5,Diptera (Brachycera),Tephritidae,Euaresta,stigmatica,29.VI.2016,2016-06-29,2016,Diptera
23T731,F5,CDFA_P5,Diptera (Brachycera),Tephritidae,Eutreta,sp.,15.VII.2010,2010-07-15,2010,Diptera
23T743,G5,CDFA_P5,Diptera (Brachycera),Tephritidae,Paracantha,genalis,17.III.2009,2009-03-17,2009,Diptera
23T755,H5,CDFA_P5,Diptera (Brachycera),Tephritidae,Procecidochares,stonei,09.III.2021,2021-03-09,2021,Diptera
23T672,A6,CDFA_P5,Diptera (Brachycera),Tephritidae,Aciurina,cf. trixa,21.IV.1981,1981-04-21,1981,Diptera
23T684,B6,CDFA_P5,Diptera (Brachycera),Tephritidae,Campiglossa,pallidipennis,01.VII.2016,2016-07-01,2016,Diptera
23T696,C6,CDFA_P5,Diptera (Brachycera),Tephritidae,Campiglossa,variabilis,05.VI.2016,2016-06-05,2016,Diptera
23T708,D6,CDFA_P5,Diptera (Brachycera),Tephritidae,Chaetorellia,australis,18.VII.1996,1996-07-18,1996,Diptera
23T720,E6,CDFA_P5,Diptera (Brachycera),Tephritidae,Euaresta,stigmatica,29.VI.2016,2016-06-29,2016,Diptera
23T732,F6,CDFA_P5,Diptera (Brachycera),Tephritidae,Goedenia,formosa,07.VII.2022,2022-07-07,2022,Diptera
23T744,G6,CDFA_P5,Diptera (Brachycera),Tephritidae,Paracantha,gentilis,16.VII.2019,2019-07-16,2019,Diptera
23T756,H6,CDFA_P5,Diptera (Brachycera),Tephritidae,Procecidochares,sp.,23.X.2002,2002-10-23,2002,Diptera
23T673,A7,CDFA_P5,Diptera (Brachycera),Tephritidae,Campiglossa,californica,30.VI.2016,2016-06-30,2016,Diptera
23T685,B7,CDFA_P5,Diptera (Brachycera),Tephritidae,Campiglossa,picciola,10.I.2013,2013-01-10,2013,Diptera
23T697,C7,CDFA_P5,Diptera (Brachycera),Tephritidae,Campiglossa,sp.,04.VII.2016,2016-07-04,2016,Diptera
23T709,D7,CDFA_P5,Diptera (Brachycera),Tephritidae,Chaetorellia,australis,18.VII.1996,1996-07-18,1996,Diptera
23T721,E7,CDFA_P5,Diptera (Brachycera),Tephritidae,Euaresta,cf. stelligera,15.VIII.1983,1983-08-15,1983,Diptera
23T733,F7,CDFA_P5,Diptera (Brachycera),Tephritidae,Neaspilota,cf. viridescens,12.VII.1991,1991-07-12,1991,Diptera
23T745,G7,CDFA_P5,Diptera (Brachycera),Tephritidae,Paracantha,gentilis,23.VII.2000,2000-07-23,2000,Diptera
23T757,H7,CDFA_P5,Diptera (Brachycera),Tephritidae,Procecidochares,sp.,28.X.2009,2009-10-28,2009,Diptera
23T674,A8,CDFA_P5,Diptera (Brachycera),Tephritidae,Campiglossa,clathrata,29.VI.2016,2016-06-29,2016,Diptera
23T686,B8,CDFA_P5,Diptera (Brachycera),Tephritidae,Campiglossa,picciola,10.I.2013,2013-01-10,2013,Diptera
23T698,C8,CDFA_P5,Diptera (Brachycera),Tephritidae,Campiglossa,sp.,04.VII.2016,2016-07-04,2016,Diptera
23T710,D8,CDFA_P5,Diptera (Brachycera),Tephritidae,Chaetorellia,australis,18.VI.1999,1999-06-18,1999,Diptera
23T722,E8,CDFA_P5,Diptera (Brachycera),Tephritidae,Euaresta,cf. stelligera,15.VIII.1983,1983-08-15,1983,Diptera
23T734,F8,CDFA_P5,Diptera (Brachycera),Tephritidae,Neaspilota,cf. viridescens,12.VII.1991,1991-07-12,1991,Diptera
23T746,G8,CDFA_P5,Diptera (Brachycera),Tephritidae,Paracantha,gentilis,23.VII.2000,2000-07-23,2000,Diptera
23T758,H8,CDFA_P5,Diptera (Brachycera),Tephritidae,Procecidochares,sp.,20.VI.2007,2007-06-20,2007,Diptera
23T675,A9,CDFA_P5,Diptera (Brachycera),Tephritidae,Campiglossa,clathrata,29.VI.2016,2016-06-29,2016,Diptera
23T687,B9,CDFA_P5,Diptera (Brachycera),Tephritidae,Campiglossa,picciola,10.I.2013,2013-01-10,2013,Diptera
23T699,C9,CDFA_P5,Diptera (Brachycera),Tephritidae,Campiglossa,sp.,05.VI.2016,2016-06-05,2016,Diptera
23T711,D9,CDFA_P5,Diptera (Brachycera),Tephritidae,Chaetostomella,undosa,23.III.2000,2000-03-23,2000,Diptera
23T723,E9,CDFA_P5,Diptera (Brachycera),Tephritidae,Eutreta,angusta,22.X.2009,2009-10-22,2009,Diptera
23T735,F9,CDFA_P5,Diptera (Brachycera),Tephritidae,Neaspilota,cf. viridescens,11.X.1998,1998-10-11,1998,Diptera
23T747,G9,CDFA_P5,Diptera (Brachycera),Tephritidae,Paraterellia,immaculata,31.VII.2010,2010-07-31,2010,Diptera
23T759,H9,CDFA_P5,Diptera (Brachycera),Tephritidae,Procecidochares,sp.,03.IX.2006,2006-09-03,2006,Diptera
23T676,A10,CDFA_P5,Diptera (Brachycera),Tephritidae,Campiglossa,farinata,29.VI.2016,2016-06-29,2016,Diptera
23T688,B10,CDFA_P5,Diptera (Brachycera),Tephritidae,Campiglossa,pygmaea,05.VI.2016,2016-06-05,2016,Diptera
23T700,C10,CDFA_P5,Diptera (Brachycera),Tephritidae,Campiglossa,sp.,01.VII.2016,2016-07-01,2016,Diptera
23T712,D10,CDFA_P5,Diptera (Brachycera),Tephritidae,Euaresta,aequalis,13.VIII.2004,2004-08-13,2004,Diptera
23T724,E10,CDFA_P5,Diptera (Brachycera),Tephritidae,Eutreta,angusta,15.VIII.1983,1983-08-15,1983,Diptera
23T736,F10,CDFA_P5,Diptera (Brachycera),Tephritidae,Neaspilota,cf. viridescens,15.VIII.1987,1987-08-15,1987,Diptera
23T748,G10,CDFA_P5,Diptera (Brachycera),Tephritidae,Paraterellia,varipennis,27.VIII.1992,1992-08-27,1992,Diptera
23T760,H10,CDFA_P5,Diptera (Brachycera),Tephritidae,Procecidochares,sp.,08.VI.2006,2006-06-08,2006,Diptera
23T677,A11,CDFA_P5,Diptera (Brachycera),Tephritidae,Campiglossa,farinata,29.VI.2016,2016-06-29,2016,Diptera
23T689,B11,CDFA_P5,Diptera (Brachycera),Tephritidae,Campiglossa,pygmaea,05.VI.2016,2016-06-05,2016,Diptera
23T701,C11,CDFA_P5,Diptera (Brachycera),Tephritidae,Campiglossa,sp.,01.VII.2016,2016-07-01,2016,Diptera
23T713,D11,CDFA_P5,Diptera (Brachycera),Tephritidae,Euaresta,aequalis,01.X.2005,2005-10-01,2005,Diptera
23T725,E11,CDFA_P5,Diptera (Brachycera),Tephritidae,Eutreta,angusta,I.2020,NA,NA,Diptera
23T737,F11,CDFA_P5,Diptera (Brachycera),Tephritidae,Neaspilota,signifera,18.IV.2003,2003-04-18,2003,Diptera
23T749,G11,CDFA_P5,Diptera (Brachycera),Tephritidae,Plaumannimyia,flava,03.X.2014,2014-10-03,2014,Diptera
23T761,H11,CDFA_P5,Diptera (Brachycera),Tephritidae,Procecidocharoides,flavissimus,05.VI.2016,2016-06-05,2016,Diptera
23T678,A12,CDFA_P5,Diptera (Brachycera),Tephritidae,Campiglossa,farinata,28.VI.2016,2016-06-28,2016,Diptera
23T690,B12,CDFA_P5,Diptera (Brachycera),Tephritidae,Campiglossa,pygmaea,05.VI.2016,2016-06-05,2016,Diptera
23T702,C12,CDFA_P5,Diptera (Brachycera),Tephritidae,Campiglossa,sp.,01.VII.2016,2016-07-01,2016,Diptera
23T714,D12,CDFA_P5,Diptera (Brachycera),Tephritidae,Euaresta,aequalis,16.IX.2005,2005-09-16,2005,Diptera
23T726,E12,CDFA_P5,Diptera (Brachycera),Tephritidae,Eutreta,fenestrata,29.VI.2016,2016-06-29,2016,Diptera
23T738,F12,CDFA_P5,Diptera (Brachycera),Tephritidae,Neaspilota,cf. signifera,18.VIII.1983,1983-08-18,1983,Diptera
23T750,G12,CDFA_P5,Diptera (Brachycera),Tephritidae,Plaumannimyia,flava,03.IX.1989,1989-09-03,1989,Diptera
23T762,H12,CDFA_P5,Diptera (Brachycera),Tephritidae,Procecidocharoides,flavissimus,30.VI.2016,2016-06-30,2016,Diptera
CASENT9131862,A1,CAS_P34,Diptera,Tabanidae,Tabanus,sp.,9/24/05,2005-09-24,2005,Diptera
CASENT9132738,B1,CAS_P34,Plecoptera,Pteronarcyidae,Pteronarcys,princeps,8/24/82,1982-08-24,1982,Plecoptera
CASENT9132880,C1,CAS_P34,NA,NA,NA,NA,NA,NA,NA,NA
CASENT9132325,D1,CAS_P34,Ephemeroptera,Isonychiidae,Isonychia,velma,10/1/14,2014-10-01,2014,Ephemeroptera
CASENT9131660,E1,CAS_P34,Plecoptera,Perlidae,Calineuria,californica,3/23/82,1982-03-23,1982,Plecoptera
CASENT9132402,F1,CAS_P34,NA,NA,Ischnura,sp.,NA,NA,NA,NA
CASENT9132499,G1,CAS_P34,Trichoptera,Limnephilidae,Lenarchus,sp.,NA,NA,NA,Trichoptera
CASENT9132704,H1,CAS_P34,Trichoptera,Rhyacophilidae,Rhyacophila,vedra,4/8/15,2015-04-08,2015,Trichoptera
CASENT9132305,A2,CAS_P34,Megaloptera,Corydalidae,Neohermes,sp.,4/8/15,2015-04-08,2015,Megaloptera
CASENT9131491,B2,CAS_P34,Trichoptera,Limnephilidae,Halesochila,taylori,3/27/17,2017-03-27,2017,Trichoptera
CASENT9132304,C2,CAS_P34,Odonata,Aeshnidae,Aeshna,sp.,8/24/82,1982-08-24,1982,Odonata
CASENT9132773,D2,CAS_P34,Diptera,Tipulidae,Tipula,sp.,5/11/11,2011-05-11,2011,Diptera
CASENT9132342,E2,CAS_P34,Trichoptera,Calamoceratidae,Heteroplectron,californicum,9/30/16,2016-09-30,2016,Trichoptera
CASENT9131851,F2,CAS_P34,Diptera,Limoniidae,Hexatoma,sp.,9/30/16,2016-09-30,2016,Diptera
CASENT9132349,G2,CAS_P34,Diptera,Limoniidae,Hexatoma,sp.,9/30/16,2016-09-30,2016,Diptera
CASENT9131460,H2,CAS_P34,Trichoptera,Rhyacophilidae,Rhyacophila,sp.,9/30/16,2016-09-30,2016,Trichoptera
CASENT9132856,A3,CAS_P34,Diptera,Limoniidae,Hexatoma,sp.,9/30/16,2016-09-30,2016,Diptera
CASENT9131583,B3,CAS_P34,Plecoptera,Perlidae,Calineuria,californica,9/30/16,2016-09-30,2016,Plecoptera
CASENT9132545,C3,CAS_P34,Trichoptera,Limnephilidae,Limnephilus,sp.,8/27/06,2006-08-27,2006,Trichoptera
CASENT9132458,D3,CAS_P34,Megaloptera,Corydalidae,Orohermes,crepusculus,7/14/13,2013-07-14,2013,Megaloptera
CASENT9132557,E3,CAS_P34,Trichoptera,Limnephilidae,Psychoglypha,sp.,7/14/13,2013-07-14,2013,Trichoptera
CASENT9131986,F3,CAS_P34,Trichoptera,Limnephilidae,Halesochila,taylori,4/30/10,2010-04-30,2010,Trichoptera
CASENT9131597,G3,CAS_P34,Plecoptera,Perlidae,Calineuria,californica,8/6/13,2013-08-06,2013,Plecoptera
CASENT9132628,H3,CAS_P34,Plecoptera,Perlidae,Hesperoperla,hoguei,4/23/14,2014-04-23,2014,Plecoptera
CASENT9132408,A4,CAS_P34,Trichoptera,Limnephilidae,Onocosmoecus,sp.,4/19/05,2005-04-19,2005,Trichoptera
CASENT9131468,B4,CAS_P34,Trichoptera,Rhyacophilidae,Rhyacophila,sp.,6/12/05,2005-06-12,2005,Trichoptera
CASENT9131858,C4,CAS_P34,Odonata,Cordulegastridae,Cordulegaster,dorsalis,6/12/05,2005-06-12,2005,Odonata
CASENT9132337,D4,CAS_P34,Plecoptera,Perlidae,Calineuria,californica,2/17/08,2008-02-17,2008,Plecoptera
CASENT9131493,E4,CAS_P34,Plecoptera,Perlidae,Calineuria,californica,6/12/05,2005-06-12,2005,Plecoptera
CASENT9132950,F4,CAS_P34,Plecoptera,Perlidae,Calineuria,californica,2/17/08,2008-02-17,2008,Plecoptera
CASENT9132331,G4,CAS_P34,Diptera,Limoniidae,Hexatoma,sp.,7/25/97,1997-07-25,1997,Diptera
CASENT9131665,H4,CAS_P34,Odonata,Aeshnidae,Aeshna,sp.,11/3/95,1995-11-03,1995,Odonata
CASENT9132279,A5,CAS_P34,NA,Kathroperlidae,Kathroperla,sp.,7/2/05,2005-07-02,2005,NA
CASENT9132912,B5,CAS_P34,NA,Kathroperlidae,Kathroperla,takhoma,3/26/08,2008-03-26,2008,NA
CASENT9131852,C5,CAS_P34,Odonata,Calopterygidae,Hetaerina,americana,10/31/97,1997-10-31,1997,Odonata
CASENT9130978,D5,CAS_P34,Megaloptera,Corydalidae,Neohermes,filicornis,3/3/08,2008-03-03,2008,Megaloptera
CASENT9130866,E5,CAS_P34,Plecoptera,Perlodidae,Skwala,sp.,2/17/08,2008-02-17,2008,Plecoptera
CASENT9131716,F5,CAS_P34,Plecoptera,Perlidae,Doroneuria,baumanni,2/17/08,2008-02-17,2008,Plecoptera
CASENT9132686,G5,CAS_P34,Trichoptera,Rhyacophilidae,Rhyacophila,sp.,7/25/97,1997-07-25,1997,Trichoptera
CASENT9130788,H5,CAS_P34,Odonata,Coenagrionidae,Argia,vivida,NA,NA,NA,Odonata
CASENT9132353,A6,CAS_P34,Trichoptera,Rhyacophilidae,Rhyacophila,sp.,NA,NA,NA,Trichoptera
CASENT9131826,B6,CAS_P34,NA,Kathroperlidae,Kathroperla,takhoma,4/17/14,2014-04-17,2014,NA
CASENT9130457,C6,CAS_P34,Plecoptera,Perlidae,Calineuria,californica,7/13/13,2013-07-13,2013,Plecoptera
CASENT9132372,D6,CAS_P34,Ephemeroptera,Ephemerellidae,Drunella,grandis,4/19/05,2005-04-19,2005,Ephemeroptera
CASENT9132674,E6,CAS_P34,Trichoptera,Limnephilidae,Dicosmoecus,gilvipes,5/27/07,2007-05-27,2007,Trichoptera
CASENT9132329,F6,CAS_P34,Trichoptera,Rhyacophilidae,Rhyacophila,sp.,5/13/06,2006-05-13,2006,Trichoptera
CASENT9131680,G6,CAS_P34,Plecoptera,Perlidae,Calineuria,californica,9/7/08,2008-09-07,2008,Plecoptera
CASENT9121563,H6,CAS_P34,Diptera,Limoniidae,Hexatoma,sp.,9/1/04,2004-09-01,2004,Diptera
CASENT9131515,A7,CAS_P34,Trichoptera,Rhyacophilidae,Rhyacophila,vocala,3/11/05,2005-03-11,2005,Trichoptera
CASENT9125114,B7,CAS_P34,Odonata,Gomphidae,Octogomphus,specularis,2/16/08,2008-02-16,2008,Odonata
CASENT9132494,C7,CAS_P34,Megaloptera,Corydalidae,Orohermes,crepusculus,2/16/08,2008-02-16,2008,Megaloptera
CASENT9131798,D7,CAS_P34,Plecoptera,Perlidae,Calineuria,californica,NA,NA,NA,Plecoptera
CASENT9131783,E7,CAS_P34,Megaloptera,Corydalidae,Orohermes,crepusculus,9/3/04,2004-09-03,2004,Megaloptera
CASENT9125099,F7,CAS_P34,Plecoptera,Pteronarcyidae,Pteronarcys,sp.,2/16/08,2008-02-16,2008,Plecoptera
CASENT9132265,G7,CAS_P34,Trichoptera,Hydropsychidae,Arctopsyche,sp.,9/3/04,2004-09-03,2004,Trichoptera
CASENT9132842,H7,CAS_P34,Trichoptera,Rhyacophilidae,Rhyacophila,sp.,11/6/04,2004-11-06,2004,Trichoptera
CASENT9132239,A8,CAS_P34,Coleoptera,Dytiscidae,Cybister,explanatus,8/11/04,2004-08-11,2004,Coleoptera
CASENT9132782,B8,CAS_P34,Trichoptera,Philopotamidae,Dolophilodes,sp.,9/3/04,2004-09-03,2004,Trichoptera
CASENT9131883,C8,CAS_P34,Plecoptera,Perlodidae,Oroperla,barbara,9/3/04,2004-09-03,2004,Plecoptera
CASENT9123866,D8,CAS_P34,NA,one removed for CAIBI 2023 DNA,Hydatophylax,hesperus,9/8/08,2008-09-08,2008,NA
CASENT9123866,D8,CAS_P34,Trichoptera,Limnephilidae,Hydatophylax,Hydatophylax hesperus,2008-09-08,2008-09-08,2008,Trichoptera
CASENT9121532,F8,CAS_P34,Diptera,Limoniidae,Hexatoma,sp.,11/6/04,2004-11-06,2004,Diptera
CASENT9132934,G8,CAS_P34,Trichoptera,Limnephilidae,Hydatophylax,hesperus,9/8/08,2008-09-08,2008,Trichoptera
CASENT9132428,H8,CAS_P34,Ephemeroptera,Ameletidae,Ameletus,sp.,2/16/08,2008-02-16,2008,Ephemeroptera
CASENT9132744,A9,CAS_P34,Plecoptera,Perlidae,Claassenia,sabulosa,9/3/04,2004-09-03,2004,Plecoptera
CASENT9131860,B9,CAS_P34,Plecoptera,Perlidae,Hesperoperla,pacifica,9/4/04,2004-09-04,2004,Plecoptera
CASENT9132439,C9,CAS_P34,Plecoptera,Perlidae,Calineuria,californica,9/1/04,2004-09-01,2004,Plecoptera
CASENT9132048,D9,CAS_P34,Trichoptera,Limnephilidae,Psychoglypha,sp.,8/11/04,2004-08-11,2004,Trichoptera
CASENT9131510,E9,CAS_P34,Ephemeroptera,Ephemerellidae,Timpanoga,hecuba,9/11/04,2004-09-11,2004,Ephemeroptera
CASENT9130099,F9,CAS_P34,Plecoptera,Perlidae,Calineuria,californica,2/16/08,2008-02-16,2008,Plecoptera
CASENT9121584,G9,CAS_P34,Trichoptera,Rhyacophilidae,Rhyacophila,sp.,NA,NA,NA,Trichoptera
CASENT9132917,H9,CAS_P34,Trichoptera,Hydropsychidae,Arctopsyche,sp.,9/3/04,2004-09-03,2004,Trichoptera
CASENT9132173,A10,CAS_P34,Ephemeroptera,Isonychiidae,Isonychia,velma,9/1/04,2004-09-01,2004,Ephemeroptera
CASENT9130530,B10,CAS_P34,Odonata,Coenagrionidae,Argia,sp.,9/1/04,2004-09-01,2004,Odonata
CASENT9121577,C10,CAS_P34,Megaloptera,Corydalidae,Orohermes,crepusculus,10/11/04,2004-10-11,2004,Megaloptera
CASENT9125088,D10,CAS_P34,Coleoptera,Dytiscidae,Dytiscus,marginicollis,2/9/04,2004-02-09,2004,Coleoptera
CASENT9130232,E10,CAS_P34,Diptera,Limoniidae,Hexatoma,sp.,9/11/04,2004-09-11,2004,Diptera
CASENT9131454,F10,CAS_P34,Plecoptera,Perlodidae,Oroperla,barbara,9/11/04,2004-09-11,2004,Plecoptera
CASENT9131502,G10,CAS_P34,Plecoptera,Perlidae,Doroneuria,baumanni,9/11/04,2004-09-11,2004,Plecoptera
CASENT9132273,H10,CAS_P34,Plecoptera,Pteronarcyidae,Pteronarcys,princeps,9/11/04,2004-09-11,2004,Plecoptera
CASENT9121543,A11,CAS_P34,Diptera,Limoniidae,Hexatoma,sp.,9/11/04,2004-09-11,2004,Diptera
CASENT9132846,B11,CAS_P34,Diptera,Limoniidae,Hexatoma,sp.,9/11/04,2004-09-11,2004,Diptera
CASENT9121559,D11,CAS_P34,Megaloptera,Corydalidae,Neohermes,sp.,3/11/05,2005-03-11,2005,Megaloptera
CASENT9132505,E11,CAS_P34,Plecoptera,Perlidae,Hesperoperla,pacifica,11/10/03,2003-11-10,2003,Plecoptera
CASENT9132083,F11,CAS_P34,Plecoptera,Perlidae,Calineuria,californica,11/10/03,2003-11-10,2003,Plecoptera
CASENT9121666,G11,CAS_P34,Diptera,Limoniidae,Hexatoma,sp.,11/9/03,2003-11-09,2003,Diptera
CASENT9132300,H11,CAS_P34,Plecoptera,Perlidae,Calineuria,californica,11/9/03,2003-11-09,2003,Plecoptera
CASENT9132401,A12,CAS_P34,Plecoptera,Perlidae,Hesperoperla,pacifica,11/9/03,2003-11-09,2003,Plecoptera
CASENT9121662,B12,CAS_P34,Coleoptera,Dytiscidae,Colymbetes,sp.,5/31/03,2003-05-31,2003,Coleoptera
CASENT9132112,C12,CAS_P34,Coleoptera,Dytiscidae,Colymbetes,sp.,5/30/03,2003-05-30,2003,Coleoptera
CASENT9121644,D12,CAS_P34,Coleoptera,Hydrophilidae,Hydrochara,rickseckeri,3/20/03,2003-03-20,2003,Coleoptera
CASENT9131873,E12,CAS_P34,Hemiptera,Corixidae,Sigara,mckinstyri,9/30/82,1982-09-30,1982,Hemiptera
CASENT9131873,E12,CAS_P34,Trichoptera,Limnephilidae,Limnephilus,sp.,3/30/03,2003-03-30,2003,Trichoptera
CASENT9121658,F12,CAS_P34,Coleoptera,Dytiscidae,Dytiscus,marginicollis,3/12/03,2003-03-12,2003,Coleoptera
CASENT9132806,A1,CAS_P35,Coleoptera,Hydrophilidae,Berosus,punctatissimus,2/23/17,2017-02-23,2017,Coleoptera
CASENT9132632,C1,CAS_P35,Hemiptera,Corixidae,Sigara,mckinstryi,NA,NA,NA,Hemiptera
CASENT9131673,D1,CAS_P35,Coleoptera,Dytiscidae,NA,NA,9/30/16,2016-09-30,2016,Coleoptera
CASENT9132106,E1,CAS_P35,Coleoptera,Elmidae,Optioservus,quadrimaculatus,9/30/16,2016-09-30,2016,Coleoptera
CASENT9132285,F1,CAS_P35,Coleoptera,Elmidae,Narpus,concolor,9/30/16,2016-09-30,2016,Coleoptera
CASENT9132747,G1,CAS_P35,Trichoptera,Sericostomatidae,Gumaga,griseola,9/30/16,2016-09-30,2016,Trichoptera
CASENT9131824,H1,CAS_P35,Plecoptera,Peltoperlidae,Yoraperla,nigrisoma,9/30/16,2016-09-30,2016,Plecoptera
CASENT9132667,A2,CAS_P35,Coleoptera,Elmidae,Optioservus,quadrimaculatus,7/14/13,2013-07-14,2013,Coleoptera
CASENT9131748,B2,CAS_P35,Coleoptera,Elmidae,Zaitzevia,parvula,7/14/13,2013-07-14,2013,Coleoptera
CASENT9132474,C2,CAS_P35,Coleoptera,Elmidae,Optioservus,quadrimaculatus,7/14/13,2013-07-14,2013,Coleoptera
CASENT9132170,D2,CAS_P35,Coleoptera,Dytiscidae,Oreodytes,picturatus,7/14/13,2013-07-14,2013,Coleoptera
CASENT9132872,E2,CAS_P35,Coleoptera,Dytiscidae,Stictotarsus,deceptus,7/14/13,2013-07-14,2013,Coleoptera
CASENT9131937,F2,CAS_P35,Coleoptera,Elmidae,Optioservus,quadrimaculatus,8/6/13,2013-08-06,2013,Coleoptera
CASENT9125082,G2,CAS_P35,Coleoptera,Dytiscidae,Rhantus,sp.,2/9/04,2004-02-09,2004,Coleoptera
CASENT9125089,H2,CAS_P35,Coleoptera,Dytiscidae,Liodessus,sp.,2/9/04,2004-02-09,2004,Coleoptera
CASENT9121565,A3,CAS_P35,Coleoptera,Elmidae,Optioservus,quadrimaculatus,9/4/04,2004-09-04,2004,Coleoptera
CASENT9132819,B3,CAS_P35,Hemiptera,Macroveliidae,Macrovelia,hornii,6/17/05,2005-06-17,2005,Hemiptera
CASENT9130988,C3,CAS_P35,Coleoptera,Scirtidae,Elodes,sp.,6/17/05,2005-06-17,2005,Coleoptera
CASENT9132726,D3,CAS_P35,Coleoptera,Dytiscidae,Liodessus,sp.,8/14/96,1996-08-14,1996,Coleoptera
CASENT9130315,E3,CAS_P35,Hemiptera,Corixidae,Sigara,mckinstryi,11/3/95,1995-11-03,1995,Hemiptera
CASENT9131315,F3,CAS_P35,Coleoptera,Elmidae,Optioservus,quadrimaculatus,4/29/07,2007-04-29,2007,Coleoptera
CASENT9132246,G3,CAS_P35,Coleoptera,Dryopidae,Helichus,suturalis,8/14/96,1996-08-14,1996,Coleoptera
CASENT9131780,H3,CAS_P35,Coleoptera,Elmidae,Optioservus,quadrimaculatus,3/5/08,2008-03-05,2008,Coleoptera
CASENT9131871,A4,CAS_P35,Coleoptera,Elmidae,Heterlimnius,koebelei,8/28/06,2006-08-28,2006,Coleoptera
CASENT9130375,B4,CAS_P35,Hemiptera,Corixidae,Sigara,mckinstryi,7/13/13,2013-07-13,2013,Hemiptera
CASENT9131067,C4,CAS_P35,Coleoptera,Dytiscidae,Stictotarsus,deceptus,8/6/13,2013-08-06,2013,Coleoptera
CASENT9130410,D4,CAS_P35,Coleoptera,Haliplidae,Peltodytes,callosus,9/12/95,1995-09-12,1995,Coleoptera
CASENT9130113,E4,CAS_P35,Hemiptera,Corixidae,Sigara,mckinstryi,11/3/95,1995-11-03,1995,Hemiptera
CASENT9132897,F4,CAS_P35,Hemiptera,Veliidae,Microvelia,californiensis,11/3/95,1995-11-03,1995,Hemiptera
CASENT9130164,G4,CAS_P35,Coleoptera,Elmidae,Optioservus,quadrimculatus,7/25/97,1997-07-25,1997,Coleoptera
CASENT9132974,H4,CAS_P35,Hemiptera,Veliidae,Microvelia,californiensis,7/25/97,1997-07-25,1997,Hemiptera
CASENT9132287,A5,CAS_P35,Coleoptera,Dryopidae,Helichus,suturalis,7/25/97,1997-07-25,1997,Coleoptera
CASENT9130397,B5,CAS_P35,Coleoptera,Dryopidae,Helichus,sp.,3/6/08,2008-03-06,2008,Coleoptera
CASENT9121608,C5,CAS_P35,Coleoptera,Dytiscidae,Oreodytes,crassulus,9/3/04,2004-09-03,2004,Coleoptera
CASENT9131281,D5,CAS_P35,Hemiptera,Veliidae,Microvelia,californiensis,6/12/05,2005-06-12,2005,Hemiptera
CASENT9131071,E5,CAS_P35,Trichoptera,Leptoceridae,Oecetis,sp.,7/25/97,1997-07-25,1997,Trichoptera
CASENT9132672,F5,CAS_P35,Coleoptera,Elmidae,Zaitzevia,parvula,6/12/05,2005-06-12,2005,Coleoptera
CASENT9130311,G5,CAS_P35,Trichoptera,Odontoceridae,Marilia,flexuosa,5/14/06,2006-05-14,2006,Trichoptera
CASENT9131579,H5,CAS_P35,Coleoptera,Elmidae,Heterlimnius,koebelei,4/18/05,2005-04-18,2005,Coleoptera
CASENT9130310,A6,CAS_P35,Coleoptera,Elmidae,Optioservus,quadrimaculatus,9/4/04,2004-09-04,2004,Coleoptera
CASENT9131018,B6,CAS_P35,Coleoptera,Elmidae,Zaitzevia,parvula,9/4/04,2004-09-04,2004,Coleoptera
CASENT9131065,C6,CAS_P35,Hemiptera,Veliidae,Rhagovelia,distincta,8/6/04,2004-08-06,2004,Hemiptera
CASENT9132251,D6,CAS_P35,Coleoptera,Elmidae,Zaitzevia,parvula,9/3/04,2004-09-03,2004,Coleoptera
CASENT9132698,E6,CAS_P35,Coleoptera,Elmidae,Optioservus,quadrimaculatus,9/3/04,2004-09-03,2004,Coleoptera
CASENT9132919,F6,CAS_P35,Hemiptera,Notonectidae,Buenoa,scimitra,8/11/04,2004-08-11,2004,Hemiptera
CASENT9132310,G6,CAS_P35,Coleoptera,Haliplidae,Peltodytes,callosus,8/11/04,2004-08-11,2004,Coleoptera
CASENT9121601,H6,CAS_P35,Coleoptera,Elmidae,Narpus,concolor,9/3/04,2004-09-03,2004,Coleoptera
CASENT9132941,A7,CAS_P35,Coleoptera,Psephenidae,Psephenus,sp.,9/25/1983,2019-09-25,2019,Coleoptera
CASENT9132878,B7,CAS_P35,Coleoptera,Elmidae,Optioservus,quadrimaculatus,9/3/04,2004-09-03,2004,Coleoptera
CASENT9131197,C7,CAS_P35,Coleoptera,Elmidae,Optioservus,quadrimaculatus,9/3/04,2004-09-03,2004,Coleoptera
CASENT9121617,D7,CAS_P35,Coleoptera,Haliplidae,Haliplus,sp.,8/11/04,2004-08-11,2004,Coleoptera
CASENT9132766,E7,CAS_P35,Coleoptera,Elmidae,Zaitzevia,parvula,9/3/04,2004-09-03,2004,Coleoptera
CASENT9121618,F7,CAS_P35,Coleoptera,Haliplidae,Peltodytes,callosus,8/11/04,2004-08-11,2004,Coleoptera
CASENT9130116,G7,CAS_P35,Coleoptera,Elmidae,Heterlimnius,corpulentus,9/3/04,2004-09-03,2004,Coleoptera
CASENT9132281,H7,CAS_P35,Hemiptera,Veliidae,Rhagovelia,distincta,9/1/04,2004-09-01,2004,Hemiptera
CASENT9121623,A8,CAS_P35,Coleoptera,Dytiscidae,Laccophilus,maculosus,8/11/04,2004-08-11,2004,Coleoptera
CASENT9131777,B8,CAS_P35,Coleoptera,Dytiscidae,Laccophilus,maculosus,8/11/04,2004-08-11,2004,Coleoptera
CASENT9121628,C8,CAS_P35,Hemiptera,Corixidae,Corisella,inscripta,8/11/04,2004-08-11,2004,Hemiptera
CASENT9131611,D8,CAS_P35,Plecoptera,Peltoperlidae,Yoraperla,sp.,4/19/05,2005-04-19,2005,Plecoptera
CASENT9131924,E8,CAS_P35,Coleoptera,Elmidae,Zaitzevia,parvula,6/12/14,2014-06-12,2014,Coleoptera
CASENT9132180,F8,CAS_P35,Coleoptera,Elmidae,Optioservus,quadrimaculatus,4/16/08,2008-04-16,2008,Coleoptera
CASENT9123768,G8,CAS_P35,Coleoptera,Elmidae,Ordobrevia,nubifera,4/16/08,2008-04-16,2008,Coleoptera
CASENT9123768,G8,CAS_P35,Coleoptera,Elmidae,Ordobrevia,Ordobrevia nubifer,2008-04-16,2008-04-16,2008,Coleoptera
CASENT9130515,H8,CAS_P35,Coleoptera,Elmidae,Zaitzevia,parvula,4/16/08,2008-04-16,2008,Coleoptera
CASENT9123767,A9,CAS_P35,Coleoptera,Dytiscidae,Oreodytes,rhyacophilus,4/16/08,2008-04-16,2008,Coleoptera
CASENT9123767,A9,CAS_P35,Coleoptera,Dytiscidae,Nectoporus,Nectoporus rhyacophilus,2008-04-16,2008-04-16,2008,Coleoptera
CASENT9132088,B9,CAS_P35,Coleoptera,Dryopidae,Helichus,columbianus,8/8/08,2008-08-08,2008,Coleoptera
CASENT9123842,C9,CAS_P35,Coleoptera,Elmidae,Zaitzevia,parvula,9/9/08,2008-09-09,2008,Coleoptera
CASENT9123842,C9,CAS_P35,Coleoptera,Elmidae,Zaitzevia,Zaitzevia parvula,2008-09-09,2008-09-09,2008,Coleoptera
CASENT9123822,D9,CAS_P35,Coleoptera,Elmidae,Ordobrevia,nubifera,9/9/08,2008-09-09,2008,Coleoptera
CASENT9123822,D9,CAS_P35,Coleoptera,Elmidae,Ordobrevia,Ordobrevia nubifer,2008-09-09,2008-09-09,2008,Coleoptera
CASENT9132321,E9,CAS_P35,Coleoptera,Elmidae,Optioservus,quadrimaculatus,9/9/08,2008-09-09,2008,Coleoptera
CASENT9123814,F9,CAS_P35,Coleoptera,Elmidae,Heterlimnius,koebelei,9/9/08,2008-09-09,2008,Coleoptera
CASENT9123814,F9,CAS_P35,Coleoptera,Elmidae,Heterlimnius,Heterlimnius corpulentus,2008-09-09,2008-09-09,2008,Coleoptera
CASENT9132938,G9,CAS_P35,Coleoptera,Elmidae,Optioservus,quadrimaculatus,6/12/14,2014-06-12,2014,Coleoptera
CASENT9130987,H9,CAS_P35,Coleoptera,Elmidae,Zaitzevia,parvula,4/22/14,2014-04-22,2014,Coleoptera
CASENT9132820,A10,CAS_P35,Coleoptera,Hydrophilidae,Helophorus,sp.,6/12/14,2014-06-12,2014,Coleoptera
CASENT9131046,B10,CAS_P35,Coleoptera,Elmidae,Narpus,angustus,6/12/14,2014-06-12,2014,Coleoptera
CASENT9132344,C10,CAS_P35,Coleoptera,Elmidae,Ordobrevia,nubifera,4/22/14,2014-04-22,2014,Coleoptera
CASENT9132252,D10,CAS_P35,Coleoptera,Elmidae,Optioservus,quadrimaculatus,4/22/14,2014-04-22,2014,Coleoptera
CASENT9132465,E10,CAS_P35,Coleoptera,Elmidae,Narpus,angustus,8/8/08,2008-08-08,2008,Coleoptera
CASENT9132813,F10,CAS_P35,Coleoptera,Elmidae,Optioservus,quadrimaculatus,8/8/08,2008-08-08,2008,Coleoptera
CASENT9123796,G10,CAS_P35,Coleoptera,Hydrophilidae,Ametor,scabrosus,8/8/08,2008-08-08,2008,Coleoptera
CASENT9123796,G10,CAS_P35,Coleoptera,Hydrophilidae,Ametor,Ametor scabrosus,2008-08-08,2008-08-08,2008,Coleoptera
CASENT9132763,H10,CAS_P35,Hemiptera,Corixidae,Corisella,inscripta,12/27/13,2013-12-27,2013,Hemiptera
CASENT9132243,A11,CAS_P35,Coleoptera,Dytiscidae,Stictotarsus,striatellus,12/27/13,2013-12-27,2013,Coleoptera
CASENT9131747,B11,CAS_P35,Hemiptera,Corixidae,Trichocorixa,calva,12/27/13,2013-12-27,2013,Hemiptera
CASENT9132743,C11,CAS_P35,Coleoptera,Dytiscidae,Stictotarsus,striatellus,12/23/13,2013-12-23,2013,Coleoptera
CASENT9131925,D11,CAS_P35,Hemiptera,Corixidae,Trichocorixa,calva,12/27/13,2013-12-27,2013,Hemiptera
CASENT9132779,E11,CAS_P35,Coleoptera,Psephenidae,Acneus,quadrimaculatus,5/23/14,2014-05-23,2014,Coleoptera
CASENT9132818,F11,CAS_P35,Coleoptera,Dytiscidae,Oreodytes,crassulus,8/8/08,2008-08-08,2008,Coleoptera
CASENT9132922,G11,CAS_P35,Coleoptera,Dytiscidae,Oreodytes,rhyacophilus,8/8/08,2008-08-08,2008,Coleoptera
CASENT9123798,H11,CAS_P35,Coleoptera,Elmidae,Zaitzevia,parvula,8/8/08,2008-08-08,2008,Coleoptera
CASENT9123798,H11,CAS_P35,Coleoptera,Elmidae,Zaitzevia,Zaitzevia parvula,2008-08-08,2008-08-08,2008,Coleoptera
CASENT9131743,A12,CAS_P35,Coleoptera,Haliplidae,Peltodytes,simplex,12/27/13,2013-12-27,2013,Coleoptera
CASENT9132104,B12,CAS_P35,Coleoptera,Dytiscidae,Neoclypeodytes,leechi,12/27/13,2013-12-27,2013,Coleoptera
CASENT9132072,C12,CAS_P35,Coleoptera,Hydrophilidae,Berosus,metalliceps,12/27/13,2013-12-27,2013,Coleoptera
CASENT9132551,D12,CAS_P35,Coleoptera,Dytiscidae,Stictotarsus,striatellus,12/27/13,2013-12-27,2013,Coleoptera
CASENT9132115,E12,CAS_P35,Coleoptera,Dytiscidae,Uvarus,subtilis,12/27/13,2013-12-27,2013,Coleoptera
CASENT9131936,F12,CAS_P35,Coleoptera,Dytiscidae,Neoclypeodytes,leachi,12/23/13,2013-12-23,2013,Coleoptera
23U227,A1,CDFA_P8,Hemiptera (Heteroptera),Hebridae,Hebrus,sp.,26.III.1987,1987-03-26,1987,Hemiptera
23U228,B1,CDFA_P8,Hemiptera (Heteroptera),Hebridae,Merragata,hebroides,22.VI.1983,1983-06-22,1983,Hemiptera
23U229,C1,CDFA_P8,Hemiptera (Heteroptera),Macroveliidae,Macrovelia,hornii,17.V.1996,1996-05-17,1996,Hemiptera
23U230,D1,CDFA_P8,Hemiptera (Heteroptera),Macroveliidae,Macrovelia,hornii,31.V.2006,2006-05-31,2006,Hemiptera
23U231,E1,CDFA_P8,Hemiptera (Heteroptera),Gelastocoridae,Gelastocoris,oculatus,30.VII.1983,1983-07-30,1983,Hemiptera
23U232,F1,CDFA_P8,Hemiptera (Heteroptera),Gelastocoridae,Gelastocoris,oculatus,26.III.1987,1987-03-26,1987,Hemiptera
23U233,G1,CDFA_P8,Hemiptera (Heteroptera),Gelastocoridae,Nerthra,martini,17.IV.2013,2013-04-17,2013,Hemiptera
23U234,H1,CDFA_P8,Hemiptera (Heteroptera),Gerridae,Aquarius,remigis,02.V.2010,2010-05-02,2010,Hemiptera
23U235,A2,CDFA_P8,Hemiptera (Heteroptera),Notonectidae,Buenoa,scimitra,26.III.1987,1987-03-26,1987,Hemiptera
23U236,B2,CDFA_P8,Hemiptera (Heteroptera),Notonectidae,Notonecta,shooteri,26.III.1987,1987-03-26,1987,Hemiptera
23U237,C2,CDFA_P8,Hemiptera (Heteroptera),Notonectidae,Notonecta,lobata,16.IV.1985,1985-04-16,1985,Hemiptera
23U238,D2,CDFA_P8,Hemiptera (Heteroptera),Notonectidae,Notonecta,kirbyi,14.VII.1989,1989-07-14,1989,Hemiptera
23U239,E2,CDFA_P8,Hemiptera (Heteroptera),Notonectidae,Notonecta,unifasciata,26.III.1987,1987-03-26,1987,Hemiptera
23U240,F2,CDFA_P8,Hemiptera (Heteroptera),Belostomatidae,Abedus,indentatus,16.V.1987,1987-05-16,1987,Hemiptera
23U241,G2,CDFA_P8,Hemiptera (Heteroptera),Belostomatidae,Belostoma,bakeri,08.XI.1980,1980-11-08,1980,Hemiptera
23U242,H2,CDFA_P8,Hemiptera (Heteroptera),Belostomatidae,Belostoma,flumineum,21.VIII.1980,1980-08-21,1980,Hemiptera
23U243,A3,CDFA_P8,Hemiptera (Heteroptera),Belostomatidae,Lethocerus,americanus,22.IX.2011,2011-09-22,2011,Hemiptera
23U244,B3,CDFA_P8,Hemiptera (Heteroptera),Corixidae,Cenocorixa,wileyae,01.VII.1987,1987-07-01,1987,Hemiptera
23U245,C3,CDFA_P8,Hemiptera (Heteroptera),Corixidae,Cenocorixa,wileyae,05.IX.1996,1996-09-05,1996,Hemiptera
23U246,D3,CDFA_P8,Hemiptera (Heteroptera),Corixidae,Sigara,washingtonensis,25.III.1987,1987-03-25,1987,Hemiptera
23U247,E3,CDFA_P8,Hemiptera (Heteroptera),Corixidae,Hesperocorixa,laevigata,25.III.1987,1987-03-25,1987,Hemiptera
23U248,F3,CDFA_P8,Hemiptera (Heteroptera),Corixidae,Hesperocorixa,laevigata,25.III.1987,1987-03-25,1987,Hemiptera
23U249,G3,CDFA_P8,Hemiptera (Heteroptera),Corixidae,Sigara,mckinstryi,26.III.1987,1987-03-26,1987,Hemiptera
23U250,H3,CDFA_P8,Hemiptera (Heteroptera),Corixidae,Corisella,decolor,15.IV.1987,1987-04-15,1987,Hemiptera
23U251,A4,CDFA_P8,Hemiptera (Heteroptera),Corixidae,Trichocorixa,reticulata,30.I.1981,1981-01-30,1981,Hemiptera
23U252,B4,CDFA_P8,Hemiptera (Heteroptera),Reduviidae,Stenolemoides,arizonensis,25.XI.1983,1983-11-25,1983,Hemiptera
23U253,C4,CDFA_P8,Hemiptera (Heteroptera),Reduviidae,Empicoris,rubromaculatus,20.IX.2005,2005-09-20,2005,Hemiptera
23U254,D4,CDFA_P8,Hemiptera (Heteroptera),Reduviidae,Apiomerus,crassipes,14.V.2010,2010-05-14,2010,Hemiptera
23U255,E4,CDFA_P8,Hemiptera (Heteroptera),Reduviidae,Pselliopus,spinicollis,09.III.1981,1981-03-09,1981,Hemiptera
23U256,F4,CDFA_P8,Hemiptera (Heteroptera),Reduviidae,Rhynocoris,ventralis,07.IV.1985,1985-04-07,1985,Hemiptera
23U257,G4,CDFA_P8,Hemiptera (Heteroptera),Reduviidae,Rhynocoris,ventralis americanus,08.VII.1996,1996-07-08,1996,Hemiptera
23U258,H4,CDFA_P8,Hemiptera (Heteroptera),Reduviidae,Rhynocoris,ventralis ventralis,26.VII.1982,1982-07-26,1982,Hemiptera
23U259,A5,CDFA_P8,Hemiptera (Heteroptera),Reduviidae,Sinea,complexa,08.III.1988,1988-03-08,1988,Hemiptera
23U260,B5,CDFA_P8,Hemiptera (Heteroptera),Reduviidae,Sinea,confusa,27.VII.1985,1985-07-27,1985,Hemiptera
23U261,C5,CDFA_P8,Hemiptera (Heteroptera),Reduviidae,Sinea,confusa,27.VIII.1988,1988-08-27,1988,Hemiptera
23U262,D5,CDFA_P8,Hemiptera (Heteroptera),Reduviidae,Sinea,diadema,18.V.1995,1995-05-18,1995,Hemiptera
23U263,E5,CDFA_P8,Hemiptera (Heteroptera),Reduviidae,Sinea,rileyi,29.III.1996,1996-03-29,1996,Hemiptera
23U264,F5,CDFA_P8,Hemiptera (Heteroptera),Reduviidae,Zelus,renardii,29.X.2013,2013-10-29,2013,Hemiptera
23U265,G5,CDFA_P8,Hemiptera (Heteroptera),Reduviidae,Zelus,tetracanthus,14.III.1988,1988-03-14,1988,Hemiptera
23U266,H5,CDFA_P8,Hemiptera (Heteroptera),Reduviidae,Melanolestes,picipes,15.V.2005,2005-05-15,2005,Hemiptera
23U267,A6,CDFA_P8,Hemiptera (Heteroptera),Reduviidae,Melanolestes,picipes,10.IV.1981,1981-04-10,1981,Hemiptera
23U268,B6,CDFA_P8,Hemiptera (Heteroptera),Reduviidae,Phymata,metcalfi,12.VIII.1982,1982-08-12,1982,Hemiptera
23U269,C6,CDFA_P8,Hemiptera (Heteroptera),Reduviidae,Phymata,metcalfi,15.VII.1999,1999-07-15,1999,Hemiptera
23U270,D6,CDFA_P8,Hemiptera (Heteroptera),Reduviidae,Phymata,pacifica,28.XII.1982,1982-12-28,1982,Hemiptera
23U271,E6,CDFA_P8,Hemiptera (Heteroptera),Reduviidae,Reduvius,personatus,22.VI.2017,2017-06-22,2017,Hemiptera
23U288,F6,CDFA_P8,Hemiptera (Heteroptera),Reduviidae,Reduvius,sonoraensis,26.VIII.1984,1984-08-26,1984,Hemiptera
23U289,G6,CDFA_P8,Hemiptera (Heteroptera),Reduviidae,Reduvius,sonoraensis,09.VIII.1987,1987-08-09,1987,Hemiptera
23U290,H6,CDFA_P8,Hemiptera (Heteroptera),Reduviidae,Reduvius,vanduzeei,10.VIII.1981,1981-08-10,1981,Hemiptera
23U291,A7,CDFA_P8,Hemiptera (Heteroptera),Reduviidae,Oncocephalus,sp.,03.V.1987,1987-05-03,1987,Hemiptera
23U292,B7,CDFA_P8,Hemiptera (Heteroptera),Reduviidae,Paratriatoma,hirsuta,09.VII.2002,2002-07-09,2002,Hemiptera
23U293,C7,CDFA_P8,Hemiptera (Heteroptera),Reduviidae,Triatoma,protracta,16.VII.1989,1989-07-16,1989,Hemiptera
23U294,D7,CDFA_P8,Hemiptera (Heteroptera),Nabidae,Hoplistoscelis,heidemanni,17.V.1983,1983-05-17,1983,Hemiptera
23U295,E7,CDFA_P8,Hemiptera (Heteroptera),Nabidae,Hoplistoscelis,heidemanni,03.VIII.2005,2005-08-03,2005,Hemiptera
23U296,F7,CDFA_P8,Hemiptera (Heteroptera),Nabidae,Nabis,alternatus,10.II.2008,2008-02-10,2008,Hemiptera
23U297,G7,CDFA_P8,Hemiptera (Heteroptera),Nabidae,Nabis,alternatus,12.IX.1997,1997-09-12,1997,Hemiptera
23U298,H7,CDFA_P8,Hemiptera (Heteroptera),Nabidae,Nabis,americoferus,14.V.1989,1989-05-14,1989,Hemiptera
23U299,A8,CDFA_P8,Hemiptera (Heteroptera),Anthocoridae,Anthocoris,antevolens,30.VI.1993,1993-06-30,1993,Hemiptera
23U300,B8,CDFA_P8,Hemiptera (Heteroptera),Anthocoridae,Anthocoris,antevolens,31.VII.1985,1985-07-31,1985,Hemiptera
23U301,C8,CDFA_P8,Hemiptera (Heteroptera),Anthocoridae,Anthocoris,bakeri,18.IV.1985,1985-04-18,1985,Hemiptera
23U302,D8,CDFA_P8,Hemiptera (Heteroptera),Anthocoridae,Anthocoris,bakeri,28.I.1982,1982-01-28,1982,Hemiptera
23U303,E8,CDFA_P8,Hemiptera (Heteroptera),Anthocoridae,Anthocoris,tomentosus,27.VI.1986,1986-06-27,1986,Hemiptera
23U304,F8,CDFA_P8,Hemiptera (Heteroptera),Anthocoridae,Coccivora,californica,19.VI.1981,1981-06-19,1981,Hemiptera
23U305,G8,CDFA_P8,Hemiptera (Heteroptera),Anthocoridae,Dufouriellus,ater,26.III.1987,1987-03-26,1987,Hemiptera
23U306,H8,CDFA_P8,Hemiptera (Heteroptera),Anthocoridae,Orius,tristicolor,29.IV.1997,1997-04-29,1997,Hemiptera
23U307,A9,CDFA_P8,Hemiptera (Heteroptera),Anthocoridae,Orius,tristicolor,07.VII.1997,1997-07-07,1997,Hemiptera
23U308,B9,CDFA_P8,Hemiptera (Heteroptera),Anthocoridae,Nidicola,jaegeri,07.VII.1982,1982-07-07,1982,Hemiptera
23U309,C9,CDFA_P8,Hemiptera (Heteroptera),Anthocoridae,Nidicola,marginata,01.VIII.1989,1989-08-01,1989,Hemiptera
23U310,D9,CDFA_P8,Hemiptera (Heteroptera),Cimicidae,Cimex,antennatus,20.V.1981,1981-05-20,1981,Hemiptera
23U311,E9,CDFA_P8,Hemiptera (Heteroptera),Cimicidae,Cimex,lectularius,12.III.2002,2002-03-12,2002,Hemiptera
23U312,F9,CDFA_P8,Hemiptera (Heteroptera),Cimicidae,Oeciacus,vicarius,18.IV.2011,2011-04-18,2011,Hemiptera
23U313,G9,CDFA_P8,Hemiptera (Heteroptera),Cimicidae,Hesperocimex,coloradensis,06.IV.2009,2009-04-06,2009,Hemiptera
23U314,H9,CDFA_P8,Hemiptera (Heteroptera),Lyctocoridae,Lyctocoris,stalii,16.VII.1991,1991-07-16,1991,Hemiptera
23U315,A10,CDFA_P8,Hemiptera (Heteroptera),Lyctocoridae,Lyctocoris,campestris,15.I.1983,1983-01-15,1983,Hemiptera
23U316,B10,CDFA_P8,Hemiptera (Heteroptera),Lyctocoridae,Lyctocoris,doris,05.V.1987,1987-05-05,1987,Hemiptera
23U317,C10,CDFA_P8,Hemiptera (Heteroptera),Miridae,Dicyphus,hesperus,11.VII.2012,2012-07-11,2012,Hemiptera
23U318,D10,CDFA_P8,Hemiptera (Heteroptera),Miridae,Dicyphus,paddocki,11.VII.2012,2012-07-11,2012,Hemiptera
23U319,E10,CDFA_P8,Hemiptera (Heteroptera),Miridae,Engytatus,modestus,25.VII.2014,2014-07-25,2014,Hemiptera
23U320,F10,CDFA_P8,Hemiptera (Heteroptera),Miridae,Halticotoma,valida,25.III.2013,2013-03-25,2013,Hemiptera
23U321,G10,CDFA_P8,Hemiptera (Heteroptera),Miridae,Closterotomus,norvegicus,04.IV.2017,2017-04-04,2017,Hemiptera
23U322,H10,CDFA_P8,Hemiptera (Heteroptera),Miridae,Irbisia,silvosa,03.IV.1981,1981-04-03,1981,Hemiptera
23U323,A11,CDFA_P8,Hemiptera (Heteroptera),Miridae,Irbisia,solani,11.IV.2013,2013-04-11,2013,Hemiptera
23U324,B11,CDFA_P8,Hemiptera (Heteroptera),Miridae,Lygus,hesperus,05.V.2021,2021-05-05,2021,Hemiptera
23U325,C11,CDFA_P8,Hemiptera (Heteroptera),Miridae,Proba,californica,13.VIII.1998,1998-08-13,1998,Hemiptera
23U326,D11,CDFA_P8,Hemiptera (Heteroptera),Miridae,Tropidosteptes,illitus,22.IV.2013,2013-04-22,2013,Hemiptera
23U327,E11,CDFA_P8,Hemiptera (Heteroptera),Miridae,Tropidosteptes,illitus,22.IV.2013,2013-04-22,2013,Hemiptera
23U328,F11,CDFA_P8,Hemiptera (Heteroptera),Miridae,Tropidosteptes,illitus or near,09.IV.2010,2010-04-09,2010,Hemiptera
23U329,G11,CDFA_P8,Hemiptera (Heteroptera),Miridae,Leptopterna,ferrugata,15.IV.2013,2013-04-15,2013,Hemiptera
23U330,H11,CDFA_P8,Hemiptera (Heteroptera),Miridae,Lapops,sp.,22.VI.2006,2006-06-22,2006,Hemiptera
23U331,A12,CDFA_P8,Hemiptera (Heteroptera),Miridae,Brachynotocoris,puncticornis,28.V.2013,2013-05-28,2013,Hemiptera
23U332,B12,CDFA_P8,Hemiptera (Heteroptera),Miridae,Cyrtopeltocoris,sp.,23.XI.1983,1983-11-23,1983,Hemiptera
23U333,C12,CDFA_P8,Hemiptera (Heteroptera),Miridae,Lepidargyrus,ancorifer,17.V.2017,2017-05-17,2017,Hemiptera
23U334,D12,CDFA_P8,Hemiptera (Heteroptera),Miridae,Pseudatomoscelis,seriatus,10.VIII.2017,2017-08-10,2017,Hemiptera
23U335,E12,CDFA_P8,Hemiptera (Heteroptera),Miridae,Pygovepres,vaccinicola,27.IV.1981,1981-04-27,1981,Hemiptera
23U336,F12,CDFA_P8,Hemiptera (Heteroptera),Miridae,Rhinacloa,forticornis,23.I.2013,2013-01-23,2013,Hemiptera
23U340,A1,CDFA_P9,Hemiptera (Heteroptera),Tingidae,Corythaica,venusta,10.VI.1997,1997-06-10,1997,Hemiptera
23U341,B1,CDFA_P9,Hemiptera (Heteroptera),Tingidae,Corythucha,gossypii,03.VI.2006,2006-06-03,2006,Hemiptera
23U342,C1,CDFA_P9,Hemiptera (Heteroptera),Tingidae,Corythucha,morrilli,30.IX.2013,2013-09-30,2013,Hemiptera
23U343,D1,CDFA_P9,Hemiptera (Heteroptera),Tingidae,Corythucha,morrilli,14.VI.1985,1985-06-14,1985,Hemiptera
23U344,E1,CDFA_P9,Hemiptera (Heteroptera),Tingidae,Corythucha,obliqua,12.VI.1998,1998-06-12,1998,Hemiptera
23U345,F1,CDFA_P9,Hemiptera (Heteroptera),Tingidae,Corythucha,sphaeralceae,07.VIII.1996,1996-08-07,1996,Hemiptera
23U346,G1,CDFA_P9,Hemiptera (Heteroptera),Tingidae,Dictyla,labeculata,16.VI.1983,1983-06-16,1983,Hemiptera
23U347,H1,CDFA_P9,Hemiptera (Heteroptera),Tingidae,Physatocheila,variegata ornata,20.VI.1983,1983-06-20,1983,Hemiptera
23U348,A2,CDFA_P9,Hemiptera (Heteroptera),Tingidae,Pseudacysta,perseae,30.XII.2004,2004-12-30,2004,Hemiptera
23U349,B2,CDFA_P9,Hemiptera (Heteroptera),Thaumastocoridae,Thaumastocoris,peregrinus,08.XI.2016,2016-11-08,2016,Hemiptera
23U350,C2,CDFA_P9,Hemiptera (Heteroptera),Aradidae,Aradus,antennalis,26.IX.1985,1985-09-26,1985,Hemiptera
23U351,D2,CDFA_P9,Hemiptera (Heteroptera),Aradidae,Aradus,debilis,14.IV.1999,1999-04-14,1999,Hemiptera
23U352,E2,CDFA_P9,Hemiptera (Heteroptera),Aradidae,Aradus,pannosus incomptus,01.III.1986,1986-03-01,1986,Hemiptera
23U353,F2,CDFA_P9,Hemiptera (Heteroptera),Aradidae,Aradus,proboscideus,05.V.1987,1987-05-05,1987,Hemiptera
23U357,G2,CDFA_P9,Hemiptera (Heteroptera),Aradidae,Quilnus,heidemanni,16.VI.1981,1981-06-16,1981,Hemiptera
23U358,H2,CDFA_P9,Hemiptera (Heteroptera),Aradidae,Mezira,pacifica,11.VI.2007,2007-06-11,2007,Hemiptera
23U359,A3,CDFA_P9,Hemiptera (Heteroptera),Aradidae,Mezira,pacifica,20.IV.1989,1989-04-20,1989,Hemiptera
23U360,B3,CDFA_P9,Hemiptera (Heteroptera),Aradidae,Mezira,reducta,05.VII.2004,2004-07-05,2004,Hemiptera
23U361,C3,CDFA_P9,Hemiptera (Heteroptera),Acanthosomatidae,Elasmucha,lateralis,14.VIII.2006,2006-08-14,2006,Hemiptera
23U362,D3,CDFA_P9,Hemiptera (Heteroptera),Cydnidae,Amnestus,pusillus,28.VII.1980,1980-07-28,1980,Hemiptera
23U363,E3,CDFA_P9,Hemiptera (Heteroptera),Cydnidae,Chilocoris,repetitus,18.XI.1985,1985-11-18,1985,Hemiptera
23U364,F3,CDFA_P9,Hemiptera (Heteroptera),Cydnidae,Dallasiellus,foratus,23.V.1983,1983-05-23,1983,Hemiptera
23U365,G3,CDFA_P9,Hemiptera (Heteroptera),Cydnidae,Melanaethus,subglaber,23.V.1983,1983-05-23,1983,Hemiptera
23U366,H3,CDFA_P9,Hemiptera (Heteroptera),Cydnidae,Microporus,obliquus,31.V.1987,1987-05-31,1987,Hemiptera
23U367,A4,CDFA_P9,Hemiptera (Heteroptera),Cydnidae,Pangaeus,bilineatus,08.X.2013,2013-10-08,2013,Hemiptera
23U368,B4,CDFA_P9,Hemiptera (Heteroptera),Cydnidae,Tominotus,conformis,13.I.1982,1982-01-13,1982,Hemiptera
23U369,C4,CDFA_P9,Hemiptera (Heteroptera),Pentatomidae,Apateticus,crocatus,01.X.2007,2007-10-01,2007,Hemiptera
23U370,D4,CDFA_P9,Hemiptera (Heteroptera),Pentatomidae,Podisus,maculiventris,01.VII.1992,1992-07-01,1992,Hemiptera
23U371,E4,CDFA_P9,Hemiptera (Heteroptera),Pentatomidae,Zicrona,caerulea,02.VII.2013,2013-07-02,2013,Hemiptera
23U372,F4,CDFA_P9,Hemiptera (Heteroptera),Pentatomidae,Neottiglossa,tumidifrons,05.V.1981,1981-05-05,1981,Hemiptera
23U373,G4,CDFA_P9,Hemiptera (Heteroptera),Pentatomidae,Agonoscelis,puberula,11.VI.2015,2015-06-11,2015,Hemiptera
23U374,H4,CDFA_P9,Hemiptera (Heteroptera),Pentatomidae,Cosmopepla,conspicillaris,01.VII.1999,1999-07-01,1999,Hemiptera
23U375,A5,CDFA_P9,Hemiptera (Heteroptera),Pentatomidae,Cosmopepla,intergressa,08.VI.1983,1983-06-08,1983,Hemiptera
23U376,B5,CDFA_P9,Hemiptera (Heteroptera),Pentatomidae,Euschistus,conspersus,02.VII.2014,2014-07-02,2014,Hemiptera
23U377,C5,CDFA_P9,Hemiptera (Heteroptera),Pentatomidae,Brochymena,affinis,11.IV.1996,1996-04-11,1996,Hemiptera
23U378,D5,CDFA_P9,Hemiptera (Heteroptera),Pentatomidae,Brochymena,sulcata,11.II.2017,2017-02-11,2017,Hemiptera
23U379,E5,CDFA_P9,Hemiptera (Heteroptera),Pentatomidae,Halyomorpha,halys,04.IX.2013,2013-09-04,2013,Hemiptera
23U380,F5,CDFA_P9,Hemiptera (Heteroptera),Pentatomidae,Halyomorpha,halys,22.IX.2006,2006-09-22,2006,Hemiptera
23U381,G5,CDFA_P9,Hemiptera (Heteroptera),Pentatomidae,Chlorochroa,ligata,11.VII.1981,1981-07-11,1981,Hemiptera
23U382,H5,CDFA_P9,Hemiptera (Heteroptera),Pentatomidae,Chlorochroa,uhleri,22.II.1991,1991-02-22,1991,Hemiptera
23U383,A6,CDFA_P9,Hemiptera (Heteroptera),Pentatomidae,Chlorochroa,uhleri,21.VI.1983,1983-06-21,1983,Hemiptera
23U384,B6,CDFA_P9,Hemiptera (Heteroptera),Pentatomidae,Banasa,dimidiata,03.XII.2003,2003-12-03,2003,Hemiptera
23U385,C6,CDFA_P9,Hemiptera (Heteroptera),Pentatomidae,Pellaea,stictica,21.XII.2021,2021-12-21,2021,Hemiptera
23U386,D6,CDFA_P9,Hemiptera (Heteroptera),Pentatomidae,Thyanta,stictica,27.VI.1998,1998-06-27,1998,Hemiptera
23U387,E6,CDFA_P9,Hemiptera (Heteroptera),Pentatomidae,Dendrocoris,pini,21.VI.1983,1983-06-21,1983,Hemiptera
23U388,F6,CDFA_P9,Hemiptera (Heteroptera),Pentatomidae,Bagrada,hilaris,20.X.2011,2011-10-20,2011,Hemiptera
23U389,G6,CDFA_P9,Hemiptera (Heteroptera),Pentatomidae,Bagrada,hilaris,18.VII.2013,2013-07-18,2013,Hemiptera
23U390,H6,CDFA_P9,Hemiptera (Heteroptera),Pentatomidae,Murgantia,histrionica,10.XI.2010,2010-11-10,2010,Hemiptera
23U391,A7,CDFA_P9,Hemiptera (Heteroptera),Pentatomidae,Amaurochrous,vanduzeei,31.I.1992,1992-01-31,1992,Hemiptera
23U392,B7,CDFA_P9,Hemiptera (Heteroptera),Scutelleridae,Eurygaster,sp.,23.IV.1998,1998-04-23,1998,Hemiptera
23U393,C7,CDFA_P9,Hemiptera (Heteroptera),Scutelleridae,Acantholomidea,porosa,11.VI.1985,1985-06-11,1985,Hemiptera
23U394,D7,CDFA_P9,Hemiptera (Heteroptera),Scutelleridae,Homaemus,sp.,14.VI.1983,1983-06-14,1983,Hemiptera
23U395,E7,CDFA_P9,Hemiptera (Heteroptera),Largidae,Largus,californicus,20.VI.1994,1994-06-20,1994,Hemiptera
23U396,F7,CDFA_P9,Hemiptera (Heteroptera),Largidae,Largus,cinctus,16.VI.1983,1983-06-16,1983,Hemiptera
23U397,G7,CDFA_P9,Hemiptera (Heteroptera),Pyrrhocoridae,Scantius,aegyptius,18.VI.2012,2012-06-18,2012,Hemiptera
23U398,H7,CDFA_P9,Hemiptera (Heteroptera),Pyrrhocoridae,Scantius,aegyptius,06.XII.2010,2010-12-06,2010,Hemiptera
23U399,A8,CDFA_P9,Hemiptera (Heteroptera),Alydidae,Alydus,calcaratus,30.VI.1988,1988-06-30,1988,Hemiptera
23U400,B8,CDFA_P9,Hemiptera (Heteroptera),Alydidae,Alydus,eurinus,16.VII.2010,2010-07-16,2010,Hemiptera
23U401,C8,CDFA_P9,Hemiptera (Heteroptera),Alydidae,Alydus,tomentosus,28.VIII.1980,1980-08-28,1980,Hemiptera
23U402,D8,CDFA_P9,Hemiptera (Heteroptera),Alydidae,Hyalymenus,subinermis,13.VI.2021,2021-06-13,2021,Hemiptera
23U403,E8,CDFA_P9,Hemiptera (Heteroptera),Alydidae,Stachyocnemus,apicalis,01.IX.1986,1986-09-01,1986,Hemiptera
23U404,F8,CDFA_P9,Hemiptera (Heteroptera),Alydidae,Tollius,curtulus,06.VIII.1999,1999-08-06,1999,Hemiptera
23U405,G8,CDFA_P9,Hemiptera (Heteroptera),Alydidae,Tollius,setosus,12.VIII.1980,1980-08-12,1980,Hemiptera
23U406,H8,CDFA_P9,Hemiptera (Heteroptera),Alydidae,Tollius,vanduzeei,28.VI.1986,1986-06-28,1986,Hemiptera
23U407,A9,CDFA_P9,Hemiptera (Heteroptera),Coreidae,Leptoglossus,clypealis,15.IV.1985,1985-04-15,1985,Hemiptera
23U408,B9,CDFA_P9,Hemiptera (Heteroptera),Coreidae,Leptoglossus,occidentalis,07.XII.2007,2007-12-07,2007,Hemiptera
23U409,C9,CDFA_P9,Hemiptera (Heteroptera),Coreidae,Leptoglossus,zonatus,30.VI.2015,2015-06-30,2015,Hemiptera
23U410,D9,CDFA_P9,Hemiptera (Heteroptera),Coreidae,Centrocoris,variegatus,30.V.2020,2020-05-30,2020,Hemiptera
23U411,E9,CDFA_P9,Hemiptera (Heteroptera),Coreidae,Anasa,tristis,18.VI.1985,1985-06-18,1985,Hemiptera
23U412,F9,CDFA_P9,Hemiptera (Heteroptera),Coreidae,Scolopocerus,uhleri,01.XII.2014,2014-12-01,2014,Hemiptera
23U413,G9,CDFA_P9,Hemiptera (Heteroptera),Coreidae,Merocoris,curtatus,04.IX.2008,2008-09-04,2008,Hemiptera
23U414,H9,CDFA_P9,Hemiptera (Heteroptera),Coreidae,Ceraleptus,pacificus,30.III.2004,2004-03-30,2004,Hemiptera
23U415,A10,CDFA_P9,Hemiptera (Heteroptera),Rhopalidae,Aufeius,impressicollis,10.VI.1997,1997-06-10,1997,Hemiptera
23U416,B10,CDFA_P9,Hemiptera (Heteroptera),Rhopalidae,Harmostes,angustatus,21.VI.1983,1983-06-21,1983,Hemiptera
23U417,C10,CDFA_P9,Hemiptera (Heteroptera),Rhopalidae,Harmostes,reflexulus,26.III.1987,1987-03-26,1987,Hemiptera
23U418,D10,CDFA_P9,Hemiptera (Heteroptera),Rhopalidae,Harmostes,reflexulus,11.VI.1988,1988-06-11,1988,Hemiptera
23U419,E10,CDFA_P9,Hemiptera (Heteroptera),Rhopalidae,Arhyssus,barberi,25.II.2020,2020-02-25,2020,Hemiptera
23U420,F10,CDFA_P9,Hemiptera (Heteroptera),Rhopalidae,Arhyssus,crassus,28.IX.2016,2016-09-28,2016,Hemiptera
23U421,G10,CDFA_P9,Hemiptera (Heteroptera),Rhopalidae,Arhyssus,distinctus,10.VIII.1980,1980-08-10,1980,Hemiptera
23U422,H10,CDFA_P9,Hemiptera (Heteroptera),Rhopalidae,Arhyssus,lateralis,13.VI.1996,1996-06-13,1996,Hemiptera
23U423,A11,CDFA_P9,Hemiptera (Heteroptera),Rhopalidae,Arhyssus,longirostratus,11.V.1982,1982-05-11,1982,Hemiptera
23U424,B11,CDFA_P9,Hemiptera (Heteroptera),Rhopalidae,Arhyssus,scutatus,12.IX.1997,1997-09-12,1997,Hemiptera
23U425,C11,CDFA_P9,Hemiptera (Heteroptera),Rhopalidae,Arhyssus,validus,14.VII.1980,1980-07-14,1980,Hemiptera
23U426,D11,CDFA_P9,Hemiptera (Heteroptera),Rhopalidae,Brachycarenus,tigrinus,21.VIII.1992,1992-08-21,1992,Hemiptera
23U427,E11,CDFA_P9,Hemiptera (Heteroptera),Rhopalidae,Liorhyssus,hyalinus,02.VI.1993,1993-06-02,1993,Hemiptera
23U428,F11,CDFA_P9,Hemiptera (Heteroptera),Rhopalidae,Boisea,rubrolineata,16.V.2010,2010-05-16,2010,Hemiptera
23U429,G11,CDFA_P9,Hemiptera (Heteroptera),Rhopalidae,Boisea,rubrolineata,23.V.2009,2009-05-23,2009,Hemiptera
23U430,H11,CDFA_P9,Hemiptera (Heteroptera),Rhopalidae,Jadera,haematoloma,25.VIII.2016,2016-08-25,2016,Hemiptera
23U431,A12,CDFA_P9,Hemiptera (Heteroptera),Berytidae,Neoneides,muticus,27.VI.2006,2006-06-27,2006,Hemiptera
23U432,B12,CDFA_P9,Hemiptera (Heteroptera),Berytidae,Neoneides,muticus,12.VIII.2010,2010-08-12,2010,Hemiptera
23U433,C12,CDFA_P9,Hemiptera (Heteroptera),Berytidae,Hoplinus,echinatus,28.VI.1986,1986-06-28,1986,Hemiptera
23U434,D12,CDFA_P9,Hemiptera (Heteroptera),Berytidae,Jalysus,wickhami,16.VII.2010,2010-07-16,2010,Hemiptera
23U435,E12,CDFA_P9,Hemiptera (Heteroptera),Blissidae,Blissus,insularis,16.X.1981,1981-10-16,1981,Hemiptera
23U436,F12,CDFA_P9,Hemiptera (Heteroptera),Cymidae,Cymus,coriacipennis,20.VI.1983,1983-06-20,1983,Hemiptera
CASENT8569094,A1,CAS_P38,Coleoptera,Trogossitidae,Temnoscheila,NA,2023-04-27,2023-04-27,2023,Coleoptera
CASENT8559738,B1,CAS_P38,NA,NA,NA,NA,NA,NA,NA,NA
CASENT8570911,C1,CAS_P38,Coleoptera,Buprestidae,Acmaeodera,Acmaeodera mojavei,2023-04-30,2023-04-30,2023,Coleoptera
CASENT8569257,D1,CAS_P38,Coleoptera,Coccinellidae,Myzia,Myzia interrupta,2023-04-27,2023-04-27,2023,Coleoptera
CASENT8560199,E1,CAS_P38,Coleoptera,Coccinellidae,Coccinella,Coccinella septempunctata,2023-04-28,2023-04-28,2023,Coleoptera
CASENT8559847,F1,CAS_P38,Coleoptera,Coccinellidae,Coccinella,Coccinella septempunctata,2023-04-28,2023-04-28,2023,Coleoptera
CASENT8570943,G1,CAS_P38,Coleoptera,Coccinellidae,Coccinella,Coccinella septempunctata,2023-04-29,2023-04-29,2023,Coleoptera
CASENT8559689,H1,CAS_P38,Coleoptera,Coccinellidae,Coccinella,Coccinella septempunctata,2023-04-25,2023-04-25,2023,Coleoptera
CASENT8571101,A2,CAS_P38,Coleoptera,Cleridae,Trichodes,Trichodes ornatus,2023-04-29,2023-04-29,2023,Coleoptera
CASENT9120374,B2,CAS_P38,Coleoptera,Cerambycidae,Anastrangalia,Anastrangalia laetifica,2023-05-08,2023-05-08,2023,Coleoptera
CASENT9120370,C2,CAS_P38,Coleoptera,Cerambycidae,Anastrangalia,Anastrangalia laetifica,2023-05-08,2023-05-08,2023,Coleoptera
CASENT8559390,D2,CAS_P38,Coleoptera,Cerambycidae,Anastrangalia,Anastrangalia laetifica,2023-05-08,2023-05-08,2023,Coleoptera
CASENT8559862,E2,CAS_P38,Coleoptera,Cerambycidae,Aneflus,Aneflus calvatus,2023-04-24,2023-04-24,2023,Coleoptera
CASENT8551429,F2,CAS_P38,Coleoptera,Dascillidae,Anorus,Anorus piceus,2023-03-14,2023-03-14,2023,Coleoptera
CASENT8571105,G2,CAS_P38,Coleoptera,Curculionidae,Ophryastes,NA,2023-04-30,2023-04-30,2023,Coleoptera
CASENT8559869,H2,CAS_P38,Coleoptera,Ripiphoridae,Ripiphorus,NA,2023-04-28,2023-04-28,2023,Coleoptera
CASENT8551512,A3,CAS_P38,NA,NA,NA,NA,NA,NA,NA,NA
CASENT8551222,B3,CAS_P38,NA,NA,NA,NA,NA,NA,NA,NA
CASENT8551036,C3,CAS_P38,Coleoptera,Tenebrionidae,Edrotes,Edrotes ventricosus,2023-03-13,2023-03-13,2023,Coleoptera
CASENT8551233,D3,CAS_P38,Coleoptera,Tenebrionidae,Edrotes,Edrotes ventricosus,2023-03-13,2023-03-13,2023,Coleoptera
CASENT8551463,F3,CAS_P38,Coleoptera,Tenebrionidae,Edrotes,Edrotes ventricosus,2023-03-13,2023-03-13,2023,Coleoptera
CASENT8551523,G3,CAS_P38,Coleoptera,Tenebrionidae,Edrotes,Edrotes ventricosus,2023-03-13,2023-03-13,2023,Coleoptera
CASENT8551499,H3,CAS_P38,Coleoptera,Tenebrionidae,Edrotes,Edrotes ventricosus,2023-03-13,2023-03-13,2023,Coleoptera
CASENT8570050,A4,CAS_P38,NA,NA,NA,NA,NA,NA,NA,NA
CASENT8570252,B4,CAS_P38,Coleoptera,Elateridae,Euthysanius,NA,2023-06-15,2023-06-15,2023,Coleoptera
CASENT8570321,C4,CAS_P38,Coleoptera,Elateridae,Euthysanius,NA,2023-06-15,2023-06-15,2023,Coleoptera
CASENT8570039,D4,CAS_P38,Coleoptera,Phengodidae,Zarhipis,Zarhipis integripennis,2023-06-15,2023-06-15,2023,Coleoptera
CASENT8570414,E4,CAS_P38,Coleoptera,Phengodidae,Zarhipis,Zarhipis integripennis,2023-06-15,2023-06-15,2023,Coleoptera
CASENT8570087,F4,CAS_P38,NA,NA,NA,NA,NA,NA,NA,NA
CASENT8539180,G4,CAS_P38,Coleoptera,Phengodidae,Zarhipis,Zarhipis integripennis,2022-05-13,2022-05-13,2022,Coleoptera
CASENT8560151,H4,CAS_P38,Coleoptera,Phengodidae,Zarhipis,NA,2023-04-25,2023-04-25,2023,Coleoptera
CASENT8559682,A5,CAS_P38,Coleoptera,Scarabaeidae,Cremastocheilus,NA,2023-04-28,2023-04-28,2023,Coleoptera
CASENT8551566,B5,CAS_P38,Coleoptera,Scarabaeidae,Tomarus,Tomarus gibbosus,2023-03-13,2023-03-13,2023,Coleoptera
CASENT8570960,C5,CAS_P38,NA,NA,NA,NA,NA,NA,NA,NA
CASENT8570954,D5,CAS_P38,Coleoptera,Scarabaeidae,NA,NA,2023-04-30,2023-04-30,2023,Coleoptera
CASENT8571039,E5,CAS_P38,Coleoptera,Meloidae,Cysteodemus,Cysteodemus armatus,2023-04-28,2023-04-28,2023,Coleoptera
CASENT8571031,F5,CAS_P38,NA,NA,NA,NA,NA,NA,NA,NA
CASENT8571073,G5,CAS_P38,Coleoptera,Meloidae,Cysteodemus,Cysteodemus armatus,2023-04-28,2023-04-28,2023,Coleoptera
CASENT8570371,H5,CAS_P38,Coleoptera,Dermestidae,Dermestes,Dermestes marmoratus,2023-08-15,2023-08-15,2023,Coleoptera
CASENT8569194,A6,CAS_P38,Coleoptera,Tenebrionidae,Schizillus,Schizillus laticeps,2023-04-27,2023-04-27,2023,Coleoptera
CASENT8569233,B6,CAS_P38,Coleoptera,Tenebrionidae,Schizillus,Schizillus laticeps,2023-04-27,2023-04-27,2023,Coleoptera
CASENT8570917,C6,CAS_P38,Coleoptera,Tenebrionidae,Triorophus,NA,2023-04-29,2023-04-29,2023,Coleoptera
CASENT8551219,D6,CAS_P38,Coleoptera,Tenebrionidae,Asbolus,Asbolus verrucosus,2023-03-14,2023-03-14,2023,Coleoptera
CASENT8551478,E6,CAS_P38,Coleoptera,Tenebrionidae,Asbolus,Asbolus verrucosus,2023-03-14,2023-03-14,2023,Coleoptera
CASENT8551310,F6,CAS_P38,Coleoptera,Tenebrionidae,Stenomorpha,Stenomorpha hirsuta,2023-03-13,2023-03-13,2023,Coleoptera
CASENT8551528,G6,CAS_P38,Coleoptera,Curculionidae,Ophryastes,Ophryastes desertus,2023-03-13,2023-03-13,2023,Coleoptera
CASENT8551555,H6,CAS_P38,Coleoptera,Curculionidae,Ophryastes,Ophryastes desertus,2023-03-14,2023-03-14,2023,Coleoptera
CASENT8539177,A7,CAS_P38,Coleoptera,Staphylinidae,Nicrophorus,Nicrophorus nigrita,2022-05-13,2022-05-13,2022,Coleoptera
CASENT8539970,B7,CAS_P38,Coleoptera,Staphylinidae,Nicrophorus,Nicrophorus nigrita,2022-09-13,2022-09-13,2022,Coleoptera
CASENT8539984,C7,CAS_P38,Coleoptera,Staphylinidae,Nicrophorus,Nicrophorus nigrita,2022-09-13,2022-09-13,2022,Coleoptera
CASENT8539955,D7,CAS_P38,Coleoptera,Staphylinidae,Nicrophorus,Nicrophorus nigrita,2022-10-10,2022-10-10,2022,Coleoptera
CASENT8559850,E7,CAS_P38,Coleoptera,Meloidae,Lytta,Lytta magister,2023-04-25,2023-04-25,2023,Coleoptera
CASENT8551156,F7,CAS_P38,Coleoptera,Scarabaeidae,Phyllophaga,NA,2023-08-15,2023-08-15,2023,Coleoptera
CASENT8570282,G7,CAS_P38,Coleoptera,Scarabaeidae,Phyllophaga,NA,2023-08-15,2023-08-15,2023,Coleoptera
CASENT8560088,H7,CAS_P38,NA,NA,NA,NA,NA,NA,NA,NA
CASENT8540129,A1,CAS_P39,Lepidoptera,Noctuidae,Agrotis,Agrotis ipsilon,2022-10-18,2022-10-18,2022,Lepidoptera
CASENT8540073,B1,CAS_P39,Lepidoptera,Noctuidae,Agrotis,Agrotis ipsilon,2022-10-18,2022-10-18,2022,Lepidoptera
CASENT8540088,C1,CAS_P39,Lepidoptera,Noctuidae,Euxoa,NA,2022-10-10,2022-10-10,2022,Lepidoptera
CASENT8540130,D1,CAS_P39,Lepidoptera,Noctuidae,Euxoa,NA,2022-10-10,2022-10-10,2022,Lepidoptera
CASENT8540354,E1,CAS_P39,Lepidoptera,Noctuidae,Euxoa,NA,2022-10-10,2022-10-10,2022,Lepidoptera
CASENT8540018,F1,CAS_P39,Lepidoptera,Noctuidae,Parabagrotis,NA,2022-10-10,2022-10-10,2022,Lepidoptera
CASENT8540407,G1,CAS_P39,Lepidoptera,Noctuidae,Ufeus,Ufeus satyricus,2022-10-18,2022-10-18,2022,Lepidoptera
CASENT8540326,H1,CAS_P39,Lepidoptera,Noctuidae,Mesogona,NA,2022-10-10,2022-10-10,2022,Lepidoptera
CASENT8540314,A2,CAS_P39,NA,NA,NA,NA,NA,NA,NA,NA
CASENT8539942,B2,CAS_P39,Lepidoptera,Noctuidae,Mesogona,NA,2022-09-13,2022-09-13,2022,Lepidoptera
CASENT8540028,C2,CAS_P39,Lepidoptera,Noctuidae,Euxoa,Euxoa comosa,2022-09-30,2022-09-30,2022,Lepidoptera
CASENT8540379,D2,CAS_P39,Lepidoptera,Noctuidae,Mesogona,Mesogona olivata,2022-09-30,2022-09-30,2022,Lepidoptera
CASENT8540172,E2,CAS_P39,Lepidoptera,Noctuidae,NA,NA,2022-10-10,2022-10-10,2022,Lepidoptera
CASENT8540311,F2,CAS_P39,Lepidoptera,Noctuidae,Euxoa,NA,2022-10-10,2022-10-10,2022,Lepidoptera
CASENT8540241,G2,CAS_P39,Lepidoptera,Noctuidae,Caradrina,Caradrina atrostriga,2022-10-10,2022-10-10,2022,Lepidoptera
CASENT8540101,H2,CAS_P39,Lepidoptera,Noctuidae,Caradrina,Caradrina atrostriga,2022-10-10,2022-10-10,2022,Lepidoptera
CASENT8540157,A3,CAS_P39,Lepidoptera,Noctuidae,Caradrina,Caradrina atrostriga,2022-10-10,2022-10-10,2022,Lepidoptera
CASENT8539872,B3,CAS_P39,Lepidoptera,Noctuidae,Lacinipolia,Lacinipolia leucogramma,2022-09-13,2022-09-13,2022,Lepidoptera
CASENT8540228,C3,CAS_P39,Lepidoptera,Noctuidae,Agrochola,Agrochola purpurea,2022-10-10,2022-10-10,2022,Lepidoptera
CASENT8540257,D3,CAS_P39,Lepidoptera,Noctuidae,Euxoa,Euxoa comosa,2022-09-30,2022-09-30,2022,Lepidoptera
CASENT8540271,E3,CAS_P39,Lepidoptera,Noctuidae,Ufeus,Ufeus satyricus,2022-09-30,2022-09-30,2022,Lepidoptera
CASENT8540098,F3,CAS_P39,Lepidoptera,Noctuidae,Ufeus,Ufeus satyricus,2022-09-30,2022-09-30,2022,Lepidoptera
CASENT8539912,G3,CAS_P39,Lepidoptera,Noctuidae,Pseudorthodes,Pseudorthodes puerilis,2022-10-10,2022-10-10,2022,Lepidoptera
CASENT8540313,H3,CAS_P39,Lepidoptera,Noctuidae,Ufeus,Ufeus satyricus,2022-10-19,2022-10-19,2022,Lepidoptera
CASENT8540033,A4,CAS_P39,Lepidoptera,Noctuidae,Fishia,Fishia discors,2022-09-30,2022-09-30,2022,Lepidoptera
CASENT8540214,B4,CAS_P39,Lepidoptera,Noctuidae,Fishia,Fishia discors,2022-10-19,2022-10-19,2022,Lepidoptera
CASENT8540117,C4,CAS_P39,Lepidoptera,Noctuidae,Xylena,Xylena thoracica,2022-10-19,2022-10-19,2022,Lepidoptera
CASENT8539926,D4,CAS_P39,Lepidoptera,Noctuidae,Andropolia,Andropolia olga,2022-09-30,2022-09-30,2022,Lepidoptera
CASENT8539954,E4,CAS_P39,Lepidoptera,Noctuidae,Hydraecia,Hydraecia obliqua,2022-09-30,2022-09-30,2022,Lepidoptera
CASENT8539871,F4,CAS_P39,Lepidoptera,Noctuidae,Hydraecia,Hydraecia obliqua,2022-09-30,2022-09-30,2022,Lepidoptera
CASENT8540030,G4,CAS_P39,Lepidoptera,Noctuidae,Oligia,Oligia divesta,2022-09-30,2022-09-30,2022,Lepidoptera
CASENT8540199,H4,CAS_P39,Lepidoptera,Noctuidae,Oligia,Oligia divesta,2022-09-30,2022-09-30,2022,Lepidoptera
CASENT8540047,A5,CAS_P39,Lepidoptera,Noctuidae,Pleromelloida,Pleromelloida cinerea,2022-09-30,2022-09-30,2022,Lepidoptera
CASENT8540154,B5,CAS_P39,Lepidoptera,Noctuidae,Brachylomia,Brachylomia curvifascia,2022-09-30,2022-09-30,2022,Lepidoptera
CASENT8540131,C5,CAS_P39,Lepidoptera,Noctuidae,Euxoa,Euxoa brevipennis,2022-10-19,2022-10-19,2022,Lepidoptera
CASENT8539969,D5,CAS_P39,Lepidoptera,Noctuidae,Zosteropoda,Zosteropoda hirtipes,2022-09-13,2022-09-13,2022,Lepidoptera
CASENT8539939,E5,CAS_P39,Lepidoptera,Noctuidae,Zosteropoda,Zosteropoda hirtipes,2022-09-13,2022-09-13,2022,Lepidoptera
CASENT8540378,F5,CAS_P39,NA,NA,NA,NA,NA,NA,NA,NA
CASENT8540355,G5,CAS_P39,Lepidoptera,Noctuidae,Orthosia,Orthosia mys,2022-09-30,2022-09-30,2022,Lepidoptera
CASENT8551562,H5,CAS_P39,Lepidoptera,Noctuidae,Homorthodes,Homorthodes hanhami,2023-03-12,2023-03-12,2023,Lepidoptera
CASENT8540226,A6,CAS_P39,Lepidoptera,Noctuidae,Lithophane,Lithophane ponderosa,2022-10-18,2022-10-18,2022,Lepidoptera
CASENT8540074,B6,CAS_P39,Lepidoptera,Noctuidae,Lithophane,Lithophane ponderosa,2022-10-19,2022-10-19,2022,Lepidoptera
CASENT8539941,C6,CAS_P39,Lepidoptera,Noctuidae,Homorthodes,Homorthodes communis,2022-10-10,2022-10-10,2022,Lepidoptera
CASENT8539997,D6,CAS_P39,Lepidoptera,Noctuidae,Homorthodes,Homorthodes communis,2022-10-10,2022-10-10,2022,Lepidoptera
CASENT8539879,E6,CAS_P39,Lepidoptera,Noctuidae,Autographa,Autographa californica,2022-09-26,2022-09-26,2022,Lepidoptera
CASENT8551565,F6,CAS_P39,NA,NA,NA,NA,NA,NA,NA,NA
CASENT8539878,G6,CAS_P39,Lepidoptera,Noctuidae,Parabagrotis,Parabagrotis insularis,2022-09-26,2022-09-26,2022,Lepidoptera
CASENT8539935,H6,CAS_P39,Lepidoptera,Noctuidae,Mythimna,Mythimna unipuncta,2022-09-26,2022-09-26,2022,Lepidoptera
CASENT8539863,A7,CAS_P39,Lepidoptera,Noctuidae,NA,NA,2022-09-15,2022-09-15,2022,Lepidoptera
CASENT8539874,B7,CAS_P39,Lepidoptera,Noctuidae,Peridroma,Peridroma saucia,2022-09-26,2022-09-26,2022,Lepidoptera
CASENT8539960,C7,CAS_P39,Lepidoptera,Noctuidae,Lacinipolia,Lacinipolia quadrilineata,2022-09-20,2022-09-20,2022,Lepidoptera
CASENT8539990,D7,CAS_P39,Lepidoptera,Noctuidae,Lacinipolia,Lacinipolia quadrilineata,2022-10-12,2022-10-12,2022,Lepidoptera
CASENT8551397,E7,CAS_P39,Lepidoptera,Noctuidae,Unciella,Unciella primula,2023-03-12,2023-03-12,2023,Lepidoptera
CASENT8551459,F7,CAS_P39,Lepidoptera,Noctuidae,Egira,Egira hiemalis,2023-02-15,2023-02-15,2023,Lepidoptera
CASENT8551014,G7,CAS_P39,Lepidoptera,Noctuidae,Egira,Egira hiemalis,2023-02-15,2023-02-15,2023,Lepidoptera
CASENT8551180,H7,CAS_P39,Lepidoptera,Noctuidae,Egira,Egira hiemalis,2023-02-15,2023-02-15,2023,Lepidoptera
CASENT8551011,A8,CAS_P39,Lepidoptera,Noctuidae,Anarta,NA,2023-03-11,2023-03-11,2023,Lepidoptera
CASENT8551298,B8,CAS_P39,Lepidoptera,Noctuidae,Schinia,Schinia niveicosta,2023-03-12,2023-03-12,2023,Lepidoptera
CASENT8551075,C8,CAS_P39,Lepidoptera,Noctuidae,Schinia,Schinia niveicosta,2023-03-12,2023-03-12,2023,Lepidoptera
CASENT8551380,D8,CAS_P39,Lepidoptera,Noctuidae,Argentostiria,Argentostiria koebelei,2023-03-12,2023-03-12,2023,Lepidoptera
CASENT8551308,E8,CAS_P39,Lepidoptera,Noctuidae,Schinia,Schinia niveicosta,2023-03-12,2023-03-12,2023,Lepidoptera
CASENT8551251,F8,CAS_P39,Lepidoptera,Noctuidae,Unciella,Unciella primula,2023-03-12,2023-03-12,2023,Lepidoptera
CASENT8551572,G8,CAS_P39,Lepidoptera,Noctuidae,Schinia,Schinia deserticola,2023-03-12,2023-03-12,2023,Lepidoptera
CASENT8551009,H8,CAS_P39,Lepidoptera,Noctuidae,Triocnemis,Triocnemis saporis,2023-03-12,2023-03-12,2023,Lepidoptera
CASENT8551234,A9,CAS_P39,Lepidoptera,Noctuidae,Acontia,Acontia cretata,2023-03-12,2023-03-12,2023,Lepidoptera
CASENT8569207,B9,CAS_P39,Lepidoptera,Noctuidae,Schinia,Schinia ligeae,2023-04-27,2023-04-27,2023,Lepidoptera
CASENT8559701,C9,CAS_P39,NA,NA,NA,NA,NA,NA,NA,NA
CASENT8570183,D9,CAS_P39,Lepidoptera,Noctuidae,Trichoplusia,Trichoplusia ni,2023-08-15,2023-08-15,2023,Lepidoptera
CASENT8569391,E9,CAS_P39,Lepidoptera,Noctuidae,Oxycnemis,Oxycnemis fusimacula,2023-04-28,2023-04-28,2023,Lepidoptera
CASENT8569381,F9,CAS_P39,Lepidoptera,Noctuidae,Oxycnemis,Oxycnemis fusimacula,2023-04-28,2023-04-28,2023,Lepidoptera
CASENT8569377,G9,CAS_P39,NA,NA,NA,NA,NA,NA,NA,NA
CASENT8569284,H9,CAS_P39,Lepidoptera,Noctuidae,Pseudobryomima,Pseudobryomima fallax,2023-04-28,2023-04-28,2023,Lepidoptera
CASENT8539181,A10,CAS_P39,NA,NA,NA,NA,NA,NA,NA,NA
CASENT8539166,B10,CAS_P39,Lepidoptera,Noctuidae,Leucania,Leucania farcta,2022-05-13,2022-05-13,2022,Lepidoptera
CASENT8539171,C10,CAS_P39,Lepidoptera,Noctuidae,Zosteropoda,Zosteropoda hirtipes,2022-05-13,2022-05-13,2022,Lepidoptera
CASENT8539174,D10,CAS_P39,Lepidoptera,Noctuidae,Parabagrotis,Parabagrotis cupidissima,2022-05-13,2022-05-13,2022,Lepidoptera
CASENT8539175,E10,CAS_P39,Lepidoptera,Noctuidae,Pseudorthodes,Pseudorthodes puerilis,2022-05-13,2022-05-13,2022,Lepidoptera
CASENT8539153,F10,CAS_P39,Lepidoptera,Noctuidae,Lacinipolia,Lacinipolia patalis,2022-05-13,2022-05-13,2022,Lepidoptera
CASENT8539152,G10,CAS_P39,Lepidoptera,Noctuidae,Lacinipolia,Lacinipolia patalis,2022-05-13,2022-05-13,2022,Lepidoptera
CASENT8551224,H10,CAS_P39,Lepidoptera,Noctuidae,Orthosia,Orthosia behrensiana,2023-02-16,2023-02-16,2023,Lepidoptera
CASENT8551003,A11,CAS_P39,Lepidoptera,Noctuidae,Orthosia,Orthosia behrensiana,2023-02-16,2023-02-16,2023,Lepidoptera
CASENT8551416,B11,CAS_P39,Lepidoptera,Noctuidae,Orthosia,Orthosia behrensiana,2023-02-16,2023-02-16,2023,Lepidoptera
CASENT8551525,C11,CAS_P39,Lepidoptera,Noctuidae,Orthosia,Orthosia behrensiana,2023-02-16,2023-02-16,2023,Lepidoptera
CASENT8551188,D11,CAS_P39,Lepidoptera,Noctuidae,Orthosia,Orthosia mys,2023-02-16,2023-02-16,2023,Lepidoptera
CASENT8551130,E11,CAS_P39,Lepidoptera,Noctuidae,Sympistis,Sympistis perscripta,2023-02-16,2023-02-16,2023,Lepidoptera
CASENT8551097,F11,CAS_P39,NA,NA,NA,NA,NA,NA,NA,NA
CASENT8539913,G11,CAS_P39,Lepidoptera,Noctuidae,Lithophane,Lithophane pertorrida,2023-02-16,2023-02-16,2023,Lepidoptera
CASENT8570447,H11,CAS_P39,NA,NA,NA,NA,NA,NA,NA,NA
CASENT8551191,A12,CAS_P39,Lepidoptera,Noctuidae,Orthosia,Orthosia erythrolita,2023-02-16,2023-02-16,2023,Lepidoptera
CASENT8551405,B12,CAS_P39,Lepidoptera,Noctuidae,Orthosia,Orthosia erythrolita,2023-02-16,2023-02-16,2023,Lepidoptera
CASENT8551183,C12,CAS_P39,Lepidoptera,Noctuidae,Orthosia,Orthosia ferrigera,2023-02-16,2023-02-16,2023,Lepidoptera
CASENT8551481,D12,CAS_P39,Lepidoptera,Noctuidae,Orthosia,Orthosia behrensiana,2023-02-16,2023-02-16,2023,Lepidoptera
CASENT8551452,E12,CAS_P39,Lepidoptera,Noctuidae,Egira,Egira curialis,2023-02-16,2023-02-16,2023,Lepidoptera
CASENT8551455,F12,CAS_P39,Lepidoptera,Noctuidae,Pleromelloida,Pleromelloida conserta,2023-02-16,2023-02-16,2023,Lepidoptera
23U835,A1,CDFA_P13,Coleoptera,Carabidae,Bradycellus,sp.,01.VI.1980,1980-06-01,1980,Coleoptera
23U836,B1,CDFA_P13,Coleoptera,Carabidae,Bradycellus,sp.,01.VI.1980,1980-06-01,1980,Coleoptera
23U837,C1,CDFA_P13,Coleoptera,Dytiscidae,Liodessus,affinis,26.III.1987,1987-03-26,1987,Coleoptera
23U838,D1,CDFA_P13,Coleoptera,Dytiscidae,Bidessus,sp.,25.III.1987,1987-03-25,1987,Coleoptera
23U839,E1,CDFA_P13,Coleoptera,Dytiscidae,Uvarus,subtilis,22.IV.1987,1987-04-22,1987,Coleoptera
23U840,F1,CDFA_P13,Coleoptera,Dytiscidae,Hygrotus,sayi,26.III.1987,1987-03-26,1987,Coleoptera
23U841,G1,CDFA_P13,Coleoptera,Dytiscidae,Hydroporus,sp.,26.III.1987,1987-03-26,1987,Coleoptera
23U842,H1,CDFA_P13,Coleoptera,Dytiscidae,Hydroporus,sp.,02.V.1983,1983-05-02,1983,Coleoptera
23U843,A2,CDFA_P13,Coleoptera,Dytiscidae,Oreodytes,picturatus,28.VIII.1986,1986-08-28,1986,Coleoptera
23U844,B2,CDFA_P13,Coleoptera,Haliplidae,Haliplus,gracilis,25.VIII.1981,1981-08-25,1981,Coleoptera
23U845,C2,CDFA_P13,Coleoptera,Haliplidae,Haliplus,immaculicollis,10.VII.1985,1985-07-10,1985,Coleoptera
23U847,D2,CDFA_P13,Coleoptera,Haliplidae,Peltodytes,callosus,26.III.1987,1987-03-26,1987,Coleoptera
23U848,E2,CDFA_P13,Coleoptera,Haliplidae,Peltodytes,simplex,11.IX.1993,1993-09-11,1993,Coleoptera
23U849,F2,CDFA_P13,Coleoptera,Haliplidae,Apteraliplus,parvulus,25.III.1987,1987-03-25,1987,Coleoptera
23U850,G2,CDFA_P13,Coleoptera,Helophoridae,Helophorus,eclectus,10.VII.1980,1980-07-10,1980,Coleoptera
23U851,H2,CDFA_P13,Coleoptera,Hydrochidae,Hydrochus,sp.,07.VIII.1980,1980-08-07,1980,Coleoptera
23U852,A3,CDFA_P13,Coleoptera,Hydrophilidae,Laccobius,borealis,08.VIII.1981,1981-08-08,1981,Coleoptera
23U853,B3,CDFA_P13,Coleoptera,Hydrophilidae,Laccobius,californicus,03.IV.1981,1981-04-03,1981,Coleoptera
23U854,C3,CDFA_P13,Coleoptera,Hydrophilidae,Laccobius,ellipticus,03.IV.1981,1981-04-03,1981,Coleoptera
23U855,D3,CDFA_P13,Coleoptera,Hydrophilidae,Laccobius,oregonensis,13.I.1981,1981-01-13,1981,Coleoptera
23U856,E3,CDFA_P13,Coleoptera,Hydrophilidae,Paracymus,sp.,07.VIII.1980,1980-08-07,1980,Coleoptera
23U857,F3,CDFA_P13,Coleoptera,Hydrophilidae,Anacaena,sp.,01.VI.1980,1980-06-01,1980,Coleoptera
23U858,G3,CDFA_P13,Coleoptera,Hydrophilidae,Cercyon,fimbriatus,30.V.2016,2016-05-30,2016,Coleoptera
23U859,H3,CDFA_P13,Coleoptera,Hydrophilidae,Cercyon,herceus herceus,24.VIII.1980,1980-08-24,1980,Coleoptera
23U860,A4,CDFA_P13,Coleoptera,Hydrophilidae,Cercyon,praetextatus,12.V.1980,1980-05-12,1980,Coleoptera
23U861,B4,CDFA_P13,Coleoptera,Hydrophilidae,Cercyon,quisquilius,30.V.1981,1981-05-30,1981,Coleoptera
23U862,C4,CDFA_P13,Coleoptera,Hydrophilidae,Megasternum,posticatum,09.II.1982,1982-02-09,1982,Coleoptera
23U863,D4,CDFA_P13,Coleoptera,Georissidae,Georissus,californicus,24.X.1991,1991-10-24,1991,Coleoptera
23U864,E4,CDFA_P13,Coleoptera,Agyrtidae,Ipelates,latus,II.1984,NA,NA,Coleoptera
23U865,F4,CDFA_P13,Coleoptera,Hydraenidae,Neochthebius,vandykei,11.XI.1981,1981-11-11,1981,Coleoptera
23U866,G4,CDFA_P13,Coleoptera,Ptiliidae,Ptenidium,sp.,08.III.1981,1981-03-08,1981,Coleoptera
23U867,H4,CDFA_P13,Coleoptera,Ptiliidae,Ptilium,sp.,08.III.1981,1981-03-08,1981,Coleoptera
23U868,A5,CDFA_P13,Coleoptera,Ptiliidae,Acrotrichis,sp.,08.III.1981,1981-03-08,1981,Coleoptera
23U869,B5,CDFA_P13,Coleoptera,Leiodidae,Colon,sp.,31.VI.1985,NA,NA,Coleoptera
23U870,C5,CDFA_P13,Coleoptera,Leiodidae,Leiodes,sp.,22.VI.1994,1994-06-22,1994,Coleoptera
23U871,D5,CDFA_P13,Coleoptera,Leiodidae,Agathidium,angulare,27.II.1986,1986-02-27,1986,Coleoptera
23U873,E5,CDFA_P13,Coleoptera,Leiodidae,Agathidium,concinnum,28.IV.1992,1992-04-28,1992,Coleoptera
23U874,F5,CDFA_P13,Coleoptera,Leiodidae,Agathidium,depressum,05.IV.1982,1982-04-05,1982,Coleoptera
23U876,G5,CDFA_P13,Coleoptera,Leiodidae,Agathidium,estriatum,17.VI.1988,1988-06-17,1988,Coleoptera
23U877,H5,CDFA_P13,Coleoptera,Leiodidae,Agathidium,exiguum,20.VII.1983,1983-07-20,1983,Coleoptera
23U878,A6,CDFA_P13,Coleoptera,Leiodidae,Agathidium,pulchrum,18.IV.1986,1986-04-18,1986,Coleoptera
23U880,B6,CDFA_P13,Coleoptera,Leiodidae,Agathidium,virile,21.II.1989,1989-02-21,1989,Coleoptera
23U881,C6,CDFA_P13,Coleoptera,Leiodidae,Anisotoma,errans,20.VII.1983,1983-07-20,1983,Coleoptera
23U882,D6,CDFA_P13,Coleoptera,Leiodidae,Anisotoma,nevadensis,01.VII.1985,1985-07-01,1985,Coleoptera
23U883,E6,CDFA_P13,Coleoptera,Leiodidae,Hydnobius,longidens,13.VII.1987,1987-07-13,1987,Coleoptera
23U884,F6,CDFA_P13,Coleoptera,Leiodidae,Kalohydnobius,strigilatus,30.V.2000,2000-05-30,2000,Coleoptera
23U885,G6,CDFA_P13,Coleoptera,Leiodidae,Triarthron,lecontei,01.VII.1987,1987-07-01,1987,Coleoptera
23U886,H6,CDFA_P13,Coleoptera,Leiodidae,Nemadus,decipiens,02.V.1990,1990-05-02,1990,Coleoptera
23U887,A7,CDFA_P13,Coleoptera,Leiodidae,Nemadus,pusio,25.II.1992,1992-02-25,1992,Coleoptera
23U888,B7,CDFA_P13,Coleoptera,Leiodidae,Dissochaetus,sp.,15.VI.1982,1982-06-15,1982,Coleoptera
23U889,C7,CDFA_P13,Coleoptera,Leiodidae,Catops,basilaris,19.VIII.1981,1981-08-19,1981,Coleoptera
23U890,D7,CDFA_P13,Coleoptera,Leiodidae,Catops,basilaris,15.X.1984,1984-10-15,1984,Coleoptera
23U891,E7,CDFA_P13,Coleoptera,Leiodidae,Ptomaphagus,californicus,14.III.1985,1985-03-14,1985,Coleoptera
23U892,F7,CDFA_P13,Coleoptera,Leiodidae,Ptomaphagus,californicus,30.V.2000,2000-05-30,2000,Coleoptera
23U893,G7,CDFA_P13,Coleoptera,Leiodidae,Ptomaphagus,fisus,VIII.1989,NA,NA,Coleoptera
23U894,H7,CDFA_P13,Coleoptera,Leiodidae,Ptomaphagus,fisus,01.IV.1994,1994-04-01,1994,Coleoptera
23U895,A8,CDFA_P13,Coleoptera,Leiodidae,Ptomaphagus,inyoensis,01.IX.1992,1992-09-01,1992,Coleoptera
23U896,B8,CDFA_P13,Coleoptera,Leiodidae,Ptomaphagus,nevadicus,27.X.1987,1987-10-27,1987,Coleoptera
23U897,C8,CDFA_P13,Coleoptera,Leiodidae,Platypsyllus,castoris,24.VI.1988,1988-06-24,1988,Coleoptera
23U898,D8,CDFA_P13,Coleoptera,Leiodidae,Pinodytes,delnorte,27.XI.1985,1985-11-27,1985,Coleoptera
23U899,E8,CDFA_P13,Coleoptera,Leiodidae,Pinodytes,humboldtensis,16.X.1985,1985-10-16,1985,Coleoptera
23U900,F8,CDFA_P13,Coleoptera,Leiodidae,Pinodytes,pusio,15.XI.1984,1984-11-15,1984,Coleoptera
23U901,G8,CDFA_P13,Coleoptera,Leiodidae,Pinodytes,tehama,04.I.1984,1984-01-04,1984,Coleoptera
23U902,H8,CDFA_P13,Coleoptera,Staphylinidae,Eutheia,sp.,23.II.1984,1984-02-23,1984,Coleoptera
23U903,A9,CDFA_P13,Coleoptera,Staphylinidae,Veraphis,sp.,17.VI.1988,1988-06-17,1988,Coleoptera
23U904,B9,CDFA_P13,Coleoptera,Staphylinidae,Catalinus,sp.,15.II.1983,1983-02-15,1983,Coleoptera
23U905,C9,CDFA_P13,Coleoptera,Staphylinidae,Euconnus,sp.,25.II.1987,1987-02-25,1987,Coleoptera
23U906,D9,CDFA_P13,Coleoptera,Staphylinidae,Lophioderus,arcifer,27.XI.1985,1985-11-27,1985,Coleoptera
23U907,E9,CDFA_P13,Coleoptera,Staphylinidae,Lophioderus,humboldt,09.I.1980,1980-01-09,1980,Coleoptera
23U908,F9,CDFA_P13,Coleoptera,Staphylinidae,Lophioderus,similis,22.V.1980,1980-05-22,1980,Coleoptera
23U909,G9,CDFA_P13,Coleoptera,Staphylinidae,Stenichnus,sp.,29.IX.1992,1992-09-29,1992,Coleoptera
23U910,H9,CDFA_P13,Coleoptera,Staphylinidae,Papusus,sp.,12.V.2023,2023-05-12,2023,Coleoptera
23U911,A10,CDFA_P13,Coleoptera,Staphylinidae,Trigonurus,sp.,21.II.1989,1989-02-21,1989,Coleoptera
23U912,B10,CDFA_P13,Coleoptera,Staphylinidae,Trigonurus,sp.,19.VI.1984,1984-06-19,1984,Coleoptera
23U913,C10,CDFA_P13,Coleoptera,Staphylinidae,Micropeplus,neotomae,15.IV.1981,1981-04-15,1981,Coleoptera
23U914,D10,CDFA_P13,Coleoptera,Staphylinidae,Micropeplus,punctatus,24.V.2020,2020-05-24,2020,Coleoptera
23U915,E10,CDFA_P13,Coleoptera,Staphylinidae,Micropeplus,punctatus,04.IX.2021,2021-09-04,2021,Coleoptera
23U916,F10,CDFA_P13,Coleoptera,Staphylinidae,Pseudopsis,montoraria,15.XI.1981,1981-11-15,1981,Coleoptera
23U917,G10,CDFA_P13,Coleoptera,Staphylinidae,Zalobius,spinicollis,31.VII.1980,1980-07-31,1980,Coleoptera
23U918,H10,CDFA_P13,Coleoptera,Staphylinidae,Nanobius,serricollis,12.III.1981,1981-03-12,1981,Coleoptera
23U919,A11,CDFA_P13,Coleoptera,Staphylinidae,Proteinus,sp.,28.II.1985,1985-02-28,1985,Coleoptera
23U920,B11,CDFA_P13,Coleoptera,Staphylinidae,Carpelimus,sp.,12.V.1997,1997-05-12,1997,Coleoptera
23U921,C11,CDFA_P13,Coleoptera,Staphylinidae,Apocellus,sp.,01.III.1981,1981-03-01,1981,Coleoptera
23U922,D11,CDFA_P13,Coleoptera,Staphylinidae,Aploderus,sp.,03.IV.1981,1981-04-03,1981,Coleoptera
23U923,E11,CDFA_P13,Coleoptera,Staphylinidae,Anotylus,sp.,07.I.1986,1986-01-07,1986,Coleoptera
23U925,F11,CDFA_P13,Coleoptera,Staphylinidae,Bledius,sp.,12.XI.1981,1981-11-12,1981,Coleoptera
23U926,G11,CDFA_P13,Coleoptera,Staphylinidae,Acrolocha,sp.,07.I.1986,1986-01-07,1986,Coleoptera
23U927,H11,CDFA_P13,Coleoptera,Staphylinidae,Dropephylla,cacti,28.VI.1986,1986-06-28,1986,Coleoptera
23U928,A12,CDFA_P13,Coleoptera,Staphylinidae,Hapalaraea,megarthroides,04.V.1989,1989-05-04,1989,Coleoptera
23U929,B12,CDFA_P13,Coleoptera,Staphylinidae,Phloeonomus,sp.,25.V.1989,1989-05-25,1989,Coleoptera
23U930,C12,CDFA_P13,Coleoptera,Staphylinidae,Phyllodrepa,sp.,20.XII.1982,1982-12-20,1982,Coleoptera
23U931,D12,CDFA_P13,Coleoptera,Staphylinidae,Omalium,algarum,10.II.1982,1982-02-10,1982,Coleoptera
23U932,E12,CDFA_P13,Coleoptera,Staphylinidae,Omalium,plagiatum,13.III.1985,1985-03-13,1985,Coleoptera
23U933,F12,CDFA_P13,Coleoptera,Staphylinidae,Paraphloeostiba,gayndahensis,08.I.2002,2002-01-08,2002,Coleoptera
23U954,A1,CDFA_P14,Diptera (Brachycera),Clusiidae,Clusia,occidentalis,11.VI.2007,2007-06-11,2007,Diptera
23U955,B1,CDFA_P14,Diptera (Brachycera),Canacidae,Pelomyia,coronata,20.X.1988,1988-10-20,1988,Diptera
23U956,C1,CDFA_P14,Diptera (Brachycera),Canacidae,Pelomyia,coronata,20.X.1988,1988-10-20,1988,Diptera
23U957,D1,CDFA_P14,Diptera (Brachycera),Canacidae,Pelomyia,occidentalis,25.IV.2002,2002-04-25,2002,Diptera
23U958,E1,CDFA_P14,Diptera (Brachycera),Canacidae,Tethina,spinulosa,15.VI.2003,2003-06-15,2003,Diptera
23U959,F1,CDFA_P14,Diptera (Brachycera),Canacidae,Tethina,spinulosa,15.VI.2003,2003-06-15,2003,Diptera
23U960,G1,CDFA_P14,Diptera (Brachycera),Drosophilidae,Amiota,picta,24.V.2009,2009-05-24,2009,Diptera
23U961,H1,CDFA_P14,Diptera (Brachycera),Drosophilidae,Amiota,picta,24.V.2009,2009-05-24,2009,Diptera
23U972,A2,CDFA_P14,Diptera (Brachycera),Drosophilidae,Gitona,americana,2.XI.1981,1981-11-02,1981,Diptera
23U975,B2,CDFA_P14,Diptera (Brachycera),Drosophilidae,Gitona,americana,2.XI.1981,1981-11-02,1981,Diptera
23U978,C2,CDFA_P14,Diptera (Brachycera),Drosophilidae,Drosophila,azteca,8.XI.2010,2010-11-08,2010,Diptera
23U979,D2,CDFA_P14,Diptera (Brachycera),Drosophilidae,Drosophila,azteca,8.XI.2010,2010-11-08,2010,Diptera
23U982,E2,CDFA_P14,Diptera (Brachycera),Drosophilidae,Drosophila,busckii,29.X.1996,1996-10-29,1996,Diptera
23U984,F2,CDFA_P14,Diptera (Brachycera),Drosophilidae,Drosophila,busckii,29.X.1996,1996-10-29,1996,Diptera
23U985,G2,CDFA_P14,Diptera (Brachycera),Drosophilidae,Drosophila,busckii,23.I.1998,1998-01-23,1998,Diptera
23U986,H2,CDFA_P14,Diptera (Brachycera),Drosophilidae,Drosophila,hydei,13.X.1987,1987-10-13,1987,Diptera
23U989,A3,CDFA_P14,Diptera (Brachycera),Drosophilidae,Drosophila,hydei,13.X.1987,1987-10-13,1987,Diptera
23U990,B3,CDFA_P14,Diptera (Brachycera),Drosophilidae,Drosophila,hydei,13.X.1987,1987-10-13,1987,Diptera
23U992,C3,CDFA_P14,Diptera (Brachycera),Drosophilidae,Drosophila,pseudoobscura,8.XI.2010,2010-11-08,2010,Diptera
23U993,D3,CDFA_P14,Diptera (Brachycera),Drosophilidae,Drosophila,pseudoobscura,8.XI.2010,2010-11-08,2010,Diptera
23U994,E3,CDFA_P14,Diptera (Brachycera),Drosophilidae,Drosophila,simulans,5.X.2009,2009-10-05,2009,Diptera
23U997,F3,CDFA_P14,Diptera (Brachycera),Drosophilidae,Drosophila,simulans,5.X.2009,2009-10-05,2009,Diptera
23U998,G3,CDFA_P14,Diptera (Brachycera),Drosophilidae,Drosophila,simulans,5.X.2009,2009-10-05,2009,Diptera
23U999,H3,CDFA_P14,Diptera (Brachycera),Drosophilidae,Drosophila,suzukii,2.XI.2009,2009-11-02,2009,Diptera
23U1000,A4,CDFA_P14,Diptera (Brachycera),Drosophilidae,Drosophila,suzukii,2.XI.2009,2009-11-02,2009,Diptera
23U1001,B4,CDFA_P14,Diptera (Brachycera),Drosophilidae,Drosophila,suzukii,2.XI.2009,2009-11-02,2009,Diptera
23U1002,C4,CDFA_P14,Diptera (Brachycera),Milichiidae,Milichiella,lacteipennis,9.IX.1999,1999-09-09,1999,Diptera
23U1003,D4,CDFA_P14,Diptera (Brachycera),Milichiidae,Milichiella,lacteipennis,9.IX.1999,1999-09-09,1999,Diptera
23U1004,E4,CDFA_P14,Diptera (Brachycera),Milichiidae,Milichiella,lacteipennis,9.IX.1999,1999-09-09,1999,Diptera
23U1005,F4,CDFA_P14,Diptera (Brachycera),Ephrydidae,Mosillus,bidentatus,28.IX.2004,2004-09-28,2004,NA
23U1006,G4,CDFA_P14,Diptera (Brachycera),Ephrydidae,Mosillus,bidentatus,28.IX.2004,2004-09-28,2004,NA
23U1007,H4,CDFA_P14,Diptera (Brachycera),Ephrydidae,Mosillus,bidentatus,28.IX.2004,2004-09-28,2004,NA
23U1008,A5,CDFA_P14,Diptera (Brachycera),Ephrydidae,Scatella,sp.,14.V.2012,2012-05-14,2012,NA
23U1009,B5,CDFA_P14,Diptera (Brachycera),Ephrydidae,Scatella,sp.,14.V.2012,2012-05-14,2012,NA
23U1010,C5,CDFA_P14,Diptera (Brachycera),Ephrydidae,Scatella,sp.,14.V.2012,2012-05-14,2012,NA
23U1011,D5,CDFA_P14,Diptera (Brachycera),Chyromyidae,Chyromya,feromella,10.IV.2003,2003-04-10,2003,Diptera
23U1012,E5,CDFA_P14,Diptera (Brachycera),Chyromyidae,Chyromya,feromella,10.IV.2003,2003-04-10,2003,Diptera
23U1013,F5,CDFA_P14,Diptera (Brachycera),Heleomyzidae,Tephrochlamys,rufiventris,8.IV.2011,2011-04-08,2011,Diptera
23U1014,G5,CDFA_P14,Diptera (Brachycera),Heleomyzidae,Tephrochlamys,NA,13.V.2013,2013-05-13,2013,Diptera
23U1015,H5,CDFA_P14,Diptera (Brachycera),Heleomyzidae,Tephrochlamys,NA,13.V.2013,2013-05-13,2013,Diptera
23U1016,A6,CDFA_P14,Diptera (Brachycera),Heleomyzidae,Suillia,NA,3.VII.2006,2006-07-03,2006,Diptera
23U1017,B6,CDFA_P14,Diptera (Brachycera),Heleomyzidae,Suillia,NA,2.VI.2007,2007-06-02,2007,Diptera
23U1018,C6,CDFA_P14,Diptera (Brachycera),Sphaeroceridae,Leptocera,acutangula,21.VII.1980,1980-07-21,1980,Diptera
23U1019,D6,CDFA_P14,Diptera (Brachycera),Sphaeroceridae,Leptocera,acutangula,21.VII.1980,1980-07-21,1980,Diptera
23U1020,E6,CDFA_P14,Diptera (Brachycera),Sphaeroceridae,Leptocera,acutangula,21.VII.1980,1980-07-21,1980,Diptera
23U1021,F6,CDFA_P14,Diptera (Brachycera),Sphaeroceridae,Coproica,ferruginata,7.IV.1989,1989-04-07,1989,Diptera
23U1022,G6,CDFA_P14,Diptera (Brachycera),Sphaeroceridae,Coproica,ferruginata,7.IV.1989,1989-04-07,1989,Diptera
23U1023,H6,CDFA_P14,Diptera (Brachycera),Sphaeroceridae,Coproica,ferruginata,7.IV.1989,1989-04-07,1989,Diptera
23U1024,A7,CDFA_P14,Diptera (Brachycera),Sphaeroceridae,Lotophila,atra,21.I.1980,1980-01-21,1980,Diptera
23U1025,B7,CDFA_P14,Diptera (Brachycera),Sphaeroceridae,Lotophila,atra,21.I.1980,1980-01-21,1980,Diptera
23U1026,C7,CDFA_P14,Diptera (Brachycera),Sphaeroceridae,Lotophila,atra,21.I.1980,1980-01-21,1980,Diptera
23U1027,D7,CDFA_P14,Diptera (Brachycera),Sphaeroceridae,Leptocera,caenosa,15.II.1990,1990-02-15,1990,Diptera
23U1028,E7,CDFA_P14,Diptera (Brachycera),Sphaeroceridae,Leptocera,fontinalis,19.IX.2008,2008-09-19,2008,Diptera
23U1029,F7,CDFA_P14,Diptera (Brachycera),Sphaeroceridae,Leptocera,NA,22.II.2009,2009-02-22,2009,Diptera
23U1030,G7,CDFA_P14,Diptera (Brachycera),Sphaeroceridae,Leptocera,NA,22.II.2009,2009-02-22,2009,Diptera
23U1031,H7,CDFA_P14,Diptera (Brachycera),Sphaeroceridae,Leptocera,NA,22.II.2009,2009-02-22,2009,Diptera
23U1032,A8,CDFA_P14,Diptera (Brachycera),Sphaeroceridae,Thoracochaeta,arnaudi,11.X.1981,1981-10-11,1981,Diptera
23U1033,B8,CDFA_P14,Diptera (Brachycera),Sphaeroceridae,Thoracochaeta,arnaudi,11.X.1981,1981-10-11,1981,Diptera
23U1034,C8,CDFA_P14,Diptera (Brachycera),Sphaeroceridae,Thoracochaeta,johnsoni,18.II.2007,2007-02-18,2007,Diptera
23U1035,D8,CDFA_P14,Diptera (Brachycera),Sphaeroceridae,Thoracochaeta,johnsoni,11.X.1981,1981-10-11,1981,Diptera
23U1036,E8,CDFA_P14,Diptera (Brachycera),Sphaeroceridae,Thoracochaeta,johnsoni,11.X.1981,1981-10-11,1981,Diptera
23U1037,F8,CDFA_P14,Diptera (Brachycera),Hippoboscidae,Stilbometopa,NA,19.XII.2006,2006-12-19,2006,Diptera
23U1038,G8,CDFA_P14,Diptera (Brachycera),Hippoboscidae,Pseudolynchia,canariensis,13.IX.2004,2004-09-13,2004,Diptera
23U1039,H8,CDFA_P14,Diptera (Brachycera),Hippoboscidae,Pseudolynchia,canariensis,II.2003,NA,NA,Diptera
23U1040,A9,CDFA_P14,Diptera (Brachycera),Hippoboscidae,Lipoptena,depressa,30.VI.1994,1994-06-30,1994,Diptera
23U1041,B9,CDFA_P14,Diptera (Brachycera),Hippoboscidae,Lipoptena,depressa,30.VI.1994,1994-06-30,1994,Diptera
23U1042,C9,CDFA_P14,Diptera (Brachycera),Hippoboscidae,Lipoptena,depressa,30.VI.1994,1994-06-30,1994,Diptera
23U1043,D9,CDFA_P14,Diptera (Brachycera),Anthomyiidae,Fucellia,rufitibia,15.VI.2003,2003-06-15,2003,Diptera
23U1044,E9,CDFA_P14,Diptera (Brachycera),Anthomyiidae,Fucellia,rufitibia,15.VI.2003,2003-06-15,2003,Diptera
23U1045,F9,CDFA_P14,Diptera (Brachycera),Anthomyiidae,Fucellia,rufitibia,15.VI.2003,2003-06-15,2003,Diptera
23U1046,G9,CDFA_P14,Diptera (Brachycera),Anthomyiidae,Fucellia,thinobia,19.IX.2007,2007-09-19,2007,Diptera
23U1047,H9,CDFA_P14,Diptera (Brachycera),Anthomyiidae,Fucellia,thinobia,19.IX.2007,2007-09-19,2007,Diptera
23U1048,A10,CDFA_P14,Diptera (Brachycera),Anthomyiidae,Fucellia,thinobia,19.IX.2007,2007-09-19,2007,Diptera
23U1049,B10,CDFA_P14,Diptera (Brachycera),Anthomyiidae,Delia,antiqua,4.VIII.1981,1981-08-04,1981,Diptera
23U1050,C10,CDFA_P14,Diptera (Brachycera),Anthomyiidae,Delia,antiqua,4.VIII.1981,1981-08-04,1981,Diptera
23U1051,D10,CDFA_P14,Diptera (Brachycera),Anthomyiidae,Anthomyia,oculifera,10.III.2005,2005-03-10,2005,Diptera
23U1052,E10,CDFA_P14,Diptera (Brachycera),Anthomyiidae,Anthomyia,oculifera,10.III.2005,2005-03-10,2005,Diptera
23U1053,F10,CDFA_P14,Diptera (Brachycera),Fanniidae,Fannia,cf. benjamini,12.XI.1986,1986-11-12,1986,Diptera
23U1054,G10,CDFA_P14,Diptera (Brachycera),Fanniidae,Fannia,cf. benjamini,12.XI.1986,1986-11-12,1986,Diptera
23U1055,H10,CDFA_P14,Diptera (Brachycera),Fanniidae,Fannia,cf. benjamini,12.XI.1986,1986-11-12,1986,Diptera
23U1056,A11,CDFA_P14,Diptera (Brachycera),Fanniidae,Fannia,conspicua,12.VIII.1998,1998-08-12,1998,Diptera
23U1057,B11,CDFA_P14,Diptera (Brachycera),Fanniidae,Fannia,conspicua,12.VIII.1998,1998-08-12,1998,Diptera
23U1058,C11,CDFA_P14,Diptera (Brachycera),Muscidae,Musca,autumnalis,30.XI.2009,2009-11-30,2009,Diptera
23U1059,D11,CDFA_P14,Diptera (Brachycera),Muscidae,Musca,autumnalis,2009,NA,NA,Diptera
23U1060,E11,CDFA_P14,Diptera (Brachycera),Muscidae,Stomoxys,calcitrans,9.IX.2013,2013-09-09,2013,Diptera
23U1061,F11,CDFA_P14,Diptera (Brachycera),Muscidae,Stomoxys,calcitrans,9.IX.2013,2013-09-09,2013,Diptera
23U1062,G11,CDFA_P14,Diptera (Brachycera),Muscidae,Coenosia,humilis,26.IX.1988,1988-09-26,1988,Diptera
23U1063,H11,CDFA_P14,Diptera (Brachycera),Muscidae,Coenosia,humilis,18.XI.2003,2003-11-18,2003,Diptera
23U1064,A12,CDFA_P14,Diptera (Brachycera),Muscidae,Coenosia,tigrina,18.XI.2003,2003-11-18,2003,Diptera
23U1065,B12,CDFA_P14,Diptera (Brachycera),Muscidae,Schoenomyza,dorsalis,2.VII.2002,2002-07-02,2002,Diptera
23U1066,C12,CDFA_P14,Diptera (Brachycera),Scathophagidae,Scathophaga,stercoraria,25.IV.2002,2002-04-25,2002,Diptera
23U1067,D12,CDFA_P14,Diptera (Brachycera),Scathophagidae,Scathophaga,stercoraria,25.IV.2002,2002-04-25,2002,Diptera
23U1068,E12,CDFA_P14,Diptera (Brachycera),Scathophagidae,Scathophaga,stercoraria,25.IV.2002,2002-04-25,2002,Diptera
23U1069,F12,CDFA_P14,Diptera (Brachycera),Calliphoridae,Chrysomya,megacephala,8.VIII.1988,1988-08-08,1988,Diptera
23U581,A1,CDFA_P11,Diptera (Brachycera),Tephritidae,Terellia,fuscicornis,13.VIII.2007,2007-08-13,2007,Diptera
23U582,B1,CDFA_P11,Diptera (Brachycera),Tephritidae,Terellia,fuscicornis,22.VIII.2000,2000-08-22,2000,Diptera
23U583,C1,CDFA_P11,Diptera (Brachycera),Tephritidae,Terellia,fuscicornis,24.VIII.2009,2009-08-24,2009,Diptera
23U585,D1,CDFA_P11,Diptera (Brachycera),Tephritidae,Terellia,occidentalis,4.VIII.1997,1997-08-04,1997,Diptera
23U587,E1,CDFA_P11,Diptera (Brachycera),Tephritidae,Terellia,occidentalis,12.VI.2000,2000-06-12,2000,Diptera
23U589,F1,CDFA_P11,Diptera (Brachycera),Tephritidae,Terellia,occidentalis,16.VII.1999,1999-07-16,1999,Diptera
23U590,G1,CDFA_P11,Diptera (Brachycera),Tephritidae,Tomoplagia,cressoni,8.VII.2003,2003-07-08,2003,Diptera
23U591,H1,CDFA_P11,Diptera (Brachycera),Tephritidae,Tomoplagia,cressoni,13.VI.2003,2003-06-13,2003,Diptera
23U592,A2,CDFA_P11,Diptera (Brachycera),Tephritidae,Tomoplagia,cressoni,9.V.2006,2006-05-09,2006,Diptera
23U593,B2,CDFA_P11,Diptera (Brachycera),Tephritidae,Trupanea,bisetosa,24.IV.1985,1985-04-24,1985,Diptera
23U594,C2,CDFA_P11,Diptera (Brachycera),Tephritidae,Trupanea,bisetosa,24.IV.1985,1985-04-24,1985,Diptera
23U595,D2,CDFA_P11,Diptera (Brachycera),Tephritidae,Trupanea,bisetosa,20.VIII.2019,2019-08-20,2019,Diptera
23U596,E2,CDFA_P11,Diptera (Brachycera),Tephritidae,Trupanea,californica,18.IX.2003,2003-09-18,2003,Diptera
23U597,F2,CDFA_P11,Diptera (Brachycera),Tephritidae,Trupanea,conjuncta,02.XII.2009,2009-12-02,2009,Diptera
23U598,G2,CDFA_P11,Diptera (Brachycera),Tephritidae,Trupanea,femoralis,07.VII.2022,2022-07-07,2022,Diptera
23U599,H2,CDFA_P11,Diptera (Brachycera),Tephritidae,Trupanea,imperfecta,24.V.2009,2009-05-24,2009,Diptera
23U600,A3,CDFA_P11,Diptera (Brachycera),Tephritidae,Trupanea,imperfecta,19.IV.2003,2003-04-19,2003,Diptera
23U601,B3,CDFA_P11,Diptera (Brachycera),Tephritidae,Trupanea,imperfecta,23-24.VII.2017,NA,NA,Diptera
23U602,C3,CDFA_P11,Diptera (Brachycera),Tephritidae,Trupanea,jonesi,21.VI.2007,2007-06-21,2007,Diptera
23U603,D3,CDFA_P11,Diptera (Brachycera),Tephritidae,Trupanea,jonesi,29.VI.2016,2016-06-29,2016,Diptera
23U604,E3,CDFA_P11,Diptera (Brachycera),Tephritidae,Trupanea,nigricornis,8.V.2019,2019-05-08,2019,Diptera
23U605,F3,CDFA_P11,Diptera (Brachycera),Tephritidae,Trupanea,nigricornis,8.V.2019,2019-05-08,2019,Diptera
23U606,G3,CDFA_P11,Diptera (Brachycera),Tephritidae,Trupanea,pseudovicina,23.XI.1991,1991-11-23,1991,Diptera
23U607,H3,CDFA_P11,Diptera (Brachycera),Tephritidae,Trupanea,pseudovicina,1.VI.2003,2003-06-01,2003,Diptera
23U608,A4,CDFA_P11,Diptera (Brachycera),Tephritidae,Trupanea,radifera,18.IV.2003,2003-04-18,2003,Diptera
23U609,B4,CDFA_P11,Diptera (Brachycera),Tephritidae,Trupanea,radifera,18.IV.2003,2003-04-18,2003,Diptera
23U610,C4,CDFA_P11,Diptera (Brachycera),Tephritidae,Trupanea,signata,30.VI.2016,2016-06-30,2016,Diptera
23U611,D4,CDFA_P11,Diptera (Brachycera),Tephritidae,Trupanea,signata,20.V.2003,2003-05-20,2003,Diptera
23U612,E4,CDFA_P11,Diptera (Brachycera),Tephritidae,Trupanea,signata,8.X.1988,1988-10-08,1988,Diptera
23U613,F4,CDFA_P11,Diptera (Brachycera),Tephritidae,Trupanea,vicina,27.X.2017,2017-10-27,2017,Diptera
23U614,G4,CDFA_P11,Diptera (Brachycera),Tephritidae,Trupanea,vicina,22.IX.2008,2008-09-22,2008,Diptera
23U615,H4,CDFA_P11,Diptera (Brachycera),Tephritidae,Trupanea,vicina,10.I.2013,2013-01-10,2013,Diptera
23U616,A5,CDFA_P11,Diptera (Brachycera),Tephritidae,Trupanea,wheeleri,27.VI.2003,2003-06-27,2003,Diptera
23U617,B5,CDFA_P11,Diptera (Brachycera),Tephritidae,Trupanea,wheeleri,22.VII.2003,2003-07-22,2003,Diptera
23U618,C5,CDFA_P11,Diptera (Brachycera),Tephritidae,Trupanea,wheeleri,2.VII.2002,2002-07-02,2002,Diptera
23U619,D5,CDFA_P11,Diptera (Brachycera),Tephritidae,Trupanea,sp.,2.IV.1993,1993-04-02,1993,Diptera
23U620,E5,CDFA_P11,Diptera (Brachycera),Tephritidae,Urophora,quadrifasciata,19.VII.1996,1996-07-19,1996,Diptera
23U621,F5,CDFA_P11,Diptera (Brachycera),Tephritidae,Urophora,quadrifasciata,18.VII.1986,1986-07-18,1986,Diptera
23U622,G5,CDFA_P11,Diptera (Brachycera),Tephritidae,Chetostoma,californicum,14.X.2021,2021-10-14,2021,Diptera
23U623,H5,CDFA_P11,Diptera (Brachycera),Tephritidae,Chetostoma,californicum,13.IX.1993,1993-09-13,1993,Diptera
23U624,A6,CDFA_P11,Diptera (Brachycera),Tephritidae,Trupanea,sp.,17.VIII.1983,1983-08-17,1983,Diptera
23U625,B6,CDFA_P11,Diptera (Brachycera),Tephritidae,Trupanea,sp.,22.IX.2008,2008-09-22,2008,Diptera
23U626,C6,CDFA_P11,Diptera (Brachycera),Tephritidae,Trupanea,sp.,1.V.2008,2008-05-01,2008,Diptera
23U627,D6,CDFA_P11,Diptera (Brachycera),Tephritidae,Urophora,quadrifasciata,19.VII.1996,1996-07-19,1996,Diptera
23U628,E6,CDFA_P11,Diptera (Brachycera),Tephritidae,Urophora,stylata,VI.2000,NA,NA,Diptera
23U629,F6,CDFA_P11,Diptera (Brachycera),Tephritidae,Urophora,stylata,VI.2000,NA,NA,Diptera
23U630,G6,CDFA_P11,Diptera (Brachycera),Tephritidae,Urophora,stylata,VI.2000,NA,NA,Diptera
23U631,H6,CDFA_P11,Diptera (Brachycera),Tephritidae,Euleia,fratria,17.VII.2009,2009-07-17,2009,Diptera
23U632,A7,CDFA_P11,Diptera (Brachycera),Tephritidae,Chetostoma,californicum,15.VI.2016,2016-06-15,2016,Diptera
23U633,B7,CDFA_P11,Diptera (Brachycera),Tephritidae,Valentibulla,californica,19.V.1981,1981-05-19,1981,Diptera
23U634,C7,CDFA_P11,Diptera (Brachycera),Tephritidae,Valentibulla,californica,19.V.1981,1981-05-19,1981,Diptera
23U635,D7,CDFA_P11,Diptera (Brachycera),Tephritidae,Valentibulla,californica,19.V.1981,1981-05-19,1981,Diptera
23U636,E7,CDFA_P11,Diptera (Brachycera),Tephritidae,Euphranta,canadensis,23.II.2021,2021-02-23,2021,Diptera
23U637,F7,CDFA_P11,Diptera (Brachycera),Tephritidae,Rhagoletis,basiola,27.VIII.2005,2005-08-27,2005,Diptera
23U639,G7,CDFA_P11,Diptera (Brachycera),Tephritidae,Rhagoletis,basiola,31.VII.2012,2012-07-31,2012,Diptera
23U640,H7,CDFA_P11,Diptera (Brachycera),Tephritidae,Rhagoletis,basiola,22.VI.2009,2009-06-22,2009,Diptera
23U641,A8,CDFA_P11,Diptera (Brachycera),Tephritidae,Euleia,fratria,18.V.1987,1987-05-18,1987,Diptera
23U642,B8,CDFA_P11,Diptera (Brachycera),Tephritidae,Euleia,fratria,27.VI.1998,1998-06-27,1998,Diptera
23U643,C8,CDFA_P11,Diptera (Brachycera),Tephritidae,Euleia,fratria,06.VII.2017,2017-07-06,2017,Diptera
23U644,D8,CDFA_P11,Diptera (Brachycera),Tephritidae,Euphranta,canadensis,23.II.2021,2021-02-23,2021,Diptera
23U645,E8,CDFA_P11,Diptera (Brachycera),Tephritidae,Rhagoletis,completa,29.IX.2003,2003-09-29,2003,Diptera
23U646,F8,CDFA_P11,Diptera (Brachycera),Tephritidae,Rhagoletis,pomonella,30.IX.2009,2009-09-30,2009,Diptera
23U647,G8,CDFA_P11,Diptera (Brachycera),Tephritidae,Rhagoletis,pomonella,8.IX.2009,2009-09-08,2009,Diptera
23U648,H8,CDFA_P11,Diptera (Brachycera),Tephritidae,Rhagoletis,pomonella,31.VIII.2010,2010-08-31,2010,Diptera
23U649,A9,CDFA_P11,Diptera (Brachycera),Tephritidae,Rhagoletis,berberis,11.VII.1983,1983-07-11,1983,Diptera
23U650,B9,CDFA_P11,Diptera (Brachycera),Tephritidae,Rhagoletis,berberis,25.VII.1984,1984-07-25,1984,Diptera
23U651,C9,CDFA_P11,Diptera (Brachycera),Tephritidae,Rhagoletis,completa,11.VIII.2009,2009-08-11,2009,Diptera
23U652,D9,CDFA_P11,Diptera (Brachycera),Tephritidae,Rhagoletis,completa,11.VIII.2009,2009-08-11,2009,Diptera
23U653,E9,CDFA_P11,Diptera (Brachycera),Agromyzidae,Phytomyza,syngenesiae,24.I.2001,2001-01-24,2001,Diptera
23U654,F9,CDFA_P11,Diptera (Brachycera),Agromyzidae,Liriomyza,nr genalis,23.IV.1997,1997-04-23,1997,Diptera
23U655,G9,CDFA_P11,Diptera (Brachycera),Agromyzidae,Liriomyza,nr genalis,23.IV.1997,1997-04-23,1997,Diptera
23U656,H9,CDFA_P11,Diptera (Brachycera),Agromyzidae,Liriomyza,nr genalis,23.IV.1997,1997-04-23,1997,Diptera
23U657,A10,CDFA_P11,Diptera (Brachycera),Tephritidae,Rhagoletis,zephyria,24.VII.2008,2008-07-24,2008,Diptera
23U658,B10,CDFA_P11,Diptera (Brachycera),Tephritidae,Rhagoletis,zephyria,4.IX.1987,1987-09-04,1987,Diptera
23U659,C10,CDFA_P11,Diptera (Brachycera),Tephritidae,Rhagoletis,zephyria,4.IX.1987,1987-09-04,1987,Diptera
23U660,D10,CDFA_P11,Diptera (Brachycera),Agromyzidae,Phytomyza,syngenesiae,24.I.2001,2001-01-24,2001,Diptera
23U661,E10,CDFA_P11,Diptera (Brachycera),Agromyzidae,Liriomyza,brassicae,4.V.1998,1998-05-04,1998,Diptera
23U662,F10,CDFA_P11,Diptera (Brachycera),Agromyzidae,Liriomyza,brassicae,20.III.1997,1997-03-20,1997,Diptera
23U663,G10,CDFA_P11,Diptera (Brachycera),Agromyzidae,Liriomyza,brassicae,30.IV.1997,1997-04-30,1997,Diptera
23U664,H10,CDFA_P11,Diptera (Brachycera),Agromyzidae,Liriomyza,huidobrensis,17.IV.2005,2005-04-17,2005,Diptera
23U665,A11,CDFA_P11,Diptera (Brachycera),Agromyzidae,Liriomyza,huidobrensis,"14.V,2008",NA,NA,Diptera
23U666,B11,CDFA_P11,Diptera (Brachycera),Agromyzidae,Liriomyza,sativae,24.III.2009,2009-03-24,2009,Diptera
23U667,C11,CDFA_P11,Diptera (Brachycera),Agromyzidae,Liriomyza,langei,2005,NA,NA,Diptera
23U668,D11,CDFA_P11,Diptera (Brachycera),Agromyzidae,Liriomyza,septentrionalis,15.VI.2003,2003-06-15,2003,Diptera
23U669,E11,CDFA_P11,Diptera (Brachycera),Agromyzidae,Liriomyza,septentrionalis,15.VI.2003,2003-06-15,2003,Diptera
23U670,F11,CDFA_P11,Diptera (Brachycera),Agromyzidae,Liriomyza,septentrionalis,24.VII.2009,2009-07-24,2009,Diptera
23U671,G11,CDFA_P11,Diptera (Brachycera),Agromyzidae,Liriomyza,trifolii,10.X.1998,1998-10-10,1998,Diptera
23U672,H11,CDFA_P11,Diptera (Brachycera),Agromyzidae,Liriomyza,trifolii,10.X.1998,1998-10-10,1998,Diptera
23U673,A12,CDFA_P11,Diptera (Brachycera),Agromyzidae,Liriomyza,trifolii,10.X.1998,1998-10-10,1998,Diptera
23U674,B12,CDFA_P11,Diptera (Brachycera),Aulacigastridae,Aulacigaster,leucopeza,30.IV.1981,1981-04-30,1981,Diptera
23U675,C12,CDFA_P11,Diptera (Brachycera),Anthomyzidae,Stiphrosoma,vittatum,26.VI.1994,1994-06-26,1994,Diptera
23U676,D12,CDFA_P11,Diptera (Brachycera),Anthomyzidae,Anthomyza,concolor,4.VI.2002,2002-06-04,2002,Diptera
23U677,E12,CDFA_P11,Diptera (Brachycera),Anthomyzidae,Anthomyza,concolor,4.VI.2002,2002-06-04,2002,Diptera
23U678,F12,CDFA_P11,Diptera (Brachycera),Anthomyzidae,Anthomyza,concolor,4.VI.2002,2002-06-04,2002,Diptera
23U680,A1,CDFA_P12,Coleoptera,Carabidae,Anisodactylus,similis,25.VIII.1981,1981-08-25,1981,Coleoptera
23U681,B1,CDFA_P12,Coleoptera,Carabidae,Anisodactylus,nivalis,25.VIII.1981,1981-08-25,1981,Coleoptera
23U682,C1,CDFA_P12,Coleoptera,Carabidae,Anisodactylus,rudis,25.VIII.1981,1981-08-25,1981,Coleoptera
23U684,D1,CDFA_P12,Coleoptera,Carabidae,Dicheirus,dilatatus,27.X.1987,1987-10-27,1987,Coleoptera
23U685,E1,CDFA_P12,Coleoptera,Carabidae,Dicheirus,brunneus,01.V.1981,1981-05-01,1981,Coleoptera
23U686,F1,CDFA_P12,Coleoptera,Carabidae,Dicheirus,piceus,30.VIII.1995,1995-08-30,1995,Coleoptera
23U687,G1,CDFA_P12,Coleoptera,Carabidae,Harpalus,fraternus,25.VIII.1981,1981-08-25,1981,Coleoptera
23U688,H1,CDFA_P12,Coleoptera,Carabidae,Selenophorus,sp.,10.VIII.1981,1981-08-10,1981,Coleoptera
23U690,A2,CDFA_P12,Coleoptera,Carabidae,Calathus,ruficollis ignicollis,13.III.1987,1987-03-13,1987,Coleoptera
23U692,B2,CDFA_P12,Coleoptera,Carabidae,Calathus,ruficollis ruficollis,18.V.1987,1987-05-18,1987,Coleoptera
23U693,C2,CDFA_P12,Coleoptera,Carabidae,Laemostenus,sp.,28.XI.1988,1988-11-28,1988,Coleoptera
23U696,D2,CDFA_P12,Coleoptera,Carabidae,Anchomenus,funebris,26.III.1987,1987-03-26,1987,Coleoptera
23U698,E2,CDFA_P12,Coleoptera,Carabidae,Tanystoma,maculicolle,25.III.1987,1987-03-25,1987,Coleoptera
23U700,F2,CDFA_P12,Coleoptera,Carabidae,Agonum,fossiger,25.III.1987,1987-03-25,1987,Coleoptera
23U704,G2,CDFA_P12,Coleoptera,Carabidae,Agonum,suturale,26.III.1987,1987-03-26,1987,Coleoptera
23U706,H2,CDFA_P12,Coleoptera,Carabidae,Agonum,limbatum,25.III.1987,1987-03-25,1987,Coleoptera
23U707,A3,CDFA_P12,Coleoptera,Carabidae,Agonum,punctiforme,19.V.1980,1980-05-19,1980,Coleoptera
23U708,B3,CDFA_P12,Coleoptera,Carabidae,Platynus,brunneomarginatus,26.III.1987,1987-03-26,1987,Coleoptera
23U709,C3,CDFA_P12,Coleoptera,Carabidae,Tetragonoderus,pallidus,14.VIII.1983,1983-08-14,1983,Coleoptera
23U710,D3,CDFA_P12,Coleoptera,Carabidae,Tetragonoderus,pallidus,25.III.1993,1993-03-25,1993,Coleoptera
23U711,E3,CDFA_P12,Coleoptera,Carabidae,Cymindis,evanescens,12.V.1981,1981-05-12,1981,Coleoptera
23U712,F3,CDFA_P12,Coleoptera,Carabidae,Cymindis,punctigera,02.XII.1981,1981-12-02,1981,Coleoptera
23U713,G3,CDFA_P12,Coleoptera,Carabidae,Calleida,brunnea,25.IX.1980,1980-09-25,1980,Coleoptera
23U714,H3,CDFA_P12,Coleoptera,Carabidae,Tecnophilus,sp.,18.VII.1980,1980-07-18,1980,Coleoptera
23U715,A4,CDFA_P12,Coleoptera,Carabidae,Pseudaptinus,sp.,11.IX.1980,1980-09-11,1980,Coleoptera
23U716,B4,CDFA_P12,Coleoptera,Carabidae,Galerita,sp.,19.IX.1986,1986-09-19,1986,Coleoptera
23U717,C4,CDFA_P12,Coleoptera,Carabidae,Cicindela,amargosae,06.VII.1999,1999-07-06,1999,Coleoptera
23U718,D4,CDFA_P12,Coleoptera,Carabidae,Cicindela,depressula depressula,25.VI.2003,2003-06-25,2003,Coleoptera
23U719,E4,CDFA_P12,Coleoptera,Carabidae,Cicindela,depressula eureka,10.IV.2000,2000-04-10,2000,Coleoptera
23U720,F4,CDFA_P12,Coleoptera,Carabidae,Cicindela,hirticollis gravida,13.IV.1980,1980-04-13,1980,Coleoptera
23U721,G4,CDFA_P12,Coleoptera,Carabidae,Cicindela,longilabris,04.IV.2000,2000-04-04,2000,Coleoptera
23U722,H4,CDFA_P12,Coleoptera,Carabidae,Cicindela,longilabris perviridis,06.VII.1982,1982-07-06,1982,Coleoptera
23U723,A5,CDFA_P12,Coleoptera,Carabidae,Cicindela,nebraskana,17.VII.2000,2000-07-17,2000,Coleoptera
23U724,B5,CDFA_P12,Coleoptera,Carabidae,Cicindela,oregona,02.V.2010,2010-05-02,2010,Coleoptera
23U725,C5,CDFA_P12,Coleoptera,Carabidae,Cicindela,oregona oregona,02.IX.1981,1981-09-02,1981,Coleoptera
23U726,D5,CDFA_P12,Coleoptera,Carabidae,Cicindela,parowana platti,07.VI.2001,2001-06-07,2001,Coleoptera
23U727,E5,CDFA_P12,Coleoptera,Carabidae,Cicindela,plutonica,04.X.1999,1999-10-04,1999,Coleoptera
23U728,F5,CDFA_P12,Coleoptera,Carabidae,Cicindela,purpurea hatchi,04.IV.2000,2000-04-04,2000,Coleoptera
23U729,G5,CDFA_P12,Coleoptera,Carabidae,Cicindela,purpurea lauta,18.II.2000,2000-02-18,2000,Coleoptera
23U730,H5,CDFA_P12,Coleoptera,Carabidae,Cicindela,tenuicincta,16.VII.1997,1997-07-16,1997,Coleoptera
23U731,A6,CDFA_P12,Coleoptera,Carabidae,Cicindela,tranquebarica parallelonota,23.VI.1983,1983-06-23,1983,Coleoptera
23U732,B6,CDFA_P12,Coleoptera,Carabidae,Cicindela,tranquebarica vibex,31.V.2001,2001-05-31,2001,Coleoptera
23U733,C6,CDFA_P12,Coleoptera,Carabidae,Cicindela,willistoni,07.VII.2000,2000-07-07,2000,Coleoptera
23U734,D6,CDFA_P12,Coleoptera,Carabidae,Cicindela,hemorrhagica,25.V.2004,2004-05-25,2004,Coleoptera
23U735,E6,CDFA_P12,Coleoptera,Carabidae,Cicindela,tenuisignata,01.X.1980,1980-10-01,1980,Coleoptera
23U736,F6,CDFA_P12,Coleoptera,Carabidae,Cylindera,terricola imperfecta,03.VI.2009,2009-06-03,2009,Coleoptera
23U737,G6,CDFA_P12,Coleoptera,Carabidae,Cylindera,terricola susanagreae,05.VI.1990,1990-06-05,1990,Coleoptera
23U738,H6,CDFA_P12,Coleoptera,Carabidae,Habroscelimorpha,californica mojavi,12.X.1999,1999-10-12,1999,Coleoptera
23U739,A7,CDFA_P12,Coleoptera,Carabidae,Amblycheila,schwarzi,27.XI.1987,1987-11-27,1987,Coleoptera
23U741,B7,CDFA_P12,Coleoptera,Carabidae,Omus,audouini,06.V.1994,1994-05-06,1994,Coleoptera
23U742,C7,CDFA_P12,Coleoptera,Carabidae,Omus,californicus intermedius,09.III.1990,1990-03-09,1990,Coleoptera
23U743,D7,CDFA_P12,Coleoptera,Dytiscidae,Laccophilus,maculosus decipiens,26.III.1987,1987-03-26,1987,Coleoptera
23U744,E7,CDFA_P12,Coleoptera,Dytiscidae,Laccophilus,mexicanus atristernalis,12.X.1981,1981-10-12,1981,Coleoptera
23U745,F7,CDFA_P12,Coleoptera,Dytiscidae,Hygrotus,masculinus,22.VI.1983,1983-06-22,1983,Coleoptera
23U746,G7,CDFA_P12,Coleoptera,Dytiscidae,Deronectes,eximius,26.III.1987,1987-03-26,1987,Coleoptera
23U747,H7,CDFA_P12,Coleoptera,Dytiscidae,Deronectes,funereus,21.I.1981,1981-01-21,1981,Coleoptera
23U748,A8,CDFA_P12,Coleoptera,Dytiscidae,Deronectes,striatellus,14.III.1985,1985-03-14,1985,Coleoptera
23U749,B8,CDFA_P12,Coleoptera,Dytiscidae,Deronectes,striatellus,26.III.1987,1987-03-26,1987,Coleoptera
23U750,C8,CDFA_P12,Coleoptera,Dytiscidae,Agabinus,glabrellus,18.II.1984,1984-02-18,1984,Coleoptera
23U751,D8,CDFA_P12,Coleoptera,Dytiscidae,Agabus,approximatus,03.V.1980,1980-05-03,1980,Coleoptera
23U752,E8,CDFA_P12,Coleoptera,Dytiscidae,Agabus,confertus,14.IV.1984,1984-04-14,1984,Coleoptera
23U753,F8,CDFA_P12,Coleoptera,Dytiscidae,Agabus,discors,29.VI.1989,1989-06-29,1989,Coleoptera
23U754,G8,CDFA_P12,Coleoptera,Dytiscidae,Agabus,disintegratus,25.VIII.1981,1981-08-25,1981,Coleoptera
23U755,H8,CDFA_P12,Coleoptera,Dytiscidae,Agabus,ilybiiformis,22.II.1989,1989-02-22,1989,Coleoptera
23U756,A9,CDFA_P12,Coleoptera,Dytiscidae,Agabus,kootenai,29.VI.1989,1989-06-29,1989,Coleoptera
23U757,B9,CDFA_P12,Coleoptera,Dytiscidae,Agabus,lineellus,25.III.1987,1987-03-25,1987,Coleoptera
23U759,C9,CDFA_P12,Coleoptera,Dytiscidae,Agabus,lugens,15.IX.1988,1988-09-15,1988,Coleoptera
23U761,D9,CDFA_P12,Coleoptera,Dytiscidae,Agabus,lugens,12.V.1983,1983-05-12,1983,Coleoptera
23U763,E9,CDFA_P12,Coleoptera,Dytiscidae,Agabus,lutosus,24.V.1983,1983-05-24,1983,Coleoptera
23U768,F9,CDFA_P12,Coleoptera,Dytiscidae,Agabus,lutosus,28.VIII.1986,1986-08-28,1986,Coleoptera
23U769,G9,CDFA_P12,Coleoptera,Dytiscidae,Agabus,regularis,30.X.1984,1984-10-30,1984,Coleoptera
23U771,H9,CDFA_P12,Coleoptera,Dytiscidae,Agabus,sasquatch,16.VI.1988,1988-06-16,1988,Coleoptera
23U772,A10,CDFA_P12,Coleoptera,Dytiscidae,Agabus,seriatus intersectus,11.VI.1988,1988-06-11,1988,Coleoptera
23U776,B10,CDFA_P12,Coleoptera,Dytiscidae,Agabus,vandykei,07.VIII.1980,1980-08-07,1980,Coleoptera
23U778,C10,CDFA_P12,Coleoptera,Dytiscidae,Agabus,walsinghami,03.V.1980,1980-05-03,1980,Coleoptera
23U780,D10,CDFA_P12,Coleoptera,Dytiscidae,Ilybius,fraterculus,20.VII.1988,1988-07-20,1988,Coleoptera
23U781,E10,CDFA_P12,Coleoptera,Dytiscidae,Coptotomus,longulus,13.VII.1987,1987-07-13,1987,Coleoptera
23U788,F10,CDFA_P12,Coleoptera,Dytiscidae,Rhantus,anisonychus,07.IV.1984,1984-04-07,1984,Coleoptera
23U789,G10,CDFA_P12,Coleoptera,Dytiscidae,Dytiscus,sp.,03.VIII.1983,1983-08-03,1983,Coleoptera
23U790,H10,CDFA_P12,Coleoptera,Dytiscidae,Acilius,sp.,25.X.1983,1983-10-25,1983,Coleoptera
23U791,A11,CDFA_P12,Coleoptera,Dytiscidae,Thermonectus,sp.,21.I.1981,1981-01-21,1981,Coleoptera
23U792,B11,CDFA_P12,Coleoptera,Dytiscidae,Eretes,sticticus,07.IV.1984,1984-04-07,1984,Coleoptera
23U793,C11,CDFA_P12,Coleoptera,Amphizoidae,Amphizoa,insolens,01.X.1982,1982-10-01,1982,Coleoptera
23U794,D11,CDFA_P12,Coleoptera,Gyrinidae,Gyrinus,sp.,29.IX.1980,1980-09-29,1980,Coleoptera
23U795,E11,CDFA_P12,Coleoptera,Hydrophilidae,Tropisternus,lateralis,03.VII.1980,1980-07-03,1980,Coleoptera
23U796,F11,CDFA_P12,Coleoptera,Hydrophilidae,Hydrophilus,sp.,18.III.1991,1991-03-18,1991,Coleoptera
23U797,G11,CDFA_P12,Coleoptera,Hydrophilidae,Berosus,sp.,18.V.1980,1980-05-18,1980,Coleoptera
23U798,H11,CDFA_P12,Coleoptera,Hydrophilidae,Enochrus,sp.,12.V.1980,1980-05-12,1980,Coleoptera
23U799,A12,CDFA_P12,Coleoptera,Hydrophilidae,Cymbiodyta,sp.,07.VIII.1980,1980-08-07,1980,Coleoptera
23U800,B12,CDFA_P12,Coleoptera,Hydrophilidae,Sphaeridium,lunatum,30.V.1981,1981-05-30,1981,Coleoptera
23U801,C12,CDFA_P12,Coleoptera,Agyrtidae,Apteroloma,sp.,20.VII.1990,1990-07-20,1990,Coleoptera
23U802,D12,CDFA_P12,Coleoptera,Agyrtidae,Pteroloma,sp.,08.VIII.1996,1996-08-08,1996,Coleoptera
23U803,E12,CDFA_P12,Coleoptera,Agyrtidae,Necrophilus,hydrophiloides,07.I.2002,2002-01-07,2002,Coleoptera
23U804,F12,CDFA_P12,Coleoptera,Agyrtidae,Necrophilus,hydrophiloides,23.II.1984,1984-02-23,1984,Coleoptera
B3-354,A1,Glenn_P4,Lepidoptera,Tortricidae,Decodes,Decodes montanus,45151,2023-08-13,2023,Lepidoptera
B3-362,B1,Glenn_P4,Lepidoptera,Tortricidae,Pelochrista,Pelochrista laticurva,45152,2023-08-14,2023,Lepidoptera
B3-393.1,C1,Glenn_P4,Lepidoptera,Tortricidae,Cydia,Cydia latiferreana,45156,2023-08-18,2023,Lepidoptera
B3-401.1,D1,Glenn_P4,Lepidoptera,Tortricidae,Cydia,Cydia latiferreana,45157,2023-08-19,2023,Lepidoptera
B3-430,E1,Glenn_P4,Lepidoptera,Tortricidae,Platphalonidia,NA,45161,2023-08-23,2023,Lepidoptera
B3-444,F1,Glenn_P4,Lepidoptera,Tortricidae,Acleris,Acleris keiferi,45168,2023-08-30,2023,Lepidoptera
B3-487,G1,Glenn_P4,Lepidoptera,Tortricidae,Argyrotaenia,Argyrotaenia provana,45177,2023-09-08,2023,Lepidoptera
B3-488,H1,Glenn_P4,Lepidoptera,Tortricidae,Pelochrista,Pelochrista crambitana,45177,2023-09-08,2023,Lepidoptera
B3-499,A2,Glenn_P4,Lepidoptera,Tortricidae,Phalonidia,NA,45179,2023-09-10,2023,Lepidoptera
B3-627,B2,Glenn_P4,Lepidoptera,Tortricidae,Decodes,nr. horariana,45198,2023-09-29,2023,Lepidoptera
B3-646,C2,Glenn_P4,Lepidoptera,Tortricidae,Epinotia,Epinotia radicana,45206,2023-10-07,2023,Lepidoptera
B3-653,D2,Glenn_P4,Lepidoptera,Tortricidae,Epinotia,Epinotia bigemina,45207,2023-10-08,2023,Lepidoptera
B3-680,E2,Glenn_P4,Lepidoptera,Tortricidae,Epinotia,Epinotia fumoviridana,45219,2023-10-20,2023,Lepidoptera
B3-681,F2,Glenn_P4,Lepidoptera,Tortricidae,Epinotia,Epinotia bigemina,45219,2023-10-20,2023,Lepidoptera
B3-687,G2,Glenn_P4,Lepidoptera,Tortricidae,Epinotia,Epinotia seorsa,45232,2023-11-02,2023,Lepidoptera
B3-690,H2,Glenn_P4,Lepidoptera,Tortricidae,Epinotia,Epinotia kasloana,45232,2023-11-02,2023,Lepidoptera
B3-702,A3,Glenn_P4,Lepidoptera,Tortricidae,Decodes,nr. horariana,45234,2023-11-04,2023,Lepidoptera
B3-712,B3,Glenn_P4,Lepidoptera,Tortricidae,Epinotia,Epinotia kasloana,45234,2023-11-04,2023,Lepidoptera
B3-277,C3,Glenn_P4,Lepidoptera,Noctuidae,Euxoa,Euxoa tessellata,45133,2023-07-26,2023,Lepidoptera
B3-317,D3,Glenn_P4,Lepidoptera,Noctuidae,Tesagrotis,Tesagrotis piscipellis,45143,2023-08-05,2023,Lepidoptera
B3-023,E3,Glenn_P4,Lepidoptera,Noctuidae,Lithophane,Lithophane gausapata,45064,2023-05-18,2023,Lepidoptera
B3-435,F3,Glenn_P4,Lepidoptera,Geometridae,Eupithecia,Eupithecia multistrigata,45167,2023-08-29,2023,Lepidoptera
B3-470,G3,Glenn_P4,Lepidoptera,Noctuidae,Euxoa,Euxoa perexcellens,45175,2023-09-06,2023,Lepidoptera
B3-473,H3,Glenn_P4,Lepidoptera,Noctuidae,Abagrotis,Abagrotis sp.,45175,2023-09-06,2023,Lepidoptera
B3-493,A4,Glenn_P4,Lepidoptera,Geometridae,Eupithecia,Eupithecia opinata,45178,2023-09-09,2023,Lepidoptera
B3-500,B4,Glenn_P4,Lepidoptera,Noctuidae,Euxoa,Euxoa sp.,45179,2023-09-10,2023,Lepidoptera
B3-513,C4,Glenn_P4,Lepidoptera,Noctuidae,Euxoa,Euxoa intrita,45179,2023-09-10,2023,Lepidoptera
B3-514,D4,Glenn_P4,Lepidoptera,Noctuidae,Euxoa,Euxoa intrita,45179,2023-09-10,2023,Lepidoptera
B3-521,E4,Glenn_P4,Lepidoptera,Noctuidae,Euxoa,Euxoa messoria,45184,2023-09-15,2023,Lepidoptera
B3-526,F4,Glenn_P4,Lepidoptera,Noctuidae,Euxoa,Euxoa punctigera,45185,2023-09-16,2023,Lepidoptera
B3-527,G4,Glenn_P4,Lepidoptera,Noctuidae,Euxoa,Euxoa auripennis,45185,2023-09-16,2023,Lepidoptera
B3-553,H4,Glenn_P4,Lepidoptera,Noctuidae,Parabagrotis,Parabagrotis formalis,45187,2023-09-18,2023,Lepidoptera
B3-555,A5,Glenn_P4,Lepidoptera,Noctuidae,Euxoa,Euxoa sp.,45187,2023-09-18,2023,Lepidoptera
B3-566,B5,Glenn_P4,Lepidoptera,Noctuidae,Euxoa,Euxoa nevada,45190,2023-09-21,2023,Lepidoptera
B3-569,C5,Glenn_P4,Lepidoptera,Noctuidae,Euxoa,Euxoa brevipennis,45190,2023-09-21,2023,Lepidoptera
B3-570,D5,Glenn_P4,Lepidoptera,Noctuidae,Euxoa,Euxoa sp.,45190,2023-09-21,2023,Lepidoptera
B3-571,E5,Glenn_P4,Lepidoptera,Noctuidae,Euxoa,Euxoa brevipennis,45191,2023-09-22,2023,Lepidoptera
B3-576,F5,Glenn_P4,Lepidoptera,Noctuidae,Euxoa,Euxoa comosa,45191,2023-09-22,2023,Lepidoptera
B3-580,G5,Glenn_P4,Lepidoptera,Noctuidae,Euxoa,Euxoa aequalis alko,45192,2023-09-23,2023,Lepidoptera
B3-581,H5,Glenn_P4,Lepidoptera,Noctuidae,Euxoa,Euxoa intermontana,45192,2023-09-23,2023,Lepidoptera
B3-588,A6,Glenn_P4,Lepidoptera,Noctuidae,Euxoa,Euxoa latro,45192,2023-09-23,2023,Lepidoptera
B3-594,B6,Glenn_P4,Lepidoptera,Noctuidae,Euxoa,Euxoa henrietta,45192,2023-09-23,2023,Lepidoptera
B3-596,C6,Glenn_P4,Lepidoptera,Noctuidae,Parabagrotis,Parabagrotis sp.,45192,2023-09-23,2023,Lepidoptera
B3-635,D6,Glenn_P4,Lepidoptera,Noctuidae,Abagrotis,Abagrotis variata,45203,2023-10-04,2023,Lepidoptera
B3-662,E6,Glenn_P4,Lepidoptera,Noctuidae,Euxoa,Euxoa difformis,45207,2023-10-08,2023,Lepidoptera
B3-670,F6,Glenn_P4,Lepidoptera,Noctuidae,Euxoa,Euxoa brevipennis,45210,2023-10-11,2023,Lepidoptera
B3-676,G6,Glenn_P4,Lepidoptera,Noctuidae,Euxoa,Euxoa sp.,45217,2023-10-18,2023,Lepidoptera
B3-706,H6,Glenn_P4,Lepidoptera,Tortricidae,Epinotia,Epinotia fumoviridana,45234,2023-11-04,2023,Lepidoptera
B3-708,A7,Glenn_P4,Lepidoptera,Tortricidae,Epinotia,Epinotia sp. (?) (m),45234,2023-11-04,2023,Lepidoptera
B0-037,B7,Glenn_P4,Lepidoptera,Noctuidae,Egira,Egira cognata,43913,2020-03-23,2020,Lepidoptera
B2-479,C7,Glenn_P4,Lepidoptera,Crambidae,Vaxi,Vaxi nr. auratellus,44750,2022-07-08,2022,Lepidoptera
B3-246,D7,Glenn_P4,Lepidoptera,Pyralidae,Dioryctria,Dioryctria sp.,45126,2023-07-19,2023,Lepidoptera
B3-252,E7,Glenn_P4,Lepidoptera,Noctuidae,Viridiseptis,Viridiseptis marina,45128,2023-07-21,2023,Lepidoptera
B3-260,F7,Glenn_P4,Lepidoptera,Geometridae,Eurhinosea,Eurhinosea flavaria,45128,2023-07-21,2023,Lepidoptera
B3-262,G7,Glenn_P4,Lepidoptera,Geometridae,Synchlora,Synchlora aerata,45129,2023-07-22,2023,Lepidoptera
B3-265,H7,Glenn_P4,Lepidoptera,Geometridae,Digrammia,Digrammia plemmelata,45131,2023-07-24,2023,Lepidoptera
B3-266,A8,Glenn_P4,Lepidoptera,Geometridae,Macaria,Macaria umbriferata (m),45131,2023-07-24,2023,Lepidoptera
B3-268,B8,Glenn_P4,Lepidoptera,Geometridae,Macaria,Macaria umbriferata (f),45131,2023-07-24,2023,Lepidoptera
B3-269,C8,Glenn_P4,Lepidoptera,Geometridae,Digrammia,Digrammia denticulata,45131,2023-07-24,2023,Lepidoptera
B3-271,D8,Glenn_P4,Lepidoptera,Erebidae,Orgyia,Orgyia cana,45131,2023-07-24,2023,Lepidoptera
B3-287,E8,Glenn_P4,Lepidoptera,Noctuidae,Euxoa,Euxoa sp.,45134,2023-07-27,2023,Lepidoptera
B3-290,F8,Glenn_P4,Lepidoptera,Geometridae,Gabriola,Gabriola dyari dyari,45135,2023-07-28,2023,Lepidoptera
B3-292,G8,Glenn_P4,Lepidoptera,Geometridae,Gabriola,Gabriola sierrae sierrae,45135,2023-07-28,2023,Lepidoptera
B2-446,H8,Glenn_P4,Lepidoptera,Noctuidae,NA,NA,44739,2022-06-27,2022,Lepidoptera
B3-298,A9,Glenn_P4,Lepidoptera,Geometridae,Pterotaea,Pterotaea sp.,45136,2023-07-29,2023,Lepidoptera
B3-305.1,B9,Glenn_P4,Lepidoptera,Erebidae,Orgyia,Orgyia vetusta,45140,2023-08-02,2023,Lepidoptera
B3-308,C9,Glenn_P4,Lepidoptera,Pyralidae,NA,NA,45140,2023-08-02,2023,Lepidoptera
B3-329,D9,Glenn_P4,Lepidoptera,Noctuidae,Euxoa,Euxoa sp.,45144,2023-08-06,2023,Lepidoptera
B3-333,E9,Glenn_P4,Lepidoptera,Noctuidae,Pseudorthodes,Pseudorthodes irrorata,45147,2023-08-09,2023,Lepidoptera
B3-334,F9,Glenn_P4,Lepidoptera,Noctuidae,Spaelotis,Spaelotis clandestina,45147,2023-08-09,2023,Lepidoptera
B3-335,G9,Glenn_P4,Lepidoptera,Noctuidae,Abagrotis,Abagrotis trigona,45147,2023-08-09,2023,Lepidoptera
B3-340,H9,Glenn_P4,Lepidoptera,Geometridae,Digrammia,Digrammia sp.,45147,2023-08-09,2023,Lepidoptera
B3-343,A10,Glenn_P4,Lepidoptera,Geometridae,Macaria,Macaria quadrilinearia,45149,2023-08-11,2023,Lepidoptera
B3-369,B10,Glenn_P4,Lepidoptera,Noctuidae,Neoligia,Neoligia lancea,45154,2023-08-16,2023,Lepidoptera
B3-370,C10,Glenn_P4,Lepidoptera,Geometridae,Digrammia,Digrammia sp.,45154,2023-08-16,2023,Lepidoptera
B3-386,D10,Glenn_P4,Lepidoptera,Noctuidae,Enargia,Enargia infumata,45154,2023-08-16,2023,Lepidoptera
B3-387,E10,Glenn_P4,Lepidoptera,Noctuidae,Abagrotis,Abagrotis denticulata,45154,2023-08-16,2023,Lepidoptera
B3-415,F10,Glenn_P4,Lepidoptera,Geometridae,Spargania,Spargania magnoliata,45158,2023-08-20,2023,Lepidoptera
B3-459,G10,Glenn_P4,Lepidoptera,Noctuidae,Euxoa,Euxoa sp.,45174,2023-09-05,2023,Lepidoptera
B3-471,H10,Glenn_P4,Lepidoptera,Noctuidae,Euxoa,Euxoa sp.,45175,2023-09-06,2023,Lepidoptera
B3-472,A11,Glenn_P4,Lepidoptera,Noctuidae,Euxoa,Euxoa sp.,45175,2023-09-06,2023,Lepidoptera
B3-486,B11,Glenn_P4,Lepidoptera,Geometridae,Entephria,Entephria sp.,45177,2023-09-08,2023,Lepidoptera
B3-490,C11,Glenn_P4,Lepidoptera,Geometridae,Digrammia,Digrammia sp.,45177,2023-09-08,2023,Lepidoptera
B3-498,D11,Glenn_P4,Lepidoptera,Noctuidae,NA,NA,45179,2023-09-10,2023,Lepidoptera
B3-522,E11,Glenn_P4,Lepidoptera,Noctuidae,Euxoa,Euxoa sp.,45184,2023-09-15,2023,Lepidoptera
B3-554,F11,Glenn_P4,Lepidoptera,Noctuidae,Euxoa,Euxoa olivia,45187,2023-09-18,2023,Lepidoptera
B3-568,G11,Glenn_P4,Lepidoptera,Noctuidae,Euxoa,Euxoa sp.,45190,2023-09-21,2023,Lepidoptera
B3-584,H11,Glenn_P4,Lepidoptera,Noctuidae,Euxoa,Euxoa sp.,45192,2023-09-23,2023,Lepidoptera
B3-592,A12,Glenn_P4,Lepidoptera,Noctuidae,Lithophane,Lithophane subtilis,45192,2023-09-23,2023,Lepidoptera
B3-595,B12,Glenn_P4,Lepidoptera,Noctuidae,Euxoa,Euxoa sp.,45192,2023-09-23,2023,Lepidoptera
B3-622,C12,Glenn_P4,Lepidoptera,Noctuidae,Euxoa,Euxoa sp.,45193,2023-09-24,2023,Lepidoptera
B3-629,D12,Glenn_P4,Lepidoptera,Noctuidae,Euxoa,Euxoa sp.,45198,2023-09-29,2023,Lepidoptera
B3-649,E12,Glenn_P4,Lepidoptera,Noctuidae,Lithophane,Lithophane boogeri,45206,2023-10-07,2023,Lepidoptera
B3-669,F12,Glenn_P4,Lepidoptera,Geometridae,Digrammia,Digrammia sp.,45208,2023-10-09,2023,Lepidoptera
CASENT9132987,A1,CAS_P36,Plecoptera,Pteronarcyidae,Pteronarcella,regularis,9/30/16,2016-09-30,2016,Plecoptera
CASENT9132547,B1,CAS_P36,Ephemeroptera,Ephemerellidae,Drunella,spinifera,9/30/16,2016-09-30,2016,Ephemeroptera
CASENT9131686,C1,CAS_P36,Trichoptera,Hydropsychidae,Parapsyche,sp.,9/30/16,2016-09-30,2016,Trichoptera
CASENT9131733,D1,CAS_P36,Coleoptera,Elmidae,Lara,sp.,9/30/16,2016-09-30,2016,Coleoptera
CASENT9131474,E1,CAS_P36,Ephemeroptera,Heptageniidae,Epeorus,longimanus,7/14/13,2013-07-14,2013,Ephemeroptera
CASENT9132642,F1,CAS_P36,Ephemeroptera,Heptageniidae,Epeorus,sp.,7/14/13,2013-07-14,2013,Ephemeroptera
CASENT9132400,G1,CAS_P36,Diptera,Athericidae,Atherix,variegata,7/14/13,2013-07-14,2013,Diptera
CASENT9132805,H1,CAS_P36,Trichoptera,Brachycentridae,Brachycentrus,americanus,7/14/13,2013-07-14,2013,Trichoptera
CASENT9131458,A2,CAS_P36,Ephemeroptera,Ephemerellidae,Timpanoga,hecuba,7/14/13,2013-07-14,2013,Ephemeroptera
CASENT9132798,B2,CAS_P36,Plecoptera,Perlidae,Calineuria,californica,7/14/13,2013-07-14,2013,Plecoptera
CASENT9130738,C2,CAS_P36,Trichoptera,Brachycentridae,Brachycentrus,americanus,7/14/13,2013-07-14,2013,Trichoptera
CASENT9132577,D2,CAS_P36,Trichoptera,Rhyacophilidae,Rhyacophila,sp.,7/14/13,2013-07-14,2013,Trichoptera
CASENT9132116,E2,CAS_P36,Plecoptera,Chloroperlidae,Drunella,flavilinea,7/14/13,2013-07-14,2013,Plecoptera
CASENT9132521,F2,CAS_P36,Trichoptera,Hydropsychidae,Arctopsyche,grandis,7/14/13,2013-07-14,2013,Trichoptera
CASENT9132909,G2,CAS_P36,Trichoptera,Hydropsychidae,Hydropsyche,sp.,8/6/13,2013-08-06,2013,Trichoptera
CASENT9132693,H2,CAS_P36,Diptera,Simuliidae,Simulium,sp.,8/6/13,2013-08-06,2013,Diptera
CASENT9132491,A3,CAS_P36,Trichoptera,Calamoceratidae,Heteroplectron,californicum,1/18/08,2008-01-18,2008,Trichoptera
CASENT9130326,B3,CAS_P36,Plecoptera,Chloroperlidae,Sweltsa,sp.,4/29/07,2007-04-29,2007,Plecoptera
CASENT9132687,C3,CAS_P36,Plecoptera,Taeniopterygidae,Taenionema,sp.,4/29/07,2007-04-29,2007,Plecoptera
CASENT9121415,D3,CAS_P36,Plecoptera,Perlodidae,Kogotus,nonus,4/29/07,2007-04-29,2007,Plecoptera
CASENT9121415,D3,CAS_P36,Plecoptera,Perlodidae,Kogotus,Kogotus nonus,2007-04-29,2007-04-29,2007,Plecoptera
CASENT9132249,E3,CAS_P36,Ephemeroptera,Ephemerellidae,Caudatella,hystrix,4/29/07,2007-04-29,2007,Ephemeroptera
CASENT9121409,F3,CAS_P36,Ephemeroptera,Ephemerellidae,Drunella,spinifera,4/29/07,2007-04-29,2007,Ephemeroptera
CASENT9121409,F3,CAS_P36,Ephemeroptera,Ephemerellidae,Drunella,Drunella spinifera,2007-04-29,2007-04-29,2007,Ephemeroptera
CASENT9132647,G3,CAS_P36,Ephemeroptera,Ephemerellidae,Drunella,doddsii,4/29/07,2007-04-29,2007,Ephemeroptera
CASENT9121369,H3,CAS_P36,Plecoptera,Nemouridae,Malenka,sp.,2/3/12,2012-02-03,2012,Plecoptera
CASENT9121369,H3,CAS_P36,Plecoptera,Nemouridae,Malenka,NA,2012-02-03,2012-02-03,2012,Plecoptera
CASENT9132467,A4,CAS_P36,Diptera,Athericidae,Atherix,variegata,4/29/07,2007-04-29,2007,Diptera
CASENT9131207,B4,CAS_P36,Ephemeroptera,Heptageniidae,Ironodes,sp.,5/24/11,2011-05-24,2011,Ephemeroptera
CASENT9132352,C4,CAS_P36,Plecoptera,Chloroperlidae,Sweltsa,sp.,5/24/11,2011-05-24,2011,Plecoptera
CASENT9132844,D4,CAS_P36,Ephemeroptera,Heptageniidae,Ironodes,sp.,3/19/08,2008-03-19,2008,Ephemeroptera
CASENT9132961,E4,CAS_P36,Ephemeroptera,Heptageniidae,Cinygmula,sp.,4/29/07,2007-04-29,2007,Ephemeroptera
CASENT9132757,F4,CAS_P36,Plecoptera,Perlodidae,Isoperla,sp.,3/19/08,2008-03-19,2008,Plecoptera
CASENT9132748,G4,CAS_P36,NA,Thremmatidae,Neophylax,occidentis,4/29/07,2007-04-29,2007,NA
CASENT9131685,H4,CAS_P36,Ephemeroptera,Ephemerellidae,Ephemerella,excrucians,4/29/07,2007-04-29,2007,Ephemeroptera
CASENT9132277,A5,CAS_P36,Ephemeroptera,Heptageniidae,Rhithrogena,sp.,4/29/07,2007-04-29,2007,Ephemeroptera
CASENT9132074,B5,CAS_P36,Plecoptera,Perlodidae,Isoperla,sp.,5/23/91,1991-05-23,1991,Plecoptera
CASENT9132635,C5,CAS_P36,Ephemeroptera,Ameletidae,Ameletus,sparsatus,5/24/11,2011-05-24,2011,Ephemeroptera
CASENT9132871,D5,CAS_P36,Ephemeroptera,Heptageniidae,Rhithrogena,sp.,12/31/07,2007-12-31,2007,Ephemeroptera
CASENT9131906,E5,CAS_P36,Ephemeroptera,Heptageniidae,Epeorus,sp.,5/31/07,2007-05-31,2007,Ephemeroptera
CASENT9121149,F5,CAS_P36,Coleoptera,Elmidae,Cleptelmis,sp.,1/18/08,2008-01-18,2008,Coleoptera
CASENT9121149,F5,CAS_P36,Coleoptera,Elmidae,Cleptelmis,NA,2008-01-18,2008-01-18,2008,Coleoptera
CASENT9121157,G5,CAS_P36,Trichoptera,Rhyacophilidae,Rhyacophila,sp.,1/18/08,2008-01-18,2008,Trichoptera
CASENT9121157,G5,CAS_P36,Trichoptera,Rhyacophilidae,Rhyacophila,NA,2008-01-18,2008-01-18,2008,Trichoptera
CASENT9121156,H5,CAS_P36,Plecoptera,Chloroperlidae,Sweltsa,sp.,1/18/08,2008-01-18,2008,Plecoptera
CASENT9121156,H5,CAS_P36,Plecoptera,Chloroperlidae,Sweltsa,NA,2008-01-18,2008-01-18,2008,Plecoptera
CASENT9121143,A6,CAS_P36,Coleoptera,Psephenidae,Eubrianax,edwardsii,1/18/08,2008-01-18,2008,Coleoptera
CASENT9121143,A6,CAS_P36,Coleoptera,Psephenidae,Eubrianax,Eubrianax edwardsii,2008-01-18,2008-01-18,2008,Coleoptera
CASENT9132092,B6,CAS_P36,Trichoptera,Rhyacophilidae,Rhyacophila,sp.,10/17/07,2007-10-17,2007,Trichoptera
CASENT9121212,C6,CAS_P36,Trichoptera,Rhyacophilidae,Rhyacophila,sp.,10/17/07,2007-10-17,2007,Trichoptera
CASENT9121212,C6,CAS_P36,Trichoptera,Rhyacophilidae,Rhyacophila,NA,2007-10-17,2007-10-17,2007,Trichoptera
CASENT9131829,D6,CAS_P36,Trichoptera,Rhyacophilidae,Rhyacophila,sp.,8/11/07,2007-08-11,2007,Trichoptera
CASENT9132374,E6,CAS_P36,Ephemeroptera,Heptageniidae,Epeorus,sp.,5/28/07,2007-05-28,2007,Ephemeroptera
CASENT9132817,F6,CAS_P36,Ephemeroptera,Ameletidae,Ameletus,sp.,4/22/14,2014-04-22,2014,Ephemeroptera
CASENT9132716,G6,CAS_P36,Ephemeroptera,Ameletidae,Ameletus,sp.,NA,NA,NA,Ephemeroptera
CASENT9132879,H6,CAS_P36,Megaloptera,Corydalidae,Neohermes,filicornis,3/7/14,2014-03-07,2014,Megaloptera
CASENT9132840,A7,CAS_P36,Ephemeroptera,Heptageniidae,Epeorus,sp.,6/12/14,2014-06-12,2014,Ephemeroptera
CASENT9132707,B7,CAS_P36,Plecoptera,Chloroperlidae,Sweltsa,sp.,4/16/08,2008-04-16,2008,Plecoptera
CASENT9132015,C7,CAS_P36,Ephemeroptera,Ephemerellidae,Ephemerella,excrucians,5/30/06,2006-05-30,2006,Ephemeroptera
CASENT9131590,D7,CAS_P36,Ephemeroptera,Ephemerellidae,Caudatella,heterocaudata,4/17/08,2008-04-17,2008,Ephemeroptera
CASENT9132795,E7,CAS_P36,Ephemeroptera,Heptageniidae,Cinygmula,sp.,5/30/06,2006-05-30,2006,Ephemeroptera
CASENT9123926,F7,CAS_P36,Trichoptera,Rhyacophilidae,Rhyacophila,sp.,8/29/07,2007-08-29,2007,Trichoptera
CASENT9123926,F7,CAS_P36,Trichoptera,Rhyacophilidae,Rhyacophila,NA,2007-08-29,2007-08-29,2007,Trichoptera
CASENT9123929,G7,CAS_P36,Plecoptera,Leuctridae,Paraleuctra,sp.,1/1/08,2008-01-01,2008,Plecoptera
CASENT9123929,G7,CAS_P36,Plecoptera,Leuctridae,Paraleuctra,NA,2008-01-01,2008-01-01,2008,Plecoptera
CASENT9132477,H7,CAS_P36,Coleoptera,Psephenidae,Acneus,quadrimaculatus,5/31/07,2007-05-31,2007,Coleoptera
CASENT9123715,A8,CAS_P36,Trichoptera,Rhyacophilidae,Rhyacophila,sp.,5/7/08,2008-05-07,2008,Trichoptera
CASENT9123715,A8,CAS_P36,Trichoptera,Rhyacophilidae,Rhyacophila,NA,2008-05-07,2008-05-07,2008,Trichoptera
CASENT9132193,B8,CAS_P36,Trichoptera,Odontoceridae,Parthina,sp.,4/17/08,2008-04-17,2008,Trichoptera
CASENT9123721,C8,CAS_P36,Trichoptera,Philopotamidae,Dolophilodes,novusamericanus,4/17/08,2008-04-17,2008,Trichoptera
CASENT9123721,C8,CAS_P36,Trichoptera,Philopotamidae,Dolophilodes,Dolophilodes novusamericanus,2008-04-17,2008-04-17,2008,Trichoptera
CASENT9123736,D8,CAS_P36,Trichoptera,Polycentropodidae,Polycentropus,sp.,5/30/08,2008-05-30,2008,Trichoptera
CASENT9123736,D8,CAS_P36,Trichoptera,Polycentropodidae,Polycentropus,NA,2008-05-30,2008-05-30,2008,Trichoptera
CASENT9121180,E8,CAS_P36,Diptera,Dixidae,Dixa,sp.,8/8/08,2008-08-08,2008,Diptera
CASENT9121180,E8,CAS_P36,Diptera,Dixidae,Dixa,NA,2008-08-08,2008-08-08,2008,Diptera
CASENT9132655,F8,CAS_P36,Ephemeroptera,Heptageniidae,Epeorus,longimanus,5/10/11,2011-05-10,2011,Ephemeroptera
CASENT9131615,G8,CAS_P36,Ephemeroptera,Ephemerellidae,Drunella,flavilinea,5/10/11,2011-05-10,2011,Ephemeroptera
CASENT9131799,H8,CAS_P36,Trichoptera,Philopotamidae,Wormaldia,sp.,5/10/11,2011-05-10,2011,Trichoptera
CASENT9131670,A9,CAS_P36,Odonata,Gomphidae,Gomphus,sp.,4/22/11,2011-04-22,2011,Odonata
CASENT9121328,B9,CAS_P36,Odonata,Coenagrionidae,Argia,emma,4/22/11,2011-04-22,2011,Odonata
CASENT9121328,B9,CAS_P36,Odonata,Coenagrionidae,Argia,Argia emma,2011-04-22,2011-04-22,2011,Odonata
CASENT9121329,C9,CAS_P36,Odonata,Coenagrionidae,Argia,vivida,4/22/11,2011-04-22,2011,Odonata
CASENT9121329,C9,CAS_P36,Odonata,Coenagrionidae,Argia,Argia vivida,2011-04-22,2011-04-22,2011,Odonata
CASENT9131817,D9,CAS_P36,Ephemeroptera,Heptageniidae,Ironodes,sp.,4/22/11,2011-04-22,2011,Ephemeroptera
CASENT9121319,E9,CAS_P36,Coleoptera,Elmidae,Lara,sp.,4/22/11,2011-04-22,2011,Coleoptera
CASENT9121319,E9,CAS_P36,Coleoptera,Elmidae,Lara,NA,2011-04-22,2011-04-22,2011,Coleoptera
CASENT9132839,F9,CAS_P36,Trichoptera,Glossosomatidae,Glossosoma,sp.,4/22/11,2011-04-22,2011,Trichoptera
CASENT9131739,G9,CAS_P36,Ephemeroptera,Heptageniidae,Rhithrogena,morrisoni,4/22/11,2011-04-22,2011,Ephemeroptera
CASENT9131892,H9,CAS_P36,Ephemeroptera,Ameletidae,Ameletus,sp.,3/5/12,2012-03-05,2012,Ephemeroptera
CASENT9132700,A10,CAS_P36,Plecoptera,Capniidae,Mesocapnia,projecta,3/8/12,2012-03-08,2012,Plecoptera
CASENT9121394,B10,CAS_P36,Plecoptera,Capniidae,Mesocapnia,projecta,3/8/12,2012-03-08,2012,Plecoptera
CASENT9121394,B10,CAS_P36,Plecoptera,Capniidae,Mesocapnia,Mesocapnia projecta,2012-03-08,2012-03-08,2012,Plecoptera
CASENT9132413,C10,CAS_P36,Plecoptera,Perlodidae,Skwala,sp.,2/3/10,2010-02-03,2010,Plecoptera
CASENT9131787,D10,CAS_P36,Ephemeroptera,Ephemerellidae,Drunella,doddsii,2/3/10,2010-02-03,2010,Ephemeroptera
CASENT9132923,E10,CAS_P36,Ephemeroptera,Ephemerellidae,Drunella,grndis,2/3/10,2010-02-03,2010,Ephemeroptera
CASENT9132923,E10,CAS_P36,Diptera,Limoniidae,Hexatoma,sp.,2/3/10,2010-02-03,2010,Diptera
CASENT9131489,F10,CAS_P36,Plecoptera,Taeniopterygidae,Taenionema,sp.,5/3/06,2006-05-03,2006,Plecoptera
CASENT9131727,G10,CAS_P36,Ephemeroptera,Ephemerellidae,Drunella,flavilinea,4/6/08,2008-04-06,2008,Ephemeroptera
CASENT9132822,H10,CAS_P36,Ephemeroptera,Ephemerellidae,Ephemerella,maculata,4/6/08,2008-04-06,2008,Ephemeroptera
CASENT9132811,A11,CAS_P36,Ephemeroptera,Ameletidae,Ameletus,sp.,4/6/08,2008-04-06,2008,Ephemeroptera
CASENT9121380,B11,CAS_P36,Plecoptera,Nemouridae,Zapada,cinctipes,2/3/10,2010-02-03,2010,Plecoptera
CASENT9121380,B11,CAS_P36,Plecoptera,Nemouridae,Zapada,Zapada cinctipes,2010-02-03,2010-02-03,2010,Plecoptera
CASENT9132830,C11,CAS_P36,Plecoptera,Capniidae,Capnia,ventura complex,3/8/12,2012-03-08,2012,Plecoptera
CASENT9132780,D11,CAS_P36,Ephemeroptera,Ameletidae,Ameletus,sp.,4/1/11,2011-04-01,2011,Ephemeroptera
CASENT9132936,E11,CAS_P36,Plecoptera,Taeniopterygidae,Oemopteryx,vanduzeea,4/1/11,2011-04-01,2011,Plecoptera
CASENT9121246,F11,CAS_P36,Plecoptera,Perlodidae,Kogotus,nonus,4/1/11,2011-04-01,2011,Plecoptera
CASENT9121246,F11,CAS_P36,Plecoptera,Perlodidae,Kogotus,Kogotus nonus,2011-04-01,2011-04-01,2011,Plecoptera
CASENT9132275,G11,CAS_P36,Trichoptera,Hydropsychidae,Homoplectra,sp.,NA,NA,NA,Trichoptera
CASENT9132852,H11,CAS_P36,Trichoptera,Hydropsychidae,Homoplectra,sp.,4/1/11,2011-04-01,2011,Trichoptera
CASENT9132486,A12,CAS_P36,Odonata,Coenagrionidae,Argia,vivida,4/1/11,2011-04-01,2011,Odonata
CASENT9132444,B12,CAS_P36,Trichoptera,Odontoceridae,Parthina,sp.,NA,NA,NA,Trichoptera
CASENT9121278,C12,CAS_P36,Ephemeroptera,Siphlonuridae,Siphlonurus,sp.,NA,NA,NA,Ephemeroptera
CASENT9121278,C12,CAS_P36,Ephemeroptera,Siphlonuridae,Siphlonurus,NA,NA,NA,NA,Ephemeroptera
CASENT9121241,D12,CAS_P36,Odonata,Gomphidae,Octogomphus,specularis,4/1/11,2011-04-01,2011,Odonata
CASENT9121241,D12,CAS_P36,Odonata,Gomphidae,Octogomphus,Octogomphus specularis,2011-04-01,2011-04-01,2011,Odonata
CASENT9121269,E12,CAS_P36,Ephemeroptera,Ameletidae,Ameletus,sp.,NA,NA,NA,Ephemeroptera
CASENT9121269,E12,CAS_P36,Ephemeroptera,Ameletidae,Ameletus,NA,NA,NA,NA,Ephemeroptera
CASENT9132760,F12,CAS_P36,Trichoptera,Sericostomatidae,Gumaga,sp.,NA,NA,NA,Trichoptera
CASENT9132135,A1,CAS_P37,Ephemeroptera,Ephemerellidae,Drunella,flavilinea,4/22/11,2011-04-22,2011,Ephemeroptera
CASENT9132712,B1,CAS_P37,Ephemeroptera,Heptageniidae,Ironodes,sp.,4/22/11,2011-04-22,2011,Ephemeroptera
CASENT9132882,C1,CAS_P37,Ephemeroptera,Ameletidae,Ameletus,sp.,4/22/11,2011-04-22,2011,Ephemeroptera
CASENT9121255,D1,CAS_P37,Plecoptera,Nemouridae,Soyedina,sp.,4/27/11,2011-04-27,2011,Plecoptera
CASENT9121255,D1,CAS_P37,Plecoptera,Nemouridae,Soyedina,NA,2011-04-27,2011-04-27,2011,Plecoptera
CASENT9121254,E1,CAS_P37,Plecoptera,Perlodidae,Rickera,sorpta,4/26/11,2011-04-26,2011,Plecoptera
CASENT9121254,E1,CAS_P37,Plecoptera,Perlodidae,Rickera,Rickera sorpta,2011-04-26,2011-04-26,2011,Plecoptera
CASENT9121261,F1,CAS_P37,Trichoptera,Hydropsychidae,Parapsyche,elsis,4/26/11,2011-04-26,2011,Trichoptera
CASENT9121261,F1,CAS_P37,Trichoptera,Hydropsychidae,Parapsyche,Parapsyche elsis,2011-04-26,2011-04-26,2011,Trichoptera
CASENT9121258,G1,CAS_P37,Trichoptera,Limnephilidae,Limnephilus,nogus,4/26/11,2011-04-26,2011,Trichoptera
CASENT9121258,G1,CAS_P37,Trichoptera,Limnephilidae,Limnephilus,Limnephilus nogus,2011-04-26,2011-04-26,2011,Trichoptera
CASENT9132254,H1,CAS_P37,Plecoptera,Chloroperlidae,Sweltsa,pisteri,4/27/11,2011-04-27,2011,Plecoptera
CASENT9121266,A2,CAS_P37,Plecoptera,Perlodidae,Chernokrilus,misnomus,4/27/11,2011-04-27,2011,Plecoptera
CASENT9121266,A2,CAS_P37,Plecoptera,Perlodidae,Chernokrilus,Chernokrilus misnomus,2011-04-27,2011-04-27,2011,Plecoptera
CASENT9121263,B2,CAS_P37,Trichoptera,Calamoceratidae,Heteroplectron,californicum,4/26/11,2011-04-26,2011,Trichoptera
CASENT9121263,B2,CAS_P37,Trichoptera,Calamoceratidae,Heteroplectron,Heteroplectron californicum,2011-04-26,2011-04-26,2011,Trichoptera
CASENT9121421,C2,CAS_P37,Trichoptera,Rhyacophilidae,Rhyacophila,sp Brunnea Group,6/16/11,2011-06-16,2011,Trichoptera
CASENT9132781,D2,CAS_P37,Diptera,Simuliidae,Prosimulium,sp.,6/16/11,2011-06-16,2011,Diptera
CASENT9132117,E2,CAS_P37,Plecoptera,Leuctridae,Paraleuctra,vershina,6/18/11,2011-06-18,2011,Plecoptera
CASENT9121434,F2,CAS_P37,Plecoptera,Nemouridae,Zapada,cinctipes,6/18/11,2011-06-18,2011,Plecoptera
CASENT9131593,G2,CAS_P37,Plecoptera,Leuctridae,Paraleuctra,vershina,6/18/11,2011-06-18,2011,Plecoptera
CASENT9132625,H2,CAS_P37,Trichoptera,Lepidostomatidae,Lepidostoma,sp.,6/18/11,2011-06-18,2011,Trichoptera
CASENT9132759,A3,CAS_P37,Trichoptera,Limnephilidae,Psychoglypha,sp.,6/18/11,2011-06-18,2011,Trichoptera
CASENT9132750,B3,CAS_P37,Trichoptera,Polycentropodidae,Polycentropus,sp.,6/18/11,2011-06-18,2011,Trichoptera
CASENT9132866,C3,CAS_P37,Ephemeroptera,Heptageniidae,Ironodes,sp.,6/18/11,2011-06-18,2011,Ephemeroptera
CASENT9132928,D3,CAS_P37,Ephemeroptera,Ameletidae,Ameletus,sp.,6/18/11,2011-06-18,2011,Ephemeroptera
CASENT9132827,E3,CAS_P37,Trichoptera,Sericostomatidae,Gumaga,sp.,6/18/11,2011-06-18,2011,Trichoptera
CASENT9121429,F3,CAS_P37,Trichoptera,Limnephilidae,Clostoeca,disjuncta,6/15/11,2011-06-15,2011,Trichoptera
CASENT9132263,G3,CAS_P37,Plecoptera,Taeniopterygidae,Oemopteryx,vanduzeea,6/15/11,2011-06-15,2011,Plecoptera
CASENT9121300,H3,CAS_P37,Trichoptera,Rhyacophilidae,Rhyacophila,sp.,4/22/11,2011-04-22,2011,Trichoptera
CASENT9121300,H3,CAS_P37,Trichoptera,Rhyacophilidae,Rhyacophila,NA,2011-04-22,2011-04-22,2011,Trichoptera
CASENT9132790,A4,CAS_P37,Trichoptera,Lepidostomatidae,Lepidostoma,cinereum,NA,NA,NA,Trichoptera
CASENT9132339,B4,CAS_P37,Ephemeroptera,Heptageniidae,Ironodes,sp.,4/21/11,2011-04-21,2011,Ephemeroptera
CASENT9121303,C4,CAS_P37,Odonata,Cordulegastridae,Cordulegaster,dorsalis,NA,NA,NA,Odonata
CASENT9121303,C4,CAS_P37,Odonata,Cordulegastridae,Cordulegaster,Cordulegaster dorsalis,NA,NA,NA,Odonata
CASENT9121294,D4,CAS_P37,Plecoptera,Perlodidae,Kogotus,nonus,4/22/11,2011-04-22,2011,Plecoptera
CASENT9121294,D4,CAS_P37,Plecoptera,Perlodidae,Kogotus,Kogotus nonus,2011-04-22,2011-04-22,2011,Plecoptera
CASENT9131811,E4,CAS_P37,Plecoptera,Chloroperlidae,Sweltsa,pisteri,4/22/11,2011-04-22,2011,Plecoptera
CASENT9131958,F4,CAS_P37,Ephemeroptera,Heptageniidae,Ironodes,sp.,4/21/11,2011-04-21,2011,Ephemeroptera
CASENT9132602,G4,CAS_P37,Ephemeroptera,Ameletidae,Ameletus,cooki,4/21/11,2011-04-21,2011,Ephemeroptera
CASENT9121313,H4,CAS_P37,Plecoptera,Perlodidae,Osobenus,yakimae,4/21/11,2011-04-21,2011,Plecoptera
CASENT9121313,H4,CAS_P37,Plecoptera,Perlodidae,Osobenus,Osobenus yakimae,2011-04-21,2011-04-21,2011,Plecoptera
CASENT9132102,A5,CAS_P37,Plecoptera,Leuctridae,Paraleuctra,vershina,4/22/11,2011-04-22,2011,Plecoptera
CASENT9121305,B5,CAS_P37,Trichoptera,Rhyacophilidae,Rhyacophila,sp.,4/22/11,2011-04-22,2011,Trichoptera
CASENT9121305,B5,CAS_P37,Trichoptera,Rhyacophilidae,Rhyacophila,NA,2011-04-22,2011-04-22,2011,Trichoptera
CASENT9121315,C5,CAS_P37,Trichoptera,Hydropsychidae,Homoplectra,oaklandensis,4/21/11,2011-04-21,2011,Trichoptera
CASENT9121315,C5,CAS_P37,Trichoptera,Hydropsychidae,Homoplectra,Homoplectra oaklandensis,2011-04-21,2011-04-21,2011,Trichoptera
CASENT9121318,D5,CAS_P37,Plecoptera,Perlodidae,Rickera,sorpta,4/21/11,2011-04-21,2011,Plecoptera
CASENT9121318,D5,CAS_P37,Plecoptera,Perlodidae,Rickera,Rickera sorpta,2011-04-21,2011-04-21,2011,Plecoptera
CASENT9132893,E5,CAS_P37,Ephemeroptera,Ephemerellidae,Caudatella,hystrix,5/17/07,2007-05-17,2007,Ephemeroptera
CASENT9130417,F5,CAS_P37,Ephemeroptera,Ameletidae,Ameletus,sp.,5/17/07,2007-05-17,2007,Ephemeroptera
CASENT9132884,G5,CAS_P37,Ephemeroptera,Ephemerellidae,Ephemerella,excrucians,5/17/07,2007-05-17,2007,Ephemeroptera
CASENT9132534,H5,CAS_P37,Trichoptera,Rhyacophilidae,Rhyacophila,sp.,5/17/07,2007-05-17,2007,Trichoptera
CASENT9132867,A6,CAS_P37,Trichoptera,Rhyacophilidae,Rhyacophila,sp.,5/17/07,2007-05-17,2007,Trichoptera
CASENT9130264,B6,CAS_P37,Coleoptera,Psephenidae,Eubrianax,edwardsi,5/17/07,2007-05-17,2007,Coleoptera
CASENT9131602,C6,CAS_P37,Diptera,Pediciidae,Dicranota,sp.,5/17/07,2007-05-17,2007,Diptera
CASENT9132729,D6,CAS_P37,Ephemeroptera,Heptageniidae,Ironodes,sp.,5/17/07,2007-05-17,2007,Ephemeroptera
CASENT9132396,E6,CAS_P37,Ephemeroptera,Heptageniidae,Epeorus,longimanus,5/17/07,2007-05-17,2007,Ephemeroptera
CASENT9131530,F6,CAS_P37,Ephemeroptera,Ephemerellidae,Ephemerella,excrucians,5/17/07,2007-05-17,2007,Ephemeroptera
CASENT9132407,G6,CAS_P37,Plecoptera,Perlidae,Calineuria,californica,5/17/07,2007-05-17,2007,Plecoptera
CASENT9132776,H6,CAS_P37,Plecoptera,Chloroperlidae,Sweltsa,townesi,5/17/07,2007-05-17,2007,Plecoptera
CASENT9131741,A7,CAS_P37,Ephemeroptera,Heptageniidae,Ironodes,sp.,5/17/07,2007-05-17,2007,Ephemeroptera
CASENT9130337,B7,CAS_P37,Ephemeroptera,Ameletidae,Ameletus,sp.,5/17/07,2007-05-17,2007,Ephemeroptera
CASENT9131918,C7,CAS_P37,Trichoptera,Hydropsychidae,Parapsyche,almota,5/17/07,2007-05-17,2007,Trichoptera
CASENT9132784,D7,CAS_P37,Plecoptera,Leuctridae,Despaxia,augusta,2/3/12,2012-02-03,2012,Plecoptera
CASENT9121391,E7,CAS_P37,Trichoptera,Rhyacophilidae,Rhyacophila,sp. Grandis Group,8/8/11,2011-08-08,2011,Trichoptera
CASENT9121391,E7,CAS_P37,Trichoptera,Rhyacophilidae,Rhyacophila,NA,2011-08-08,2011-08-08,2011,Trichoptera
CASENT9121351,F7,CAS_P37,Plecoptera,Capniidae,Mesocapnia,projecta,2/2/12,2012-02-02,2012,Plecoptera
CASENT9121351,F7,CAS_P37,Plecoptera,Capniidae,Mesocapnia,Mesocapnia projecta,2012-02-02,2012-02-02,2012,Plecoptera
CASENT9132315,G7,CAS_P37,Trichoptera,Rhyacophilidae,Rhyacophila,sp. Brunnea Group,8/8/11,2011-08-08,2011,Trichoptera
CASENT9121388,H7,CAS_P37,NA,Thremmatidae,Neophylax,sp.,2/2/12,2012-02-02,2012,NA
CASENT9121388,H7,CAS_P37,Hymenoptera,NA,Neophylax,NA,2012-02-02,2012-02-02,2012,NA
CASENT9132438,A8,CAS_P37,Plecoptera,Leuctridae,Despaxia,augusta,2/2/12,2012-02-02,2012,Plecoptera
CASENT9130332,B8,CAS_P37,Plecoptera,Capniidae,Mesocapnia,projecta,2/2/12,2012-02-02,2012,Plecoptera
CASENT9132786,C8,CAS_P37,Plecoptera,Capniidae,Isocapnia,eichlini,3/5/12,2012-03-05,2012,Plecoptera
CASENT9132604,D8,CAS_P37,Ephemeroptera,Heptageniidae,Epeorus,longimanus,4/21/11,2011-04-21,2011,Ephemeroptera
CASENT9132256,E8,CAS_P37,Plecoptera,Leuctridae,Despaxia,augusta,2/22/12,2012-02-22,2012,Plecoptera
CASENT9132868,F8,CAS_P37,Ephemeroptera,Ameletidae,Ameletus,sp.,2/22/12,2012-02-22,2012,Ephemeroptera
CASENT9121372,G8,CAS_P37,Ephemeroptera,Ameletidae,Ameletus,sp.,8/8/11,2011-08-08,2011,Ephemeroptera
CASENT9121372,G8,CAS_P37,Ephemeroptera,Ameletidae,Ameletus,NA,2011-08-08,2011-08-08,2011,Ephemeroptera
CASENT9121387,H8,CAS_P37,Ephemeroptera,Baetidae,Baetis,sp.,8/8/11,2011-08-08,2011,Ephemeroptera
CASENT9121387,H8,CAS_P37,Ephemeroptera,Baetidae,Baetis,NA,2011-08-08,2011-08-08,2011,Ephemeroptera
CASENT9132069,A9,CAS_P37,Ephemeroptera,Ephemerellidae,Serratella,micheneri,8/8/11,2011-08-08,2011,Ephemeroptera
CASENT9121366,B9,CAS_P37,Ephemeroptera,Ephemerellidae,Drunella,flavilinea,8/8/11,2011-08-08,2011,Ephemeroptera
CASENT9121366,B9,CAS_P37,Ephemeroptera,Ephemerellidae,Drunella,Drunella flavilinea,2011-08-08,2011-08-08,2011,Ephemeroptera
CASENT9132517,C9,CAS_P37,Diptera,Limoniidae,Hexatoma,sp.,8/8/11,2011-08-08,2011,Diptera
CASENT9132771,D9,CAS_P37,NA,Thremmatidae,Neophylax,splendens,8/8/11,2011-08-08,2011,NA
CASENT9121426,E9,CAS_P37,Ephemeroptera,Ameletidae,Ameletus,cooki,5/24/11,2011-05-24,2011,Ephemeroptera
CASENT9121437,F9,CAS_P37,Trichoptera,Limnephilidae,Limnephilus,sitchensis,5/24/11,2011-05-24,2011,Trichoptera
CASENT9132778,G9,CAS_P37,Trichoptera,Limnephilidae,Limnephilus,nogus,5/24/11,2011-05-24,2011,Trichoptera
CASENT9121436,H9,CAS_P37,Trichoptera,Calamoceratidae,Heteroplectron,californicum,5/24/11,2011-05-24,2011,Trichoptera
CASENT9121463,A10,CAS_P37,Trichoptera,Limnephilidae,Clostoeca,disjuncta,6/8/11,2011-06-08,2011,Trichoptera
CASENT9121468,B10,CAS_P37,Trichoptera,Rhyacophilidae,Rhyacophila,vedra,6/8/11,2011-06-08,2011,Trichoptera
CASENT9132869,C10,CAS_P37,Trichoptera,Rhyacophilidae,Rhyacophila,acuminata,6/18/11,2011-06-18,2011,Trichoptera
CASENT9121459,D10,CAS_P37,Trichoptera,Rhyacophilidae,Rhyacophila,vocala,6/8/11,2011-06-08,2011,Trichoptera
CASENT9121469,E10,CAS_P37,Plecoptera,Perlidae,Doroneuria,baumanni,6/16/11,2011-06-16,2011,Plecoptera
CASENT9132855,F10,CAS_P37,Plecoptera,Leuctridae,Despaxia,augusta,1/23/10,2010-01-23,2010,Plecoptera
CASENT9121296,G10,CAS_P37,Diptera,Culicidae,Culiseta,incidens,1/20/11,2011-01-20,2011,Diptera
CASENT9121296,G10,CAS_P37,Diptera,Culicidae,Culiseta,Culiseta incidens,2011-01-20,2011-01-20,2011,Diptera
CASENT9132785,H10,CAS_P37,Diptera,Simuliidae,Prosimulium,sp.,6/18/11,2011-06-18,2011,Diptera
CASENT9121465,B11,CAS_P37,Trichoptera,Rhyacophilidae,Rhyacophila,vedra,6/8/11,2011-06-08,2011,Trichoptera
CASENT9121458,C11,CAS_P37,Trichoptera,Lepidostomatidae,Lepidostoma,sp.,6/8/11,2011-06-08,2011,Trichoptera
CASENT9131963,D11,CAS_P37,Plecoptera,Chloroperlidae,Sweltsa,borealis,6/16/11,2011-06-16,2011,Plecoptera
CASENT9121453,E11,CAS_P37,Diptera,Pediciidae,Dicranota,sp.,6/18/11,2011-06-18,2011,Diptera
CASENT9132266,F11,CAS_P37,Plecoptera,Leuctridae,Paraleuctra,vershina,6/16/11,2011-06-16,2011,Plecoptera
CASENT9121460,G11,CAS_P37,Ephemeroptera,Heptageniidae,Epeorus,sp.,6/16/11,2011-06-16,2011,Ephemeroptera
CASENT9132788,H11,CAS_P37,Plecoptera,Peltoperlidae,Soliperla,thyra,5/11/11,2011-05-11,2011,Plecoptera
CASENT9132711,A12,CAS_P37,Trichoptera,Rhyacophilidae,Rhyacophila,vocala,5/11/11,2011-05-11,2011,Trichoptera
CASENT9132847,B12,CAS_P37,Ephemeroptera,Ephemerellidae,Drunella,flavilinea,7/24/06,2006-07-24,2006,Ephemeroptera
CASENT9132313,C12,CAS_P37,Ephemeroptera,Heptageniidae,Ironodes,sp.,5/11/11,2011-05-11,2011,Ephemeroptera
CASENT9132836,D12,CAS_P37,NA,Thremmatidae,Neophylax,splendens,5/11/11,2011-05-11,2011,NA
CASENT9121346,E12,CAS_P37,Ephemeroptera,Heptageniidae,Epeorus,sp.,5/10/11,2011-05-10,2011,Ephemeroptera
CASENT9121346,E12,CAS_P37,Ephemeroptera,Heptageniidae,Epeorus,NA,2011-05-10,2011-05-10,2011,Ephemeroptera
CASENT9130948,F12,CAS_P37,Ephemeroptera,Heptageniidae,Ironodes,sp.,5/10/11,2011-05-10,2011,Ephemeroptera
23T287,A1,CDFA_P16,Diptera (Brachycera),Ulidiidae,Tritoxa,callifornica,6.IX.2023,2023-09-06,2023,Diptera
23T288,B1,CDFA_P16,Diptera (Brachycera),Tephritidae,Procecidochares,minuta,6.IX.2023,2023-09-06,2023,Diptera
23T289,C1,CDFA_P16,Diptera (Brachycera),Tephritidae,Rhagoletis,ebbettsi,6.IX.2023,2023-09-06,2023,Diptera
23T290,D1,CDFA_P16,Diptera (Brachycera),Tephritidae,Rhagoletis,ebbettsi,6.IX.2023,2023-09-06,2023,Diptera
23T622,E1,CDFA_P16,Diptera (Brachycera),Tephritidae,Tephritis,webbii,17.X.2023,2023-10-17,2023,Diptera
24V069,F1,CDFA_P16,Diptera (Brachycera),Syrphidae,Toxomerus,marginatus,5.VII.2023,2023-07-05,2023,Diptera
24V070,G1,CDFA_P16,Diptera (Brachycera),Syrphidae,Toxomerus,occidentalis,5.VII.2023,2023-07-05,2023,Diptera
24V071,H1,CDFA_P16,Diptera (Brachycera),Syrphidae,Platycheirus,trichopus,5.VII.2023,2023-07-05,2023,Diptera
24V230,A2,CDFA_P16,Diptera (Brachycera),Tephritidae,Tephritis,footei,10.X.2023,2023-10-10,2023,Diptera
24V231,B2,CDFA_P16,Diptera (Brachycera),Tephritidae,Tephritis,footei,10.X.2023,2023-10-10,2023,Diptera
24V234,C2,CDFA_P16,Coleoptera,Tenebrionidae,Apocrypha,anthicoides,12.I.2024,2024-01-12,2024,Coleoptera
24V236,D2,CDFA_P16,Coleoptera,Tenebrionidae,Apocrypha,anthicoides,12.I.2024,2024-01-12,2024,Coleoptera
24V237,E2,CDFA_P16,Diptera (Brachycera),Ulidiidae,Ceroxys,latiusculus,9.X.2023,2023-10-09,2023,Diptera
24V240,F2,CDFA_P16,Coleoptera,Zopheridae,Usechimorpha,barberi,10.XI.2023,2023-11-10,2023,Coleoptera
24V241,G2,CDFA_P16,Coleoptera,Curculionidae,Schizomicrus,caecus,10.XI.2023,2023-11-10,2023,Coleoptera
24V242,H2,CDFA_P16,Coleoptera,Erotylidae,Dacne,californica,10.XI.2023,2023-11-10,2023,Coleoptera
24V243,A3,CDFA_P16,Coleoptera,Staphylinidae,Micropeplus,neotomae,2.XI.2023,2023-11-02,2023,Coleoptera
24V246,B3,CDFA_P16,Coleoptera,Zopheridae,Megataphrus,tenuicornis,10.XI.2023,2023-11-10,2023,Coleoptera
24V247,C3,CDFA_P16,Coleoptera,Curculionidae,Schizomicrus,caecus,10.XI.2023,2023-11-10,2023,Coleoptera
24V248,D3,CDFA_P16,Coleoptera,Staphylinidae,Micropeplus,neotomae,2.XI.2023,2023-11-02,2023,Coleoptera
24V249,E3,CDFA_P16,Coleoptera,Zopheridae,Megataphrus,tenuicornis,10.XI.2023,2023-11-10,2023,Coleoptera
24V250,F3,CDFA_P16,Diptera (Brachycera),Tephritidae,Trupanea,femoralis,5.VII.2023,2023-07-05,2023,Diptera
24V251,G3,CDFA_P16,Diptera (Brachycera),Pipunculidae,Tomosvaryella,NA,5.VII.2023,2023-07-05,2023,Diptera
24V254,H3,CDFA_P16,Coleoptera,Tenebrionidae,Eulabis,bicarinata,14.XII.2023,2023-12-14,2023,Coleoptera
24V255,A4,CDFA_P16,Coleoptera,Tenebrionidae,Eulabis,bicarinata,14.XII.2023,2023-12-14,2023,Coleoptera
24V257,B4,CDFA_P16,Diptera (Brachycera),Syrphidae,Toxomerus,marginatus,5.VII.2023,2023-07-05,2023,Diptera
24V258,C4,CDFA_P16,Diptera (Brachycera),Tephritidae,Tephritis,aldrichii,5.VII.2023,2023-07-05,2023,Diptera
24V259,D4,CDFA_P16,Diptera (Brachycera),Tephritidae,Tephritis,aldrichii,5.VII.2023,2023-07-05,2023,Diptera
24V260,E4,CDFA_P16,Diptera (Brachycera),Tephritidae,Tephritis,aldrichii,5.VII.2023,2023-07-05,2023,Diptera
24V261,F4,CDFA_P16,Diptera (Brachycera),Tephritidae,Tephritis,araneosa,3.VIII.2023,2023-08-03,2023,Diptera
24V262,G4,CDFA_P16,Diptera (Brachycera),Tephritidae,Tephritis,araneosa,3.VIII.2023,2023-08-03,2023,Diptera
24V263,H4,CDFA_P16,Diptera (Brachycera),Tephritidae,Tephritis,araneosa,3.VIII.2023,2023-08-03,2023,Diptera
24V312,A5,CDFA_P16,Diptera (Brachycera),Sarcophagidae,Taxigramma,heterenoura,14.VIII.1983,1983-08-14,1983,Diptera
24V314,B5,CDFA_P16,Diptera (Brachycera),Tachinidae,Erynniopsis,antennata,1982,NA,NA,Diptera
24V316,C5,CDFA_P16,Diptera (Brachycera),Tachinidae,Erynniopsis,antennata,1982,NA,NA,Diptera
24V317,D5,CDFA_P16,Diptera (Brachycera),Tachinidae,Erynniopsis,antennata,1982,NA,NA,Diptera
24V318,E5,CDFA_P16,Diptera (Brachycera),Tachinidae,Ametadoria,harrisinae,26.VIII.1983,1983-08-26,1983,Diptera
24V319,F5,CDFA_P16,Diptera (Brachycera),Tachinidae,Ametadoria,harrisinae,26.VIII.1983,1983-08-26,1983,Diptera
24V320,G5,CDFA_P16,Diptera (Brachycera),Tachinidae,Ametadoria,harrisinae,27.VII.1983,1983-07-27,1983,Diptera
24V323,H5,CDFA_P16,Diptera (Brachycera),Tachinidae,Triarthria,setipennis,4.VII.1983,1983-07-04,1983,Diptera
24V324,A6,CDFA_P16,Diptera (Brachycera),Tachinidae,Phasia,NA,19.III.2002,2002-03-19,2002,Diptera
24V326,B6,CDFA_P16,Diptera (Brachycera),Tachinidae,Phasia,NA,20.V.1984,1984-05-20,1984,Diptera
24V327,C6,CDFA_P16,Diptera (Brachycera),Tachinidae,Leucostoma,NA,10.VIII.1983,1983-08-10,1983,Diptera
24V328,D6,CDFA_P16,Diptera (Brachycera),Tachinidae,Masiphya,NA,20.V.1983,1983-05-20,1983,Diptera
24V329,E6,CDFA_P16,Diptera (Brachycera),Tachinidae,Siphona,NA,24.VII.2009,2009-07-24,2009,Diptera
24V330,F6,CDFA_P16,Diptera (Brachycera),Tachinidae,Siphona,NA,17.VIII.1983,1983-08-17,1983,Diptera
24V331,G6,CDFA_P16,Diptera (Brachycera),Tachinidae,Siphona,NA,17.VIII.1983,1983-08-17,1983,Diptera
24V332,H6,CDFA_P16,Diptera (Brachycera),Tachinidae,Gymnosoma,NA,17.VIII.1983,1983-08-17,1983,Diptera
24V335,A7,CDFA_P16,Diptera (Brachycera),Tachinidae,Catharosia,NA,8.IX.1983,1983-09-08,1983,Diptera
24V336,B7,CDFA_P16,Diptera (Brachycera),Tachinidae,Catharosia,NA,22.IX.1984,1984-09-22,1984,Diptera
24V337,C7,CDFA_P16,Diptera (Brachycera),Tachinidae,Catharosia,NA,15.IX.1984,1984-09-15,1984,Diptera
24V338,D7,CDFA_P16,Diptera (Brachycera),Tachinidae,Xanthomelanodes,NA,9.VII.2008,2008-07-09,2008,Diptera
24V339,E7,CDFA_P16,Diptera (Brachycera),Tachinidae,Patelloa,NA,2.IX.1984,1984-09-02,1984,Diptera
24V340,F7,CDFA_P16,Diptera (Brachycera),Tachinidae,Patelloa,NA,25.IV.1984,1984-04-25,1984,Diptera
24V342,G7,CDFA_P16,Diptera (Brachycera),Tachinidae,Gymnosoma,NA,17.IV.2002,2002-04-17,2002,Diptera
24V343,H7,CDFA_P16,Diptera (Brachycera),Tachinidae,Paradidyma,NA,14.VII.1985,1985-07-14,1985,Diptera
24V344,A8,CDFA_P16,Diptera (Brachycera),Tachinidae,Gymnoclytia,NA,3.VI.1984,1984-06-03,1984,Diptera
24V345,B8,CDFA_P16,Diptera (Brachycera),Tachinidae,Aplomya,NA,28.VI.1984,1984-06-28,1984,Diptera
24V346,C8,CDFA_P16,Diptera (Brachycera),Tachinidae,Aplomya,NA,28.VI.1984,1984-06-28,1984,Diptera
24V347,D8,CDFA_P16,Diptera (Brachycera),Tachinidae,Aplomya,NA,28.VI.1984,1984-06-28,1984,Diptera
24V348,E8,CDFA_P16,Diptera (Brachycera),Tachinidae,Eutrixa,NA,23.VI.1994,1994-06-23,1994,Diptera
24V349,F8,CDFA_P16,Diptera (Brachycera),Tachinidae,Leskia,NA,30.V.2009,2009-05-30,2009,Diptera
24V350,G8,CDFA_P16,Diptera (Brachycera),Tachinidae,Dichocera,NA,2.VI.2009,2009-06-02,2009,Diptera
24V351,H8,CDFA_P16,Diptera (Brachycera),Tachinidae,Madremyia,NA,8.VII.1989,1989-07-08,1989,Diptera
24V352,A9,CDFA_P16,Diptera (Brachycera),Tachinidae,Triarthria,setipennis,29.VI.1979,1979-06-29,1979,Diptera
24V353,B9,CDFA_P16,Diptera (Brachycera),Tachinidae,Triarthria,setipennis,29.VI.1979,1979-06-29,1979,Diptera
24V354,C9,CDFA_P16,Diptera (Brachycera),Tachinidae,Triarthria,setipennis,29.VI.1979,1979-06-29,1979,Diptera
24V355,D9,CDFA_P16,Diptera (Brachycera),Tachinidae,Besseria,NA,12.VIII.1980,1980-08-12,1980,Diptera
24V356,E9,CDFA_P16,Diptera (Brachycera),Tachinidae,Bonia,NA,9.IV.2010,2010-04-09,2010,Diptera
24V357,F9,CDFA_P16,Diptera (Brachycera),Tachinidae,Masiphya,NA,24.VIII.1981,1981-08-24,1981,Diptera
24V358,G9,CDFA_P16,Diptera (Brachycera),Tachinidae,Voria,NA,8.VIII.1989,1989-08-08,1989,Diptera
24V359,H9,CDFA_P16,Diptera (Brachycera),Tachinidae,Melanophrys,NA,1.VIII.1983,1983-08-01,1983,Diptera
24V360,A10,CDFA_P16,Diptera (Brachycera),Tachinidae,Patelloa,NA,7.IV.1984,1984-04-07,1984,Diptera
24V361,B10,CDFA_P16,Diptera (Brachycera),Sarcophagidae,Taxigramma,heterenoura,14.VIII.1983,1983-08-14,1983,Diptera
24V362,C10,CDFA_P16,Diptera (Brachycera),Sarcophagidae,Taxigramma,heterenoura,14.VIII.1983,1983-08-14,1983,Diptera
24V363,D10,CDFA_P16,Diptera (Brachycera),Tachinidae,Leucostoma,NA,8.IX.1983,1983-09-08,1983,Diptera
24V364,E10,CDFA_P16,Diptera (Brachycera),Tachinidae,Melanophrys,NA,1.VIII.1983,1983-08-01,1983,Diptera
24V365,F10,CDFA_P16,Diptera (Brachycera),Tachinidae,Deopalpus,NA,16.VII.1989,1989-07-16,1989,Diptera
24V366,G10,CDFA_P16,Diptera (Brachycera),Tachinidae,Archytas,NA,21.VIII.2007,2007-08-21,2007,Diptera
24V367,H10,CDFA_P16,Diptera (Brachycera),Tachinidae,Melanophrys,NA,1.VIII.1983,1983-08-01,1983,Diptera
24V368,A11,CDFA_P16,Diptera (Brachycera),Tachinidae,Leucostoma,NA,10.VIII.1983,1983-08-10,1983,Diptera
24V369,B11,CDFA_P16,Diptera (Brachycera),Tachinidae,Ptilopdexia,NA,30.V.2009,2009-05-30,2009,Diptera
24V370,C11,CDFA_P16,Diptera (Brachycera),Tachinidae,Ptilopdexia,NA,30.V.2009,2009-05-30,2009,Diptera
24V371,D11,CDFA_P16,Diptera (Brachycera),Tachinidae,Ptilopdexia,NA,30.V.2009,2009-05-30,2009,Diptera
24V372,E11,CDFA_P16,Diptera (Brachycera),Tachinidae,Cylindromyia,nana,V.2016,NA,NA,Diptera
24V373,F11,CDFA_P16,Diptera (Brachycera),Tachinidae,Gymnoclytia,NA,5.IV.2009,2009-04-05,2009,Diptera
24V374,G11,CDFA_P16,Diptera (Brachycera),Tachinidae,Trichopoda,NA,20.V.1984,1984-05-20,1984,Diptera
24V375,H11,CDFA_P16,Diptera (Brachycera),Tachinidae,Trichopoda,NA,20.V.1984,1984-05-20,1984,Diptera
24V376,A12,CDFA_P16,Diptera (Brachycera),Tachinidae,Uramya,halisidotae,9.VII.2008,2008-07-09,2008,Diptera
24V377,B12,CDFA_P16,Diptera (Brachycera),Tachinidae,Cryptomeigenia,NA,4.VI.2002,2002-06-04,2002,Diptera
24V378,C12,CDFA_P16,Diptera (Brachycera),Tachinidae,Voria,NA,1.VII.1989,1989-07-01,1989,Diptera
24V379,D12,CDFA_P16,Diptera (Brachycera),Tachinidae,Voria,NA,1.VII.1989,1989-07-01,1989,Diptera
24V380,E12,CDFA_P16,Diptera (Brachycera),Tachinidae,Archytas,NA,28.VI.2001,2001-06-28,2001,Diptera
24V381,F12,CDFA_P16,Diptera (Brachycera),Tachinidae,Epalpus,signifer,11.IV.2011,2011-04-11,2011,Diptera
24W087,A1,CDFA_P25,Diptera (Brachycera),Apsilocephalidae,Apsilocephala,NA,3.VI.2014,2014-06-03,2014,Diptera
24W089,B1,CDFA_P25,Diptera (Brachycera),Apystomyiidae,Apystomyia,elinguis,28.V.2015,2015-05-28,2015,NA
24W091,C1,CDFA_P25,Diptera (Brachycera),Apystomyiidae,Apystomyia,elinguis,28.V.2015,2015-05-28,2015,NA
24W092,D1,CDFA_P25,Diptera (Brachycera),Apystomyiidae,Apystomyia,elinguis,28.V.2015,2015-05-28,2015,NA
24W099,E1,CDFA_P25,Diptera (Brachycera),Hybotidae,Drapetis,NA,30.VI.1994,1994-06-30,1994,Diptera
24W102,F1,CDFA_P25,Diptera (Brachycera),Hybotidae,Drapetis,NA,9.VIII.1982,1982-08-09,1982,Diptera
24W104,G1,CDFA_P25,Diptera (Brachycera),Hybotidae,Drapetis,NA,9.VIII.1982,1982-08-09,1982,Diptera
24W105,H1,CDFA_P25,Diptera (Brachycera),Hybotidae,Tachyempis,NA,21.VIII.1983,1983-08-21,1983,Diptera
24W112,A2,CDFA_P25,Diptera (Brachycera),Dolichopodidae,Chrysotus,NA,11.VIII.1984,1984-08-11,1984,Diptera
24W113,B2,CDFA_P25,Diptera (Brachycera),Dolichopodidae,Chrysotus,NA,14.VII.1985,1985-07-14,1985,Diptera
24W114,C2,CDFA_P25,Diptera (Brachycera),Dolichopodidae,Chrysotus,NA,27.VII.1982,1982-07-27,1982,Diptera
24W116,D2,CDFA_P25,Diptera (Brachycera),Empididae,Clinocera,NA,8.VI.2006,2006-06-08,2006,Diptera
24W120,E2,CDFA_P25,Diptera (Brachycera),Hybotidae,Platypalpus,NA,19.III.2002,2002-03-19,2002,Diptera
24W122,F2,CDFA_P25,Diptera (Brachycera),Hybotidae,Platypalpus,NA,19.III.2002,2002-03-19,2002,Diptera
24W123,G2,CDFA_P25,Diptera (Brachycera),Hybotidae,Platypalpus,NA,19.III.2002,2002-03-19,2002,Diptera
24W125,H2,CDFA_P25,Diptera (Brachycera),Syrphidae,Allograpta,exotica,19.III.2002,2002-03-19,2002,Diptera
24W131,A3,CDFA_P25,Diptera (Brachycera),Dolichopodidae,Gymnopternus,NA,14.VIII.1982,1982-08-14,1982,Diptera
24W133,B3,CDFA_P25,Diptera (Brachycera),Dolichopodidae,Gymnopternus,NA,5.VII.1985,1985-07-05,1985,Diptera
24W134,C3,CDFA_P25,Diptera (Brachycera),Dolichopodidae,Gymnopternus,NA,5.VII.1985,1985-07-05,1985,Diptera
24W136,D3,CDFA_P25,Diptera (Brachycera),Empididae,Clinocera,lineata,8.VI.2006,2006-06-08,2006,Diptera
24W137,E3,CDFA_P25,Diptera (Brachycera),Hybotidae,Tachypeza,NA,14.VII.1987,1987-07-14,1987,Diptera
24W139,F3,CDFA_P25,Diptera (Brachycera),Hybotidae,Tachypeza,NA,7.VIII.1982,1982-08-07,1982,Diptera
24W140,G3,CDFA_P25,Diptera (Brachycera),Hybotidae,Tachypeza,NA,17.VIII.1985,1985-08-17,1985,Diptera
24W141,H3,CDFA_P25,Diptera (Brachycera),Syrphidae,Allograpta,exotica,15.IV.2003,2003-04-15,2003,Diptera
24W142,A4,CDFA_P25,Diptera (Brachycera),Dolichopodidae,Medetera,johnthomasi,23.IX.2005,2005-09-23,2005,Diptera
24W143,B4,CDFA_P25,Diptera (Brachycera),Dolichopodidae,Medetera,johnthomasi,23.IX.2005,2005-09-23,2005,Diptera
24W144,C4,CDFA_P25,Diptera (Brachycera),Dolichopodidae,Medetera,johnthomasi,23.IX.2005,2005-09-23,2005,Diptera
24W145,D4,CDFA_P25,Diptera (Brachycera),Empididae,Empis,NA,3.V.1984,1984-05-03,1984,Diptera
24W150,E4,CDFA_P25,Diptera (Brachycera),Lonchopteridae,Lonchoptera,furcata,29.VI.1980,1980-06-29,1980,Diptera
24W151,F4,CDFA_P25,Diptera (Brachycera),Lonchopteridae,Lonchoptera,furcata,15.VIII.1981,1981-08-15,1981,Diptera
24W152,G4,CDFA_P25,Diptera (Brachycera),Lonchopteridae,Lonchoptera,furcata,15.VIII.1981,1981-08-15,1981,Diptera
24W153,H4,CDFA_P25,Diptera (Brachycera),Syrphidae,Allograpta,exotica,15.IV.2003,2003-04-15,2003,Diptera
24W154,A5,CDFA_P25,Diptera (Brachycera),Dolichopodidae,Paraphrosylus,praedator,19.II.2007,2007-02-19,2007,Diptera
24W155,B5,CDFA_P25,Diptera (Brachycera),Dolichopodidae,Paraphrosylus,praedator,19.II.2007,2007-02-19,2007,Diptera
24W156,C5,CDFA_P25,Diptera (Brachycera),Dolichopodidae,Paraphrosylus,praedator,19.II.2007,2007-02-19,2007,Diptera
24W158,D5,CDFA_P25,Diptera (Brachycera),Hybotidae,Crossopalpus,NA,12.IX.1981,1981-09-12,1981,Diptera
24W159,E5,CDFA_P25,Diptera (Brachycera),Lonchopteridae,NA,NA,4.VI.2002,2002-06-04,2002,Diptera
24W160,F5,CDFA_P25,Diptera (Brachycera),Lonchopteridae,NA,NA,4.VI.2002,2002-06-04,2002,Diptera
